;name;year;certificate;runtime;genre;rating;metascore;text-muted;director;stars
30;I'm Still Here;I) (2010;R;108;['Comedy', ' Drama', ' Music            '];6.2;48;Documents Joaquin Phoenix's transition from the acting world to a career as an aspiring rapper.;['Casey Affleck', None];['Joaquin Phoenix', 'Antony Langdon', 'Carey Perloff', 'Larry McHale']
31;The Rocker;2008;Tous Public;102;['Comedy', ' Music            '];6.2;53;In the 1980s, a drummer is abandoned by his band just before they become rock superstars. Twenty years later, the drummer sees his second chance at stardom arise when he is asked to perform with his teenage nephew's high school rock band.;['Peter Cattaneo', None];['Rainn Wilson', 'Josh Gad', 'Christina Applegate', 'Teddy Geiger']
32;Sexy Dance 2;2008;Tous Public;98;['Drama', ' Music', ' Romance            '];6.2;50;Romantic sparks occur between two dance students from different backgrounds at the Maryland School of the Arts.;['Jon M. Chu', None];['Robert Hoffman', 'Briana Evigan', 'Cassie Ventura', 'Adam Sevani']
33;Shall we dance? La nouvelle vie de Monsieur Clark;2004;Tous Public;106;['Comedy', ' Drama', ' Music            '];6.2;47;A romantic comedy where a bored, overworked Estate Lawyer, upon first sight of a beautiful instructor, signs up for ballroom dancing lessons.;['Peter Chelsom', None];['Richard Gere', 'Jennifer Lopez', 'Susan Sarandon', 'Stanley Tucci']
34;Save the Last Dance;2001;Tous publics;112;['Drama', ' Music', ' Romance            '];6.2;53;A white midwestern girl moves to Chicago, where her new boyfriend is a black teen from the South Side with a rough, semi-criminal past.;['Thomas Carter', None];['Julia Stiles', 'Sean Patrick Thomas', 'Kerry Washington', 'Fredro Starr']
35;Une nuit au Roxbury;1998;Tous publics;82;['Comedy', ' Music', ' Romance            '];6.2;26;Two dim-witted brothers dream of owning their own dance club or at least getting into the coolest and most exclusive club in town, The Roxbury.;['John Fortenberry', None];['Chris Kattan', 'Will Ferrell', 'Raquel Gardner', 'Viveca Paulin']
36;Wayne's World 2;1993;Tous Public;95;['Comedy', ' Music            '];6.2;60;The inseparable duo try to organize a rock concert while Wayne must fend off a record producer who has an eye for his girlfriend.;['Stephen Surjik', None];['Mike Myers', 'Dana Carvey', 'Christopher Walken', 'Tia Carrere']
37;Dick Tracy;1990;Tous publics;105;['Action', ' Comedy', ' Crime            '];6.2;68;The comic strip detective finds his life vastly complicated when Breathless Mahoney makes advances towards him while he is trying to battle Big Boy Caprice's united mob.;['Warren Beatty', None];['Warren Beatty', 'Madonna', 'Al Pacino', 'Charlie Korsmo']
38;Great Balls of Fire! ou la légende vivante du rock and roll;1989;Tous publics;108;['Biography', ' Drama', ' Music            '];6.2;49;The life and career of wildly controversial rock 'n' roll star Jerry Lee Lewis.;['Jim McBride', None];['Dennis Quaid', 'Winona Ryder', 'John Doe', 'Stephen Tobolowsky']
39;Chorus Line;1985;Tous publics;113;['Drama', ' Music', ' Musical            '];6.2;46;Hopefuls try out before a demanding director for a part in a new musical.;['Richard Attenborough', None];['Michael Douglas', 'Terrence Mann', 'Michael Blevins', 'Yamil Borges']
40;Flashdance;1983;Tous publics;95;['Drama', ' Music', ' Romance            '];6.2;39;A Pittsburgh woman with two jobs as a welder and an exotic dancer wants to get into ballet school.;['Adrian Lyne', None];['Jennifer Beals', 'Michael Nouri', 'Lilia Skala', 'Sunny Johnson']
41;We Are Your Friends;2015;Tous publics;96;['Drama', ' Music', ' Romance            '];6.1;46;Caught between a forbidden romance and the expectations of his friends, aspiring DJ Cole Carter attempts to find the path in life that leads to fame and fortune.;['Max Joseph', None];['Zac Efron', 'Wes Bentley', 'Emily Ratajkowski', 'Jonny Weston']
42;Sexy Dance 3 The Battle;2010;Tous Public;107;['Drama', ' Music', ' Romance            '];6.1;45;A tight-knit group of New York City street dancers find themselves pitted against the world's best hip hop dancers in a high-stakes showdown.;['Jon M. Chu', None];['Sharni Vinson', 'Rick Malambri', 'Adam Sevani', 'Alyson Stoner']
43;Work It;2020;7;93;['Comedy', ' Music            '];6.1;58;When Quinn Ackerman's admission to the college of her dreams depends on her performance at a dance competition, she forms a ragtag group of dancers to take on the best squad in school...now she just needs to learn how to dance.;['Laura Terruso', None];['Keiynan Lonsdale', 'Liza Koshy', 'Briana Andrade-Gomes', 'Kalliane Brémault']
44;Marry Me;2022;Tous publics;112;['Comedy', ' Music', ' Romance            '];6.1;51;Music superstars Kat Valdez and Bastian are getting married before a global audience of fans. But when Kat learns, seconds before her vows, that Bastian has been unfaithful, she instead decides to marry Charlie, a stranger in the crowd.;['Kat Coiro', None];['Jennifer Lopez', 'Owen Wilson', 'Maluma', 'John Bradley']
45;ATL;2006;PG-13;105;['Comedy', ' Crime', ' Drama            '];6.1;63;As four friends prepare for life after high school, different challenges bring about turning points in each of their lives. The dramas unfold and resolve at their local rollerskating rink, Cascade.;['Chris Robinson', None];['T.I.', 'Lauren London', 'Evan Ross', 'Greg Andrews']
46;The man who cried - Les larmes d'un homme;2000;Tous publics;100;['Drama', ' Music', ' Romance            '];6.1;40;A young refugee traveling from Russia to America in search of her lost father falls for a gypsy horseman.;['Sally Potter', None];['Christina Ricci', 'Cate Blanchett', 'Oleg Yankovskiy', 'Claudia Lander-Duke']
47;Radio Rebels;1994;PG-13;92;['Comedy', ' Crime', ' Music            '];6.1;46;Three band members hoping for a big break head to a radio station to play their demo tape and wind up holding everyone hostage with plastic guns when the head D.J. refuses to play them.;['Michael Lehmann', None];['Brendan Fraser', 'Steve Buscemi', 'Adam Sandler', 'Chris Farley']
48;Une étoile est née;1976;Tous publics;139;['Drama', ' Music', ' Romance            '];6.1;59;A has-been rock star falls in love with a young, up-and-coming songstress.;['Frank Pierson', None];['Barbra Streisand', 'Kris Kristofferson', 'Gary Busey', 'Oliver Clark']
49;Beyond the Valley of the Dolls;1970;16;109;['Comedy', ' Drama', ' Music            '];6.1;60;Three girls come to Hollywood to make it big, but find only sex, drugs and sleaze.;['Russ Meyer', None];['Dolly Read', 'Cynthia Myers', 'Marcia McBroom', 'John Lazar']
0;Le roi de la polka;2017;NaN;95;['Biography', ' Comedy', ' Drama            '];6.0;65;Local Pennsylvania polka legend Jan Lewan develops a plan to get rich that shocks his fans and lands him in jail.;['Maya Forbes', None];['Jack Black', 'Jenny Slate', 'Jason Schwartzman', 'Jacki Weaver']
1;Ricki and the Flash;2015;Tous Public;101;['Comedy', ' Drama', ' Music            '];6.0;54;A musician who gave up everything for her dream of rock-and-roll stardom returns home, looking to make things right with her family.;['Jonathan Demme', None];['Meryl Streep', 'Kevin Kline', 'Mamie Gummer', 'Sebastian Stan']
2;La dernière chanson;2010;Tous Public;108;['Drama', ' Music', ' Romance            '];6.0;33;A rebellious girl is sent to a Southern beach town for the summer to stay with her father. Through their mutual love of music, the estranged duo learn to reconnect.;['Julie Anne Robinson', None];['Miley Cyrus', 'Liam Hemsworth', 'Greg Kinnear', 'Bobby Coleman']
3;Moonwalker;1988;Tous Public;93;['Action', ' Crime', ' Fantasy            '];6.0;-1;"Anthology movie by, and starring, Michael Jackson in his prime, combining a number of music videos from his bestselling ""Bad"" album with a fantasy tale of Michael's confrontation with a ruthless drug dealer known as Mr. Big.";['    Directors:', 'Jerry Kramer, ', 'Colin Chilvers', None];['Michael Jackson', 'Joe Pesci', 'Sean Lennon', 'Kelley Parker']
4;Sexy Dance 5: All in Vegas;2014;Tous Public;112;['Drama', ' Music', ' Romance            '];5.9;45;All-stars from the previous Step Up installments come together in glittering Las Vegas, battling for a victory that could define their dreams and their careers.;['Trish Sie', None];['Ryan Guzman', 'Briana Evigan', 'Adam Sevani', 'Misha Gabriel Hamilton']
5;Grand Piano;2013;R;90;['Drama', ' Music', ' Mystery            '];5.9;61;A pianist with stage fright endures a performance under the eyes of a mysterious sniper, who will shoot and kill him if a wrong note is played.;['Eugenio Mira', None];['Elijah Wood', 'John Cusack', 'Kerry Bishé', 'Tamsin Egerton']
6;Bill et Ted sauvent l'Univers;2020;Tous publics;91;['Adventure', ' Comedy', ' Music            '];5.9;65;Once told they'd save the universe during a time-traveling adventure, 2 would-be rockers from San Dimas, California find themselves as middle-aged dads still trying to crank out a hit song and fulfill their destiny.;['Dean Parisot', None];['Keanu Reeves', 'Alex Winter', 'Kristen Schaal', 'Samara Weaving']
7;Dirty Dancing 2;2004;Tous publics;86;['Drama', ' Music', ' Romance            '];5.9;39;High school senior Katey moves to Havana in November 1958, when her dad gets a promotion at Ford. She meets a local waiter, who introduces her to sensual Cuban music/dance. They enter a big dance contest for the prize when he gets fired.;['Guy Ferland', None];['Diego Luna', 'Romola Garai', 'Sela Ward', 'John Slattery']
8;Beat Battle;2002;Tous Public;118;['Comedy', ' Drama', ' Romance            '];5.9;63;A band director recruits a Harlem street drummer to play at a Southern university.;['Charles Stone III', None];['Nick Cannon', 'Zoe Saldana', 'Orlando Jones', 'Leonard Roberts']
9;Capitaine Corelli;2001;Tous publics;131;['Drama', ' Music', ' Romance            '];5.9;36;When a fisherman leaves to fight with the Greek army during World War II, his fiancée falls in love with the local Italian commander.;['John Madden', None];['Nicolas Cage', 'Penélope Cruz', 'John Hurt', 'Christian Bale']
10;Girls Just Want to Have Fun;1985;Tous Public;90;['Comedy', ' Music', ' Romance            '];5.9;56;"Janey is new in town and soon meets Lynne, who shares her passion for dancing in general and ""Dance TV"" in particular.";['Alan Metter', None];['Biff Yeager', 'Kristi Somers', 'Richard Blade', 'Ian Michael Giatti']
11;Vox Lux;2018;R;114;['Drama', ' Music            '];5.8;67;An unusual set of circumstances brings unexpected success to a pop star.;['Brady Corbet', None];['Natalie Portman', 'Jude Law', 'Stacy Martin', 'Jennifer Ehle']
12;Pitch Perfect 3;2017;Tous publics;93;['Comedy', ' Music            '];5.8;40;Following their win at the world championship, the now separated Bellas reunite for one last singing competition at an overseas USO tour, but face a group who uses both instruments and voices.;['Trish Sie', None];['Anna Kendrick', 'Rebel Wilson', 'Brittany Snow', 'Anna Camp']
13;All Eyez on Me;2017;R;139;['Biography', ' Drama', ' Music            '];5.8;38;Tells the true and untold story of prolific rapper, actor, poet and activist Tupac Shakur.;['Benny Boom', None];['Demetrius Shipp Jr.', 'Danai Gurira', 'Kat Graham', 'Annie Ilonzeh']
14;StreetDance 3D;2010;Tous Public;98;['Drama', ' Music', ' Romance            '];5.8;-1;In order to win the Street Dance Championships, a dance crew is forced to work with ballet dancers from the Royal Dance School in exchange for rehearsal space.;['    Directors:', 'Max Giwa, ', 'Dania Pasquini', None];['Nichola Burley', 'Richard Winsor', 'Ukweli Roach', 'Frank Harper']
15;Happy Feet 2;2011;Tous publics;117;['Animation', ' Adventure', ' Comedy            '];5.8;50;Mumble's son, Erik, is struggling to realize his talents in the Emperor Penguin world. Meanwhile, Mumble and his family and friends discover a new threat their home -- one that will take everyone working together to save them.;['    Directors:', 'George Miller, ', 'Gary Eck, ', 'David Peers', None];['Elijah Wood', 'Robin Williams', 'Pink', 'Carlos Alazraqui']
16;Footloose;2011;Tous Public;113;['Comedy', ' Drama', ' Music            '];5.8;58;City teenager Ren MacCormack moves to a small town where rock music and dancing have been banned, and his rebellious spirit shakes up the populace.;['Craig Brewer', None];['Kenny Wormald', 'Julianne Hough', 'Dennis Quaid', 'Andie MacDowell']
17;Trouve ta voix;2004;PG;107;['Family', ' Music', ' Musical            '];5.8;33;A girl from a small town heads to the big city of Los Angeles to spend the summer at a performing arts high school.;['Sean McNamara', None];['Hilary Duff', 'John Corbett', 'Rebecca De Mornay', 'Oliver James']
18;Studio 54;1998;12;93;['Drama', ' Music            '];5.8;33;The famous 1970s New York City nightclub seen and told through the eyes of a young employee.;['Mark Christopher', None];['Ryan Phillippe', 'Salma Hayek', 'Neve Campbell', 'Mike Myers']
19;How to Talk to Girls at Parties;2017;Tous publics;102;['Comedy', ' Music', ' Romance            '];5.7;50;An alien touring the galaxy breaks away from her group and meets two young inhabitants of the most dangerous place in the universe: the London borough of Croydon.;['John Cameron Mitchell', None];['Elle Fanning', 'Alex Sharp', 'Nicole Kidman', 'Matt Lucas']
20;Last Days;2005;R;97;['Drama', ' Music            '];5.7;67;A Seattle musician's life and career are reminiscent of those of Kurt Cobain.;['Gus Van Sant', None];['Michael Pitt', 'Lukas Haas', 'Asia Argento', 'Scott Patrick Green']
21;Coyote Girls;2000;Tous publics;100;['Comedy', ' Drama', ' Music            '];5.7;27;Aspiring songwriter Violet Sanford, after getting a job at a women-run NYC bar that teases its male patrons, comes out of her shell.;['David McNally', None];['Piper Perabo', 'Adam Garcia', 'John Goodman', 'Maria Bello']
22;Magic Mike XXL;2015;Tous publics;115;['Comedy', ' Drama', ' Music            '];5.6;60;Three years after Mike bowed out of the stripper life at the top of his game, he and the remaining Kings of Tampa hit the road to Myrtle Beach to put on one last blow-out performance.;['Gregory Jacobs', None];['Channing Tatum', 'Joe Manganiello', 'Matt Bomer', 'Adam Rodriguez']
23;Song to Song;I) (2017;Tous publics;129;['Drama', ' Music', ' Romance            '];5.6;54;Two intersecting love triangles. Obsession and betrayal set against the music scene in Austin, Texas.;['Terrence Malick', None];['Ryan Gosling', 'Rooney Mara', 'Michael Fassbender', 'Natalie Portman']
24;Be Cool;2005;Tous Public;118;['Comedy', ' Crime', ' Music            '];5.6;37;Disenchanted with the movie industry, Chili Palmer tries the music industry, meeting and romancing a widow of a music executive on the way.;['F. Gary Gray', None];['John Travolta', 'Uma Thurman', 'Dwayne Johnson', 'Vince Vaughn']
25;Kevin & Perry;2000;Tous publics;82;['Comedy', ' Music            '];5.6;-1;Two inseparable, hormonal, English BFF teen boys, avoided by all others, head to Ibiza with Kevin's parents. Will they lose their virginity there?;['Ed Bye', None];['Harry Enfield', 'Kathy Burke', 'Rhys Ifans', 'Laura Fraser']
26;Sister Act: acte 2;1993;Tous Public;107;['Comedy', ' Family', ' Music            '];5.6;38;Showgirl Deloris Van Cartier returns as Sister Mary Clarence to teach music to a group of Catholic students whose run-down school is slated for closure.;['Bill Duke', None];['Whoopi Goldberg', 'Kathy Najimy', 'Maggie Smith', 'Barnard Hughes']
27;Rock the Kasbah;2015;R;106;['Comedy', ' Music', ' War            '];5.5;29;A down-on-his-luck music manager discovers a teenage girl with an extraordinary voice while on a music tour in Afghanistan and takes her to Kabul to compete on the popular television show, Afghan Star.;['Barry Levinson', None];['Bill Murray', 'Leem Lubany', 'Zooey Deschanel', 'Bruce Willis']
28;American Dreamz;2006;Tous publics;107;['Comedy', ' Music            '];5.5;45;"The new season of ""American Dreamz,"" the wildly popular television singing contest, has captured the country's attention, as the competition looks to be between a young Midwestern gal (Moore) and a showtunes-loving young man from Orange County (Golzari). Recently awakened President Staton (Quaid) even wants in on the craze, as he signs up for the potential explosive season finale.";['Paul Weitz', None];['Hugh Grant', 'Dennis Quaid', 'Mandy Moore', 'Willem Dafoe']
29;Lizzie McGuire, le film;2003;Tous publics;94;['Adventure', ' Comedy', ' Family            '];5.5;56;Lizzie McGuire has graduated from middle school and takes a trip to Rome, Italy with her class. And what was supposed to be only a normal trip, becomes a teenager's dream come true.;['Jim Fall', None];['Hilary Duff', 'Adam Lamberg', 'Clayton Snyder', 'Hallie Todd']
30;Josie et les Pussycats;2001;Tous publics;98;['Comedy', ' Music            '];5.5;47;A girl group find themselves in the middle of a conspiracy to deliver subliminal messages through popular music.;['    Directors:', 'Harry Elfont, ', 'Deborah Kaplan', None];['Rachael Leigh Cook', 'Tara Reid', 'Rosario Dawson', 'Gabriel Mann']
31;Steppin';2007;Tous Public;115;['Drama', ' Music', ' Romance            '];5.4;44;When his brother is murdered, a street dancer moves to Georgia to work his way through college. He joins a fraternity's step dancing team for a competition. Will he also get an education and the girl?;['Sylvain White', None];['Columbus Short', 'Meagan Good', 'Ne-Yo', 'Darrin Dewitt Henson']
32;Réussir ou mourir;2005;12;117;['Biography', ' Crime', ' Drama            '];5.4;45;A tale of an inner city drug dealer who turns away from a life of crime to pursue his passion of rap music.;['Jim Sheridan', None];['50 Cent', 'Joy Bryant', 'Adewale Akinnuoye-Agbaje', 'Omar Benson Miller']
33;Le gourou et les femmes;2002;Tous publics;94;['Comedy', ' Music', ' Romance            '];5.4;47;A young man leaves India to find fame and fortune in America where he unexpectedly becomes a sex guru.;['Daisy von Scherler Mayer', None];['Jimi Mistry', 'Heather Graham', 'Marisa Tomei', 'Michael McKean']
34;Honey;2003;Tous publics;94;['Drama', ' Music', ' Romance            '];5.3;37;Honey is a sexy, tough music video choreographer who shakes up her life after her mentor gives her an ultimatum: sleep with him or be blacklisted within their industry.;['Bille Woodruff', None];['Jessica Alba', 'Mekhi Phifer', 'Romeo Miller', 'Missy Elliott']
35;Le livre de la jungle 2;2003;Tous publics;72;['Animation', ' Adventure', ' Comedy            '];5.3;38;Mowgli, missing the jungle and his old friends, runs away from the man village unaware of the danger he's in by going back to the wild.;['Steve Trenbirth', None];['John Goodman', 'Haley Joel Osment', 'Tony Jay', 'Mae Whitman']
36;We Summon the Darkness;2019;R;91;['Horror', ' Music', ' Thriller            '];5.2;55;Three best friends embark on a road trip to a heavy-metal show, where they bond with three aspiring musicians and head off to one of the girls' country home for an after-party.;['Marc Meyers', None];['Alexandra Daddario', 'Keean Johnson', 'Maddie Hasson', 'Amy Forsyth']
37;Alvin et les Chipmunks;2007;Tous publics;92;['Adventure', ' Comedy', ' Drama            '];5.2;39;Three musical chipmunks are discovered by an aspiring songwriter who wants to use their amazing singing abilities to become famous.;['Tim Hill', None];['Jason Lee', 'Ross Bagdasarian Jr.', 'Janice Karman', 'David Cross']
38;Alvin et les Chipmunks : À fond la caisse;2015;Tous publics;92;['Animation', ' Adventure', ' Comedy            '];4.9;33;The Chipmunks believe that Dave plans to propose to his new girlfriend in Miami.--and dump them. They have three days to get to him and save themselves not only from losing Dave but also from gaining a terrible stepbrother.;['Walt Becker', None];['Jason Lee', 'Justin Long', 'Matthew Gray Gubler', 'Jesse McCartney']
39;High School Musical 3 - Nos années lycée;2008;Tous Public;112;['Comedy', ' Drama', ' Family            '];4.9;57;As seniors in high school, Troy and Gabriella struggle with the idea of being separated from one another as college approaches. Along with the rest of the Wildcats, they stage a spring musical to address their experiences, hopes and fears about their future.;['Kenny Ortega', None];['Zac Efron', 'Vanessa Hudgens', 'Ashley Tisdale', 'Lucas Grabeel']
40;Blues Brothers 2000;1998;Tous publics;123;['Action', ' Comedy', ' Crime            '];4.9;-1;"Elwood must reunite the old band, with a few new members, and go on another ""Mission from God.""";['John Landis', None];['Dan Aykroyd', 'John Goodman', 'Walter Levine', 'Tom Davis']
41;9 Songs;2004;18;71;['Drama', ' Music', ' Romance            '];4.8;43;In London, intense sexual encounters take place between an American college student, named Lisa, and an English scientist, named Matt, between attending rock concerts.;['Michael Winterbottom', None];"[""Kieran O'Brien"", 'Margo Stilley', 'Robert Levon Been', 'Black Rebel Motorcycle Club']"
42;Who's That Girl;1987;Tous Public;92;['Comedy', ' Music', ' Romance            '];4.8;27;The life of an uptight tax lawyer turns chaotic when he is asked to escort a young woman newly released from prison, who persuades him to help prove her innocence.;['James Foley', None];['Madonna', 'Griffin Dunne', 'Haviland Morris', 'John McMartin']
43;Staying Alive;1983;Tous publics;93;['Drama', ' Music', ' Romance            '];4.7;23;Five years later, Tony Manero's Saturday Night Fever is still burning. Now he's strutting toward his biggest challenge yet: succeeding as a dancer on the Broadway stage.;['Sylvester Stallone', None];['John Travolta', 'Cynthia Rhodes', 'Finola Hughes', 'Steve Inwood']
44;Journal intime d'une future star;2004;Tous publics;89;['Comedy', ' Family', ' Music            '];4.6;33;A teenage girl is convinced that her home city revolves around her until her family packs up and moves to the suburbs, where she finds herself competing for attention.;['Sara Sugarman', None];['Lindsay Lohan', 'Megan Fox', 'Adam Garcia', 'Glenne Headly']
45;Ishtar;1987;Tous Public;107;['Action', ' Adventure', ' Comedy            '];4.6;52;Two terrible lounge singers get booked to play a gig in a Moroccan hotel but somehow become pawns in an international power play between the C.I.A., the Emir of Ishtar, and the rebels trying to overthrow his regime.;['Elaine May', None];['Warren Beatty', 'Dustin Hoffman', 'Isabelle Adjani', 'Charles Grodin']
46;Alvin et les Chipmunks 2;2009;Tous Public;88;['Animation', ' Adventure', ' Comedy            '];4.5;41;The world-famous singing preteen chipmunk trio return to contend with the pressures of school, celebrity, and a rival female music group known as The Chipettes.;['Betty Thomas', None];['Jason Lee', 'Zachary Levi', 'David Cross', 'Justin Long']
47;Hannah Montana - Le film;2009;Tous Public;102;['Comedy', ' Drama', ' Family            '];4.5;47;As Hannah Montana's popularity begins to take over her life, Miley Stewart, on the urging from her father takes a trip to her hometown of Crowley Corners, Tennessee to get some perspective on what matters in life the most.;['Peter Chelsom', None];['Miley Cyrus', 'Emily Osment', 'Billy Ray Cyrus', 'Jason Earles']
48;Grease 2;1982;NaN;115;['Comedy', ' Music', ' Musical            '];4.5;52;A British student at a 1960s American high school must prove himself to the leader of a girls' gang whose members can only date greasers.;['Patricia Birch', None];['Michelle Pfeiffer', 'Maxwell Caulfield', 'Lorna Luft', 'Maureen Teefy']
49;Alvin et les Chipmunks 3;2011;Tous Public;87;['Animation', ' Adventure', ' Comedy            '];4.3;24;Playing around while aboard a cruise ship, the Chipmunks and Chipettes accidentally go overboard and end up marooned in a tropical paradise. They discover their new turf is not as deserted as it seems.;['Mike Mitchell', None];['Justin Long', 'Matthew Gray Gubler', 'Jesse McCartney', 'Jason Lee']
0;Yoga Hosers;2016;PG-13;88;['Action', ' Comedy', ' Horror            '];4.2;23;Two teenage yoga enthusiasts must do battle with an evil presence that is threatening to rise from its underground lair and endanger their major party plans.;['Kevin Smith', None];['Lily-Rose Depp', 'Harley Quinn Smith', 'Johnny Depp', 'Adam Brody']
1;Street Dancers;2004;Tous Public;95;['Drama', ' Music            '];3.8;37;In order to achieve their dream of opening a recording studio, two friends (Omarion, Houston) must first win their city's dance contest -- a fierce competition that pits them against a group of tough street dancers.;['Chris Stokes', None];"['Omarion', 'Jarell Houston', 'Raz B', ""Lil' Fizz""]"
2;Spice World;1997;Tous publics;93;['Comedy', ' Family', ' Music            '];3.6;32;World famous pop group the Spice Girls zip around London in their luxurious double decker tour bus having various adventures and performing for their fans.;['Bob Spiers', None];['Mel B', 'Emma Bunton', 'Melanie C', 'Geri Horner']
3;Spy Kids 4: Tout le temps du monde;2011;PG;89;['Action', ' Adventure', ' Comedy            '];3.5;37;A retired spy is called back into action, and to bond with her new step-children, she invites them along for the adventure to stop the evil Timekeeper from taking over the world.;['Robert Rodriguez', None];['Jessica Alba', 'Jeremy Piven', 'Joel McHale', 'Rowan Blanchard']
4;Dance Movie;2009;PG-13;83;['Action', ' Comedy', ' Music            '];3.5;40;Street dancer Thomas Uncles is from the wrong side of the tracks, but his bond with the beautiful Megan White might help the duo realize their dreams as they enter in the mother of all dance battles.;['Damien Dante Wayans', None];['Marlon Wayans', 'Shawn Wayans', 'Shoshana Bush', 'Damon Wayans Jr.']
