;name;year;certificate;runtime;genre;rating;metascore;text-muted;director;stars
0;Whiplash;2014;Tous publics;106;['Drama', ' Music            '];8.5;88;A promising young drummer enrolls at a cut-throat music conservatory where his dreams of greatness are mentored by an instructor who will stop at nothing to realize a student's potential.;['Damien Chazelle', None];['Miles Teller', 'J.K. Simmons', 'Melissa Benoist', 'Paul Reiser']
1;Le pianiste;2002;Tous publics;150;['Biography', ' Drama', ' Music            '];8.5;85;A Polish Jewish musician struggles to survive the destruction of the Warsaw ghetto of World War II.;['Roman Polanski', None];['Adrien Brody', 'Thomas Kretschmann', 'Frank Finlay', 'Emilia Fox']
2;Coco;I) (2017;Tous publics;105;['Animation', ' Adventure', ' Comedy            '];8.4;81;Aspiring musician Miguel, confronted with his family's ancestral ban on music, enters the Land of the Dead to find his great-great-grandfather, a legendary singer.;['    Directors:', 'Lee Unkrich, ', 'Adrian Molina', None];['Anthony Gonzalez', 'Gael García Bernal', 'Benjamin Bratt', 'Alanna Ubach']
3;Amadeus;1984;Tous publics;160;['Biography', ' Drama', ' Music            '];8.4;88;The life, success and troubles of Wolfgang Amadeus Mozart, as told by Antonio Salieri, the contemporaneous composer who was insanely jealous of Mozart's talent and claimed to have murdered him.;['Milos Forman', None];['F. Murray Abraham', 'Tom Hulce', 'Elizabeth Berridge', 'Roy Dotrice']
4;Andhadhun;2018;NaN;139;['Comedy', ' Crime', ' Music            '];8.2;-1;A series of mysterious events change the life of a blind pianist, who must now report a crime that he should technically know nothing of.;['Sriram Raghavan', None];['Tabu', 'Ayushmann Khurrana', 'Radhika Apte', 'Anil Dhawan']
5;Green Book: Sur les routes du sud;2018;Tous publics;130;['Biography', ' Comedy', ' Drama            '];8.2;69;A working-class Italian-American bouncer becomes the driver for an African-American classical pianist on a tour of venues through the 1960s American South.;['Peter Farrelly', None];['Viggo Mortensen', 'Mahershala Ali', 'Linda Cardellini', 'Sebastian Maniscalco']
6;Certains l'aiment chaud;1959;12;121;['Comedy', ' Music', ' Romance            '];8.2;98;After two male musicians witness a mob hit, they flee the state in an all-female band disguised as women, but further complications set in.;['Billy Wilder', None];['Marilyn Monroe', 'Tony Curtis', 'Jack Lemmon', 'George Raft']
7;Un homme dans la foule;1957;Tous publics;126;['Drama', ' Music            '];8.2;72;A female radio reporter turns a folk-singing drifter into a powerful media star.;['Elia Kazan', None];['Andy Griffith', 'Patricia Neal', 'Anthony Franciosa', 'Walter Matthau']
8;Sonate d'automne;1978;Tous publics;99;['Drama', ' Music            '];8.1;-1;A devoted wife is visited by her mother, a successful concert pianist who had little time for her when she was young.;['Ingmar Bergman', None];['Ingrid Bergman', 'Liv Ullmann', 'Lena Nyman', 'Halvar Björk']
9;Les chaussons rouges;1948;Tous Public;135;['Drama', ' Music', ' Romance            '];8.1;-1;A young ballet dancer is torn between the man she loves and her pursuit to become a prima ballerina.;['    Directors:', 'Michael Powell, ', 'Emeric Pressburger', None];['Anton Walbrook', 'Marius Goring', 'Moira Shearer', 'Robert Helpmann']
10;La La Land;2016;Tous publics;128;['Comedy', ' Drama', ' Music            '];8.0;94;While navigating their careers in Los Angeles, a pianist and an actress fall in love while attempting to reconcile their aspirations for the future.;['Damien Chazelle', None];['Ryan Gosling', 'Emma Stone', 'Rosemarie DeWitt', 'J.K. Simmons']
11;Soul;2020;6+;100;['Animation', ' Adventure', ' Comedy            '];8.0;83;After landing the gig of a lifetime, a New York jazz pianist suddenly finds himself trapped in a strange land between Earth and the afterlife.;['    Directors:', 'Pete Docter, ', 'Kemp Powers', None];['Jamie Foxx', 'Tina Fey', 'Graham Norton', 'Rachel House']
12;CODA;2021;13;111;['Comedy', ' Drama', ' Music            '];8.0;74;As a CODA (Child of Deaf Adults) Ruby is the only hearing person in her deaf family. When the family's fishing business is threatened, Ruby finds herself torn between pursuing her passion at Berklee College of Music and her fear of abandoning her parents.;['Sian Heder', None];['Emilia Jones', 'Marlee Matlin', 'Troy Kotsur', 'Daniel Durant']
13;La légende du pianiste sur l'océan;1998;Tous publics;169;['Drama', ' Music', ' Romance            '];8.0;58;A baby boy, discovered in 1900 on an ocean liner, grows into a musical prodigy, never setting foot on land.;['Giuseppe Tornatore', None];['Tim Roth', 'Pruitt Taylor Vince', 'Mélanie Thierry', 'Bill Nunn']
14;Pink Floyd: The Wall;1982;12;95;['Drama', ' Fantasy', ' Music            '];8.0;47;A confined but troubled rock star descends into madness in the midst of his physical and social isolation from everyone.;['Alan Parker', None];['Bob Geldof', 'Christine Hargreaves', 'James Laurenson', 'Eleanor David']
15;Les Feux de la rampe;1952;Tous publics;137;['Drama', ' Music', ' Romance            '];8.0;-1;A fading comedian and a suicidally despondent ballet dancer must look to each other to find purpose and hope in their lives.;['Charles Chaplin', None];['Charles Chaplin', 'Claire Bloom', 'Nigel Bruce', 'Buster Keaton']
16;Sing Street;2016;Tous publics;106;['Comedy', ' Drama', ' Music            '];7.9;79;A boy growing up in Dublin during the 1980s escapes his strained family life by starting a band to impress the mysterious girl he likes.;['John Carney', None];['Ferdia Walsh-Peelo', 'Aidan Gillen', 'Maria Doyle Kennedy', 'Jack Reynor']
17;Gully Boy;2019;NaN;154;['Drama', ' Music', ' Romance            '];7.9;65;A coming-of-age story based on the lives of street rappers in Mumbai.;['Zoya Akhtar', None];['Ranveer Singh', 'Alia Bhatt', 'Siddhant Chaturvedi', 'Vijay Raaz']
18;Bohemian Rhapsody;2018;Tous publics;134;['Biography', ' Drama', ' Music            '];7.9;49;The story of the legendary British rock band Queen and lead singer Freddie Mercury, leading up to their famous performance at Live Aid (1985).;['Bryan Singer', None];['Rami Malek', 'Lucy Boynton', 'Gwilym Lee', 'Ben Hardy']
19;Presque célèbre;2000;Tous publics;122;['Adventure', ' Comedy', ' Drama            '];7.9;90;A high-school boy in the early 1970s is given the chance to write a story for Rolling Stone magazine about an up-and-coming rock band as he accompanies them on their concert tour.;['Cameron Crowe', None];['Billy Crudup', 'Patrick Fugit', 'Kate Hudson', 'Frances McDormand']
20;Spinal Tap;1984;Tous publics;82;['Comedy', ' Music            '];7.9;92;Spinal Tap, one of England's loudest bands, is chronicled by film director Marty DiBergi on what proves to be a fateful tour.;['Rob Reiner', None];['Rob Reiner', 'Michael McKean', 'Christopher Guest', 'Kimberly Stringer']
21;Les Blues Brothers;1980;Tous publics;133;['Action', ' Adventure', ' Comedy            '];7.9;60;Jake Blues rejoins with his brother Elwood after being released from prison, but the duo has just days to reunite their old R&B band and save the Catholic home where the two were raised, outrunning the police as they tear through Chicago.;['John Landis', None];['John Belushi', 'Dan Aykroyd', 'Cab Calloway', 'John Candy']
22;N.W.A: Straight Outta Compton;2015;Tous publics;147;['Biography', ' Drama', ' History            '];7.8;72;The rap group NWA emerges from the mean streets of Compton in Los Angeles, California, in the mid-1980s and revolutionizes Hip Hop culture with their music and tales about life in the hood.;['F. Gary Gray', None];"[""O'Shea Jackson Jr."", 'Corey Hawkins', 'Jason Mitchell', 'Neil Brown Jr.']"
23;Once;I) (2007;Tous publics;86;['Drama', ' Music', ' Romance            '];7.8;88;A modern-day musical about a busker and an immigrant and their eventful week in Dublin, as they write, rehearse and record songs that tell their love story.;['John Carney', None];['Glen Hansard', 'Markéta Irglová', 'Hugh Walsh', 'Gerard Hendrick']
24;Interstella 5555: The 5tory of the 5ecret 5tar 5ystem;2003;Tous publics;68;['Animation', ' Adventure', ' Music            '];7.8;-1;"A continuation of the story told in the Daft Punk music videos ""One More Time,"" ""Aerodynamic,"" ""Digital Love,"" and ""Harder, Better, Faster, Stronger.""";['    Directors:', 'Daisuke Nishio, ', 'Hirotoshi Rissen, ', 'Leiji Matsumoto, ', 'Kazuhisa Takenouchi', None];['Romanthony', 'Thomas Bangalter']
25;Walk the Line;2005;Tous publics;136;['Biography', ' Drama', ' Music            '];7.8;72;A chronicle of country music legend Johnny Cash's life, from his early days on an Arkansas cotton farm to his rise to fame with Sun Records in Memphis, where he recorded alongside Elvis Presley, Jerry Lee Lewis, and Carl Perkins.;['James Mangold', None];['Joaquin Phoenix', 'Reese Witherspoon', 'Ginnifer Goodwin', 'Robert Patrick']
26;Que le spectacle commence...;1979;Tous publics;123;['Drama', ' Music', ' Musical            '];7.8;72;Director/choreographer Bob Fosse tells his own life story as he details the sordid career of Joe Gideon, a womanizing, drug-using dancer.;['Bob Fosse', None];['Roy Scheider', 'Jessica Lange', 'Ann Reinking', 'Leland Palmer']
27;Cabaret;1972;Tous publics;124;['Drama', ' Music', ' Musical            '];7.8;80;A female girlie club entertainer in Weimar Republic era Berlin romances two men while the Nazi Party rises to power around them.;['Bob Fosse', None];['Liza Minnelli', 'Michael York', 'Helmut Griem', 'Joel Grey']
28;Une nuit à l'opéra;1935;Tous Public;96;['Comedy', ' Music', ' Musical            '];7.8;-1;A sly business manager and the wacky friends of two opera singers in Italy help them achieve success in America while humiliating their stuffy and snobbish enemies.;['    Directors:', 'Sam Wood, ', 'Edmund Goulding', None];['Groucho Marx', 'Chico Marx', 'Harpo Marx', 'Kitty Carlisle']
29;Sound of Metal;2019;Tous publics;120;['Drama', ' Music            '];7.7;82;A heavy-metal drummer's life is thrown into freefall when he begins to lose his hearing.;['Darius Marder', None];['Riz Ahmed', 'Olivia Cooke', 'Paul Raci', 'Lauren Ridloff']
30;Alabama Monroe;2012;Tous publics;111;['Drama', ' Music', ' Romance            '];7.7;70;Elise and Didier fall in love at first sight, in spite of their differences. He talks, she listens. He's a romantic atheist, she's a religious realist. When their daughter becomes seriously ill, their love is put on trial.;['Felix van Groeningen', None];['Veerle Baetens', 'Johan Heldenbergh', 'Nell Cattrysse', 'Geert Van Rampelberg']
31;Joyeux Noël;2005;Tous publics;116;['Drama', ' History', ' Music            '];7.7;70;In December 1914, an unofficial Christmas truce on the Western Front allows soldiers from opposing sides of the First World War to gain insight into each other's way of life.;['Christian Carion', None];['Diane Kruger', 'Benno Fürmann', 'Guillaume Canet', 'Natalie Dessay']
32;Ray;I) (2004;Tous publics;152;['Biography', ' Drama', ' Music            '];7.7;73;The story of the life and career of the legendary rhythm and blues musician Ray Charles, from his humble beginnings in the South, where he went blind at age seven, to his meteoric rise to stardom during the 1950s and 1960s.;['Taylor Hackford', None];['Jamie Foxx', 'Regina King', 'Kerry Washington', 'Clifton Powell']
33;Billy Elliot;2000;Tous publics;110;['Drama', ' Music            '];7.7;74;A talented young boy becomes torn between his unexpected love of dance and the disintegration of his family.;['Stephen Daldry', None];['Jamie Bell', 'Julie Walters', 'Jean Heywood', 'Jamie Draven']
34;Hedwig and the Angry Inch;2001;Tous publics;95;['Comedy', ' Drama', ' Music            '];7.7;85;A gender-queer punk-rock singer from East Berlin tours the U.S. with her band as she tells her life story and follows the former lover/band-mate who stole her songs.;['John Cameron Mitchell', None];['John Cameron Mitchell', 'Miriam Shor', 'Stephen Trask', 'Theodore Liscinski']
35;O' Brother;2000;Tous publics;107;['Adventure', ' Comedy', ' Crime            '];7.7;69;In the deep south during the 1930s, three escaped convicts search for hidden treasure while a relentless lawman pursues them.;['    Directors:', 'Joel Coen, ', 'Ethan Coen', None];['George Clooney', 'John Turturro', 'Tim Blake Nelson', 'John Goodman']
36;Shine;1996;Tous publics;105;['Biography', ' Drama', ' Music            '];7.7;87;Pianist David Helfgott, driven by his father and teachers, has a breakdown. Years later he returns to the piano, to popular if not critical acclaim.;['Scott Hicks', None];['Geoffrey Rush', 'Armin Mueller-Stahl', 'Justin Braine', 'Sonia Todd']
37;Nashville;1975;Tous publics;160;['Comedy', ' Drama', ' Music            '];7.7;96;Over the course of a few hectic days, numerous interrelated people prepare for a political convention.;['Robert Altman', None];['Keith Carradine', 'Karen Black', 'Ronee Blakley', 'Shelley Duvall']
38;Fantasia;1940;Tous publics;125;['Animation', ' Family', ' Fantasy            '];7.7;96;A collection of animated interpretations of great works of Western classical music, ranging from the abstract to depictions of mythology and fantasy, and settings including the prehistoric, supernatural and sacred.;['    Directors:', 'James Algar, ', 'Samuel Armstrong, ', 'Ford Beebe Jr., ', 'Norman Ferguson, ', 'David Hand, ', 'Jim Handley, ', 'T. Hee, ', 'Wilfred Jackson, ', 'Hamilton Luske, ', 'Bill Roberts, ', 'Paul Satterfield, ', 'Ben Sharpsteen', None];['Leopold Stokowski', 'Deems Taylor', 'The Philadelphia Orchestra', 'Corey Burton']
39;L'ange bleu;1930;Tous Public;104;['Drama', ' Music            '];7.7;88;An elderly professor's ordered life spins dangerously out of control when he falls for a nightclub singer.;['Josef von Sternberg', None];['Emil Jannings', 'Marlene Dietrich', 'Kurt Gerron', 'Rosa Valetti']
40;Baby Driver;2017;Tous publics;113;['Action', ' Crime', ' Drama            '];7.6;86;After being coerced into working for a crime boss, a young getaway driver finds himself taking part in a heist doomed to fail.;['Edgar Wright', None];['Ansel Elgort', 'Jon Bernthal', 'Jon Hamm', 'Eiza González']
41;A Star is Born;2018;Tous publics;136;['Drama', ' Music', ' Romance            '];7.6;88;A musician helps a young singer find fame as age and alcoholism send his own career into a downward spiral.;['Bradley Cooper', None];['Lady Gaga', 'Bradley Cooper', 'Sam Elliott', 'Greg Grunberg']
42;La Môme;2007;Tous publics;140;['Biography', ' Drama', ' Music            '];7.6;66;Biopic of the iconic French singer Édith Piaf. Raised by her grandmother in a brothel, she was discovered while singing on a street corner at the age of 19. Despite her success, Piaf's life was filled with tragedy.;['Olivier Dahan', None];['Marion Cotillard', 'Sylvie Testud', 'Pascal Greggory', 'Emmanuelle Seigner']
43;Control;2007;Tous publics;122;['Biography', ' Drama', ' Music            '];7.6;78;A profile of Ian Curtis, the enigmatic singer of Joy Division whose personal, professional, and romantic troubles led him to commit suicide at the age of 23.;['Anton Corbijn', None];['Sam Riley', 'Samantha Morton', 'Craig Parkinson', 'Alexandra Maria Lara']
44;Le violon rouge;1998;Tous publics;140;['Drama', ' Music', ' Mystery            '];7.6;57;A red-colored violin inspires passion, making its way through three centuries over several owners and countries, eventually ending up at an auction where it may find a new owner.;['François Girard', None];['Carlo Cecchi', 'Jean-Luc Bideau', 'Christoph Koncz', 'Jason Flemyng']
45;Les Commitments;1991;R;118;['Comedy', ' Drama', ' Music            '];7.6;73;Jimmy Rabbitte, an unemployed Dublin boy, decides to put together a soul band made up entirely of the Irish working class.;['Alan Parker', None];['Robert Arkins', 'Michael Aherne', 'Angeline Ball', 'Maria Doyle Kennedy']
46;À bout de course;1988;12;116;['Crime', ' Drama', ' Music            '];7.6;67;The eldest son of a fugitive family comes of age and wants to live a life of his own.;['Sidney Lumet', None];['River Phoenix', 'Christine Lahti', 'Judd Hirsch', 'Jonas Abry']
47;Victor/Victoria;1982;Tous publics;134;['Comedy', ' Music', ' Romance            '];7.6;84;A struggling female soprano finds work playing a male female impersonator, but it complicates her personal life.;['Blake Edwards', None];['Julie Andrews', 'James Garner', 'Robert Preston', 'Lesley Ann Warren']
48;La glorieuse parade;1942;Tous Public;126;['Biography', ' Drama', ' Family            '];7.6;89;The life of the renowned musical composer, playwright, actor, dancer, and singer George M. Cohan.;['Michael Curtiz', None];['James Cagney', 'Joan Leslie', 'Walter Huston', 'Richard Whorf']
49;Clouds;I) (2020;14+;121;['Biography', ' Drama', ' Music            '];7.5;55;Based on real events, a Young musician discovers his cancer has spread, leaving him just a few months to live. With limited time, he follows his dream and makes an album, unaware that it will soon be a viral music phenomenon.;['Justin Baldoni', None];['Fin Argus', 'Neve Campbell', 'Sabrina Carpenter', 'Madison Iseman']
0;Elvis;2022;Tous publics;159;['Biography', ' Drama', ' Music            '];7.5;64;The life of American music icon Elvis Presley, from his childhood to becoming a rock and movie star in the 1950s while maintaining a complex relationship with his manager, Colonel Tom Parker.;['Baz Luhrmann', None];['Tom Hanks', 'Austin Butler', 'Olivia DeJonge', 'Helen Thomson']
1;La visite de la fanfare;2007;Tous publics;87;['Comedy', ' Drama', ' Music            '];7.5;80;A band comprised of members of the Egyptian police force head to Israel to play at the inaugural ceremony of an Arab arts center, only to find themselves lost in the wrong town.;['Eran Kolirin', None];['Sasson Gabay', 'Ronit Elkabetz', 'Saleh Bakri', 'Khalifa Natour']
2;La chorale du bonheur;2004;NaN;133;['Comedy', ' Drama', ' Music            '];7.5;-1;A famous international conductor returns to his small childhood town in Sweden for early retirement. He's asked to help with the church choir. He affects the lives of all in the choir.;['Kay Pollak', None];['Michael Nyqvist', 'Frida Hallgren', 'Helen Sjöholm', 'Lennart Jähkel']
3;La vie est un miracle!;2004;NaN;155;['Comedy', ' Romance', ' Music            '];7.5;-1;What could be better for the village than a scenic railway to bring in the tourists? What could be worse for tourism than war? Luka builds the railway and shuts his eyes to war. Then Luka's wife runs off with a musician and his son is called up to the army. Luka's life is a war zone. Then he meets Sabaha..;['Emir Kusturica', None];['Slavko Stimac', 'Natasa Tapuskovic', 'Vesna Trivalic', 'Vuk Kostic']
4;Priscilla, folle du désert;1994;Tous publics;104;['Comedy', ' Music            '];7.5;70;Two drag performers and a transgender woman travel across the desert to perform their unique style of cabaret.;['Stephan Elliott', None];['Hugo Weaving', 'Guy Pearce', 'Terence Stamp', 'Rebel Penfold-Russell']
5;La leçon de piano;1993;Tous publics;121;['Drama', ' Music', ' Romance            '];7.5;89;In the mid-19th century a mute woman is sent to New Zealand along with her young daughter and prized piano for an arranged marriage to a farmer, but is soon lusted after by a farm worker.;['Jane Campion', None];['Holly Hunter', 'Harvey Keitel', 'Sam Neill', 'Anna Paquin']
6;Nashville Lady;1980;Tous publics;124;['Biography', ' Drama', ' Music            '];7.5;87;The fictionalized life of singer Loretta Lynn, a girl who rose from humble beginnings to become a country music star in the 1960s/70s.;['Michael Apted', None];['Sissy Spacek', 'Tommy Lee Jones', 'Levon Helm', 'Phyllis Boyens']
7;Les Producteurs;1967;Tous publics;88;['Comedy', ' Music            '];7.5;96;A stage-play producer devises a plan to make money by producing a sure-fire flop.;['Mel Brooks', None];['Zero Mostel', 'Gene Wilder', 'Dick Shawn', 'Kenneth Mars']
8;Inside Llewyn Davis;2013;Tous publics;104;['Drama', ' Music            '];7.4;93;A week in the life of a young singer as he navigates the Greenwich Village folk scene of 1961.;['    Directors:', 'Ethan Coen, ', 'Joel Coen', None];['Oscar Isaac', 'Carey Mulligan', 'John Goodman', 'Garrett Hedlund']
9;New York Melody;II) (2013;Tous publics;104;['Comedy', ' Drama', ' Music            '];7.4;62;A chance encounter between a down-and-out music-business executive and a young singer-songwriter, new to Manhattan, turns into a promising collaboration between the two talents.;['John Carney', None];['Keira Knightley', 'Mark Ruffalo', 'Adam Levine', 'Hailee Steinfeld']
10;Rudderless;2014;R;105;['Comedy', ' Drama', ' Music            '];7.4;52;A grieving father in a downward spiral stumbles across a box of his recently deceased son's demo tapes and lyrics. Shocked by the discovery of this unknown talent, he forms a band in the hope of finding some catharsis.;['William H. Macy', None];['Billy Crudup', 'Anton Yelchin', 'Felicity Huffman', 'Selena Gomez']
11;Love & Mercy, la véritable histoire de Brian Wilson des Beach Boys;2014;Tous Public;121;['Biography', ' Drama', ' Music            '];7.4;80;In the 60s, Beach Boys leader Brian Wilson struggles with emerging psychosis as he attempts to craft his avant-garde pop masterpiece. In the 80s, he's a broken, confused man under the 24-hour watch of shady therapist, Dr. Eugene Landy.;['Bill Pohlad', None];['John Cusack', 'Paul Dano', 'Elizabeth Banks', 'Paul Giamatti']
12;August Rush;2007;Tous publics;114;['Drama', ' Music            '];7.4;38;An orphaned musical prodigy uses his gift to try to find his birth parents.;['Kirsten Sheridan', None];['Freddie Highmore', 'Keri Russell', 'Jonathan Rhys Meyers', 'Terrence Howard']
13;Topsy-Turvy;1999;Tous publics;160;['Biography', ' Comedy', ' Drama            '];7.4;90;Set in the 1880s, the story of how, during a creative dry spell, the partnership of the legendary musical/theatrical writers Gilbert and Sullivan almost dissolves, before they turn it all around and write the Mikado.;['Mike Leigh', None];['Jim Broadbent', 'Allan Corduner', 'Dexter Fletcher', 'Sukie Smith']
14;High Fidelity;2000;Tous publics;113;['Comedy', ' Drama', ' Music            '];7.4;79;Rob, a record store owner and compulsive list maker, recounts his top five breakups, including the one in progress.;['Stephen Frears', None];['John Cusack', 'Iben Hjejle', 'Todd Louiso', 'Jack Black']
15;SLC Punk!;1998;R;97;['Comedy', ' Drama', ' Music            '];7.4;50;In the early 1980s Stevo and Heroin Bob are the only two dedicated punks in conservative Salt Lake City.;['James Merendino', None];['Matthew Lillard', 'Michael A. Goorjian', 'Annabeth Gish', 'Jennifer Lien']
16;Ludwig van B.;1994;Tous publics;121;['Biography', ' Drama', ' Music            '];7.4;-1;"The life and death of the legendary Ludwig van Beethoven. Besides all the work he is known for, the composer once wrote a famous love letter to a nameless beloved, and the movie tries to ...                See full summary »
";['Bernard Rose', None];['Gary Oldman', 'Jeroen Krabbé', 'Isabella Rossellini', 'Johanna ter Steege']
17;Tendre bonheur;1983;Tous Public;92;['Drama', ' Music            '];7.4;76;A broken-down, middle-aged country singer gets a new wife, reaches out to his long-lost daughter, and tries to put his troubled life back together.;['Bruce Beresford', None];['Robert Duvall', 'Tess Harper', 'Betty Buckley', 'Wilford Brimley']
18;La Voix du pardon;2018;Tous publics;110;['Biography', ' Drama', ' Family            '];7.3;30;The inspiring and unknown true story behind MercyMe's beloved, chart topping song that brings ultimate hope to so many is a gripping reminder of the power of true forgiveness.;['    Directors:', 'Andrew Erwin, ', 'Jon Erwin', None];['J. Michael Finley', 'Madeline Carroll', 'Dennis Quaid', 'Trace Adkins']
19;Youth;I) (2015;Tous publics;124;['Comedy', ' Drama', ' Music            '];7.3;64;A retired orchestra conductor is on vacation with his daughter and his film director best friend in the Alps when he receives an invitation from Queen Elizabeth II to perform for Prince Philip's birthday.;['Paolo Sorrentino', None];['Michael Caine', 'Harvey Keitel', 'Rachel Weisz', 'Jane Fonda']
20;Phoenix;II) (2014;Tous publics;98;['Drama', ' History', ' Music            '];7.3;89;A disfigured Holocaust survivor sets out to determine if the man she loved betrayed her trust.;['Christian Petzold', None];['Nina Hoss', 'Ronald Zehrfeld', 'Nina Kunzendorf', 'Trystan Pütter']
21;Good Morning England;2009;Tous publics;135;['Comedy', ' Drama', ' Music            '];7.3;58;A band of rogue DJs that captivated Britain, playing the music that defined a generation and standing up to a government that wanted classical music, and nothing else, on the airwaves.;['Richard Curtis', None];['Philip Seymour Hoffman', 'Bill Nighy', 'Nick Frost', 'Michael Hadley']
22;Across the Universe;2007;Tous publics;133;['Drama', ' Fantasy', ' History            '];7.3;56;The music of The Beatles and the Vietnam War form the backdrop for the romance between an upper-class American girl and a poor Liverpudlian artist.;['Julie Taymor', None];['Evan Rachel Wood', 'Jim Sturgess', 'Joe Anderson', 'Dana Fuchs']
23;Hustle & Flow;2005;R;116;['Crime', ' Drama', ' Music            '];7.3;68;With help from his friends, a Memphis pimp in a mid-life crisis attempts to become a successful hip-hop emcee.;['Craig Brewer', None];['Terrence Howard', 'Ludacris', 'Anthony Anderson', 'Taryn Manning']
24;Frankie Wilde;2004;R;90;['Biography', ' Comedy', ' Drama            '];7.3;56;A famous DJ in the Ibiza club scene finds the alcohol and drug-fueled party that is his life threatened by the progressive loss of his hearing.;['Michael Dowse', None];['Paul Kaye', 'Beatriz Batarda', 'Kate Magowan', 'Mike Wilmot']
