;name;year;certificate;runtime;genre;rating;metascore;text-muted;director;stars
7;Étreintes brisées;2009;Tous publics;127;['Drama', ' Romance', ' Thriller            '];7.2;76;Harry Caine, a blind writer, reaches this moment in time when he has to heal his wounds from 14 years back. He was then still known by his real name, Mateo Blanco, and directing his last movie.;['Pedro Almodóvar', None];['Penélope Cruz', 'Lluís Homar', 'Blanca Portillo', 'José Luis Gómez']
8;Petits suicides entre amis;2006;R;88;['Comedy', ' Drama', ' Fantasy            '];7.2;62;A film set in a strange afterlife way station that has been reserved for people who have committed suicide.;['Goran Dukic', None];['Patrick Fugit', 'Shea Whigham', 'Tom Waits', 'Will Arnett']
9;Le guerrier pacifique;2006;Unrated;120;['Drama', ' Romance', ' Sport            '];7.2;40;A chance encounter with a stranger changes the life of a college gymnast.;['Victor Salva', None];['Scott Mechlowicz', 'Nick Nolte', 'Amy Smart', 'Tim DeKay']
10;Candy;2006;R;108;['Drama', ' Romance            '];7.2;57;A poet falls in love with an art student who gravitates to his bohemian lifestyle -- and his love of heroin. Hooked as much on one another as they are on the drug, their relationship alternates between states of oblivion, self-destruction, and despair.;['Neil Armfield', None];['Heath Ledger', 'Abbie Cornish', 'Geoffrey Rush', 'Tom Budge']
11;The Fountain;2006;Tous publics;97;['Drama', ' Mystery', ' Romance            '];7.2;51;As a modern-day scientist, Tommy is struggling with mortality, desperately searching for the medical breakthrough that will save the life of his cancer-stricken wife, Izzi.;['Darren Aronofsky', None];['Hugh Jackman', 'Rachel Weisz', 'Sean Patrick Thomas', 'Ellen Burstyn']
12;Broken Flowers;2005;Tous publics;106;['Comedy', ' Drama', ' Mystery            '];7.2;79;As the extremely withdrawn Don Johnston is dumped by his latest woman, he receives an anonymous letter from a former lover informing him that he has a son who may be looking for him. A freelance sleuth neighbor moves Don to embark on a cross-country search for his old flames in search of answers.;['Jim Jarmusch', None];['Bill Murray', 'Jessica Lange', 'Sharon Stone', 'Julie Delpy']
13;Paris, je t'aime;2006;Tous publics;120;['Comedy', ' Drama', ' Romance            '];7.2;66;Through the neighborhoods of Paris, love is veiled, revealed, imitated, sucked dry, reinvented, and awakened.;['    Directors:', 'Olivier Assayas, ', 'Frédéric Auburtin, ', 'Gurinder Chadha, ', 'Sylvain Chomet, ', 'Ethan Coen, ', 'Joel Coen, ', 'Isabel Coixet, ', 'Wes Craven, ', 'Alfonso Cuarón, ', 'Gérard Depardieu, ', 'Christopher Doyle, ', 'Richard LaGravenese, ', 'Vincenzo Natali, ', 'Alexander Payne, ', 'Bruno Podalydès, ', 'Walter Salles, ', 'Oliver Schmitz, ', 'Nobuhiro Suwa, ', 'Daniela Thomas, ', 'Tom Tykwer, ', 'Gus Van Sant', None];['Juliette Binoche', 'Leonor Watling', 'Ludivine Sagnier', 'Fanny Ardant']
14;Closer: entre adultes consentants;I) (2004;Tous publics;104;['Drama', ' Romance            '];7.2;65;The relationships of two couples become complicated and deceitful when the man from one couple meets the woman of the other.;['Mike Nichols', None];['Natalie Portman', 'Jude Law', 'Clive Owen', 'Julia Roberts']
15;La vie aquatique;2004;Tous publics;119;['Action', ' Adventure', ' Comedy            '];7.2;62;With a plan to exact revenge on a mythical shark that killed his partner, Oceanographer Steve Zissou (Bill Murray) rallies a crew that includes his estranged wife, a journalist, and a man who may or may not be his son.;['Wes Anderson', None];['Bill Murray', 'Owen Wilson', 'Anjelica Huston', 'Cate Blanchett']
16;King Kong;2005;Tous publics avec avertissement;187;['Action', ' Adventure', ' Drama            '];7.2;81;A greedy film producer assembles a team of moviemakers and sets out for the infamous Skull Island, where they find more than just cannibalistic natives.;['Peter Jackson', None];['Naomi Watts', 'Jack Black', 'Adrien Brody', 'Thomas Kretschmann']
17;La science des rêves;2006;Tous publics;105;['Comedy', ' Drama', ' Fantasy            '];7.2;70;A man entranced by his dreams and imagination is love-struck with a French woman and feels he can show her his world.;['Michel Gondry', None];['Gael García Bernal', 'Charlotte Gainsbourg', 'Miou-Miou', 'Alain Chabat']
18;Le royaume des chats;2002;Tous Public;75;['Animation', ' Adventure', ' Comedy            '];7.2;70;After helping a cat, a seventeen-year-old girl finds herself involuntarily engaged to a cat Prince in a magical world where her only hope of freedom lies with a dapper cat statuette come to life.;['Hiroyuki Morita', None];['Chizuru Ikewaki', 'Yoshihiko Hakamada', 'Aki Maeda', 'Takayuki Yamada']
19;Le fantôme de l'opéra;2004;Tous Public;143;['Drama', ' Musical', ' Romance            '];7.2;40;A young soprano becomes the obsession of a disfigured and murderous musical genius who lives beneath the Paris Opéra House.;['Joel Schumacher', None];['Gerard Butler', 'Emmy Rossum', 'Patrick Wilson', 'Miranda Richardson']
20;Lantana;2001;Tous publics;121;['Drama', ' Mystery', ' Romance            '];7.2;84;The relationships of four couples unravel after the discovery of a young woman's body in Lantana bush in suburban Sydney.;['Ray Lawrence', None];['Anthony LaPaglia', 'Geoffrey Rush', 'Rachael Blake', 'Kerry Armstrong']
21;Avant la nuit;2000;Tous publics;133;['Biography', ' Drama', ' Romance            '];7.2;85;The life of Cuban poet and novelist, Reinaldo Arenas.;['Julian Schnabel', None];['Javier Bardem', 'Johnny Depp', 'Olatz López Garmendia', 'Giovani Florido']
22;Love & Basketball;2000;Tous publics;124;['Drama', ' Romance', ' Sport            '];7.2;70;Monica and Quincy love and play basketball together through many life challenges from childhood to adulthood.;['Gina Prince-Bythewood', None];['Sanaa Lathan', 'Omar Epps', 'Glenndon Chatman', 'Jess Willard']
23;Retour à Cold Mountain;2003;Tous publics;154;['Adventure', ' Drama', ' History            '];7.2;73;In the waning days of the American Civil War, a wounded soldier embarks on a perilous journey back home to Cold Mountain, North Carolina to reunite with his sweetheart.;['Anthony Minghella', None];['Jude Law', 'Nicole Kidman', 'Renée Zellweger', 'Eileen Atkins']
24;Virgin Suicides;1999;Tous publics;97;['Drama', ' Romance            '];7.2;76;A group of male friends become obsessed with five mysterious sisters who are sheltered by their strict, religious parents in suburban Detroit in the mid 1970s.;['Sofia Coppola', None];['Kirsten Dunst', 'Josh Hartnett', 'James Woods', 'Kathleen Turner']
25;Coup de foudre à Notting Hill;1999;Tous publics;124;['Comedy', ' Drama', ' Romance            '];7.2;68;The life of a simple bookshop owner changes when he meets the most famous film star in the world.;['Roger Michell', None];['Hugh Grant', 'Julia Roberts', 'Richard McCabe', 'Rhys Ifans']
26;Rencontre avec Joe Black;1998;Tous publics;178;['Drama', ' Fantasy', ' Romance            '];7.2;43;Death, who takes the form of a young man killed in an accident, asks a media mogul to act as his guide to teach him about life on Earth and, in the process, he falls in love with the mogul's daughter.;['Martin Brest', None];['Brad Pitt', 'Anthony Hopkins', 'Claire Forlani', 'Jake Weber']
27;La dame de Windsor;1997;Tous publics;101;['Biography', ' Drama', ' History            '];7.2;71;When Queen Victoria's husband Prince Albert dies, she finds solace in her trusted servant, Mr. John Brown, but their relationship also brings scandal and turmoil.;['John Madden', None];['Judi Dench', 'Billy Connolly', 'Geoffrey Palmer', 'Antony Sher']
28;Méprise multiple;1997;Tous publics;113;['Comedy', ' Drama', ' Romance            '];7.2;71;Holden and Banky are comic book artists. Everything's going good for them until they meet Alyssa, also a comic book artist. Holden falls for her, but his hopes are crushed when he finds out she's a lesbian.;['Kevin Smith', None];['Ben Affleck', 'Joey Lauren Adams', 'Ethan Suplee', 'Scott Mosier']
29;Les virtuoses;1996;R;108;['Comedy', ' Drama', ' Music            '];7.2;60;The coal mine in a northern English village may be closing, which would also mean the end of the miners' brass band.;['Mark Herman', None];['Pete Postlethwaite', 'Tara Fitzgerald', 'Ewan McGregor', 'Stephen Tompkinson']
30;Arizona Dream;1993;Tous publics;142;['Comedy', ' Drama', ' Fantasy            '];7.2;62;A young New Yorker goes to Arizona where he finds freedom to both love and dream.;['Emir Kusturica', None];['Johnny Depp', 'Jerry Lewis', 'Faye Dunaway', 'Lili Taylor']
31;Le Temps de l'innocence;1993;Tous publics;139;['Drama', ' Romance            '];7.2;90;A tale of nineteenth-century New York high society in which a young lawyer falls in love with a woman separated from her husband, while he is engaged to the woman's cousin.;['Martin Scorsese', None];['Daniel Day-Lewis', 'Michelle Pfeiffer', 'Winona Ryder', 'Linda Faye Farkas']
32;Ballroom Dancing;1992;Tous Public;94;['Comedy', ' Drama', ' Music            '];7.2;72;A maverick dancer risks his career by performing an unusual routine and sets out to succeed with a new partner.;['Baz Luhrmann', None];['Paul Mercurio', 'Tara Morice', 'Bill Hunter', 'Pat Thomson']
33;Lunes de fiel;1992;12;139;['Drama', ' Romance', ' Thriller            '];7.2;62;After hearing stories of her, a passenger on a cruise ship develops an irresistible infatuation with an eccentric paraplegic's wife.;['Roman Polanski', None];['Hugh Grant', 'Kristin Scott Thomas', 'Emmanuelle Seigner', 'Peter Coyote']
34;The Crying Game;1992;12;112;['Crime', ' Drama', ' Romance            '];7.2;90;A British soldier kidnapped by the IRA soon befriends one of his captors, who then becomes drawn into the soldier's world.;['Neil Jordan', None];['Stephen Rea', 'Jaye Davidson', 'Forest Whitaker', 'Miranda Richardson']
35;Les anges de la nuit;1990;12;134;['Action', ' Crime', ' Drama            '];7.2;60;A New York cop is recruited to return to his hometown and infiltrate the mob ran by his best friend's brother.;['Phil Joanou', None];['Sean Penn', 'Ed Harris', 'Gary Oldman', 'Robin Wright']
36;Willow;1988;Tous publics;126;['Action', ' Adventure', ' Drama            '];7.2;47;A young farmer is chosen to undertake a perilous journey in order to protect a special baby from an evil queen.;['Ron Howard', None];['Val Kilmer', 'Joanne Whalley', 'Warwick Davis', 'Jean Marsh']
37;Broadcast News;1987;Tous publics;133;['Comedy', ' Drama', ' Romance            '];7.2;84;Take two rival television reporters: one handsome, one talented, both male. Add one producer, female. Mix well, and watch the sparks fly.;['James L. Brooks', None];['William Hurt', 'Albert Brooks', 'Holly Hunter', 'Robert Prosky']
38;Chambre avec vue...;1985;Tous publics;117;['Drama', ' Romance            '];7.2;83;Lucy meets George in a Florence pensione and the two share a brief romance before Lucy returns home, where she becomes engaged to Cecil. However, it isn't long before George unexpectedly enters her life again.;['James Ivory', None];['Maggie Smith', 'Helena Bonham Carter', 'Denholm Elliott', 'Julian Sands']
39;Les enfants du silence;1986;NaN;119;['Drama', ' Romance            '];7.2;80;A new speech teacher at a school for the deaf falls in love with the janitor, a deaf woman speechless by choice.;['Randa Haines', None];['William Hurt', 'Marlee Matlin', 'Piper Laurie', 'Philip Bosco']
40;Silverado;1985;Tous publics;133;['Action', ' Crime', ' Drama            '];7.2;64;A misfit bunch of friends comes together to right the injustices which exist in a small town.;['Lawrence Kasdan', None];['Kevin Kline', 'Scott Glenn', 'Kevin Costner', 'Danny Glover']
41;Quelque part dans le temps;1980;Tous publics;103;['Drama', ' Fantasy', ' Romance            '];7.2;29;A Chicago playwright uses self-hypnosis to travel back in time and meet the actress whose vintage portrait hangs in a grand hotel.;['Jeannot Szwarc', None];['Christopher Reeve', 'Jane Seymour', 'Christopher Plummer', 'Teresa Wright']
42;Grease;1978;Tous publics;110;['Comedy', ' Musical', ' Romance            '];7.2;70;Good girl Sandy Olsson and greaser Danny Zuko fell in love over the summer. When they unexpectedly discover they're now in the same high school, will they be able to rekindle their romance?;['Randal Kleiser', None];['John Travolta', 'Olivia Newton-John', 'Stockard Channing', 'Jeff Conaway']
43;La fureur de vaincre;1972;Tous publics;95;['Action', ' Drama', ' Romance            '];7.2;68;A young man seeks vengence for the death of his teacher.;['Wei Lo', None];['Bruce Lee', 'Nora Miao', 'James Tien', 'Maria Yi']
44;Avanti!;1972;Tous publics;144;['Comedy', ' Romance            '];7.2;-1;A successful businessman goes to Italy to arrange for the return of his tycoon father's body only to discover dad died with his long-time mistress.;['Billy Wilder', None];['Jack Lemmon', 'Juliet Mills', 'Clive Revill', 'Edward Andrews']
45;Fleur de cactus;1969;Tous Public;104;['Comedy', ' Romance            '];7.2;67;A dentist pretends to be married to avoid commitment, but when he falls for his girlfriend and proposes, he must recruit his lovelorn nurse to pose as his wife.;['Gene Saks', None];['Walter Matthau', 'Ingrid Bergman', 'Goldie Hawn', 'Jack Weston']
46;La grande course autour du monde;1965;Tous publics;160;['Action', ' Adventure', ' Comedy            '];7.2;71;In the early 20th century, two rivals, the heroic Leslie and the despicable Professor Fate, engage in an epic automobile race from New York to Paris.;['Blake Edwards', None];['Tony Curtis', 'Natalie Wood', 'Jack Lemmon', 'Peter Falk']
47;Les Révoltés du Bounty;1962;Tous publics;178;['Adventure', ' Drama', ' History            '];7.2;48;In 1787, British ship Bounty leaves Portsmouth to bring a cargo of bread-fruit from Tahiti but the savage on-board conditions imposed by Captain Bligh trigger a mutiny led by officer Fletcher Christian.;['    Directors:', 'Lewis Milestone, ', 'Carol Reed', None];['Marlon Brando', 'Trevor Howard', 'Richard Harris', 'Hugh Griffith']
48;La fiancée de Papa;1961;Tous publics;129;['Comedy', ' Family', ' Romance            '];7.2;73;Teenage twin sisters swap places and scheme to reunite their divorced parents.;['David Swift', None];"['Hayley Mills', ""Maureen O'Hara"", 'Brian Keith', 'Charles Ruggles']"
49;Misfits - Les Désaxés;1961;NaN;125;['Drama', ' Romance', ' Western            '];7.2;77;A divorcée falls for an over-the-hill cowboy who is struggling to maintain his romantically independent lifestyle.;['John Huston', None];['Clark Gable', 'Marilyn Monroe', 'Montgomery Clift', 'Thelma Ritter']
0;Le Cid;1961;Tous publics;182;['Biography', ' Drama', ' History            '];7.2;79;The fabled Spanish hero Rodrigo Diaz de Vivar (a.k.a. El Cid) overcomes a family vendetta and court intrigue to defend Christian Spain against the Moors.;['Anthony Mann', None];['Charlton Heston', 'Sophia Loren', 'Raf Vallone', 'Geneviève Page']
1;La Belle au bois dormant;1959;Tous publics;75;['Animation', ' Adventure', ' Family            '];7.2;85;After being snubbed by the royal family, a malevolent fairy places a curse on a princess which only a prince can break, along with the help of three good fairies.;['    Directors:', 'Les Clark, ', 'Clyde Geronimi, ', 'Eric Larson, ', 'Wolfgang Reitherman, ', 'Hamilton Luske', None];['Mary Costa', 'Bill Shirley', 'Eleanor Audley', 'Verna Felton']
2;Shadows;1958;Tous Public;81;['Drama', ' Music', ' Romance            '];7.2;86;Cassavetes' jazz-scored improvisational film explores interracial friendships and relationships in Beat-Era (1950s) New York City.;['John Cassavetes', None];['Ben Carruthers', 'Lelia Goldoni', 'Hugh Hurd', 'Anthony Ray']
3;Opération jupons;1959;Tous publics;124;['Comedy', ' Romance', ' War            '];7.2;-1;During World War II, a commander finds himself stuck with a decrepit (and pink) submarine, a con man executive officer, and a group of army nurses.;['Blake Edwards', None];"['Cary Grant', 'Tony Curtis', ""Joan O'Brien"", 'Dina Merrill']"
4;La blonde du Far-West;1953;Tous Public;101;['Musical', ' Romance', ' Western            '];7.2;-1;The story of Calamity Jane, her saloon, and her romance with Wild Bill Hickok.;['David Butler', None];['Doris Day', 'Howard Keel', 'Allyn Ann McLerie', 'Philip Carey']
5;Un Américain à Paris;1951;Tous publics;114;['Drama', ' Musical', ' Romance            '];7.2;83;Three friends struggle to find work in Paris. Things become more complicated when two of them fall in love with the same woman.;['Vincente Minnelli', None];['Gene Kelly', 'Leslie Caron', 'Oscar Levant', 'Georges Guétary']
6;Un million clefs en main;1948;Tous publics;94;['Comedy', ' Romance            '];7.2;-1;A man and his wife decide they can afford to have a house in the country built to their specifications. It's a lot more trouble than they think.;['H.C. Potter', None];['Cary Grant', 'Myrna Loy', 'Melvyn Douglas', 'Reginald Denny']
7;Le mur invisible;1947;Tous Public;118;['Drama', ' Romance            '];7.2;-1;A reporter pretends to be Jewish in order to cover a story on anti-Semitism, and personally discovers the true depths of bigotry and hatred.;['Elia Kazan', None];['Gregory Peck', 'Dorothy McGuire', 'John Garfield', 'Celeste Holm']
8;La falaise mystérieuse;1944;Tous publics;99;['Fantasy', ' Horror', ' Mystery            '];7.2;-1;A composer and his sister discover that the reason they are able to purchase a beautiful gothic seacoast mansion very cheaply is the house's unsavory past.;['Lewis Allen', None];['Ray Milland', 'Ruth Hussey', 'Donald Crisp', 'Cornelia Otis Skinner']
9;La femme de l'année;1942;Tous Public;114;['Comedy', ' Drama', ' Romance            '];7.2;-1;Rival reporters Sam and Tess fall in love and get married, only to find their relationship strained when Sam comes to resent Tess' hectic lifestyle.;['George Stevens', None];['Spencer Tracy', 'Katharine Hepburn', 'Fay Bainter', 'Reginald Owen']
10;Le loup-garou;1941;Tous Public;70;['Horror', ' Mystery', ' Romance            '];7.2;72;Larry Talbot returns to his father's castle in Wales and meets a beautiful woman. One fateful night, Talbot escorts her to a local carnival where they meet a mysterious gypsy fortune teller.;['George Waggner', None];['Claude Rains', 'Warren William', 'Lon Chaney Jr.', 'Ralph Bellamy']
11;Le petit César;1931;Tous Public;79;['Action', ' Crime', ' Drama            '];7.2;-1;A small-time criminal moves to a big city to seek bigger fortune.;['Mervyn LeRoy', None];['Edward G. Robinson', 'Douglas Fairbanks Jr.', 'Glenda Farrell', 'William Collier Jr.']
12;Queen & Slim;2019;Tous publics;132;['Crime', ' Drama', ' Romance            '];7.1;74;A couple's first date takes an unexpected turn when a police officer pulls them over.;['Melina Matsoukas', None];['Daniel Kaluuya', 'Jodie Turner-Smith', 'Bokeem Woodbine', 'Chloë Sevigny']
13;Words on Bathroom Walls;2020;PG-13;110;['Drama', ' Romance            '];7.1;61;Diagnosed with a mental illness halfway through his senior year of high school, a witty, introspective teen struggles to keep it a secret while falling in love with a brilliant classmate who inspires him to not be defined by his condition.;['Thor Freudenthal', None];['Charlie Plummer', 'Andy Garcia', 'Taylor Russell', 'AnnaSophia Robb']
14;Si Beale Street pouvait parler;2018;Tous publics;119;['Drama', ' Romance            '];7.1;87;A young woman embraces her pregnancy while she and her family set out to prove her childhood friend and lover innocent of a crime he didn't commit.;['Barry Jenkins', None];['KiKi Layne', 'Stephan James', 'Regina King', 'Teyonah Parris']
15;Breathe;I) (2017;PG-13;118;['Biography', ' Drama', ' Romance            '];7.1;51;The inspiring true love story of Robin (Andrew Garfield) and Diana Cavendish (Claire Foy), an adventurous couple who refuse to give up in the face of a devastating disease. Their heartwarming celebration of human possibility marks the directorial debut of Andy Serkis.;['Andy Serkis', None];['Andrew Garfield', 'Claire Foy', 'Hugh Bonneville', 'Ed Speleers']
16;Alliés;2016;Tous publics;124;['Action', ' Drama', ' Romance            '];7.1;60;In 1942, a Canadian intelligence officer in North Africa encounters a female French Resistance fighter on a deadly mission behind enemy lines. When they reunite in London, their relationship is tested by the pressures of war.;['Robert Zemeckis', None];['Brad Pitt', 'Marion Cotillard', 'Jared Harris', 'Vincent Ebrahim']
17;45 ans;2015;Tous publics;95;['Drama', ' Romance            '];7.1;94;A married couple preparing to celebrate their wedding anniversary receives shattering news that promises to forever change the course of their lives.;['Andrew Haigh', None];['Charlotte Rampling', 'Tom Courtenay', 'Geraldine James', 'Dolly Wells']
18;Mon roi;2015;Tous publics;124;['Drama', ' Romance            '];7.1;68;Tony is admitted to a rehabilitation center after a serious skiing accident. Dependent on medical staff and painkillers, she takes the time to remember the tumultuous love story she lived with Georgio.;['Maïwenn', None];['Vincent Cassel', 'Emmanuelle Bercot', 'Louis Garrel', 'Isild Le Besco']
19;The Lobster;2015;Tous publics avec avertissement;119;['Drama', ' Romance', ' Sci-Fi            '];7.1;82;In a dystopian near future, according to the laws of The City, single people are taken to The Hotel, where they are obliged to find a romantic partner in 45 days or they're transformed into beasts and sent off into The Woods.;['Yorgos Lanthimos', None];['Colin Farrell', 'Rachel Weisz', 'Jessica Barden', 'Olivia Colman']
20;Le monde de Nathan;2014;Tous Public;111;['Drama', ' Romance            '];7.1;65;A socially awkward teenage maths prodigy finds new confidence and new friendships when he lands a spot on the British squad at the International Mathematics Olympiad.;['Morgan Matthews', None];['Asa Butterfield', 'Rafe Spall', 'Sally Hawkins', 'Eddie Marsan']
21;Loin de la foule déchaînée;2015;Tous publics;119;['Drama', ' Romance            '];7.1;71;"In Victorian England, the independent and headstrong Bathsheba Everdene attracts three very different suitors: Gabriel Oak, a sheep farmer; Frank Troy, a reckless Sergeant; and William Boldwood, a prosperous and mature bachelor.";['Thomas Vinterberg', None];['Carey Mulligan', 'Matthias Schoenaerts', 'Michael Sheen', 'Tom Sturridge']
22;La Belle et la Bête;I) (2017;Tous publics;129;['Adventure', ' Family', ' Fantasy            '];7.1;65;A selfish Prince is cursed to become a monster for the rest of his life, unless he learns to fall in love with a beautiful young woman he keeps prisoner.;['Bill Condon', None];['Emma Watson', 'Dan Stevens', 'Luke Evans', 'Josh Gad']
23;La Femme du Diplomate;2014;R;95;['Comedy', ' Drama', ' Romance            '];7.1;52;An aspiring novelist enters into a relationship with a woman, though there's just one catch: She's married and the couple can only meet between the hours of 5 and 7 each evening.;['Victor Levin', None];['Anton Yelchin', 'Bérénice Marlohe', 'Olivia Thirlby', 'Lambert Wilson']
24;Beaucoup de bruit pour rien;I) (2012;Tous Public;109;['Comedy', ' Drama', ' Romance            '];7.1;78;A modern retelling of Shakespeare's classic comedy about two pairs of lovers with different takes on romance and a way with words.;['Joss Whedon', None];['Alexis Denisof', 'Amy Acker', 'Fran Kranz', 'Jillian Morgese']
25;Les Voies du destin;2013;Tous publics avec avertissement;116;['Biography', ' Drama', ' Romance            '];7.1;59;A former British Army officer, who was tortured as a prisoner of war at a Japanese labor camp during World War II, discovers that the man responsible for much of his treatment is still alive and sets out to confront him.;['Jonathan Teplitzky', None];['Colin Firth', 'Nicole Kidman', 'Stellan Skarsgård', 'Jeremy Irvine']
26;Lore;2012;Tous publics;109;['Drama', ' Romance', ' War            '];7.1;76;As the Allies sweep across Germany, Lore leads her siblings on a journey that exposes them to the truth of their parents' beliefs. An encounter with a mysterious refugee forces Lore to rely on a person she has always been taught to hate.;['Cate Shortland', None];['Saskia Rosendahl', 'Kai-Peter Malina', 'Nele Trebs', 'Ursina Lardi']
27;The Hit Girls;2012;Tous publics;112;['Comedy', ' Music', ' Romance            '];7.1;66;Beca, a freshman at Barden University, is cajoled into joining The Bellas, her school's all-girls singing group. Injecting some much needed energy into their repertoire, The Bellas take on their male rivals in a campus competition.;['Jason Moore', None];['Anna Kendrick', 'Brittany Snow', 'Rebel Wilson', 'Anna Camp']
28;The Spectacular Now;2013;Tous publics;95;['Drama', ' Romance            '];7.1;82;"A hard-partying high school senior's philosophy on life changes when he meets the not-so-typical ""nice girl.""";['James Ponsoldt', None];['Miles Teller', 'Shailene Woodley', 'Kyle Chandler', 'Jennifer Jason Leigh']
29;Love, Rosie;2014;R;102;['Comedy', ' Romance            '];7.1;44;Rosie and Alex have been best friends since they were 5, so they couldn't possibly be right for one another...or could they? When it comes to love, life and making the right choices, these two are their own worst enemies.;['Christian Ditter', None];['Lily Collins', 'Sam Claflin', 'Christian Cooke', 'Jaime Winstone']
30;Les amours imaginaires;2010;Tous publics;101;['Drama', ' Romance            '];7.1;70;The story of three close friends who are involved in a love-triangle.;['Xavier Dolan', None];['Xavier Dolan', 'Monia Chokri', 'Niels Schneider', 'Anne Dorval']
