;name;year;certificate;runtime;genre;rating;metascore;text-muted;director;stars
0;Les Évadés;1994;Tous publics;142;['Drama            '];9.3;81;Two imprisoned men bond over a number of years, finding solace and eventual redemption through acts of common decency.;['Frank Darabont', None];['Tim Robbins', 'Morgan Freeman', 'Bob Gunton', 'William Sadler']
1;Le Parrain;1972;12;175;['Crime', ' Drama            '];9.2;100;The aging patriarch of an organized crime dynasty in postwar New York City transfers control of his clandestine empire to his reluctant youngest son.;['Francis Ford Coppola', None];['Marlon Brando', 'Al Pacino', 'James Caan', 'Diane Keaton']
2;The Dark Knight : Le Chevalier noir;2008;Tous publics;152;['Action', ' Crime', ' Drama            '];9.0;84;When the menace known as the Joker wreaks havoc and chaos on the people of Gotham, Batman must accept one of the greatest psychological and physical tests of his ability to fight injustice.;['Christopher Nolan', None];['Christian Bale', 'Heath Ledger', 'Aaron Eckhart', 'Michael Caine']
3;Le Seigneur des anneaux : Le Retour du roi;2003;Tous publics;201;['Action', ' Adventure', ' Drama            '];9.0;94;Gandalf and Aragorn lead the World of Men against Sauron's army to draw his gaze from Frodo and Sam as they approach Mount Doom with the One Ring.;['Peter Jackson', None];['Elijah Wood', 'Viggo Mortensen', 'Ian McKellen', 'Orlando Bloom']
4;La liste de Schindler;1993;Tous publics;195;['Biography', ' Drama', ' History            '];9.0;94;In German-occupied Poland during World War II, industrialist Oskar Schindler gradually becomes concerned for his Jewish workforce after witnessing their persecution by the Nazis.;['Steven Spielberg', None];['Liam Neeson', 'Ralph Fiennes', 'Ben Kingsley', 'Caroline Goodall']
5;Le Parrain, 2ᵉ partie;1974;13;202;['Crime', ' Drama            '];9.0;90;The early life and career of Vito Corleone in 1920s New York City is portrayed, while his son, Michael, expands and tightens his grip on the family crime syndicate.;['Francis Ford Coppola', None];['Al Pacino', 'Robert De Niro', 'Robert Duvall', 'Diane Keaton']
6;12 Hommes en colère;1957;Tous publics;96;['Crime', ' Drama            '];9.0;96;The jury in a New York City murder trial is frustrated by a single member whose skeptical caution forces them to more carefully consider the evidence before jumping to a hasty verdict.;['Sidney Lumet', None];['Henry Fonda', 'Lee J. Cobb', 'Martin Balsam', 'John Fiedler']
7;Rocketry: The Nambi Effect;2022;NaN;157;['Biography', ' Drama            '];8.9;-1;Based on the life of Indian Space Research Organization scientist Nambi Narayanan, who was framed for being a spy and arrested in 1994. Though free, he continues to fight for justice against the officials who falsely implicated him.;['Madhavan', None];['Madhavan', 'Simran', 'Rajit Kapoor', 'Ravi Raghavendra']
8;Pulp Fiction;1994;12;154;['Crime', ' Drama            '];8.9;94;The lives of two mob hitmen, a boxer, a gangster and his wife, and a pair of diner bandits intertwine in four tales of violence and redemption.;['Quentin Tarantino', None];['John Travolta', 'Uma Thurman', 'Samuel L. Jackson', 'Bruce Willis']
9;Le Seigneur des anneaux : Les Deux Tours;2002;Tous publics;179;['Action', ' Adventure', ' Drama            '];8.8;87;While Frodo and Sam edge closer to Mordor with the help of the shifty Gollum, the divided fellowship makes a stand against Sauron's new ally, Saruman, and his hordes of Isengard.;['Peter Jackson', None];['Elijah Wood', 'Ian McKellen', 'Viggo Mortensen', 'Orlando Bloom']
10;Fight Club;1999;16;139;['Drama            '];8.8;66;An insomniac office worker and a devil-may-care soap maker form an underground fight club that evolves into much more.;['David Fincher', None];['Brad Pitt', 'Edward Norton', 'Meat Loaf', 'Zach Grenier']
11;Le Seigneur des anneaux : La Communauté de l'anneau;2001;Tous publics;178;['Action', ' Adventure', ' Drama            '];8.8;92;A meek Hobbit from the Shire and eight companions set out on a journey to destroy the powerful One Ring and save Middle-earth from the Dark Lord Sauron.;['Peter Jackson', None];['Elijah Wood', 'Ian McKellen', 'Orlando Bloom', 'Sean Bean']
12;Forrest Gump;1994;Tous publics;142;['Drama', ' Romance            '];8.8;82;The presidencies of Kennedy and Johnson, the Vietnam War, the Watergate scandal and other historical events unfold from the perspective of an Alabama man with an IQ of 75, whose only desire is to be reunited with his childhood sweetheart.;['Robert Zemeckis', None];['Tom Hanks', 'Robin Wright', 'Gary Sinise', 'Sally Field']
13;Les affranchis;1990;16;145;['Biography', ' Crime', ' Drama            '];8.7;90;The story of Henry Hill and his life in the mob, covering his relationship with his wife Karen Hill and his mob partners Jimmy Conway and Tommy DeVito in the Italian-American crime syndicate.;['Martin Scorsese', None];['Robert De Niro', 'Ray Liotta', 'Joe Pesci', 'Lorraine Bracco']
14;Vol au-dessus d'un nid de coucou;1975;Tous publics avec avertissement;133;['Drama            '];8.7;84;In the Fall of 1963, a Korean War veteran and criminal pleads insanity and is admitted to a mental institution, where he rallies up the scared patients against the tyrannical nurse.;['Milos Forman', None];['Jack Nicholson', 'Louise Fletcher', 'Michael Berryman', 'Peter Brocco']
15;Interstellar;2014;Tous publics;169;['Adventure', ' Drama', ' Sci-Fi            '];8.6;74;A team of explorers travel through a wormhole in space in an attempt to ensure humanity's survival.;['Christopher Nolan', None];['Matthew McConaughey', 'Anne Hathaway', 'Jessica Chastain', 'Mackenzie Foy']
16;Il faut sauver le soldat Ryan;1998;Tous publics avec avertissement;169;['Drama', ' War            '];8.6;91;Following the Normandy Landings, a group of U.S. soldiers go behind enemy lines to retrieve a paratrooper whose brothers have been killed in action.;['Steven Spielberg', None];['Tom Hanks', 'Matt Damon', 'Tom Sizemore', 'Edward Burns']
17;La ligne verte;1999;12;189;['Crime', ' Drama', ' Fantasy            '];8.6;61;The lives of guards on Death Row are affected by one of their charges: a black man accused of child murder and rape, yet who has a mysterious gift.;['Frank Darabont', None];['Tom Hanks', 'Michael Clarke Duncan', 'David Morse', 'Bonnie Hunt']
18;La vie est belle;1997;Tous publics;116;['Comedy', ' Drama', ' Romance            '];8.6;59;When an open-minded Jewish waiter and his son become victims of the Holocaust, he uses a perfect mixture of will, humor, and imagination to protect his son from the dangers around their camp.;['Roberto Benigni', None];['Roberto Benigni', 'Nicoletta Braschi', 'Giorgio Cantarini', 'Giustino Durano']
19;Joli village, jolie flamme;1996;NaN;115;['Comedy', ' Drama', ' History            '];8.6;-1;During the war in Bosnia, two childhood friends eventually become enemies, as the tragic and devastating circumstances of the war put them on the opposite sides and expose the most gruesome and cruel aspects of the human nature.;['Srdjan Dragojevic', None];['Dragan Bjelogrlic', 'Nikola Kojo', 'Dragan Maksimovic', 'Zoran Cvijanovic']
20;Seven;1995;12;127;['Crime', ' Drama', ' Mystery            '];8.6;65;Two detectives, a rookie and a veteran, hunt a serial killer who uses the seven deadly sins as his motives.;['David Fincher', None];['Morgan Freeman', 'Brad Pitt', 'Kevin Spacey', 'Andrew Kevin Walker']
21;Le Silence des agneaux;1991;16;118;['Crime', ' Drama', ' Thriller            '];8.6;85;A young F.B.I. cadet must receive the help of an incarcerated and manipulative cannibal killer to help catch another serial killer, a madman who skins his victims.;['Jonathan Demme', None];['Jodie Foster', 'Anthony Hopkins', 'Lawrence A. Bonney', 'Kasi Lemmons']
22;La vie est belle;1946;Tous publics;130;['Drama', ' Family', ' Fantasy            '];8.6;89;An angel is sent from Heaven to help a desperately frustrated businessman by showing him what life would have been like if he had never existed.;['Frank Capra', None];['James Stewart', 'Donna Reed', 'Lionel Barrymore', 'Thomas Mitchell']
23;Parasite;2019;Tous publics avec avertissement;132;['Drama', ' Thriller            '];8.5;96;Greed and class discrimination threaten the newly formed symbiotic relationship between the wealthy Park family and the destitute Kim clan.;['Bong Joon Ho', None];['Song Kang-ho', 'Lee Sun-kyun', 'Cho Yeo-jeong', 'Choi Woo-sik']
24;Whiplash;2014;Tous publics;106;['Drama', ' Music            '];8.5;88;A promising young drummer enrolls at a cut-throat music conservatory where his dreams of greatness are mentored by an instructor who will stop at nothing to realize a student's potential.;['Damien Chazelle', None];['Miles Teller', 'J.K. Simmons', 'Melissa Benoist', 'Paul Reiser']
25;Intouchables;2011;Tous publics;112;['Biography', ' Comedy', ' Drama            '];8.5;57;After he becomes a quadriplegic from a paragliding accident, an aristocrat hires a young man from the projects to be his caregiver.;['    Directors:', 'Olivier Nakache, ', 'Éric Toledano', None];['François Cluzet', 'Omar Sy', 'Anne Le Ny', 'Audrey Fleurot']
26;Le Prestige;2006;Tous publics;130;['Drama', ' Mystery', ' Sci-Fi            '];8.5;66;After a tragic accident, two stage magicians in 1890s London engage in a battle to create the ultimate illusion while sacrificing everything they have to outwit each other.;['Christopher Nolan', None];['Christian Bale', 'Hugh Jackman', 'Scarlett Johansson', 'Michael Caine']
27;Les infiltrés;2006;Tous publics avec avertissement;151;['Crime', ' Drama', ' Thriller            '];8.5;85;An undercover cop and a mole in the police attempt to identify each other while infiltrating an Irish gang in South Boston.;['Martin Scorsese', None];['Leonardo DiCaprio', 'Matt Damon', 'Jack Nicholson', 'Mark Wahlberg']
28;Nos meilleures années;2003;R;366;['Drama', ' Romance            '];8.5;89;An Italian epic that follows the lives of two brothers from the 1960s to the 2000s.;['Marco Tullio Giordana', None];['Luigi Lo Cascio', 'Alessio Boni', 'Jasmine Trinca', 'Adriana Asti']
29;Le pianiste;2002;Tous publics;150;['Biography', ' Drama', ' Music            '];8.5;85;A Polish Jewish musician struggles to survive the destruction of the Warsaw ghetto of World War II.;['Roman Polanski', None];['Adrien Brody', 'Thomas Kretschmann', 'Frank Finlay', 'Emilia Fox']
30;Gladiator;2000;Tous publics avec avertissement;155;['Action', ' Adventure', ' Drama            '];8.5;67;A former Roman General sets out to exact vengeance against the corrupt emperor who murdered his family and sent him into slavery.;['Ridley Scott', None];['Russell Crowe', 'Joaquin Phoenix', 'Connie Nielsen', 'Oliver Reed']
31;American History X;1998;12;119;['Crime', ' Drama            '];8.5;62;A former neo-nazi skinhead tries to prevent his younger brother from going down the same wrong path that he did.;['Tony Kaye', None];"['Edward Norton', 'Edward Furlong', ""Beverly D'Angelo"", 'Jennifer Lien']"
32;Usual Suspects;1995;Tous publics;106;['Crime', ' Drama', ' Mystery            '];8.5;77;A sole survivor tells of the twisty events leading up to a horrific gun battle on a boat, which began when five criminals met at a seemingly random police lineup.;['Bryan Singer', None];['Kevin Spacey', 'Gabriel Byrne', 'Chazz Palminteri', 'Stephen Baldwin']
33;Léon;1994;12;110;['Action', ' Crime', ' Drama            '];8.5;64;12-year-old Mathilda is reluctantly taken in by Léon, a professional assassin, after her family is murdered. An unusual relationship forms as she becomes his protégée and learns the assassin's trade.;['Luc Besson', None];['Jean Reno', 'Gary Oldman', 'Natalie Portman', 'Danny Aiello']
34;Le Roi Lion;1994;Tous publics;88;['Animation', ' Adventure', ' Drama            '];8.5;88;Lion prince Simba and his father are targeted by his bitter uncle, who wants to ascend the throne himself.;['    Directors:', 'Roger Allers, ', 'Rob Minkoff', None];['Matthew Broderick', 'Jeremy Irons', 'James Earl Jones', 'Whoopi Goldberg']
35;Apocalypse Now;1979;Tous publics avec avertissement;147;['Drama', ' Mystery', ' War            '];8.5;94;A U.S. Army officer serving in Vietnam is tasked with assassinating a renegade Special Forces Colonel who sees himself as a god.;['Francis Ford Coppola', None];['Martin Sheen', 'Marlon Brando', 'Robert Duvall', 'Frederic Forrest']
36;Casablanca;1942;Tous publics;102;['Drama', ' Romance', ' War            '];8.5;100;A cynical expatriate American cafe owner struggles to decide whether or not to help his former lover and her fugitive husband escape the Nazis in French Morocco.;['Michael Curtiz', None];['Humphrey Bogart', 'Ingrid Bergman', 'Paul Henreid', 'Claude Rains']
37;Les temps modernes;1936;Tous publics;87;['Comedy', ' Drama', ' Romance            '];8.5;96;The Tramp struggles to live in modern industrial society with the help of a young homeless woman.;['Charles Chaplin', None];['Charles Chaplin', 'Paulette Goddard', 'Henry Bergman', 'Tiny Sandford']
38;Les lumières de la ville;1931;Tous publics;87;['Comedy', ' Drama', ' Romance            '];8.5;99;With the aid of a wealthy erratic tippler, a dewy-eyed tramp who has fallen in love with a sightless flower girl accumulates money to be able to help her medically.;['Charles Chaplin', None];['Charles Chaplin', 'Virginia Cherrill', 'Florence Lee', 'Harry Myers']
39;Hamilton;2020;12;160;['Biography', ' Drama', ' History            '];8.4;90;The real life of one of America's foremost founding fathers and first Secretary of the Treasury, Alexander Hamilton. Captured live on Broadway from the Richard Rodgers Theater with the original Broadway cast.;['Thomas Kail', None];['Lin-Manuel Miranda', 'Phillipa Soo', 'Leslie Odom Jr.', 'Renée Elise Goldsberry']
40;Joker;I) (2019;12 avec avertissement;122;['Crime', ' Drama', ' Thriller            '];8.4;59;A mentally troubled stand-up comedian embarks on a downward spiral that leads to the creation of an iconic villain.;['Todd Phillips', None];['Joaquin Phoenix', 'Robert De Niro', 'Zazie Beetz', 'Frances Conroy']
41;Avengers: Endgame;2019;Tous publics;181;['Action', ' Adventure', ' Drama            '];8.4;78;After the devastating events of Avengers: Infinity War (2018), the universe is in ruins. With the help of remaining allies, the Avengers assemble once more in order to reverse Thanos' actions and restore balance to the universe.;['    Directors:', 'Anthony Russo, ', 'Joe Russo', None];['Robert Downey Jr.', 'Chris Evans', 'Mark Ruffalo', 'Chris Hemsworth']
42;Django Unchained;2012;12;165;['Drama', ' Western            '];8.4;81;With the help of a German bounty-hunter, a freed slave sets out to rescue his wife from a brutal plantation-owner in Mississippi.;['Quentin Tarantino', None];['Jamie Foxx', 'Christoph Waltz', 'Leonardo DiCaprio', 'Kerry Washington']
43;Top Gun: Maverick;2022;Tous publics;130;['Action', ' Drama            '];8.4;78;After thirty years, Maverick is still pushing the envelope as a top naval aviator, but must confront ghosts of his past when he leads TOP GUN's elite graduates on a mission that demands the ultimate sacrifice from those chosen to fly it.;['Joseph Kosinski', None];['Tom Cruise', 'Jennifer Connelly', 'Miles Teller', 'Val Kilmer']
44;The Dark Knight Rises;2012;Tous publics;164;['Action', ' Drama            '];8.4;78;Eight years after the Joker's reign of anarchy, Batman, with the help of the enigmatic Selina Kyle, is forced from his exile to save Gotham City from the brutal guerrilla terrorist Bane.;['Christopher Nolan', None];['Christian Bale', 'Tom Hardy', 'Anne Hathaway', 'Gary Oldman']
45;3 Idiots;2009;Tous publics;170;['Comedy', ' Drama            '];8.4;67;"Two friends are searching for their long lost companion. They revisit their college days and recall the memories of their friend who inspired them to think differently, even as the rest of the world called them ""idiots"".";['Rajkumar Hirani', None];['Aamir Khan', 'Madhavan', 'Mona Singh', 'Sharman Joshi']
46;Sardar Udham;2021;16;164;['Biography', ' Crime', ' Drama            '];8.4;-1;A biopic detailing the 2 decades that Punjabi Sikh revolutionary Udham Singh spent planning the assassination of the man responsible for the Jallianwala Bagh massacre.;['Shoojit Sircar', None];['Vicky Kaushal', 'Shaun Scott', 'Stephen Hogan', 'Amol Parashar']
47;Black Friday;2004;NaN;143;['Action', ' Crime', ' Drama            '];8.4;76;A film about the investigations following the 1993 serial Bombay bomb blasts, told through the different stories of the people involved --police, conspirators, victims, middlemen.;['Anurag Kashyap', None];['Kay Kay Menon', 'Pawan Malhotra', 'Aditya Srivastav', 'Dibyendu Bhattacharya']
48;American Beauty;1999;Tous publics;122;['Drama            '];8.4;84;A sexually frustrated suburban father has a mid-life crisis after becoming infatuated with his daughter's best friend.;['Sam Mendes', None];['Kevin Spacey', 'Annette Bening', 'Thora Birch', 'Wes Bentley']
49;Braveheart;1995;Tous publics;178;['Biography', ' Drama', ' History            '];8.4;68;Scottish warrior William Wallace leads his countrymen in a rebellion to free his homeland from the tyranny of King Edward I of England.;['Mel Gibson', None];['Mel Gibson', 'Sophie Marceau', 'Patrick McGoohan', 'Angus Macfadyen']
0;La chute;2004;Tous publics avec avertissement;156;['Biography', ' Drama', ' History            '];8.2;82;Traudl Junge, the final secretary for Adolf Hitler, tells of the Nazi dictator's final days in his Berlin bunker at the end of WWII.;['Oliver Hirschbiegel', None];['Bruno Ganz', 'Alexandra Maria Lara', 'Ulrich Matthes', 'Juliane Köhler']
1;Un homme d'exception;2001;Tous publics;135;['Biography', ' Drama            '];8.2;72;After John Nash, a brilliant but asocial mathematician, accepts secret work in cryptography, his life takes a turn for the nightmarish.;['Ron Howard', None];['Russell Crowe', 'Ed Harris', 'Jennifer Connelly', 'Christopher Plummer']
2;Kill Bill: Volume I;2003;16;111;['Action', ' Crime', ' Drama            '];8.2;69;After awakening from a four-year coma, a former assassin wreaks vengeance on the team of assassins who betrayed her.;['Quentin Tarantino', None];['Uma Thurman', 'David Carradine', 'Daryl Hannah', 'Michael Madsen']
3;Sixième sens;1999;12;107;['Drama', ' Mystery', ' Thriller            '];8.2;64;A frightened, withdrawn Philadelphia boy who communicates with spirits seeks the help of a disheartened child psychologist.;['M. Night Shyamalan', None];['Bruce Willis', 'Haley Joel Osment', 'Toni Collette', 'Olivia Williams']
4;The Truman Show;1998;Tous publics;103;['Comedy', ' Drama            '];8.2;90;An insurance salesman discovers his whole life is actually a reality TV show.;['Peter Weir', None];['Jim Carrey', 'Ed Harris', 'Laura Linney', 'Noah Emmerich']
5;L.A. Confidential;1997;Tous publics;138;['Crime', ' Drama', ' Mystery            '];8.2;90;As corruption grows in 1950s Los Angeles, three policemen - one strait-laced, one brutal, and one sleazy - investigate a series of murders with their own brand of justice.;['Curtis Hanson', None];['Kevin Spacey', 'Russell Crowe', 'Guy Pearce', 'Kim Basinger']
6;Casino;1995;12;178;['Crime', ' Drama            '];8.2;73;A tale of greed, deception, money, power, and murder occur between two best friends: a mafia enforcer and a casino executive compete against each other over a gambling empire, and over a fast-living and fast-loving socialite.;['Martin Scorsese', None];['Robert De Niro', 'Sharon Stone', 'Joe Pesci', 'James Woods']
7;Impitoyable;1992;Tous publics;130;['Drama', ' Western            '];8.2;85;"Retired Old West gunslinger William Munny reluctantly takes on one last job, with the help of his old partner Ned Logan and a young man, The ""Schofield Kid.""";['Clint Eastwood', None];['Clint Eastwood', 'Gene Hackman', 'Morgan Freeman', 'Richard Harris']
8;Jo Jeeta Wohi Sikandar;1992;NaN;174;['Comedy', ' Drama', ' Romance            '];8.2;-1;A rich brat and a poor chap try to woo a girl, with their rivalry culminating in the most prestigious college event - the marathon cycle race.;['Mansoor Khan', None];['Aamir Khan', 'Ayesha Jhulka', 'Deepak Tijori', 'Pooja Bedi']
9;Raging Bull;1980;12;129;['Biography', ' Drama', ' Sport            '];8.2;89;The life of boxer Jake LaMotta, whose violence and temper that led him to the top in the ring destroyed his life outside of it.;['Martin Scorsese', None];['Robert De Niro', 'Cathy Moriarty', 'Joe Pesci', 'Frank Vincent']
10;Le Lion du désert;1980;Tous publics;173;['Biography', ' Drama', ' History            '];8.2;-1;In 1929, Italian Fascist dictator Benito Mussolini appoints General Rodolfo Graziani as colonial governor to Italian Libya with orders to stamp-out all resistance from Libyan nationalists led by rebel guerrilla leader Omar Mukhtar.;['Moustapha Akkad', None];['Anthony Quinn', 'Oliver Reed', 'Rod Steiger', 'Irene Papas']
11;Elephant Man;1980;Tous publics;124;['Biography', ' Drama            '];8.2;78;A Victorian surgeon rescues a heavily disfigured man who is mistreated while scraping a living as a side-show freak. Behind his monstrous façade, there is revealed a person of kindness, intelligence and sophistication.;['David Lynch', None];['Anthony Hopkins', 'John Hurt', 'Anne Bancroft', 'John Gielgud']
12;Taxi Driver;1976;16;114;['Crime', ' Drama            '];8.2;94;A mentally unstable veteran works as a nighttime taxi driver in New York City, where the perceived decadence and sleaze fuels his urge for violent action.;['Martin Scorsese', None];['Robert De Niro', 'Jodie Foster', 'Cybill Shepherd', 'Albert Brooks']
13;Chinatown;1974;12;130;['Drama', ' Mystery', ' Thriller            '];8.2;92;A private detective hired to expose an adulterer in 1930s Los Angeles finds himself caught up in a web of deceit, corruption, and murder.;['Roman Polanski', None];['Jack Nicholson', 'Faye Dunaway', 'John Huston', 'Perry Lopez']
14;Z;1969;Tous publics;127;['Crime', ' Drama', ' Thriller            '];8.2;86;The public murder of a prominent politician and doctor amid a violent demonstration is covered up by military and government officials. A tenacious magistrate is determined not to let them get away with it.;['Costa-Gavras', None];['Yves Montand', 'Irene Papas', 'Jean-Louis Trintignant', 'François Périer']
15;La Grande Évasion;1963;Tous publics;172;['Adventure', ' Drama', ' History            '];8.2;86;Allied prisoners of war plan for several hundred of their number to escape from a German camp during World War II.;['John Sturges', None];['Steve McQueen', 'James Garner', 'Richard Attenborough', 'Charles Bronson']
16;Le Fanfaron;1962;Tous publics;105;['Comedy', ' Drama            '];8.2;-1;An impulsive braggart takes a shy law student with him for a two-day road trip from Rome to Tuscany.;['Dino Risi', None];['Vittorio Gassman', 'Catherine Spaak', 'Jean-Louis Trintignant', 'Claudio Gora']
17;Un homme dans la foule;1957;Tous publics;126;['Drama', ' Music            '];8.2;72;A female radio reporter turns a folk-singing drifter into a powerful media star.;['Elia Kazan', None];['Andy Griffith', 'Patricia Neal', 'Anthony Franciosa', 'Walter Matthau']
18;Le pont de la rivière Kwaï;1957;Tous publics;161;['Adventure', ' Drama', ' War            '];8.2;87;British POWs are forced to build a railway bridge across the river Kwai for their Japanese captors in occupied Burma, not knowing that the allied forces are planning a daring commando raid through the jungle to destroy it.;['David Lean', None];['William Holden', 'Alec Guinness', 'Jack Hawkins', 'Sessue Hayakawa']
19;Voyage à Tokyo;1953;Tous publics;136;['Drama            '];8.2;-1;An old couple visit their children and grandchildren in the city, but receive little attention.;['Yasujirô Ozu', None];['Chishû Ryû', 'Chieko Higashiyama', 'Sô Yamamura', 'Setsuko Hara']
20;Le salaire de la peur;1953;Tous Public;156;['Adventure', ' Drama', ' Thriller            '];8.2;85;In a decrepit South American village, four men are hired to transport an urgent nitroglycerine shipment without the equipment that would make it safe.;['Henri-Georges Clouzot', None];['Yves Montand', 'Charles Vanel', 'Peter van Eyck', 'Folco Lulli']
21;Ève...;1950;Tous publics;138;['Drama            '];8.2;98;A seemingly timid but secretly ruthless ingénue insinuates herself into the lives of an aging Broadway star and her circle of theater friends.;['Joseph L. Mankiewicz', None];['Bette Davis', 'Anne Baxter', 'George Sanders', 'Celeste Holm']
22;Le Trésor de la Sierra Madre;1948;Tous publics;126;['Adventure', ' Drama', ' Western            '];8.2;98;Two down-on-their-luck Americans searching for work in 1920s Mexico convince an old prospector to help them mine for gold in the Sierra Madre Mountains.;['John Huston', None];['Humphrey Bogart', 'Walter Huston', 'Tim Holt', 'Bruce Bennett']
23;Autant en emporte le vent;1939;Tous publics;238;['Drama', ' Romance', ' War            '];8.2;97;The manipulative daughter of a Georgia plantation owner conducts a turbulent romance with a roguish profiteer during the American Civil War and Reconstruction periods.;['    Directors:', 'Victor Fleming, ', 'George Cukor, ', 'Sam Wood', None];"['Clark Gable', 'Vivien Leigh', 'Thomas Mitchell', ""Barbara O'Neil""]"
24;Je suis un évadé;1932;NaN;92;['Crime', ' Drama', ' Film-Noir            '];8.2;-1;Wrongly convicted James Allen serves in the intolerable conditions of a Southern chain gang, which later comes back to haunt him.;['Mervyn LeRoy', None];['Paul Muni', 'Glenda Farrell', 'Helen Vinson', 'Noel Francis']
