;name;year;certificate;runtime;genre;rating;metascore;text-muted;director;stars
4;Selena;1997;Tous Public;127;['Biography', ' Drama', ' Music            '];6.8;67;The true story of Selena, a Texas-born Tejano singer who rose from cult status to performing at the Astrodome, as well as having chart-topping albums on the Latin music charts.;['Gregory Nava', None];['Jennifer Lopez', 'Edward James Olmos', 'Jon Seda', 'Jackie Guerra']
5;Beavis et Butt-Head se font l'Amérique;1996;Tous publics;81;['Animation', ' Adventure', ' Comedy            '];6.8;64;Our intrepid adolescent heroes wake up to find their beloved television stolen, and embark on an epic journey across America to recover it, and, who knows, maybe even score.;['    Directors:', 'Mike Judge, ', 'Mike de Seve, ', 'Brian Mulroney, ', 'Yvette Kaplan', None];['Mike Judge', 'Bruce Willis', 'Demi Moore', 'Cloris Leachman']
6;Le Dernier Dragon;1985;Tous publics;109;['Action', ' Comedy', ' Drama            '];6.8;58;In New York City, a young man searches for a Master to obtain the final level of martial arts mastery known as the Glow.;['Michael Schultz', None];['Taimak', 'Vanity', 'Christopher Murney', 'Julius Carry']
7;La Fièvre du samedi soir;1977;Tous publics;118;['Drama', ' Music            '];6.8;77;Anxious about his future after high school, a 19-year-old Italian-American from Brooklyn tries to escape the harsh reality of his bleak family life by dominating the dance floor at the local disco.;['John Badham', None];['John Travolta', 'Karen Lynn Gorney', 'Barry Miller', 'Joseph Cali']
8;Moxie;I) (2021;13;111;['Comedy', ' Drama', ' Music            '];6.7;54;Inspired by her mom's rebellious past and a confident new friend, a shy 16-year-old publishes an anonymous zine calling out sexism at her school.;['Amy Poehler', None];['Hadley Robinson', 'Lauren Tsai', 'Alycia Pascual-Pena', 'Nico Hiraga']
9;Nos cœurs meurtris;2022;13;122;['Drama', ' Music', ' Romance            '];6.7;30;In spite of their many differences, Cassie, a struggling singer-songwriter, and Luke, a troubled Marine, agree to marry solely for military benefits. But when tragedy strikes, the line between real and pretend begins to blur.;['Elizabeth Allen Rosenbaum', None];['Sofia Carson', 'Nicholas Galitzine', 'Chosen Jacobs', 'John Harlan Kim']
10;Ballerina;2016;Tous publics;89;['Animation', ' Adventure', ' Comedy            '];6.7;48;An orphan girl dreams of becoming a ballerina and flees her rural Brittany for Paris, where she passes for someone else and accedes to the position of pupil at the Grand Opera House.;['    Directors:', 'Eric Summer, ', 'Éric Warin, ', 'Mimi Maynard, ', 'Paulette Victor-Lifton', None];['Elle Fanning', 'Dane DeHaan', 'Carly Rae Jepsen', 'Maddie Ziegler']
11;Si je reste;2014;Tous publics;107;['Drama', ' Fantasy', ' Music            '];6.7;46;Life changes in an instant for young Mia Hall after a car accident puts her in a coma. During an out-of-body experience, she must decide whether to wake up and live a life far different than she had imagined. The choice is hers if she can go on.;['R.J. Cutler', None];['Chloë Grace Moretz', 'Mireille Enos', 'Jamie Blackley', 'Joshua Leonard']
12;Metal Lords;2022;R;97;['Comedy', ' Music            '];6.7;59;Two friends try to form a heavy metal band with a cellist for a Battle of the Bands.;['Peter Sollett', None];['Jaeden Martell', 'Adrian Greensmith', 'Isis Hainsworth', 'Noah Urrea']
13;Hôtel Woodstock;2009;Tous publics;120;['Biography', ' Comedy', ' Drama            '];6.7;55;A man working at his parents' motel in the Catskills inadvertently sets in motion the generation-defining concert in the summer of 1969.;['Ang Lee', None];['Demetri Martin', 'Henry Goodman', 'Edward Hibbert', 'Imelda Staunton']
14;Un monstre à Paris;2011;Tous publics;90;['Animation', ' Adventure', ' Comedy            '];6.7;-1;A 3D-animated movie set in Paris in the year 1910 and centered on a monster who lives in a garden and his love for a beautiful, young singer.;['Bibo Bergeron', None];['Matthieu Chedid', 'Vanessa Paradis', 'Gad Elmaleh', 'François Cluzet']
15;Le soliste;2009;Tous Public;117;['Biography', ' Drama', ' Music            '];6.7;61;A newspaper journalist discovers a homeless musical genius and tries to improve his situation.;['Joe Wright', None];['Jamie Foxx', 'Robert Downey Jr.', 'Catherine Keener', 'Tom Hollander']
16;Copying Beethoven;2006;Tous Public;104;['Biography', ' Drama', ' Music            '];6.7;59;A fictionalized account of the last year of Beethoven's life.;['Agnieszka Holland', None];['Ed Harris', 'Diane Kruger', 'Matthew Goode', 'Ralph Riach']
17;The Last Show;2006;Tous Public;105;['Comedy', ' Drama', ' Music            '];6.7;75;A look at what goes on backstage during the last broadcast of America's most celebrated radio show, where singing cowboys Dusty and Lefty, a country music siren, and a host of others hold court.;['Robert Altman', None];['Lily Tomlin', 'Meryl Streep', 'Woody Harrelson', 'John C. Reilly']
18;Las Vegas Boy;2004;PG-13;118;['Biography', ' Drama', ' Music            '];6.7;46;"A swooning study of ""Mack the Knife"" singer Bobby Darin and specifically his relationship with wife Sandra Dee.";['Kevin Spacey', None];['Kevin Spacey', 'Kate Bosworth', 'John Goodman', 'Bob Hoskins']
19;Les derniers jours du disco;1998;Tous publics;113;['Comedy', ' Drama', ' Music            '];6.7;76;Story of two female Manhattan book editors fresh out of college, both finding love and themselves while frequenting the local disco.;['Whit Stillman', None];['Chloë Sevigny', 'Kate Beckinsale', 'Chris Eigeman', 'Mackenzie Astin']
20;Empire Records;1995;Tous publics;90;['Comedy', ' Drama', ' Music            '];6.7;30;Twenty-four hours in the lives of the young employees at Empire Records when they all grow up and become young adults thanks to each other and the manager. They all face the store joining a chain store with strict rules.;['Allan Moyle', None];['Anthony LaPaglia', 'Debi Mazar', 'Maxwell Caulfield', 'Rory Cochrane']
21;Swing Kids;1993;PG-13;112;['Drama', ' Music            '];6.7;39;A group of teens adores forbidden music in Nazi Germany just before the outbreak of World War II.;['Thomas Carter', None];['Robert Sean Leonard', 'Christian Bale', 'Frank Whaley', 'Barbara Hershey']
22;Singles;1992;Tous publics;99;['Comedy', ' Drama', ' Music            '];6.7;71;A group of twenty-something friends search for love and success in grunge-era Seattle.;['Cameron Crowe', None];['Bridget Fonda', 'Campbell Scott', 'Kyra Sedgwick', 'Sheila Kelley']
23;Les rues de feu;1984;Tous publics;93;['Action', ' Crime', ' Drama            '];6.7;59;A mercenary is hired to rescue his ex-girlfriend, a singer who has been kidnapped by a motorcycle gang.;['Walter Hill', None];['Michael Paré', 'Diane Lane', 'Rick Moranis', 'Amy Madigan']
24;Guava Island;2019;NaN;55;['Comedy', ' Drama', ' Music            '];6.6;-1;A young musician seeks to hold a festival to liberate the oppressed people of Guava Island, even if only for a day.;['Hiro Murai', None];['Donald Glover', 'Rihanna', 'Letitia Wright', 'Nonso Anozie']
25;Juliet, Naked;2018;R;97;['Comedy', ' Drama', ' Music            '];6.6;67;Annie (the long-suffering girlfriend of Duncan) has an unlikely transatlantic romance with once revered, now faded, singer-songwriter, Tucker Crowe, who also happens to be the subject of Duncan's musical obsession.;['Jesse Peretz', None];"[""Chris O'Dowd"", 'Rose Byrne', 'Ethan Hawke', ""Kitty O'Beirne""]"
26;Lords of Chaos;2018;16;118;['Biography', ' Drama', ' Horror            '];6.6;48;A teenager's quest to launch Norwegian Black Metal in Oslo in the early 1990s results in a very violent outcome.;['Jonas Åkerlund', None];['Rory Culkin', 'Emory Cohen', 'Jack Kilmer', 'Sky Ferreira']
27;Forever My Girl;2018;Tous publics;108;['Comedy', ' Drama', ' Music            '];6.6;36;After being gone for a decade a country star returns home to the love he left behind.;['Bethany Ashton Wolf', None];['Alex Roe', 'Jessica Rothe', 'Abby Ryder Fortson', 'Travis Tritt']
28;Respect;2021;Tous publics;145;['Biography', ' Drama', ' Music            '];6.6;61;Following the rise of Aretha Franklin's career from a child singing in her father's church's choir to her international superstardom, RESPECT is the remarkable true story of the music icon's journey to find her voice.;['Liesl Tommy', None];['Jennifer Hudson', 'Forest Whitaker', 'Marlon Wayans', 'Tituss Burgess']
29;CBGB;2013;R;102;['Crime', ' Drama', ' Music            '];6.6;30;A look at the New York City punk-rock scene and the venerable nightclub, CBGB.;['Randall Miller', None];['Alan Rickman', 'Malin Akerman', 'Justin Bartha', 'Richard de Klerk']
30;Une nuit à New York;2008;Tous publics;90;['Comedy', ' Drama', ' Music            '];6.6;64;High school student Nick O'Leary, member of the Queercore band The Jerk Offs, meets college-bound Norah Silverberg when she asks him to be her boyfriend for five minutes.;['Peter Sollett', None];['Michael Cera', 'Kat Dennings', 'Aaron Yoo', 'Rafi Gavron']
31;Notorious B.I.G.;2009;Tous publics;122;['Biography', ' Crime', ' Drama            '];6.6;60;The life and death story of The Notorious B.I.G. (a.k.a. Christopher Wallace), who came straight out of Brooklyn to take the world of rap music by storm.;['George Tillman Jr.', None];['Jamal Woolard', 'Anthony Mackie', 'Derek Luke', 'Momo Dione']
32;Dance with Me;2006;Tous publics;118;['Drama', ' Music            '];6.6;55;The real story of a dance teacher who believed in the talent of a group of problem kids.;['Liz Friedlander', None];['Antonio Banderas', 'Rob Brown', 'Yaya DaCosta', 'Alfre Woodard']
33;Dreamgirls;2006;Tous Public;130;['Drama', ' Music', ' Musical            '];6.6;76;A trio of black female soul singers cross over to the pop charts in the early 1960s, facing their own personal struggles along the way.;['Bill Condon', None];['Beyoncé', 'Jamie Foxx', 'Eddie Murphy', 'Danny Glover']
34;De-Lovely;2004;Tous Public;125;['Biography', ' Drama', ' Music            '];6.6;53;Inspecting a magical biographical stage musical, composer Cole Porter reviews his life and career with his wife, Linda.;['Irwin Winkler', None];['Kevin Kline', 'Ashley Judd', 'Jonathan Pryce', 'Kevin McNally']
35;The Very Black Show;2000;Tous publics;135;['Comedy', ' Drama', ' Music            '];6.6;54;A frustrated African-American TV writer proposes a blackface minstrel show in protest, but to his chagrin, it becomes a hit.;['Spike Lee', None];['Damon Wayans', 'Savion Glover', 'Jada Pinkett Smith', 'Michael Rapaport']
36;Danse ta vie;2000;Tous publics;115;['Drama', ' Music', ' Romance            '];6.6;52;A group of 12 teenagers from various backgrounds enroll at the American Ballet Academy in New York to make it as ballet dancers and each one deals with the problems and stress of training and getting ahead in the world of dance.;['Nicholas Hytner', None];['Amanda Schull', 'Ethan Stiefel', 'Sascha Radetsky', 'Christine Dunham']
37;Mo' Better Blues;1990;NaN;129;['Drama', ' Music', ' Romance            '];6.6;61;Jazz trumpeter Bleek Gilliam makes questionable decisions in his professional and romantic lives.;['Spike Lee', None];['Denzel Washington', 'Spike Lee', 'Wesley Snipes', 'Giancarlo Esposito']
38;Les Feebles;1989;12;97;['Comedy', ' Music', ' Musical            '];6.6;-1;Multiple animals and insects experience the sleazier side of show business while working on a variety show.;['Peter Jackson', None];['Danny Mulheron', 'Donna Akersten', 'Stuart Devenie', 'Mark Hadlow']
39;Footloose;1984;Tous Public;107;['Drama', ' Music', ' Romance            '];6.6;42;A city teenager moves to a small town where rock music and dancing have been banned, and his rebellious spirit shakes up the populace.;['Herbert Ross', None];['Kevin Bacon', 'Lori Singer', 'John Lithgow', 'Dianne Wiest']
40;Fame;1980;Tous publics;134;['Drama', ' Music', ' Musical            '];6.6;58;A chronicle of the lives of several teenagers who attend a New York high school for students gifted in the performing arts.;['Alan Parker', None];['Eddie Barth', 'Irene Cara', 'Lee Curreri', 'Laura Dean']
41;Le lycée des cancres;1979;Tous publics;93;['Comedy', ' Music            '];6.6;70;Ramones fanatic and delinquent Riff Randell battles it out with the strict new principal of Vince Lombardi High School, Miss Togar, with help from the Ramones.;['    Directors:', 'Allan Arkush, ', 'Joe Dante', None];['P.J. Soles', 'Vincent Van Patten', 'Clint Howard', 'Dey Young']
42;New York, New York;1977;Tous publics;155;['Drama', ' Music', ' Musical            '];6.6;64;An egotistical saxophonist and a young lounge singer meet on VJ Day and embark upon a strained and rocky romance, even as their careers begin a long, uphill climb.;['Martin Scorsese', None];['Liza Minnelli', 'Robert De Niro', 'Lionel Stander', 'Barry Primus']
43;La rivière sans retour;1954;NaN;91;['Action', ' Adventure', ' Drama            '];6.6;-1;The titular river unites a farmer recently released from prison, his young son, and an ambitious saloon singer. In order to survive, each must be purged of anger, and each must learn to understand and care for the others.;['    Directors:', 'Otto Preminger, ', 'Jean Negulesco', None];['Robert Mitchum', 'Marilyn Monroe', 'Rory Calhoun', 'Tommy Rettig']
44;Brad's Status;2017;R;102;['Comedy', ' Drama', ' Music            '];6.5;71;A father takes his son to tour colleges on the East Coast and meets up with an old friend who makes him feel inferior about his life's choices.;['Mike White', None];['Ben Stiller', 'Austin Abrams', 'Jenna Fischer', 'Michael Sheen']
45;Les Runaways;2010;Tous publics;106;['Biography', ' Drama', ' Music            '];6.5;65;A coming-of-age biographical film about the 1970s teenage all-girl rock band The Runaways. The relationship between band members Cherie Currie and Joan Jett is also explored.;['Floria Sigismondi', None];['Kristen Stewart', 'Dakota Fanning', 'Michael Shannon', 'Stella Maeve']
46;Le come back;2007;Tous Public;104;['Comedy', ' Music', ' Romance            '];6.5;59;A washed up singer is given a couple days to compose a chart-topping hit for an aspiring teen sensation. Though he's never written a decent lyric in his life, he sparks with an offbeat younger woman with a flair for words.;['Marc Lawrence', None];['Hugh Grant', 'Drew Barrymore', 'Scott Porter', 'Nick Bacon']
47;Sexy Dance;2006;Tous Public;104;['Crime', ' Drama', ' Music            '];6.5;48;Tyler Gage receives the opportunity of a lifetime after vandalizing a performing arts school, gaining him the chance to earn a scholarship and dance with an up and coming dancer, Nora.;['Anne Fletcher', None];"['Channing Tatum', 'Jenna Dewan', 'Damaine Radcliff', ""De'Shawn Washington""]"
48;Sister Act;1992;Tous publics;100;['Comedy', ' Family', ' Music            '];6.5;51;When a nightclub singer is forced to take refuge from the mob in a convent, she ends up turning the convent choir into a soulful chorus complete with a Motown repertoire, until the sudden celebrity of the choir jeopardizes her identity.;['Emile Ardolino', None];['Whoopi Goldberg', 'Maggie Smith', 'Kathy Najimy', 'Wendy Makkena']
49;Purple Rain;1984;Tous publics;111;['Drama', ' Music', ' Romance            '];6.5;55;A young musician, tormented by an abusive situation at home, must contend with a rival singer, a burgeoning romance, and his own dissatisfied band, as his star begins to rise.;['Albert Magnoli', None];['Prince', 'Apollonia Kotero', 'Morris Day', 'Olga Karlatos']
0;Cotton Club;1984;Tous publics;129;['Crime', ' Drama', ' Music            '];6.5;68;Meet the jazz musicians, dancers, owner, and guests (like gangster Dutch Schultz) of The Cotton Club in 1928-1930s Harlem.;['Francis Ford Coppola', None];['Richard Gere', 'Gregory Hines', 'Diane Lane', 'Lonette McKee']
1;L'inconnu de Las Vegas;1960;Tous publics;127;['Comedy', ' Crime', ' Music            '];6.5;57;Danny Ocean gathers a group of his World War II compatriots to pull off the ultimate Las Vegas heist. Together the eleven friends plan to rob five Las Vegas casinos in one night.;['Lewis Milestone', None];['Frank Sinatra', 'Dean Martin', 'Sammy Davis Jr.', 'Peter Lawford']
2;J'y crois encore;2020;Tous Public;116;['Biography', ' Drama', ' Music            '];6.4;41;The true-life story of Christian music star Jeremy Camp and his journey of love and loss that looks to prove there is always hope.;['    Directors:', 'Andrew Erwin, ', 'Jon Erwin', None];['K.J. Apa', 'Britt Robertson', 'Nathan Parsons', 'Gary Sinise']
3;La voix du succès;2020;Tous publics;113;['Drama', ' Music', ' Romance            '];6.4;58;A superstar singer and her overworked personal assistant are presented with a choice that could alter the course of their respective careers.;['Nisha Ganatra', None];['Dakota Johnson', 'Tracee Ellis Ross', 'Kelvin Harrison Jr.', 'Bill Pullman']
4;Pitch Perfect 2;2015;Tous publics;115;['Comedy', ' Music            '];6.4;63;After a humiliating command performance at The Kennedy Center, the Barden Bellas enter an international competition that no American group has ever won in order to regain their status and right to perform.;['Elizabeth Banks', None];['Anna Kendrick', 'Rebel Wilson', 'Hailee Steinfeld', 'Brittany Snow']
5;A Bigger Splash;2015;Tous publics avec avertissement;125;['Drama', ' Music', ' Thriller            '];6.4;74;A famous rock star's vacation in Italy with her boyfriend is disrupted by the unexpected visit of an old friend and his daughter.;['Luca Guadagnino', None];['Tilda Swinton', 'Matthias Schoenaerts', 'Ralph Fiennes', 'Dakota Johnson']
6;Sexy Dance 4: Miami Heat;2012;Tous Public;99;['Drama', ' Music', ' Romance            '];6.4;43;Emily arrives in Miami with aspirations to become a professional dancer. She sparks with Sean, the leader of a dance crew whose neighborhood is threatened by Emily's father's development plans.;['Scott Speer', None];['Kathryn McCormick', 'Ryan Guzman', 'Cleopatra Coleman', 'Misha Gabriel Hamilton']
7;Burlesque;I) (2010;Tous publics;119;['Drama', ' Music', ' Musical            '];6.4;47;A small-town girl ventures to Los Angeles and finds her place in a neo-burlesque club run by a former dancer.;['Steve Antin', None];['Cher', 'Christina Aguilera', 'Alan Cumming', 'Eric Dane']
8;Soul Men;2008;R;100;['Comedy', ' Drama', ' Music            '];6.4;49;Though it's been about twenty years since they have spoken with one another, two estranged soul-singing legends agree to participate in a reunion performance at the Apollo Theater to honor their recently deceased band leader.;['Malcolm D. Lee', None];['Samuel L. Jackson', 'Bernie Mac', 'Sharon Leal', 'Adam Herschman']
9;Miles Ahead;2015;R;100;['Biography', ' Drama', ' Music            '];6.4;64;An exploration of the life and music of Miles Davis.;['Don Cheadle', None];['Don Cheadle', 'Emayatzy Corinealdi', 'Ewan McGregor', 'Michael Stuhlbarg']
10;Happy Feet;2006;Tous publics;108;['Animation', ' Adventure', ' Comedy            '];6.4;77;Into the world of the Emperor Penguins, who find their soul mates through song, a penguin is born who cannot sing. But he can tap dance something fierce!;['    Directors:', 'George Miller, ', 'Warren Coleman, ', 'Judy Morris', None];['Elijah Wood', 'Brittany Murphy', 'Hugh Jackman', 'Robin Williams']
11;House Party;1990;Tous publics;100;['Comedy', ' Music', ' Romance            '];6.4;76;Kid decides to go to his friend Play's house party, but neither of them can predict what's in store for them on what could be the wildest night of their lives.;['Reginald Hudlin', None];['Christopher Reid', 'Robin Harris', 'Christopher Martin', 'Martin Lawrence']
12;Les aventures de Ford Fairlane;1990;NaN;104;['Action', ' Adventure', ' Comedy            '];6.4;24;A vulgar private detective is hired to find a missing groupie and is drawn into a mystery involving a series of murders tied to the music industry.;['Renny Harlin', None];['Andrew Dice Clay', 'Lauren Holly', 'Wayne Newton', 'Priscilla Presley']
13;Le chanteur de jazz;1927;Tous Public;88;['Drama', ' Music', ' Musical            '];6.4;66;The son of a Jewish Cantor must defy the traditions of his religious father in order to pursue his dream of becoming a jazz singer.;['Alan Crosland', None];['Al Jolson', 'May McAvoy', 'Warner Oland', 'Eugenie Besserer']
14;Billie Holiday, une affaire d'État;2021;Tous publics avec avertissement;126;['Biography', ' Drama', ' Music            '];6.3;52;Follows Holiday during her career as she is targeted by the Federal Department of Narcotics with an undercover sting operation led by black Federal Agent Jimmy Fletcher, with whom she has a tumultuous affair.;['Lee Daniels', None];['Andra Day', 'Trevante Rhodes', 'Garrett Hedlund', 'Natasha Lyonne']
15;Gloria Bell;2018;Tous publics;102;['Comedy', ' Drama', ' Music            '];6.3;79;A free-spirited woman in her 50s seeks out love at L.A. dance clubs.;['Sebastián Lelio', None];['Julianne Moore', 'John Turturro', 'Caren Pistorius', 'Michael Cera']
16;Deathgasm;2015;NaN;86;['Action', ' Comedy', ' Horror            '];6.3;65;Two teenage boys unwittingly summon an ancient evil entity known as The Blind One by delving into black magic while trying to escape their mundane lives.;['Jason Howden', None];['Milo Cawthorne', 'James Joshua Blake', 'Kimberley Crossman', 'Sam Berkley']
17;David Brent: Life on the Road;2016;NaN;96;['Comedy', ' Music            '];6.3;54;A camera crew catches up with David Brent, the former star of the fictional British TV series The Office (2001), as he now fancies himself a rock star on the road.;['Ricky Gervais', None];['Ricky Gervais', 'Rob Jarvis', 'Abbie Murphy', 'Mandeep Dhillon']
18;Rio 2;2014;Tous publics;101;['Animation', ' Adventure', ' Comedy            '];6.3;49;It's a jungle out there for Blu, Jewel, and their three kids after they're hurtled from Rio de Janeiro to the wilds of the Amazon. As Blu tries to fit in, he goes beak-to-beak with the vengeful Nigel and meets his father-in-law.;['Carlos Saldanha', None];['Jesse Eisenberg', 'Anne Hathaway', 'Jemaine Clement', 'Andy Garcia']
19;To Rome with Love;2012;Tous Public;112;['Comedy', ' Music', ' Romance            '];6.3;54;The lives of some visitors and residents of Rome and the romances, adventures and predicaments they get into.;['Woody Allen', None];['Woody Allen', 'Penélope Cruz', 'Jesse Eisenberg', 'Elliot Page']
20;Sur la plage de Chesil;2017;R;110;['Drama', ' Music', ' Romance            '];6.3;62;In 1962 England, a young couple find their idyllic romance colliding with issues of sexual freedom and societal pressure, leading to an awkward and fateful wedding night.;['Dominic Cooke', None];['Billy Howle', 'Saoirse Ronan', 'Andy Burse', 'Rasmus Hardiker']
21;Country Strong;2010;Tous Public;117;['Drama', ' Music            '];6.3;45;A rising country-music songwriter works with a fallen star to work their way to fame, causing romantic complications along the way.;['Shana Feste', None];['Garrett Hedlund', 'Gwyneth Paltrow', 'Leighton Meester', 'Tim McGraw']
22;American Trip;2010;Tous publics;109;['Comedy', ' Music            '];6.3;65;A record company intern is hired to accompany out-of-control British rock star Aldous Snow to a concert at L.A.'s Greek Theater.;['Nicholas Stoller', None];['Jonah Hill', 'Russell Brand', 'Elisabeth Moss', 'Rose Byrne']
23;Hamlet 2;2008;Tous publics;92;['Comedy', ' Music            '];6.3;54;In this irreverent comedy, a failed actor-turned-worse-high-school-drama-teacher rallies his Tucson, AZ students as he conceives and stages politically incorrect musical sequel to Shakespeare's Hamlet.;['Andrew Fleming', None];['Steve Coogan', 'Elisabeth Shue', 'Catherine Keener', 'Joseph Julian Soria']
24;College Rock Stars;2009;Tous Public;111;['Comedy', ' Drama', ' Family            '];6.3;66;A new kid in town assembles a fledgling rock band -- together, they achieve their dreams and compete against the best in the biggest event of the year, a battle of the bands.;['Todd Graff', None];['Aly Michalka', 'Vanessa Hudgens', 'Gaelan Connell', 'Scott Porter']
25;Freaky friday - Dans la peau de ma mère;2003;Tous Public;97;['Comedy', ' Family', ' Fantasy            '];6.3;70;An overworked mother and her daughter do not get along. When they switch bodies, each is forced to adapt to the other's life for one freaky Friday.;['Mark Waters', None];['Jamie Lee Curtis', 'Lindsay Lohan', 'Mark Harmon', 'Harold Gould']
26;Rock Star;2001;R;105;['Drama', ' Music            '];6.3;54;Lead singer of a tribute band becomes lead singer of the real band he idolizes.;['Stephen Herek', None];['Mark Wahlberg', 'Jennifer Aniston', 'Dominic West', 'Jason Bonham']
27;Bodyguard;1992;Tous publics;129;['Action', ' Drama', ' Music            '];6.3;39;A former Secret Service agent takes on the job of bodyguard to an R&B singer, whose lifestyle is most unlike a President's.;['Mick Jackson', None];['Kevin Costner', 'Whitney Houston', 'Gary Kemp', 'Bill Cobbs']
28;Les folles aventures de Bill et Ted;1991;Tous Public;93;['Adventure', ' Comedy', ' Fantasy            '];6.3;60;A tyrant from the future creates evil android doubles of Bill and Ted and sends them back to eliminate the originals.;['Peter Hewitt', None];['Keanu Reeves', 'Alex Winter', 'William Sadler', 'Joss Ackland']
29;The Perfection;2018;16;90;['Drama', ' Horror', ' Music            '];6.2;60;When troubled musical prodigy Charlotte seeks out Elizabeth, the new star pupil of her former school, the encounter sends both musicians down a sinister path with shocking consequences.;['Richard Shepard', None];['Marie Maskell', 'Allison Williams', 'Christina Jastrzembska', 'Glynis Davies']
