;name;year;certificate;runtime;genre;rating;metascore;text-muted;director;stars
4;Goal! - Naissance d'un prodige;2005;Tous Public;118;['Drama', ' Romance', ' Sport            '];6.7;53;The extremely talented Santiago Muñez is spotted by a Newcastle United scout and given a chance at professional football.;['    Directors:', 'Danny Cannon, ', 'Michael Winterbottom', None];['Kuno Becker', 'Alessandro Nivola', 'Anna Friel', 'Leonardo Guerra']
5;Tout peut arriver;2003;Tous publics;128;['Comedy', ' Drama', ' Romance            '];6.7;66;A swinger on the cusp of being a senior citizen with a taste for young women falls in love with an accomplished woman closer to his age.;['Nancy Meyers', None];['Jack Nicholson', 'Diane Keaton', 'Keanu Reeves', 'Amanda Peet']
6;Sous le soleil de Toscane;2003;Tous Public;113;['Comedy', ' Drama', ' Romance            '];6.7;52;A writer impulsively buys a villa in Tuscany in order to change her life.;['Audrey Wells', None];['Diane Lane', 'Raoul Bova', 'Sandra Oh', 'Lindsay Duncan']
7;All the Real Girls;2003;R;108;['Drama', ' Romance            '];6.7;71;Small-town love story of a young man with a reputation for womanizing and his best friend's sister.;['David Gordon Green', None];['Zooey Deschanel', 'Paul Schneider', 'Patricia Clarkson', 'Shea Whigham']
8;Joue-la comme Beckham;2002;Tous publics;112;['Comedy', ' Drama', ' Romance            '];6.7;66;Two ambitious girls, despite their parents' wishes, have their hearts set on careers in professional soccer.;['Gurinder Chadha', None];['Parminder Nagra', 'Keira Knightley', 'Jonathan Rhys Meyers', 'Anupam Kher']
9;Girl Next Door;2004;Tous publics;109;['Comedy', ' Drama', ' Romance            '];6.7;47;A teenager's dreams come true when a former porn star moves in next door and they fall in love.;['Luke Greenfield', None];['Emile Hirsch', 'Nicholas Downs', 'Elisha Cuthbert', 'Timothy Olyphant']
10;Le sortilège du scorpion de Jade;2001;Tous publics;103;['Comedy', ' Crime', ' Mystery            '];6.7;52;An insurance investigator and an efficency expert who hate each other are both hypnotized by a crooked hypnotist with a jade scorpion into stealing jewels.;['Woody Allen', None];['Greg Stebner', 'Woody Allen', 'John Tormey', 'John Schuck']
11;Infidèle;2002;12;124;['Drama', ' Romance', ' Thriller            '];6.7;63;A New York suburban couple's marriage goes dangerously awry when the wife indulges in an adulterous fling.;['Adrian Lyne', None];['Richard Gere', 'Diane Lane', 'Olivier Martinez', 'Erik Per Sullivan']
12;Le journal de Bridget Jones;2001;Tous publics;97;['Comedy', ' Drama', ' Romance            '];6.7;66;Bridget Jones is determined to improve herself while she looks for love in a year in which she keeps a personal diary.;['Sharon Maguire', None];['Renée Zellweger', 'Colin Firth', 'Hugh Grant', 'Gemma Jones']
13;Sweet November;2001;Tous publics;119;['Drama', ' Romance            '];6.7;27;A workaholic executive, and an unconventional woman agree to a personal relationship for a short period. In this short period she changes his life.;"[""Pat O'Connor"", None]";['Keanu Reeves', 'Charlize Theron', 'Jason Isaacs', 'Greg Germann']
14;Où le coeur nous mène;2000;Tous publics;120;['Comedy', ' Drama', ' Romance            '];6.7;30;A pregnant seventeen-year-old rebuilds her life after being abandoned by her boyfriend at a Walmart in Sequoyah, Oklahoma.;['Matt Williams', None];['Natalie Portman', 'James Frain', 'Ashley Judd', 'Stockard Channing']
15;But I'm a Cheerleader;1999;R;85;['Comedy', ' Drama', ' Romance            '];6.7;39;A naive teenager is sent to rehab camp when her straitlaced parents and friends suspect her of being a lesbian.;['Jamie Babbit', None];['Natasha Lyonne', 'Clea DuVall', 'Michelle Williams', 'Brandt Wille']
16;Le Mariage de l'année;1999;R;120;['Comedy', ' Drama', ' Romance            '];6.7;61;Just before his best friend's wedding, the life of a Chicago writer becomes crazy when his best friend guesses that his new book's story is based on his bride's fervent past.;['Malcolm D. Lee', None];['Taye Diggs', 'Nia Long', 'Morris Chestnut', 'Harold Perrineau']
17;Anna et le roi;1999;Tous publics;148;['Drama', ' History', ' Romance            '];6.7;56;The story of the romance between the King of Siam and widowed British schoolteacher, Anna Leonowens, during the 1860s.;['Andy Tennant', None];['Jodie Foster', 'Chow Yun-Fat', 'Bai Ling', 'Tom Felton']
18;Summer of Sam;1999;12;142;['Crime', ' Drama', ' Romance            '];6.7;67;"Spike Lee's take on the ""Son of Sam"" murders in New York City during the summer of 1977 centering on the residents of an Italian-American Northeast Bronx neighborhood who live in fear and distrust of one another.";['Spike Lee', None];['John Leguizamo', 'Adrien Brody', 'Mira Sorvino', 'Jennifer Esposito']
19;Chevauchée avec le diable;I) (1999;Tous publics;138;['Drama', ' Romance', ' War            '];6.7;69;During the American Civil War, two friends join the Bushwhackers, a militant group loyal to the Confederacy.;['Ang Lee', None];['Tobey Maguire', 'Skeet Ulrich', 'Jewel', 'Jeremy W. Auman']
20;Vous avez un mess@ge;1998;Tous publics;119;['Comedy', ' Drama', ' Romance            '];6.7;57;Book superstore magnate, Joe Fox and independent book shop owner, Kathleen Kelly fall in love in the anonymity of the Internet both blissfully unaware that he's trying to put her out of business.;['Nora Ephron', None];['Tom Hanks', 'Meg Ryan', 'Greg Kinnear', 'Parker Posey']
21;Première sortie;1999;Tous publics;112;['Comedy', ' Drama', ' Romance            '];6.7;48;A naive man comes out into the world after spending 35 years in a nuclear fallout shelter.;['Hugh Wilson', None];['Brendan Fraser', 'Alicia Silverstone', 'Christopher Walken', 'Sissy Spacek']
22;Les derniers jours du disco;1998;Tous publics;113;['Comedy', ' Drama', ' Music            '];6.7;76;Story of two female Manhattan book editors fresh out of college, both finding love and themselves while frequenting the local disco.;['Whit Stillman', None];['Chloë Sevigny', 'Kate Beckinsale', 'Chris Eigeman', 'Mackenzie Astin']
23;La cité des anges;1998;Tous publics;114;['Drama', ' Fantasy', ' Romance            '];6.7;54;An angel on Earth, a doctor unable to believe, a patient with a secret, a love story made in Heaven.;['Brad Silberling', None];['Nicolas Cage', 'Meg Ryan', 'Andre Braugher', 'Dennis Franz']
24;Yes Boss;1997;NaN;163;['Comedy', ' Drama', ' Musical            '];6.7;-1;Rahul Joshi wants to be a successful businessman so he works hard for his boss Siddharth. One day Rahul meets Seema, an up and coming model, and he feels like he's finally met his match. Will Seema fall for Rahul?;['Aziz Mirza', None];['Shah Rukh Khan', 'Juhi Chawla', 'Aditya Pancholi', 'Kashmira Shah']
25;Pile & face;1998;Tous publics;99;['Comedy', ' Drama', ' Fantasy            '];6.7;59;A London woman's love life and career both hinge, unknown to her, on whether or not she catches a train. We see it both ways, in parallel.;['Peter Howitt', None];['Gwyneth Paltrow', 'John Hannah', 'John Lynch', 'Jeanne Tripplehorn']
26;L'homme qui murmurait à l'oreille des chevaux;1998;Tous publics;169;['Drama', ' Romance', ' Western            '];6.7;65;The mother of a severely traumatized daughter enlists the aid of a unique horse trainer to help the girl's equally injured horse.;['Robert Redford', None];['Robert Redford', 'Kristin Scott Thomas', 'Sam Neill', 'Dianne Wiest']
27;Carton jaune;1997;R;102;['Comedy', ' Drama', ' Romance            '];6.7;55;A sports fan's romantic courtship clashes with his obsession with his favorite football team.;['David Evans', None];['Colin Firth', 'Ruth Gemmell', 'Luke Aikman', 'Bea Guard']
28;Roméo + Juliette;1996;Tous publics;120;['Drama', ' Romance            '];6.7;60;Shakespeare's famous play is updated to the hip modern suburb of Verona still retaining its original dialogue.;['Baz Luhrmann', None];['Leonardo DiCaprio', 'Claire Danes', 'John Leguizamo', 'Harold Perrineau']
29;Tout le monde dit I love you;1996;Tous publics;101;['Comedy', ' Musical', ' Romance            '];6.7;-1;A New York girl sets her father up with a beautiful woman in a troubled marriage while her stepsister gets engaged.;['Woody Allen', None];['Woody Allen', 'Goldie Hawn', 'Julia Roberts', 'Edward Norton']
30;L'amour à tout prix;1995;Tous publics;103;['Comedy', ' Drama', ' Romance            '];6.7;67;A hopelessly romantic Chicago Transit Authority token collector is mistaken for the fiancée of a coma patient.;['Jon Turteltaub', None];['Sandra Bullock', 'Bill Pullman', 'Peter Gallagher', 'Peter Boyle']
31;Les vendanges de feu;1995;Tous publics;102;['Drama', ' Romance            '];6.7;54;A married soldier returning from World War II poses as a pregnant woman's husband to save her from her father's anger and honor.;['Alfonso Arau', None];['Keanu Reeves', 'Aitana Sánchez-Gijón', 'Anthony Quinn', 'Giancarlo Giannini']
32;Pocahontas, une légende indienne;I) (1995;Tous publics;81;['Animation', ' Adventure', ' Drama            '];6.7;58;An English soldier and the daughter of an Algonquin chief share a romance when English colonists invade seventeenth century Virginia.;['    Directors:', 'Mike Gabriel, ', 'Eric Goldberg', None];['Mel Gibson', 'Linda Hunt', 'Christian Bale', 'Joe Baker']
33;Souvenirs d'un été;1995;Tous publics;100;['Comedy', ' Drama', ' Romance            '];6.7;50;Four 12-year-old girls grow up together during an eventful small-town summer in 1970.;['Lesli Linka Glatter', None];"['Christina Ricci', 'Demi Moore', ""Rosie O'Donnell"", 'Thora Birch']"
34;Kicking and Screaming;1995;R;96;['Comedy', ' Drama', ' Romance            '];6.7;75;A bunch of guys hang around their college for months after graduation, continuing a life much like the one before graduation.;['Noah Baumbach', None];['Josh Hamilton', 'Eric Stoltz', 'Samuel Gould', 'Catherine Kellner']
35;Empire Records;1995;Tous publics;90;['Comedy', ' Drama', ' Music            '];6.7;30;Twenty-four hours in the lives of the young employees at Empire Records when they all grow up and become young adults thanks to each other and the manager. They all face the store joining a chain store with strict rules.;['Allan Moyle', None];['Anthony LaPaglia', 'Debi Mazar', 'Maxwell Caulfield', 'Rory Cochrane']
36;Don Juan DeMarco;1994;12;97;['Comedy', ' Drama', ' Romance            '];6.7;63;A psychiatrist must cure a young patient who presents himself as Don Juan, the world's greatest lover.;['Jeremy Leven', None];['Johnny Depp', 'Marlon Brando', 'Faye Dunaway', 'Géraldine Pailhas']
37;Sacré Robin des Bois;1993;Tous Public;104;['Adventure', ' Comedy', ' Musical            '];6.7;44;A spoof of Robin Hood in general, and Robin des bois: Prince des voleurs (1991) in particular.;['Mel Brooks', None];['Cary Elwes', 'Richard Lewis', 'Roger Rees', 'Amy Yasbeck']
38;M. Butterfly;1993;R;101;['Drama', ' Romance            '];6.7;43;In 1960s China, French diplomat Rene Gallimard falls in love with an opera singer, Song Liling - but Song is not at all who Gallimard thinks.;['David Cronenberg', None];['Jeremy Irons', 'John Lone', 'Barbara Sukowa', 'Ian Richardson']
39;Singles;1992;Tous publics;99;['Comedy', ' Drama', ' Music            '];6.7;71;A group of twenty-something friends search for love and success in grunge-era Seattle.;['Cameron Crowe', None];['Bridget Fonda', 'Campbell Scott', 'Kyra Sedgwick', 'Sheila Kelley']
40;Fatale;1992;Tous publics;111;['Drama', ' Romance            '];6.7;71;A member of Parliament falls passionately in love with his son's fiancée despite the dangers of discovery.;['Louis Malle', None];['Jeremy Irons', 'Juliette Binoche', 'Miranda Richardson', 'Rupert Graves']
41;Les Hauts de Hurlevent;1992;PG;105;['Drama', ' History', ' Romance            '];6.7;-1;A man becomes obsessed with vengeance when his soul mate marries another man.;['Peter Kosminsky', None];['Juliette Binoche', 'Ralph Fiennes', 'Janet McTeer', 'Sophie Ward']
42;À propos d'Henry;1991;Tous publics;108;['Drama', ' Romance            '];6.7;47;After being shot, a lawyer loses his memory and must relearn speech and mobility, but he has a loving family to support him.;['Mike Nichols', None];['Harrison Ford', 'Annette Bening', 'Michael Haley', 'Stanley Swerdlow']
43;Los Angeles Story;1991;Tous publics;95;['Comedy', ' Drama', ' Fantasy            '];6.7;66;With the help of a talking freeway billboard, a wacky weatherman tries to win the heart of an English newspaper reporter, who is struggling to make sense of the strange world of early 1990s Los Angeles.;['Mick Jackson', None];['Steve Martin', 'Victoria Tennant', 'Richard E. Grant', 'Sarah Jessica Parker']
44;Frankie & Johnny;1991;Tous publics;118;['Comedy', ' Drama', ' Romance            '];6.7;66;Johnny has just been released from prison, and gets a job in a café beside waitress Frankie. Frankie is a bit of a loner, but Johnny is determined their romance will blossom.;['Garry Marshall', None];['Al Pacino', 'Michelle Pfeiffer', 'Hector Elizondo', 'Nathan Lane']
45;Les 2 sirènes;1990;Tous publics;110;['Comedy', ' Drama', ' Romance            '];6.7;56;An unconventional single mother relocates with her two daughters to a small Massachusetts town in 1963, where a number of events and relationships both challenge and strengthen their familial bonds.;['Richard Benjamin', None];['Cher', 'Bob Hoskins', 'Winona Ryder', 'Michael Schoeffling']
46;Colors;1988;12;120;['Action', ' Crime', ' Drama            '];6.7;66;An experienced cop and his rookie partner patrol the streets of East Los Angeles while trying to keep the gang violence under control.;['Dennis Hopper', None];['Sean Penn', 'Robert Duvall', 'Maria Conchita Alonso', 'Randy Brooks']
47;Voyageur malgré lui;1988;Tous Public;121;['Drama', ' Romance            '];6.7;53;An emotionally distant writer of travel guides must carry on with his life after his son is killed and his marriage crumbles.;['Lawrence Kasdan', None];['William Hurt', 'Kathleen Turner', 'Geena Davis', 'Amy Wright']
48;L'amour ne s'achète pas;1987;Tous publics;94;['Comedy', ' Drama', ' Romance            '];6.7;36;An outcast secretly pays the most popular girl in school one thousand dollars to pretend to be his girlfriend for a month.;['Steve Rash', None];['Patrick Dempsey', 'Amanda Peterson', 'Courtney Gains', 'Tina Caspary']
49;Rose bonbon;1986;Tous publics;97;['Comedy', ' Drama', ' Romance            '];6.7;56;A poor girl must choose between the affections of dating her childhood sweetheart or a rich but sensitive playboy.;['Howard Deutch', None];['Molly Ringwald', 'Jon Cryer', 'Harry Dean Stanton', 'Annie Potts']
0;L'honneur des Prizzi;1985;Tous publics;130;['Comedy', ' Crime', ' Drama            '];6.7;84;Two professional assassins fall in love.;['John Huston', None];['Jack Nicholson', 'Kathleen Turner', 'Robert Loggia', 'John Randolph']
1;Les rues de feu;1984;Tous publics;93;['Action', ' Crime', ' Drama            '];6.7;59;A mercenary is hired to rescue his ex-girlfriend, a singer who has been kidnapped by a motorcycle gang.;['Walter Hill', None];['Michael Paré', 'Diane Lane', 'Rick Moranis', 'Amy Madigan']
2;Comme au bon vieux temps;1980;Tous Public;102;['Comedy', ' Romance            '];6.7;58;Wrongfully accused of a bank robbery, a writer seeks the help of his ex-wife, who is now married to the soon-to-be Attorney General of California.;['Jay Sandrich', None];['Goldie Hawn', 'Chevy Chase', 'Charles Grodin', 'Robert Guillaume']
3;Guerre et Paix;1956;Tous publics;208;['Drama', ' Romance', ' War            '];6.7;-1;Napoleon's tumultuous relations with Russia, including his disastrous 1812 invasion, serve as the backdrop for the tangled personal lives of two aristocratic families.;['King Vidor', None];['Audrey Hepburn', 'Henry Fonda', 'Mel Ferrer', 'Vittorio Gassman']
4;Le tour du monde en 80 jours;1956;Tous Public;167;['Adventure', ' Comedy', ' Family            '];6.7;69;A Victorian Englishman bets that with the new steamships and railways he can circumnavigate the globe in eighty days.;['    Directors:', 'Michael Anderson, ', 'John Farrow', None];['David Niven', 'Cantinflas', 'Finlay Currie', 'Robert Morley']
5;Bros;I) (2022;Tous publics;115;['Comedy', ' Romance            '];6.6;77;Two men with commitment problems attempt a relationship.;['Nicholas Stoller', None];['Billy Eichner', 'Luke Macfarlane', 'Guy Branum', 'Miss Lawrence']
6;Dans les yeux de Tammy Faye;2021;12;126;['Biography', ' Drama', ' Romance            '];6.6;55;An intimate look at the extraordinary rise, fall and redemption of televangelist Tammy Faye Bakker.;['Michael Showalter', None];"['Jessica Chastain', 'Andrew Garfield', 'Cherry Jones', ""Vincent D'Onofrio""]"
7;Ma belle-famille, Noël, et moi;2020;Tous publics;102;['Comedy', ' Crime', ' Drama            '];6.6;69;A holiday romantic comedy that captures the range of emotions tied to wanting your family's acceptance, being true to yourself, and trying not to ruin Christmas by revealing a nasty secret.;['Clea DuVall', None];['Kristen Stewart', 'Mackenzie Davis', 'Mary Steenburgen', 'Victor Garber']
8;On sera deux!;I) (2019;NaN;98;['Comedy', ' Drama', ' Romance            '];6.6;65;In order to survive a summer of wedding fever, longtime single friends, Ben and Alice, agree to be each other's plus one at every wedding they've been invited to.;['    Directors:', 'Jeff Chan, ', 'Andrew Rhymer', None];['Jack Quaid', 'Maya Erskine', 'Beck Bennett', 'Jessy Hodges']
9;Mamma Mia! Here We Go Again;2018;Tous publics;114;['Comedy', ' Musical', ' Romance            '];6.6;60;Five years after the events of Mamma Mia! (2008), Sophie prepares for the grand reopening of the Hotel Bella Donna as she learns more about her mother's past.;['Ol Parker', None];['Lily James', 'Amanda Seyfried', 'Meryl Streep', 'Cher']
10;I Want You Back;2022;R;116;['Comedy', ' Romance            '];6.6;62;Newly dumped thirty-somethings Peter and Emma team up to sabotage their exes' new relationships and win them back for good.;['Jason Orley', None];['Charlie Day', 'Jenny Slate', 'Scott Eastwood', 'Gina Rodriguez']
11;À la dérive;I) (2018;Tous publics;96;['Action', ' Adventure', ' Biography            '];6.6;56;A true story of survival, as a young couple's chance encounter leads them first to love, and then on the adventure of a lifetime as they face one of the most catastrophic hurricanes in recorded history.;['Baltasar Kormákur', None];['Shailene Woodley', 'Sam Claflin', 'Jeffrey Thomas', 'Elizabeth Hawthorne']
12;Les aéronautes;2019;13;100;['Action', ' Adventure', ' Drama            '];6.6;60;A balloon pilot and a scientist find themselves in a fight for survival while attempting to make discoveries in a gas balloon in the 1860s.;['Tom Harper', None];['Felicity Jones', 'Eddie Redmayne', 'Himesh Patel', 'Vincent Perez']
13;Désobéissance;2017;Tous publics;114;['Drama', ' Romance            '];6.6;74;A woman returns to her Orthodox Jewish community that shunned her for her attraction to a female childhood friend. Once back, their passions reignite as they explore the boundaries of faith and sexuality.;['Sebastián Lelio', None];['Rachel Weisz', 'Rachel McAdams', 'Alessandro Nivola', 'Anton Lesser']
14;Juliet, Naked;2018;R;97;['Comedy', ' Drama', ' Music            '];6.6;67;Annie (the long-suffering girlfriend of Duncan) has an unlikely transatlantic romance with once revered, now faded, singer-songwriter, Tucker Crowe, who also happens to be the subject of Duncan's musical obsession.;['Jesse Peretz', None];"[""Chris O'Dowd"", 'Rose Byrne', 'Ethan Hawke', ""Kitty O'Beirne""]"
15;Midnight Sun;2018;Tous publics;91;['Drama', ' Romance            '];6.6;38;A 17-year-old girl suffers from a condition that prevents her from being out in the sunlight.;['Scott Speer', None];['Bella Thorne', 'Patrick Schwarzenegger', 'Rob Riggle', 'Quinn Shephard']
16;Café Society;2016;Tous publics;96;['Comedy', ' Drama', ' Romance            '];6.6;64;In the 1930s, a Bronx native moves to Hollywood and falls in love with a young woman who is seeing a married man.;['Woody Allen', None];['Jesse Eisenberg', 'Kristen Stewart', 'Steve Carell', 'Blake Lively']
17;Forever My Girl;2018;Tous publics;108;['Comedy', ' Drama', ' Music            '];6.6;36;After being gone for a decade a country star returns home to the love he left behind.;['Bethany Ashton Wolf', None];['Alex Roe', 'Jessica Rothe', 'Abby Ryder Fortson', 'Travis Tritt']
18;Hello, My Name Is Doris;2015;R;90;['Comedy', ' Drama', ' Romance            '];6.6;63;A self-help seminar inspires a sixty-something woman to romantically pursue her younger co-worker.;['Michael Showalter', None];['Sally Field', 'Max Greenfield', 'Tyne Daly', 'Wendi McLendon-Covey']
19;L'homme irrationnel;2015;Tous publics;95;['Comedy', ' Crime', ' Drama            '];6.6;53;A tormented philosophy professor finds a will to live when he commits an existential act.;['Woody Allen', None];['Joaquin Phoenix', 'Emma Stone', 'Parker Posey', 'Joe Stapleton']
20;La Famille Hollar;2016;PG-13;88;['Comedy', ' Drama', ' Romance            '];6.6;53;A man returns to his small hometown after learning that his mother has fallen ill and is about to undergo surgery.;['John Krasinski', None];['Sharlto Copley', 'Charlie Day', 'Richard Jenkins', 'Anna Kendrick']
21;Diversion;II) (2015;Tous publics;105;['Comedy', ' Crime', ' Drama            '];6.6;56;In the midst of veteran con man Nicky's latest scheme, a woman from his past - now an accomplished femme fatale - shows up and throws his plans for a loop.;['    Directors:', 'Glenn Ficarra, ', 'John Requa', None];['Will Smith', 'Margot Robbie', 'Rodrigo Santoro', 'Adrian Martinez']
22;Lessons in love;2013;PG-13;111;['Comedy', ' Drama', ' Romance            '];6.6;49;An art instructor and an English teacher form a rivalry that ends up with a competition at their school in which students decide whether words or pictures are more important.;['Fred Schepisi', None];['Clive Owen', 'Juliette Binoche', 'Bruce Davison', 'Amy Brenneman']
23;Une seconde chance;2014;Tous Public;118;['Drama', ' Romance            '];6.6;29;A pair of former high school sweethearts reunite after many years when they return to visit their small hometown.;['Michael Hoffman', None];['James Marsden', 'Michelle Monaghan', 'Luke Bracey', 'Liana Liberato']
24;The Immigrant;2013;Tous publics;120;['Drama', ' Romance            '];6.6;77;In 1921, an innocent immigrant woman is tricked into a life of burlesque and vaudeville until a dazzling magician tries to save her and reunite her with her sister who is being held in the confines of Ellis Island.;['James Gray', None];['Marion Cotillard', 'Joaquin Phoenix', 'Jeremy Renner', 'Dagmara Dominczyk']
25;Inherent Vice;2014;Tous publics;148;['Comedy', ' Crime', ' Drama            '];6.6;81;"In 1970, drug-fueled Los Angeles private investigator Larry ""Doc"" Sportello investigates the disappearance of a former girlfriend.";['Paul Thomas Anderson', None];['Joaquin Phoenix', 'Josh Brolin', 'Owen Wilson', 'Katherine Waterston']
26;CBGB;2013;R;102;['Crime', ' Drama', ' Music            '];6.6;30;A look at the New York City punk-rock scene and the venerable nightclub, CBGB.;['Randall Miller', None];['Alan Rickman', 'Malin Akerman', 'Justin Bartha', 'Richard de Klerk']
27;Anna Karenine;I) (2012;Tous Public;129;['Drama', ' Romance            '];6.6;63;In late-19th-century Russian high society, St. Petersburg aristocrat Anna Karenina enters into a life-changing affair with the dashing Count Alexei Vronsky.;['Joe Wright', None];['Keira Knightley', 'Jude Law', 'Aaron Taylor-Johnson', 'Matthew Macfadyen']
28;À la folie;2011;PG-13;86;['Drama', ' Romance            '];6.6;68;A British college student falls for an American student, only to be separated from him when she's banned from the U.S. after overstaying her visa.;['Drake Doremus', None];['Felicity Jones', 'Anton Yelchin', 'Jennifer Lawrence', 'Charlie Bewley']
29;Un havre de paix;I) (2013;Tous Public;115;['Drama', ' Romance', ' Thriller            '];6.6;34;A young woman with a mysterious past lands in Southport, North Carolina where her bond with a widower forces her to confront the dark secret that haunts her.;['Lasse Hallström', None];['Julianne Hough', 'Josh Duhamel', 'Cobie Smulders', 'David Lyons']
30;Free Love;2015;Tous publics;103;['Biography', ' Drama', ' Romance            '];6.6;50;New Jersey police lieutenant Laurel Hester and her registered domestic partner Stacie Andree battle to secure Hester's pension benefits when she is diagnosed with terminal cancer.;['Peter Sollett', None];['Julianne Moore', 'Elliot Page', 'Steve Carell', 'Michael Shannon']
31;Celeste & Jesse Forever;2012;R;92;['Comedy', ' Drama', ' Romance            '];6.6;59;A divorcing couple tries to maintain their friendship while they both pursue other people.;['Lee Toland Krieger', None];['Rashida Jones', 'Andy Samberg', 'Elijah Wood', 'Emma Roberts']
32;Malcolm & Marie;2021;13;106;['Drama', ' Romance            '];6.6;53;A director and his girlfriend's relationship is tested after they return home from his movie premiere and face each other's turmoil during one long night.;['Sam Levinson', None];['John David Washington', 'Zendaya']
33;Last Chance for Love;2008;Tous Public;93;['Drama', ' Romance            '];6.6;57;In London for his daughter's wedding, a rumpled man finds his romantic spirits lifted by a new woman in his life.;['Joel Hopkins', None];['Dustin Hoffman', 'Emma Thompson', 'Kathy Baker', 'Eileen Atkins']
34;I Love You Phillip Morris;2009;Tous publics avec avertissement;102;['Biography', ' Comedy', ' Crime            '];6.6;65;A cop turns con man once he comes out of the closet. Once imprisoned, he meets the second love of his life, whom he'll stop at nothing to be with.;['    Directors:', 'Glenn Ficarra, ', 'John Requa', None];['Jim Carrey', 'Ewan McGregor', 'Leslie Mann', 'Rodrigo Santoro']
