;name;year;certificate;runtime;genre;rating;metascore;text-muted;director;stars
44;Les Razmoket à Paris, le film;2000;Tous publics;78;['Animation', ' Adventure', ' Comedy            '];6.1;62;While on a family vacation in Paris, the Rugrats attempt to help Chuckie find a new mom while stopping his dad from marrying a conniving businesswoman who hates kids.;['    Directors:', 'Stig Bergqvist, ', 'Paul Demeyer', None];['Christine Cavanaugh', 'Elizabeth Daily', 'Cheryl Chase', 'Tara Strong']
45;The man who cried - Les larmes d'un homme;2000;Tous publics;100;['Drama', ' Music', ' Romance            '];6.1;40;A young refugee traveling from Russia to America in search of her lost father falls for a gypsy horseman.;['Sally Potter', None];['Christina Ricci', 'Cate Blanchett', 'Oleg Yankovskiy', 'Claudia Lander-Duke']
46;American Girls;2000;Tous publics;98;['Comedy', ' Romance', ' Sport            '];6.1;52;A champion high school cheerleading squad discovers its previous captain stole all their best routines from an inner-city school and must scramble to compete at this year's championships.;['Peyton Reed', None];['Kirsten Dunst', 'Eliza Dushku', 'Jesse Bradford', 'Gabrielle Union']
47;Othello 2003;2001;R;95;['Drama', ' Romance', ' Thriller            '];6.1;53;An update of Shakespeare's 'Othello' with a young cast, set in an upper class prep school, & centered around basketball player Odin.;['Tim Blake Nelson', None];['Mekhi Phifer', 'Julia Stiles', 'Martin Sheen', 'Josh Hartnett']
48;Coup de foudre et conséquences;1997;Tous publics;109;['Comedy', ' Drama', ' Romance            '];6.1;37;After a one night stand with Alex, Isabel realizes that she is pregnant and they decide to get married. However, along with the marriage comes compromise of one's own cultural traditions.;['Andy Tennant', None];['Matthew Perry', 'Salma Hayek', 'Jon Tenney', 'Carlos Gómez']
49;Addicted to Love;1997;R;100;['Comedy', ' Romance            '];6.1;49;"Maggie's and Sam's former partners are in love; she wants revenge and he wants his lost love back, so they work together to break up the happy couple.";['Griffin Dunne', None];['Meg Ryan', 'Matthew Broderick', 'Kelly Preston', 'Tchéky Karyo']
0;Personnel et confidentiel;1996;PG-13;124;['Drama', ' Romance            '];6.1;-1;An ambitious young woman, determined to build a career in television journalism, gets good advice from her first boss, and they fall in love.;['Jon Avnet', None];['Robert Redford', 'Michelle Pfeiffer', 'Stockard Channing', 'Joe Mantegna']
1;Mes doubles, ma femme et moi;1996;PG-13;117;['Comedy', ' Romance', ' Sci-Fi            '];6.1;53;A man who never has enough time for the things he wants to do is offered the opportunity to have himself duplicated.;['Harold Ramis', None];['Michael Keaton', 'Andie MacDowell', 'Zack Duhame', 'Katie Schlossberg']
2;Poetic Justice;1993;R;109;['Drama', ' Romance            '];6.1;51;Grieving hairdresser, Justice, goes on a road trip from South Central L.A. to Oakland on a mail truck alongside her friend and a postal worker which she cannot stand;['John Singleton', None];['Janet Jackson', 'Tupac Shakur', 'Regina King', 'Joe Torry']
3;En toute bonne foi;1992;PG-13;108;['Comedy', ' Drama', ' Romance            '];6.1;-1;Fake faith healer Jonas Nightingale is stranded in a small town where he finds he can't fool all of the people all of the time.;['Richard Pearce', None];['Steve Martin', 'Debra Winger', 'Lolita Davidovich', 'Liam Neeson']
4;Fais comme chez toi;1992;Tous Public;102;['Comedy', ' Romance            '];6.1;52;Con artist Gwen moves into Newton's empty home without his knowledge and begins setting up house, posing as his new wife.;['Frank Oz', None];['Steve Martin', 'Goldie Hawn', 'Dana Delany', 'Julie Harris']
5;The Two Jakes - Piège pour un privé;1990;Tous publics;137;['Crime', ' Drama', ' Mystery            '];6.1;56;"The sequel to Chinatown (1974) finds J.J. ""Jake"" Gittes investigating adultery and murder, and the money that comes from oil.";['Jack Nicholson', None];['Jack Nicholson', 'Harvey Keitel', 'Meg Tilly', 'Madeleine Stowe']
6;La maison Russie;1990;R;123;['Drama', ' Romance', ' Thriller            '];6.1;67;An expatriate British publisher unexpectedly finds himself working for British intelligence to investigate people in Russia.;['Fred Schepisi', None];['Sean Connery', 'Michelle Pfeiffer', 'Roy Scheider', 'James Fox']
7;Traquée;1987;Tous publics;106;['Crime', ' Drama', ' Romance            '];6.1;55;A married New York cop falls for the socialite murder witness he's been assigned to protect.;['Ridley Scott', None];['Tom Berenger', 'Mimi Rogers', 'Lorraine Bracco', 'Jerry Orbach']
8;Teen Wolf;1985;Tous publics;91;['Comedy', ' Fantasy', ' Romance            '];6.1;25;An ordinary high school student discovers that his family has an unusual pedigree when he finds himself turning into a werewolf.;['Rod Daniel', None];['Michael J. Fox', 'James Hampton', 'Susan Ursitti', 'Jerry Levine']
9;Lifeforce - L'étoile du mal;1985;12;101;['Action', ' Horror', ' Mystery            '];6.1;50;A race of space vampires arrives in London and infects the populace, beginning an apocalyptic descent into chaos.;['Tobe Hooper', None];['Steve Railsback', 'Mathilda May', 'Peter Firth', 'Frank Finlay']
10;Le diamant du Nil;1985;Tous Public;106;['Action', ' Adventure', ' Comedy            '];6.1;53;When Joan Wilder is abducted while on a trip along the Nile, her boyfriend, Jack Colton, and pal Ralph rush to rescue her and retrieve a fabled jewel.;['Lewis Teague', None];['Michael Douglas', 'Kathleen Turner', 'Danny DeVito', 'Spyros Fokas']
11;Philadelphia Experiment;1984;Tous publics;102;['Adventure', ' Drama', ' Romance            '];6.1;44;"A United States Navy destroyer escort participates in a Navy ""invisibility"" experiment that inadvertently sends two sailors forty years into the future.";['Stewart Raffill', None];['Michael Paré', 'Nancy Allen', 'Eric Christmas', 'Bobby Di Cicco']
12;Bronco Billy;1980;NaN;116;['Action', ' Adventure', ' Comedy            '];6.1;66;An idealistic, modern-day cowboy struggles to keep his Wild West show afloat in the face of hard luck and waning interest.;['Clint Eastwood', None];['Clint Eastwood', 'Sondra Locke', 'Geoffrey Lewis', 'Scatman Crothers']
13;Elle;1979;12;122;['Comedy', ' Romance            '];6.1;68;A Hollywood composer goes through a mid-life crisis and becomes infatuated with a sexy, newly married woman.;['Blake Edwards', None];['Dudley Moore', 'Bo Derek', 'Julie Andrews', 'Robert Webber']
14;Une étoile est née;1976;Tous publics;139;['Drama', ' Music', ' Romance            '];6.1;59;A has-been rock star falls in love with a young, up-and-coming songstress.;['Frank Pierson', None];['Barbra Streisand', 'Kris Kristofferson', 'Gary Busey', 'Oliver Clark']
15;Jexi;2019;Tous publics;84;['Comedy', ' Romance', ' Sci-Fi            '];6.0;39;"Phil makes top 10 pop lists at work. His only ""friend"" is cellphone Siri. His new phone includes AI helper Jexi, who improves/controls his social life.";['    Directors:', 'Jon Lucas, ', 'Scott Moore', None];['Adam Devine', 'Alexandra Shipp', 'Rose Byrne', 'Ron Funches']
16;À tous les garçons: P.S. Je t'aime toujours;2020;7;101;['Comedy', ' Drama', ' Romance            '];6.0;54;Lara Jean and Peter have just taken their relationship from pretend to officially official when another recipient of one of her old love letters enters the picture.;['Michael Fimognari', None];['Lana Condor', 'Noah Centineo', 'Jordan Fisher', 'Anna Cathcart']
17;La Princesse de Chicago;2018;Tous publics;101;['Comedy', ' Drama', ' Family            '];6.0;-1;Competing in a Christmas baking competition in Belgravia, a Chicago baker bumps into the prince's fiancée--who looks just like her. They switch lives for two days.;['Mike Rohl', None];['Vanessa Hudgens', 'Sam Palladio', 'Nick Sagar', 'Alexa Adeosun']
18;Destination mariage et plus si affinités ...;2018;R;87;['Comedy', ' Drama', ' Romance            '];6.0;46;The story of two miserable and unpleasant wedding guests, Lindsay and Frank, who develop a mutual affection despite themselves.;['Victor Levin', None];['Winona Ryder', 'Keanu Reeves', 'DJ Dallenbach', 'Ted Dubost']
19;My Cousin Rachel;2017;Tous publics;106;['Drama', ' Mystery', ' Romance            '];6.0;63;A young Englishman plots revenge against his late cousin's mysterious, beautiful wife, believing her responsible for his death. But his feelings become complicated as he finds himself falling under the beguiling spell of her charms.;['Roger Michell', None];['Rachel Weisz', 'Sam Claflin', 'Holliday Grainger', 'Iain Glen']
20;The Escort;2015;NaN;88;['Comedy', ' Drama', ' Romance            '];6.0;-1;Desperate for a good story, a sex-addicted journalist throws himself into the world of high-class escorts when he starts following a Stanford-educated prostitute.;['Will Slocombe', None];['Lyndsy Fonseca', 'Michael Doneger', 'Tommy Dewey', 'Bruce Campbell']
21;Love;II) (2015;18;135;['Drama', ' Romance            '];6.0;51;Murphy is an American living in Paris who enters a highly sexually and emotionally charged relationship with Electra. Unaware of the effect it will have on their relationship, they invite their pretty neighbor into their bed.;['Gaspar Noé', None];['Aomi Muyock', 'Karl Glusman', 'Klara Kristin', 'Juan Saavedra']
22;Mariage à la grecque 2;2016;Tous publics;94;['Comedy', ' Romance            '];6.0;37;A Portokalos family secret brings the beloved characters back together for an even bigger and Greeker wedding.;['Kirk Jones', None];['Nia Vardalos', 'John Corbett', 'Michael Constantine', 'Lainie Kazan']
23;La mariée d'Humpty Sharma;2014;Tous publics;133;['Comedy', ' Drama', ' Romance            '];6.0;-1;A girl from Ambala, Kavya Pratap Singh, is about to be married. When she visits Delhi to shop for her 'dhai lakh ka Ghagra, she meets Humpty Sharma, a carefree Delhiite, and falls in love with him.;['Shashank Khaitan', None];['Varun Dhawan', 'Alia Bhatt', 'Ashutosh Rana', 'Sidharth Shukla']
24;Equals;2015;PG-13;101;['Drama', ' Romance', ' Sci-Fi            '];6.0;43;In an emotionless utopia, two people fall in love when they regain their feelings from a mysterious disease, causing tensions between them and their society.;['Drake Doremus', None];['Nicholas Hoult', 'Kristen Stewart', 'Vernetta Lopez', 'Scott Lawrence']
25;Hors contrôle;2016;Tous publics;98;['Comedy', ' Romance            '];6.0;51;Two hard-partying brothers place an online ad to find the perfect dates for their sister's Hawaiian wedding. Hoping for a wild getaway, the boys instead find themselves out-hustled by an uncontrollable duo.;['Jake Szymanski', None];['Zac Efron', 'Adam Devine', 'Anna Kendrick', 'Aubrey Plaza']
26;Rebecca;I) (2020;13;123;['Drama', ' Mystery', ' Romance            '];6.0;46;A young newlywed arrives at her husband's imposing family estate on a windswept English coast and finds herself battling the shadow of his first wife, Rebecca, whose legacy lives on in the house long after her death.;['Ben Wheatley', None];['Lily James', 'Armie Hammer', 'Kristin Scott Thomas', 'Keeley Hawes']
27;Triple alliance;2014;Tous Public;109;['Comedy', ' Romance            '];6.0;39;After discovering her boyfriend is married, Carly soon meets the wife he's been betraying. And when yet another love affair is discovered, all three women team up to plot revenge on the three-timing S.O.B.;['Nick Cassavetes', None];['Cameron Diaz', 'Leslie Mann', 'Kate Upton', 'Nikolaj Coster-Waldau']
28;Chennai Express;2013;Tous publics;141;['Action', ' Comedy', ' Romance            '];6.0;45;A man heading towards Rameshwaram via Chennai express to immerse his late grandfather's ashes unwillingly gets caught amidst goons after helping their boss's daughter and them board the train.;['Rohit Shetty', None];['Deepika Padukone', 'Shah Rukh Khan', 'Sathyaraj', 'Nikitin Dheer']
29;About Last Night;2014;16;100;['Comedy', ' Romance            '];6.0;62;Follow two couples as they journey from the bar to the bedroom and are eventually put to the test in the real world.;['Steve Pink', None];['Kevin Hart', 'Michael Ealy', 'Regina Hall', 'Joy Bryant']
30;Murder Mystery;2019;13;97;['Action', ' Comedy', ' Crime            '];6.0;38;A New York cop and his wife go on a European vacation to reinvigorate the spark in their marriage, but end up getting framed and on the run for the death of an elderly billionaire.;['Kyle Newacheck', None];['Adam Sandler', 'Jennifer Aniston', 'Luke Evans', 'Terence Stamp']
31;2 Days in New York;2012;R;96;['Comedy', ' Drama', ' Romance            '];6.0;61;Manhattan couple Marion and Mingus, who each have children from prior relationships, find their comfortable family dynamic jostled by a visit from Marion's relatives.;['Julie Delpy', None];['Julie Delpy', 'Chris Rock', 'Albert Delpy', 'Alexia Landeau']
32;Les Survivants;2015;PG-13;98;['Drama', ' Romance', ' Sci-Fi            '];6.0;68;In the wake of a disaster that wipes out most of civilization, two men and a young woman find themselves in an emotionally charged love triangle as the last known survivors.;['Craig Zobel', None];['Chiwetel Ejiofor', 'Chris Pine', 'Margot Robbie']
33;Overboard;2018;Tous Public;112;['Comedy', ' Romance            '];6.0;42;After a spoiled, wealthy yacht owner is thrown overboard and loses his memory, a mistreated employee convinces him that he is her working-class husband.;['Rob Greenberg', None];['Eugenio Derbez', 'Anna Faris', 'Eva Longoria', 'John Hannah']
34;La dernière chanson;2010;Tous Public;108;['Drama', ' Music', ' Romance            '];6.0;33;A rebellious girl is sent to a Southern beach town for the summer to stay with her father. Through their mutual love of music, the estranged duo learn to reconnect.;['Julie Anne Robinson', None];['Miley Cyrus', 'Liam Hemsworth', 'Greg Kinnear', 'Bobby Coleman']
35;Célibataire, mode d'emploi;2016;Tous publics;110;['Comedy', ' Drama', ' Romance            '];6.0;51;A group of young adults navigate love and relationships in New York City.;['Christian Ditter', None];['Dakota Johnson', 'Rebel Wilson', 'Leslie Mann', 'Alison Brie']
36;Les Immortels;2011;Tous publics avec avertissement;110;['Action', ' Drama', ' Fantasy            '];6.0;46;Theseus is a mortal man chosen by Zeus to lead the fight against the ruthless King Hyperion, who is on a rampage across Greece to obtain a weapon that can destroy humanity.;['Tarsem Singh', None];['Henry Cavill', 'Mickey Rourke', 'John Hurt', 'Stephen Dorff']
37;Kites;I) (2010;NaN;123;['Action', ' Drama', ' Romance            '];6.0;62;A wounded man searches for his sweetheart in the Mexican desert while on the run from the police, bounty hunters, and others.;['Anurag Basu', None];['Hrithik Roshan', 'Bárbara Mori', 'Nicholas Brown', 'Kangana Ranaut']
38;Les hauts de Hurlevent;2011;Tous publics;129;['Drama', ' Romance            '];6.0;70;A poor boy of unknown origins is rescued from poverty and taken in by the Earnshaw family where he develops an intense relationship with his young foster sister, Cathy.;['Andrea Arnold', None];['Kaya Scodelario', 'James Howson', 'Solomon Glave', 'Shannon Beer']
39;Histoires enchantées;2008;Tous publics;99;['Adventure', ' Comedy', ' Family            '];6.0;33;A hotel handyman's life changes when the lavish bedtime stories he tells his niece and nephew start to magically come true.;['Adam Shankman', None];['Adam Sandler', 'Keri Russell', 'Courteney Cox', 'Guy Pearce']
40;Nos nuits à Rodanthe;2008;PG-13;97;['Drama', ' Romance            '];6.0;39;A doctor, who is travelling to see his estranged son, sparks with an unhappily married woman at a North Carolina inn.;['George C. Wolfe', None];['Diane Lane', 'Richard Gere', 'Christopher Meloni', 'Viola Davis']
41;Baby Mama;2008;Tous Public;99;['Comedy', ' Romance            '];6.0;55;A successful, single businesswoman who dreams of having a baby discovers she is infertile and hires a working class woman to be her unlikely surrogate.;['Michael McCullers', None];['Tina Fey', 'Amy Poehler', 'Sigourney Weaver', 'Greg Kinnear']
42;(S)ex List;2011;Tous publics;106;['Comedy', ' Romance            '];6.0;35;A woman looks back at the past nineteen men she's had relationships with in her life and wonders if one of them might be her one true love.;['Mark Mylod', None];['Anna Faris', 'Chris Evans', 'Ari Graynor', 'Blythe Danner']
43;Trop jeune pour elle !;2007;PG-13;97;['Comedy', ' Drama', ' Romance            '];6.0;-1;A mother falls for a younger man while her daughter falls in love for the first time. Mother Nature messes with their fates.;['Amy Heckerling', None];['Michelle Pfeiffer', 'Paul Rudd', 'Saoirse Ronan', 'Tracey Ullman']
44;Blind Dating;2006;PG-13;99;['Comedy', ' Romance            '];6.0;-1;A blind young man (Pine) thinks he finds love with an Indian woman (Jay), though their relationship is fraught with cultural differences.;['James Keach', None];['Chris Pine', 'Anjali Jay', 'Eddie Kaye Thomas', 'Jennifer Alden']
45;The Good German;2006;R;105;['Drama', ' Mystery', ' Romance            '];6.0;49;While in post-war Berlin to cover the Potsdam Conference, an American military journalist is drawn into a murder investigation that involves his former mistress and his driver.;['Steven Soderbergh', None];['George Clooney', 'Cate Blanchett', 'Tobey Maguire', 'Beau Bridges']
46;Kabhi Alvida Naa Kehna;2006;NaN;193;['Drama', ' Romance            '];6.0;-1;Dev, a former football player is married to Rhea, a successful fashion editor. Maya is a kindergarten teacher who is married to Rishi, an outgoing event planner. These couples' lives intersect and they each question their own marriage.;['Karan Johar', None];['Shah Rukh Khan', 'Rani Mukerji', 'Amitabh Bachchan', 'Abhishek Bachchan']
47;Half Light;2006;R;110;['Drama', ' Horror', ' Mystery            '];6.0;-1;Rachel Carlson, a successful novelist moves to a small Scottish village to move on with her life after the death of her son. Strange things start to happen when she is haunted by ghosts and real life terror.;['Craig Rosenberg', None];['Demi Moore', 'Henry Ian Cusick', 'Nicholas Gleaves', 'James Cosmo']
48;Le secret de Moonacre;2008;Tous publics;103;['Adventure', ' Family', ' Fantasy            '];6.0;-1;Maria inherits a book of secrets from her dad. She moves to her uncle's Moonacre estate. A family curse was cast on the valley. Only Maria can break it using her book.;['Gabor Csupo', None];['Ioan Gruffudd', 'Dakota Blue Richards', 'Tim Curry', 'Juliet Stevenson']
49;Jeux de dupes;2008;Tous publics;114;['Comedy', ' Drama', ' Romance            '];6.0;56;In 1925, an enterprising pro football player convinces America's too-good-to-be-true college football hero to play for his team and keep the league from going under.;['George Clooney', None];['George Clooney', 'Renée Zellweger', 'John Krasinski', 'David de Vries']
0;Astérix et les Vikings;2006;Tous publics;78;['Animation', ' Adventure', ' Comedy            '];6.0;-1;The vikings come to Gaul and kidnap the chief's nephew. The chief sends Asterix and Obelix up north to get him back but the nephew has fallen in love with the viking chief's daughter v.v. What to do?;['    Directors:', 'Stefan Fjeldmark, ', 'Jesper Møller', None];['Roger Carel', 'Lorànt Deutsch', 'Sara Forestier', 'Jacques Frantz']
1;Esprit libre;2004;Tous Public;101;['Comedy', ' Romance            '];6.0;46;Anna wants to be like other girls her age (18): date a guy etc. but she's the US president's daughter and always guarded. In Prague he breaks his promise of only 2 agents following her to a concert and she runs away with Ben to see Europe.;['Andy Cadiff', None];['Mandy Moore', 'Matthew Goode', 'Mark Harmon', 'Stark Sands']
2;Fashion maman;2004;Tous Public;119;['Comedy', ' Drama', ' Romance            '];6.0;38;After her sister and brother-in-law die in a car accident, a young woman becomes the guardian of their three children.;['Garry Marshall', None];['Kate Hudson', 'John Corbett', 'Joan Cusack', 'Hayden Panettiere']
3;Polly et moi;2004;Tous publics;90;['Comedy', ' Romance            '];6.0;44;A buttoned-up newlywed finds his strictly organized life descend into chaos when he falls in love with an old classmate.;['John Hamburg', None];['Ben Stiller', 'Jennifer Aniston', 'Debra Messing', 'Philip Seymour Hoffman']
4;Sur la route;2012;Tous publics;124;['Adventure', ' Drama', ' Romance            '];6.0;56;Young writer Sal Paradise has his life shaken by the arrival of free-spirited Dean Moriarty and his girl, Marylou. As they travel across the country, they encounter a mix of people who each impact their journey indelibly.;['Walter Salles', None];['Sam Riley', 'Garrett Hedlund', 'Kristen Stewart', 'Amy Adams']
5;Bridget Jones: L'âge de raison;2004;Tous publics;108;['Comedy', ' Drama', ' Romance            '];6.0;44;After finding love, Bridget Jones questions if she really has everything she'd ever dreamed of having.;['Beeban Kidron', None];['Renée Zellweger', 'Colin Firth', 'Hugh Grant', 'Gemma Jones']
6;L'amour extra large;2001;Tous publics;114;['Comedy', ' Drama', ' Fantasy            '];6.0;48;A shallow man falls in love with a 300-pound woman because of her inner beauty.;['    Directors:', 'Bobby Farrelly, ', 'Peter Farrelly', None];['Jack Black', 'Gwyneth Paltrow', 'Jason Alexander', 'Joe Viterelli']
7;Attraction animale;2001;Tous publics;97;['Comedy', ' Romance            '];6.0;32;After being jilted by her boyfriend, a talk show talent scout writes a column on the relationship habits of men which gains her national fame.;['Tony Goldwyn', None];['Ashley Judd', 'Greg Kinnear', 'Hugh Jackman', 'Marisa Tomei']
8;Péché originel;2001;Tous publics;116;['Drama', ' Mystery', ' Romance            '];6.0;33;A woman, along with her lover, plans to con a rich man by marrying him, earning his trust, and then running away with all his money. Everything goes as planned until she falls in love with him.;['Michael Cristofer', None];['Antonio Banderas', 'Angelina Jolie', 'Thomas Jane', 'Jack Thompson']
9;Jackie Chan à Hong Kong;1999;PG-13;121;['Action', ' Comedy', ' Romance            '];6.0;-1;A romantic girl travels to Hong Kong in search of certain love but instead meets a kind-hearted professional fighter for whom she begins to fall instead.;['Vincent Kok', None];['Jackie Chan', 'Shu Qi', 'Tony Chiu-Wai Leung', 'Emil Chau']
10;College attitude;1999;Tous publics;107;['Comedy', ' Drama', ' Romance            '];6.0;60;A newspaper reporter enrolls in high school as part of research for a story.;['Raja Gosnell', None];['Drew Barrymore', 'David Arquette', 'Michael Vartan', 'Molly Shannon']
11;Un de trop;1999;Tous publics;98;['Comedy', ' Romance            '];6.0;36;A rich businessman's assumption that his new colleague is gay leads him to ask the man to keep an eye on his mistress. However, the man is not gay, and begins to fall for the woman himself.;['Damon Santostefano', None];['Neve Campbell', 'Matthew Perry', 'Dylan McDermott', 'Oliver Platt']
12;Supersens;1998;Tous publics;108;['Comedy', ' Romance            '];6.0;36;A student gets his senses enhanced by an experimental drug. But abuse is not an option.;['Penelope Spheeris', None];['Marlon Wayans', 'David Spade', 'Brad Dourif', 'Esther Scott']
13;Les aiguilleurs;1999;Tous publics;124;['Comedy', ' Drama', ' Romance            '];6.0;47;A feud develops between two air traffic controllers: one cocky and determined while the other is restrained and laidback, which inevitably affects their lives.;['Mike Newell', None];['John Cusack', 'Billy Bob Thornton', 'Cate Blanchett', 'Angelina Jolie']
14;L'objet de mon affection;1998;Tous publics;111;['Comedy', ' Drama', ' Romance            '];6.0;51;A pregnant New York City social worker begins to develop romantic feelings for her gay best friend, and decides she'd rather raise her child with him, much to the dismay of her overbearing boyfriend.;['Nicholas Hytner', None];['Jennifer Aniston', 'Paul Rudd', 'Kali Rocha', 'Lena Cardwell']
15;Ainsi va la vie;1998;Tous publics;114;['Drama', ' Romance            '];6.0;42;Birdee Calvert must choose between her morals and her heart after her husband divorces her and a charming young man, who her daughter disapproves of, comes back into her life.;['Forest Whitaker', None];['Sandra Bullock', 'Harry Connick Jr.', 'Gena Rowlands', 'Mae Whitman']
16;Petits mensonges entre frères;1996;Tous publics;96;['Comedy', ' Drama', ' Romance            '];6.0;53;The love lives of two brothers, Mickey and Francis, interconnect as Francis cheats on his wife with Mickey's ex-girlfriend, while Mickey impulsively marries a stranger.;['Edward Burns', None];['Edward Burns', 'Jennifer Aniston', 'John Mahoney', 'Michael McGlone']
17;Kama Sutra, une histoire d'amour;1996;16;117;['Crime', ' Drama', ' History            '];6.0;-1;Two female friends become sexual rivals at maturity.;['Mira Nair', None];['Naveen Andrews', 'Sarita Choudhury', 'Indira Varma', 'Ramon Tikaram']
18;Lancelot : Le Premier Chevalier;1995;Tous publics;134;['Action', ' Adventure', ' Drama            '];6.0;57;Lancelot falls in love with Guinevere, who is due to be married to King Arthur. Meanwhile, a violent warlord tries to seize power from Arthur and his Knights of the Round Table.;['Jerry Zucker', None];['Sean Connery', 'Richard Gere', 'Julia Ormond', 'Ben Cross']
19;Le père de la mariée II;1995;PG;106;['Comedy', ' Family', ' Romance            '];6.0;49;George Banks must deal not only with his daughter's pregnancy, but also with his wife's.;['Charles Shyer', None];['Steve Martin', 'Diane Keaton', 'Martin Short', 'Kimberly Williams-Paisley']
