;name;year;certificate;runtime;genre;rating;metascore;text-muted;director;stars
16;Masculin féminin;1966;Tous publics;110;['Drama', ' Romance            '];7.4;93;A romance between young Parisians, shown through a series of vignettes.;['Jean-Luc Godard', None];['Jean-Pierre Léaud', 'Chantal Goya', 'Marlène Jobert', 'Michel Debord']
17;Coups de feu dans la Sierra;1962;Tous Public;94;['Drama', ' Western            '];7.4;92;An ex-union soldier is hired to transport gold from a mining community through dangerous territory. But what he doesn't realize is that his partner and old friend is plotting to double-cross him.;['Sam Peckinpah', None];['Joel McCrea', 'Randolph Scott', 'Mariette Hartley', 'Ron Starr']
18;Tirez sur le pianiste;1960;Tous publics;81;['Crime', ' Drama', ' Thriller            '];7.4;-1;A pianist helps his brother escape from two gangsters, who retaliate by abducting their kid brother.;['François Truffaut', None];['Charles Aznavour', 'Marie Dubois', 'Nicole Berger', 'Michèle Mercier']
19;Pollyanna;1960;Tous Public;134;['Comedy', ' Drama', ' Family            '];7.4;66;A young girl comes to an embittered town and confronts its attitude with her determination to see the best in life.;['David Swift', None];['Jane Wyman', 'Hayley Mills', 'Richard Egan', 'Karl Malden']
20;Le journal d'Anne Frank;1959;Tous publics;180;['Biography', ' Drama', ' Family            '];7.4;59;During World War II, a teenage Jewish girl named Anne Frank and her family are forced into hiding in the Nazi-occupied Netherlands.;['George Stevens', None];['Millie Perkins', 'Shelley Winters', 'Joseph Schildkraut', 'Richard Beymer']
21;Le faux coupable;1956;NaN;105;['Drama', ' Film-Noir            '];7.4;83;"In 1953, an innocent man named Christopher Emanuel ""Manny"" Balestrero is arrested after being mistaken for an armed robber.";['Alfred Hitchcock', None];['Henry Fonda', 'Vera Miles', 'Anthony Quayle', 'Harold J. Stone']
22;Torpilles sous l'Atlantique;1957;Tous publics;98;['Action', ' Adventure', ' Drama            '];7.4;-1;During WWII an American destroyer discovers a German U-boat, and in the ensuing duel the American captain must draw upon all his experience to defeat the equally experienced German commander.;['Dick Powell', None];['Robert Mitchum', 'Curd Jürgens', 'David Hedison', 'Theodore Bikel']
23;Elle et lui;1957;Tous Public;115;['Drama', ' Romance            '];7.4;71;A couple falls in love and agrees to meet in six months at the Empire State Building - but will it happen?;['Leo McCarey', None];['Cary Grant', 'Deborah Kerr', 'Richard Denning', 'Neva Patterson']
24;Écrit sur du vent;1956;Tous publics;99;['Drama            '];7.4;86;Alcoholic playboy Kyle Hadley marries the woman secretly loved by his poor but hard-working best friend, who in turn is pursued by Kyle's nymphomaniac sister.;['Douglas Sirk', None];['Rock Hudson', 'Lauren Bacall', 'Robert Stack', 'Dorothy Malone']
25;L'homme qui en savait trop;1956;Tous Public;120;['Drama', ' Thriller            '];7.4;76;An American doctor and his wife, a former singing star, witness a murder while vacationing in Morocco, and are drawn into a twisting plot of international intrigue when their young son is kidnapped.;['Alfred Hitchcock', None];['James Stewart', 'Doris Day', 'Brenda de Banzie', 'Bernard Miles']
26;Le roi et moi;1956;Tous Public;133;['Biography', ' Drama', ' Musical            '];7.4;72;A widow accepts a job as a live-in governess to the King of Siam's children.;['Walter Lang', None];['Yul Brynner', 'Deborah Kerr', 'Rita Moreno', 'Martin Benson']
27;La mauvaise graine;1956;NaN;129;['Drama', ' Horror', ' Thriller            '];7.4;51;Rhoda Penmark seems like your average, sweet eight-year-old girl. When her rival at school dies in mysterious circumstances at the school picnic her mother starts to suspect that Rhoda was responsible.;['Mervyn LeRoy', None];['Nancy Kelly', 'Patty McCormack', 'Gage Clarke', 'Jesse White']
28;Les briseurs de barrages;1955;Tous publics;124;['Drama', ' History', ' War            '];7.4;-1;The story of how the British attacked German dams in World War II by using an ingenious technique to drop bombs where they would be most effective.;['Michael Anderson', None];['Richard Todd', 'Michael Redgrave', 'Ursula Jeans', 'Basil Sydney']
29;Les fous du roi;1949;12;110;['Drama', ' Film-Noir            '];7.4;-1;The rise and fall of a corrupt politician, who makes his friends richer and retains power by dint of a populist appeal.;['Robert Rossen', None];['Broderick Crawford', 'John Ireland', 'Joanne Dru', 'John Derek']
30;L'Emprise du crime;1946;Tous publics;116;['Drama', ' Film-Noir', ' Romance            '];7.4;-1;A man is reunited with his childhood friend and her husband, who believe he knows the truth about the death of her rich aunt years earlier.;['Lewis Milestone', None];['Barbara Stanwyck', 'Van Heflin', 'Lizabeth Scott', 'Kirk Douglas']
31;Le facteur sonne toujours deux fois;1946;Tous publics;113;['Crime', ' Drama', ' Film-Noir            '];7.4;84;A married woman and a drifter fall in love, then plot to murder her husband.;['Tay Garnett', None];['Lana Turner', 'John Garfield', 'Cecil Kellaway', 'Hume Cronyn']
32;Dix petits indiens;1945;Tous Public;97;['Crime', ' Drama', ' Mystery            '];7.4;-1;Seven guests, a newly hired secretary and two staff are gathered at a manor house on an isolated island by an unknown absentee host and are killed off one-by-one. They work together to determine who the killer is before it's too late.;['René Clair', None];['Barry Fitzgerald', 'Walter Huston', 'Louis Hayward', 'Roland Young']
33;Le ciel peut attendre;1943;Tous publics;112;['Comedy', ' Drama', ' Fantasy            '];7.4;-1;An old roué arrives in Hades to review his life with Satan, who will rule on his eligibility to enter the Underworld.;['Ernst Lubitsch', None];['Gene Tierney', 'Don Ameche', 'Charles Coburn', 'Marjorie Main']
34;L'insoumise;1938;Tous Public;104;['Drama', ' Romance            '];7.4;-1;In 1850s Louisiana, a free-spirited Southern belle loses her fiancé due to her stubborn vanity and pride, and vows to win him back.;['William Wyler', None];['Bette Davis', 'Henry Fonda', 'George Brent', 'Margaret Lindsay']
35;Dracula;1931;Tous Public;75;['Drama', ' Fantasy', ' Horror            '];7.4;71;Transylvanian vampire Count Dracula bends a naive real estate agent to his will, then takes up residence at a London estate where he sleeps in his coffin by day and searches for potential victims by night.;['    Directors:', 'Tod Browning, ', 'Karl Freund', None];['Bela Lugosi', 'Helen Chandler', 'David Manners', 'Dwight Frye']
36;Nomadland;2020;Tous publics;107;['Drama            '];7.3;93;A woman in her sixties, after losing everything in the Great Recession, embarks on a journey through the American West, living as a van-dwelling modern-day nomad.;['Chloé Zhao', None];['Frances McDormand', 'David Strathairn', 'Linda May', 'Gay DeForest']
37;The Friend;2019;R;124;['Drama', ' Romance            '];7.3;57;After receiving life-altering news, a couple finds unexpected support from their best friend, who puts his own life on hold and moves into their family home, bringing an impact much greater and more profound than anyone could have imagined;['Gabriela Cowperthwaite', None];['Jason Segel', 'Isabella Kai', 'Violet McGraw', 'Casey Affleck']
38;El Camino: Un film Breaking Bad;2019;16;122;['Action', ' Crime', ' Drama            '];7.3;72;Fugitive Jesse Pinkman runs from his captors, the law, and his past.;['Vince Gilligan', None];['Aaron Paul', 'Jonathan Banks', 'Matt Jones', 'Charles Baker']
39;Minamata;2020;R;115;['Drama            '];7.3;55;War photographer W. Eugene Smith travels back to Japan where he documents the devastating effect of mercury poisoning in coastal communities.;['Andrew Levitas', None];['Akiko Iwase', 'Kogarashi Wakasugi', 'Johnny Depp', 'Katherine Jenkins']
40;Et le ciel s'assombrit;2021;16;107;['Drama', ' History', ' War            '];7.3;-1;The fates of several Copenhagen residents collide when a WWII bombing mission accidentally targets a school full of children.;['Ole Bornedal', None];['Bertram Bisgaard Enevoldsen', 'Ester Birch', 'Ella Josephine Lund Nilsson', 'Malena Lucia Lodahl']
41;Le haut du panier;2022;7;117;['Comedy', ' Drama', ' Sport            '];7.3;68;A basketball scout discovers a phenomenal street ball player while in Spain and sees the prospect as his opportunity to get back into the NBA.;['Jeremiah Zagar', None];['Adam Sandler', 'Queen Latifah', 'Juancho Hernangomez', 'Ben Foster']
42;Le roi;I) (2019;16;140;['Biography', ' Drama', ' History            '];7.3;62;Hal, wayward prince and heir to the English throne, is crowned King Henry V after his tyrannical father dies. Now the young king must navigate palace politics, the war his father left behind, and the emotional strings of his past life.;['David Michôd', None];['Tom Glynn-Carney', 'Gábor Czap', 'Tom Fisher', 'Edward Ashley']
43;Hérédité;2018;12;127;['Drama', ' Horror', ' Mystery            '];7.3;87;A grieving family is haunted by tragic and disturbing occurrences.;['Ari Aster', None];['Toni Collette', 'Milly Shapiro', 'Gabriel Byrne', 'Alex Wolff']
44;Apprentis parents;2018;Tous publics;118;['Comedy', ' Drama            '];7.3;57;A couple find themselves in over their heads when they foster three children.;['Sean Anders', None];['Mark Wahlberg', 'Rose Byrne', 'Isabela Merced', 'Gustavo Escobar']
45;La Voix du pardon;2018;Tous publics;110;['Biography', ' Drama', ' Family            '];7.3;30;The inspiring and unknown true story behind MercyMe's beloved, chart topping song that brings ultimate hope to so many is a gripping reminder of the power of true forgiveness.;['    Directors:', 'Andrew Erwin, ', 'Jon Erwin', None];['J. Michael Finley', 'Madeline Carroll', 'Dennis Quaid', 'Trace Adkins']
46;La ballade de Buster Scruggs;2018;16;133;['Comedy', ' Drama', ' Musical            '];7.3;79;Six tales of life and violence in the Old West, following a singing gunslinger, a bank robber, a traveling impresario, an elderly prospector, a wagon train, and a perverse pair of bounty hunters.;['    Directors:', 'Ethan Coen, ', 'Joel Coen', None];['Tim Blake Nelson', 'Willie Watson', 'Clancy Brown', 'Danny McCarthy']
47;The Banker;2020;Tous publics;120;['Biography', ' Drama            '];7.3;59;In the 1960s two African-American entrepreneurs hire a working-class white man to pretend to be the head of their business empire while they pose as a janitor and chauffeur.;['George Nolfi', None];['Anthony Mackie', 'Samuel L. Jackson', 'Nicholas Hoult', 'Nia Long']
48;Blue Jay;I) (2016;NaN;80;['Drama', ' Romance            '];7.3;69;Meeting by chance when they return to their tiny California hometown, two former high-school sweethearts reflect on their shared past.;['Alex Lehmann', None];['Mark Duplass', 'Sarah Paulson', 'Clu Gulager', 'James Andrews']
49;Lucky;I) (2017;Tous publics;88;['Comedy', ' Drama            '];7.3;80;Lucky follows the spiritual journey of a 90-year-old atheist and the quirky characters that inhabit his off the map desert town.;['John Carroll Lynch', None];['Harry Dean Stanton', 'David Lynch', 'Ron Livingston', 'Ed Begley Jr.']
0;The Place Beyond the Pines;2012;Tous publics;140;['Crime', ' Drama', ' Thriller            '];7.3;68;A motorcycle stunt rider turns to robbing banks as a way to provide for his lover and their newborn child, a decision that puts him on a collision course with an ambitious rookie cop navigating a department ruled by a corrupt detective.;['Derek Cianfrance', None];['Ryan Gosling', 'Bradley Cooper', 'Eva Mendes', 'Craig Van Hook']
1;Little Boy;2015;PG-13;106;['Drama', ' History', ' War            '];7.3;30;An eight-year-old boy is willing to do whatever it takes to end World War II so he can bring his father home. The story reveals the indescribable love a father has for his little boy and the love a son has for his father.;['Alejandro Monteverde', None];['Jakob Salvati', 'Emily Watson', 'David Henrie', 'Michael Rapaport']
2;La rage au ventre;2015;Tous publics;124;['Action', ' Crime', ' Drama            '];7.3;57;After a fatal incident sends him on a rampant path of destruction, a champion boxer fights to get custody of his daughter and revive his professional career.;['Antoine Fuqua', None];['Jake Gyllenhaal', 'Rachel McAdams', 'Oona Laurence', 'Forest Whitaker']
3;United;I) (2011;PG-13;94;['Drama', ' History', ' Sport            '];7.3;-1;"Based on the true story of Manchester United's legendary ""Busby Babes"", the youngest side ever to win the Football League, and the 1958 Munich Air Crash that claimed eight of their number.";['James Strong', None];['Dean Andrews', 'Kate Ashfield', 'Natalie Burt', 'David Calder']
4;Take Shelter;2011;Tous publics avec avertissement;121;['Drama', ' Sci-Fi', ' Thriller            '];7.3;85;Plagued by a series of apocalyptic visions, a young husband and father questions whether to shelter his family from a coming storm, or from himself.;['Jeff Nichols', None];['Michael Shannon', 'Jessica Chastain', 'Shea Whigham', 'Tova Stewart']
5;Café de Flore;2011;Tous publics;120;['Drama', ' Romance            '];7.3;53;A love story between a man and woman. And between a mother and her son. A mystical and fantastical odyssey on love.;['Jean-Marc Vallée', None];['Vanessa Paradis', 'Kevin Parent', 'Hélène Florent', 'Evelyne Brochu']
6;Les trois prochains jours;2010;Tous publics;133;['Action', ' Crime', ' Drama            '];7.3;52;A married couple's life is turned upside down when the wife is accused of a murder.;['Paul Haggis', None];['Russell Crowe', 'Elizabeth Banks', 'Liam Neeson', 'Michael Buie']
7;The Way - La route ensemble;I) (2010;Tous publics;123;['Comedy', ' Drama            '];7.3;64;"A father heads overseas to recover the body of his estranged son who died while traveling the ""El camino de Santiago,"" and decides to take the pilgrimage himself.";['Emilio Estevez', None];['Martin Sheen', 'Emilio Estevez', 'Deborah Kara Unger', 'Yorick van Wageningen']
8;Submarine;2010;Tous publics;97;['Comedy', ' Drama', ' Romance            '];7.3;76;15-year-old Oliver Tate has two objectives: To lose his virginity before his next birthday, and to extinguish the flame between his mother and an ex-lover who has resurfaced in her life.;['Richard Ayoade', None];['Craig Roberts', 'Sally Hawkins', 'Paddy Considine', 'Noah Taylor']
9;Cha Cha Real Smooth;2022;-12;107;['Comedy', ' Drama            '];7.3;69;A young man who works as a Bar Mitzvah party host strikes up a friendship with a mother and her autistic daughter.;['Cooper Raiff', None];['Cooper Raiff', 'Dakota Johnson', 'Evan Assante', 'Vanessa Burghardt']
10;Le Monde de Barney;2010;Tous publics;134;['Comedy', ' Drama            '];7.3;67;The picaresque and touching story of the politically incorrect, fully lived life of the impulsive, irascible and fearlessly blunt Barney Panofsky.;['Richard J. Lewis', None];['Paul Giamatti', 'Rosamund Pike', 'Jake Hoffman', 'Macha Grenon']
11;Venir au monde;2012;R;127;['Drama', ' Romance', ' War            '];7.3;34;A mother brings her teenage son to Sarajevo, where his father died in the Bosnian conflict years ago.;['Sergio Castellitto', None];['Penélope Cruz', 'Emile Hirsch', 'Adnan Haskovic', 'Saadet Aksoy']
12;We Are Four Lions;2010;Tous publics;97;['Comedy', ' Crime', ' Drama            '];7.3;68;Four incompetent British terrorists set out to train for and commit an act of terror.;['Christopher Morris', None];['Will Adamsdale', 'Riz Ahmed', 'Adeel Akhtar', 'Arsher Ali']
13;D'où l'on vient;2021;Tous publics;143;['Drama', ' Musical', ' Romance            '];7.3;84;A film version of the Broadway musical in which Usnavi, a sympathetic New York bodega owner, saves every penny every day as he imagines and sings about a better life.;['Jon M. Chu', None];['Anthony Ramos', 'Corey Hawkins', 'Leslie Grace', 'Melissa Barrera']
14;Animal Kingdom;2010;12;113;['Crime', ' Drama            '];7.3;83;A seventeen-year-old navigates his survival amongst an explosive criminal family and the detective who thinks he can save him.;['David Michôd', None];['James Frecheville', 'Guy Pearce', 'Joel Edgerton', 'Bryce Lindemann']
15;Le Cercle littéraire de Guernesey;2018;Tous publics;124;['Drama', ' Romance', ' War            '];7.3;65;In the aftermath of World War II, a writer forms an unexpected bond with the residents of Guernsey Island when she decides to write a book about their experiences during the war.;['Mike Newell', None];['Jessica Brown Findlay', 'Tom Courtenay', 'Michiel Huisman', 'Katherine Parkinson']
16;Belfast;2021;Tous publics;98;['Biography', ' Drama            '];7.3;75;A young boy and his working-class Belfast family experience the tumultuous late 1960s.;['Kenneth Branagh', None];['Jude Hill', 'Lewis McAskie', 'Caitríona Balfe', 'Jamie Dornan']
17;Fish Tank;2009;Tous publics;123;['Drama            '];7.3;81;Everything changes for 15-year-old Mia when her mum brings home a new boyfriend.;['Andrea Arnold', None];['Katie Jarvis', 'Michael Fassbender', 'Kierston Wareing', 'Rebecca Griffiths']
18;Jane Eyre;2011;Tous publics;120;['Drama', ' Romance            '];7.3;76;A mousy governess who softens the heart of her employer soon discovers that he's hiding a terrible secret.;['Cary Joji Fukunaga', None];['Mia Wasikowska', 'Michael Fassbender', 'Jamie Bell', 'Su Elliot']
19;My Beautiful Boy;I) (2018;Tous publics avec avertissement;120;['Biography', ' Drama            '];7.3;62;Based on the best-selling pair of memoirs from father and son David and Nic Sheff, Beautiful Boy chronicles the heartbreaking and inspiring experience of survival, relapse and recovery in a family coping with addiction over many years.;['Felix van Groeningen', None];['Steve Carell', 'Maura Tierney', 'Jack Dylan Grazer', 'Oakley Bull']
20;First Man: Le Premier Homme sur la Lune;2018;Tous publics;141;['Biography', ' Drama', ' History            '];7.3;84;A look at the life of the astronaut, Neil Armstrong, and the legendary space mission that led him to become the first man to walk on the Moon on July 20, 1969.;['Damien Chazelle', None];['Ryan Gosling', 'Claire Foy', 'Jason Clarke', 'Kyle Chandler']
21;Le Second souffle;2014;R;102;['Drama            '];7.3;56;A drama centered on a classical pianist who has been diagnosed with ALS and the brash college student who becomes her caregiver.;['George C. Wolfe', None];['Hilary Swank', 'Emmy Rossum', 'Josh Duhamel', 'Stephanie Beatriz']
22;La défense Lincoln;2011;Tous publics;118;['Crime', ' Drama', ' Mystery            '];7.3;63;A lawyer defending a wealthy man begins to believe his client is guilty of more than just one crime.;['Brad Furman', None];['Matthew McConaughey', 'Marisa Tomei', 'Ryan Phillippe', 'William H. Macy']
23;Une éducation;2009;Tous publics;100;['Drama            '];7.3;85;A coming-of-age story about a teenage girl in 1960s suburban London, and how her life changes with the arrival of a playboy nearly twice her age.;['Lone Scherfig', None];['Carey Mulligan', 'Peter Sarsgaard', 'Alfred Molina', 'Olivia Williams']
24;Ghajini;2008;NaN;186;['Action', ' Drama', ' Mystery            '];7.3;-1;A short-term memory loss patient sets out on his journey to avenge the death of his beloved girl.;['A.R. Murugadoss', None];['Aamir Khan', 'Asin Thottumkal', 'Jiah Khan', 'Aamir Naik']
25;Uncle Frank;2020;Not Rated;95;['Comedy', ' Drama            '];7.3;58;In 1973, when Frank Bledsoe and his 18-year-old niece Beth take a road trip from Manhattan to Creekville, South Carolina, for the family patriarch's funeral, they're unexpectedly joined by Frank's lover, Walid.;['Alan Ball', None];['Paul Bettany', 'Sophia Lillis', 'Peter Macdissi', 'Steve Zahn']
26;Good Morning England;2009;Tous publics;135;['Comedy', ' Drama', ' Music            '];7.3;58;A band of rogue DJs that captivated Britain, playing the music that defined a generation and standing up to a government that wanted classical music, and nothing else, on the airwaves.;['Richard Curtis', None];['Philip Seymour Hoffman', 'Bill Nighy', 'Nick Frost', 'Michael Hadley']
27;Blue Valentine;2010;Tous publics;112;['Drama', ' Romance            '];7.3;81;The relationship of a contemporary married couple, charting their evolution over a span of years by cross-cutting between time periods.;['Derek Cianfrance', None];['Ryan Gosling', 'Michelle Williams', 'John Doman', 'Faith Wladyka']
28;Eddie the Eagle;2015;Tous publics;106;['Adventure', ' Biography', ' Comedy            '];7.3;54;The story of Eddie Edwards, the notoriously tenacious British underdog ski jumper who charmed the world at the 1988 Winter Olympics.;['Dexter Fletcher', None];['Taron Egerton', 'Hugh Jackman', 'Tom Costello', 'Jo Hartley']
29;Ma vie pour la tienne;2009;Tous Public;109;['Drama', ' Family            '];7.3;51;Anna Fitzgerald looks to earn medical emancipation from her parents who until now have relied on their youngest child to help their leukemia-stricken daughter Kate remain alive.;['Nick Cassavetes', None];['Cameron Diaz', 'Abigail Breslin', 'Alec Baldwin', 'Walter Raney']
30;Invictus;2009;Tous publics;134;['Action', ' Biography', ' Drama            '];7.3;74;Nelson Mandela, in his first term as President of South Africa, initiates a unique venture to unite the Apartheid-torn land: enlist the national rugby team on a mission to win the 1995 Rugby World Cup.;['Clint Eastwood', None];['Morgan Freeman', 'Matt Damon', 'Tony Kgoroge', 'Patrick Mofokeng']
31;Fleur du désert;2009;Tous publics;120;['Biography', ' Drama            '];7.3;54;Waris Dirie, born 1965 in Somalia, flees at 13 when sold as 4th wife. She's maid at the Somalian embassy in London, then McDonald's, where she's discovered and becomes int'l top model. 1997, she speaks up against female genital mutilation.;['Sherry Hormann', None];['Soraya Omar-Scego', 'Idriss Abdillahi Houfaneh', 'Awa Saïd Darar', 'Roun Daher Aïnan']
32;The Descendants;2011;Tous publics;115;['Comedy', ' Drama            '];7.3;84;A land baron tries to reconnect with his two daughters after his wife is seriously injured in a boating accident.;['Alexander Payne', None];['George Clooney', 'Shailene Woodley', 'Amara Miller', 'Nick Krause']
33;Max Manus;2008;NaN;118;['Action', ' Biography', ' Drama            '];7.3;60;The true story about one of the most brilliant saboteurs during World War II and his battle to overcome his inner demons.;['    Directors:', 'Joachim Rønning, ', 'Espen Sandberg', None];['Aksel Hennie', 'Agnes Kittelsen', 'Nicolai Cleve Broch', 'Ken Duken']
34;Compartiment N°6;2021;Tous publics;107;['Drama', ' Romance            '];7.3;80;As a train weaves its way up to the arctic circle, two strangers share a journey that will change their perspective on life.;['Juho Kuosmanen', None];['Yuriy Borisov', 'Seidi Haarla', 'Valeriy Nikolaev', 'Yuliya Aug']
35;Il divo;2008;Tous publics;110;['Biography', ' Drama            '];7.3;81;The story of Italian politician Giulio Andreotti, who has served as Prime Minister of Italy seven times since the restoration of democracy in 1946.;['Paolo Sorrentino', None];['Toni Servillo', 'Anna Bonaiuto', 'Giulio Bosetti', 'Flavio Bucci']
36;Les chemins de la liberté;I) (2010;Tous publics;133;['Adventure', ' Drama', ' History            '];7.3;66;Siberian gulag escapees travel four thousand miles by foot to freedom in India.;['Peter Weir', None];['Jim Sturgess', 'Ed Harris', 'Colin Farrell', 'Dragos Bucur']
37;Les noces rebelles;2008;Tous publics;119;['Drama', ' Romance            '];7.3;69;A young couple living in a Connecticut suburb during the mid-1950s struggle to come to terms with their personal problems while trying to raise their two children.;['Sam Mendes', None];['Leonardo DiCaprio', 'Kate Winslet', 'Christopher Fitzgerald', 'Jonathan Roumie']
38;Precious;II) (2009;12;110;['Drama            '];7.3;78;In New York City's Harlem circa 1987, an overweight, abused, illiterate teen who is pregnant with her second child is invited to enroll in an alternative school in hopes that she can re-route her life in a better direction.;['Lee Daniels', None];"['Gabourey Sidibe', ""Mo'Nique"", 'Paula Patton', 'Mariah Carey']"
39;Ten Inch Hero;2007;R;102;['Comedy', ' Drama', ' Romance            '];7.3;-1;An artist gets a job at a beachside sandwich shop, where she hangs out with a techie, a flirt, a rocker, a hippie, and a Wiccan.;['David Mackay', None];['Elisabeth Harnois', 'Clea DuVall', 'Sean Patrick Flanery', 'Jensen Ackles']
40;Une fiancée pas comme les autres;2007;Tous publics;106;['Comedy', ' Drama', ' Romance            '];7.3;70;A delusional young man strikes up an unconventional relationship with a doll he finds on the Internet.;['Craig Gillespie', None];['Ryan Gosling', 'Emily Mortimer', 'Paul Schneider', 'R.D. Reid']
41;Red Dog;2011;Tous Public;92;['Biography', ' Comedy', ' Drama            '];7.3;-1;Based on the legendary true story of the Red Dog who united a disparate local community while roaming the Australian outback in search of his long lost master.;['Kriv Stenders', None];['Josh Lucas', 'Rachael Taylor', 'Rohan Nichol', 'Luke Ford']
42;Gangster's Paradise: Jerusalema;2008;R;119;['Action', ' Crime', ' Drama            '];7.3;53;A young hoodlum's rise from a small-time criminal to a powerful crime entrepreneur during the turbulent years before and after the fall of apartheid.;['Ralph Ziman', None];['Rapulana Seiphemo', 'Jeffrey Sekele', 'Ronnie Nyakale', 'Shelley Meskin']
43;Mr. Brooks;2007;12;120;['Crime', ' Drama', ' Thriller            '];7.3;45;A well-respected businessman is sometimes controlled by his murder and mayhem-loving alter ego.;['Bruce A. Evans', None];['Kevin Costner', 'Demi Moore', 'William Hurt', 'Dane Cook']
