;name;year;certificate;runtime;genre;rating;metascore;text-muted;director;stars
43;Young Adult;2011;Tous publics;94;['Comedy', ' Drama            '];6.3;71;Soon after her divorce, a fiction writer returns to her home in small-town Minnesota, looking to rekindle a romance with her ex-boyfriend, who is now happily married and has a newborn daughter.;['Jason Reitman', None];['Charlize Theron', 'Patrick Wilson', 'Patton Oswalt', 'Elizabeth Reaser']
44;Daydream Nation;2010;R;98;['Drama', ' Romance            '];6.3;57;A city girl who moves to a small town and becomes entangled in a love triangle between her high school teacher and a stoner classmate.;['Michael Goldbach', None];['Kat Dennings', 'Reece Thompson', 'Andie MacDowell', 'Josh Lucas']
45;Country Strong;2010;Tous Public;117;['Drama', ' Music            '];6.3;45;A rising country-music songwriter works with a fallen star to work their way to fame, causing romantic complications along the way.;['Shana Feste', None];['Garrett Hedlund', 'Gwyneth Paltrow', 'Leighton Meester', 'Tim McGraw']
46;Tous les espoirs sont permis;2012;Tous Public;100;['Comedy', ' Drama', ' Romance            '];6.3;65;After thirty years of marriage, a middle-aged couple attends an intense, week-long counseling session to work on their relationship.;['David Frankel', None];['Meryl Streep', 'Tommy Lee Jones', 'Steve Carell', 'Jean Smart']
47;Under the Skin;I) (2013;Tous publics;108;['Drama', ' Horror', ' Mystery            '];6.3;80;A mysterious young woman seduces lonely men in the evening hours in Scotland. However, events lead her to begin a process of self-discovery.;['Jonathan Glazer', None];['Scarlett Johansson', 'Jeremy McWilliams', 'Lynsey Taylor Mackay', 'Dougie McConnell']
48;The American;2010;Tous publics;105;['Action', ' Crime', ' Drama            '];6.3;61;An assassin hides out in Italy for one last assignment.;['Anton Corbijn', None];['George Clooney', 'Paolo Bonacelli', 'Violante Placido', 'Irina Björklund']
49;Look Both Ways;2022;13;110;['Comedy', ' Drama', ' Romance            '];6.3;49;On the eve of her college graduation, Natalie's life diverges into parallel realities: one in which she becomes pregnant and remains in her hometown to raise her child and another in which she moves to LA to pursue her dream career.;['Wanuri Kahiu', None];['Lili Reinhart', 'Danny Ramirez', 'Aisha Dee', 'Jaden Tolliver']
0;Enduring Love;2004;R;100;['Drama', ' Mystery', ' Romance            '];6.3;61;Two strangers become connected by a tragedy, yet one dangerously feels that the connection goes much deeper than the other is willing to admit.;['Roger Michell', None];['Rhys Ifans', 'Daniel Craig', 'Samantha Morton', 'Bill Weston']
1;Astro Boy;2009;Tous Public;94;['Animation', ' Action', ' Adventure            '];6.3;53;When an android replica of a boy is rejected by his aggrieved creator, he goes off to find his own identity in an adventure that would make him the greatest hero of his time.;['David Bowers', None];['Freddie Highmore', 'Nicolas Cage', 'Kristen Bell', 'Charlize Theron']
2;Rencontres à Elizabethtown;2005;Tous Public;123;['Comedy', ' Drama', ' Romance            '];6.3;45;During a hometown memorial for his Kentucky-born father, a young man begins an unexpected romance with a too-good-to-be-true stewardess.;['Cameron Crowe', None];['Orlando Bloom', 'Kirsten Dunst', 'Susan Sarandon', 'Alec Baldwin']
3;Revolver;2005;12;111;['Action', ' Crime', ' Drama            '];6.3;25;Gambler Jake Green enters into a game with potentially deadly consequences.;['Guy Ritchie', None];['Jason Statham', 'Ray Liotta', 'André 3000', 'Vincent Pastore']
4;Baron Rouge;2008;PG-13;106;['Action', ' Adventure', ' Biography            '];6.3;-1;German biopic loosely based on the World War I fighter ace Manfred Von Richthofen, nicknamed the Red Baron by friend and foe alike.;['Nikolai Müllerschön', None];['Matthias Schweighöfer', 'Lena Headey', 'Til Schweiger', 'Joseph Fiennes']
5;Art School Confidential;2006;R;102;['Comedy', ' Drama', ' Romance            '];6.3;54;Starting from childhood attempts at illustration, the protagonist pursues his true obsession to art school. But as he learns how the art world really works, he finds that he must adapt his vision to the reality that confronts him.;['Terry Zwigoff', None];['Max Minghella', 'Sophia Myles', 'John Malkovich', 'Jim Broadbent']
6;Esprit de famille;2005;Tous Public;103;['Comedy', ' Drama', ' Romance            '];6.3;56;An uptight, conservative businesswoman accompanies her boyfriend to his eccentric and outgoing family's annual Christmas celebration and finds that she's a fish out of water in their free-spirited way of life.;['Thomas Bezucha', None];['Dermot Mulroney', 'Sarah Jessica Parker', 'Claire Danes', 'Diane Keaton']
7;Le roi Arthur;2004;Tous publics;126;['Action', ' Adventure', ' Drama            '];6.3;46;A demystified take on the tale of King Arthur and the Knights of the Round Table.;['Antoine Fuqua', None];['Clive Owen', 'Stephen Dillane', 'Keira Knightley', 'Ioan Gruffudd']
8;Shopgirl;2005;Tous publics;106;['Drama', ' Romance            '];6.3;62;A film adaptation of Steve Martin's novel about a complex love triangle between a bored salesgirl, a wealthy businessman and an aimless young man.;['Anand Tucker', None];['Steve Martin', 'Claire Danes', 'Jason Schwartzman', 'Bridgette Wilson-Sampras']
9;Sylvia;2003;R;110;['Biography', ' Drama', ' Romance            '];6.3;56;"Story of the relationship between poets Edward James ""Ted"" Hughes and Sylvia Plath.";['Christine Jeffs', None];['Gwyneth Paltrow', 'Daniel Craig', 'Lucy Davenport', 'David Birkin']
10;Loving Annabelle;2006;NaN;77;['Drama', ' Romance            '];6.3;-1;The intelligent Annabelle starts in an elite Catholic girls' boarding high school after being expelled from the previous 2 schools. She's open about being lesbian. She's attracted to her teacher, Simone.;['Katherine Brooks', None];['Erin Kelly', 'Diane Gaidry', 'Laura Breckenridge', 'Michelle Horn']
11;Winn-Dixie mon meilleur ami;2005;Tous Public;106;['Comedy', ' Drama', ' Family            '];6.3;54;A mischievous dog befriends a lonely young girl in a new town and helps her make new friends.;['Wayne Wang', None];['AnnaSophia Robb', 'Jeff Daniels', 'Eva Marie Saint', 'Cicely Tyson']
12;Barbershop;2002;Tous publics;102;['Comedy', ' Drama            '];6.3;66;A day in the life of a South Side Chicago barbershop.;['Tim Story', None];['Ice Cube', 'Cedric the Entertainer', 'Eve', 'Anthony Anderson']
13;Versus l'ultime guerrier;II) (2000;16;119;['Action', ' Drama', ' Fantasy            '];6.3;-1;There are 666 portals that connect this world to the other side. These are concealed from all human beings. Somewhere in Japan exists the 444th portal.... The forest of resurrection.;['Ryûhei Kitamura', None];['Tak Sakaguchi', 'Hideo Sakaki', 'Chieko Misaka', 'Kenji Matsuda']
14;Ararat;2002;Tous publics;115;['Drama', ' War            '];6.3;62;Interrogated by a customs officer, a young man recounts how his life was changed during the making of a film about the Armenian genocide.;['Atom Egoyan', None];['Charles Aznavour', 'Brent Carver', 'Eric Bogosian', 'Simon Abkarian']
15;Crève Smoochy, crève;2002;R;109;['Comedy', ' Crime', ' Drama            '];6.3;38;A kids' show host, Rainbow Randolph, is fired in disgrace while his replacement, Sheldon Mopes, A.K.A. Smoochy the Rhino, finds himself a rising star. Unfortunately for Sheldon, the business of kids' television isn't all child's play.;['Danny DeVito', None];['Robin Williams', 'Edward Norton', 'Catherine Keener', 'Danny DeVito']
16;Pas un mot...;2001;12;113;['Drama', ' Mystery', ' Thriller            '];6.3;38;When the daughter of a psychiatrist is kidnapped, he's horrified to discover that the abductors' demand is that he break through to a post traumatic stress disorder suffering young woman who knows a secret...;['Gary Fleder', None];['Michael Douglas', 'Sean Bean', 'Brittany Murphy', 'Skye McCole Bartusiak']
17;Crimes et pouvoir;2002;Tous publics;115;['Crime', ' Drama', ' Mystery            '];6.3;48;A successful lawyer's husband is arrested for murdering 9 villagers in El Salvador in 1988 as US soldier under a different name. She defends him in military court and investigates. Framed?;['Carl Franklin', None];['Jim Caviezel', 'Morgan Freeman', 'Ashley Judd', 'Adam Scott']
18;Possession;2002;PG-13;102;['Drama', ' Mystery', ' Romance            '];6.3;52;A pair of literary sleuths unearth the amorous secret of two Victorian poets only to find themselves falling under a passionate spell.;['Neil LaBute', None];['Gwyneth Paltrow', 'Aaron Eckhart', 'Jeremy Northam', 'Jennifer Ehle']
19;Mission évasion;2002;Tous publics;125;['Drama', ' War            '];6.3;49;A law student becomes a lieutenant during World War II, is captured and asked to defend a black prisoner of war falsely accused of murder.;['Gregory Hoblit', None];['Bruce Willis', 'Colin Farrell', 'Terrence Howard', 'Cole Hauser']
20;L'échange;2000;Tous publics;135;['Action', ' Drama', ' Thriller            '];6.3;45;Alice hires a professional negotiator to obtain the release of her engineer husband, who has been kidnapped by anti-government guerrillas in South America.;['Taylor Hackford', None];['Meg Ryan', 'Russell Crowe', 'David Morse', 'Pamela Reed']
21;Made;2001;R;95;['Comedy', ' Crime', ' Drama            '];6.3;62;Two aspiring boxers, life-long friends, get involved in a money-laundering scheme through a low-level organized crime group.;['Jon Favreau', None];['Vince Vaughn', 'Jon Favreau', 'Joe Goossen', 'Famke Janssen']
22;Les aventures de Tigrou et de Winnie l'ourson;2000;Tous publics;77;['Animation', ' Adventure', ' Comedy            '];6.3;53;Tigger goes looking through the hundred-acre-wood to find his family.;['Jun Falkenstein', None];['Jim Cummings', 'Nikita Hopkins', 'Ken Sansom', 'John Fiedler']
23;Rock Star;2001;R;105;['Drama', ' Music            '];6.3;54;Lead singer of a tribute band becomes lead singer of the real band he idolizes.;['Stephen Herek', None];['Mark Wahlberg', 'Jennifer Aniston', 'Dominic West', 'Jason Bonham']
24;Nurse Betty;2000;Tous publics;110;['Comedy', ' Crime', ' Drama            '];6.3;69;Comedy about a widow's post-traumatic obsession with a soap star.;['Neil LaBute', None];['Renée Zellweger', 'Morgan Freeman', 'Chris Rock', 'Greg Kinnear']
25;Guns 1748;1999;Tous publics;99;['Action', ' Adventure', ' Comedy            '];6.3;44;Two robbers are persecuted by the law, whose servants are not much better and even worse.;['Jake Scott', None];['Robert Carlyle', 'Jonny Lee Miller', 'Iain Robertson', 'Ken Stott']
26;Pecker;1998;Tous publics;87;['Comedy', ' Drama            '];6.3;66;A talented young photographer, who enjoys snapping photos of his satirical, perverted Baltimore neighborhood and his wacky family, gets dragged into a world of pretentious artists from New York City and finds newfound fame.;['John Waters', None];['Edward Furlong', 'Christina Ricci', 'Bess Armstrong', 'Mark Joy']
27;Aussi profond que l'océan;1999;Tous publics;106;['Drama            '];6.3;45;A film about a family's reaction when Ben, the youngest son is kidnapped and then found nine years later, living in the same town, where his family had just moved.;['Ulu Grosbard', None];['Michelle Pfeiffer', 'Treat Williams', 'Whoopi Goldberg', 'Jonathan Jackson']
28;Celebrity;1998;Tous publics;113;['Comedy', ' Drama            '];6.3;41;The fortunes of a husband and wife differ drastically after they divorce.;['Woody Allen', None];['Kenneth Branagh', 'Judy Davis', 'Leonardo DiCaprio', 'Greg Mottola']
29;Smilla;1997;Tous publics;121;['Crime', ' Drama', ' Mystery            '];6.3;45;A 6 y.o. Inuit boy runs off a snowy roof in Copenhagen and dies. Smilla, a half Inuit who lives in the building and knows the boy, looks into it. What makes an acrophobic boy run up on the roof? The clues take her to Greenland.;['Bille August', None];['Julia Ormond', 'Jens Jørgen Fleischer', 'Agga Olsen', 'Patrick Field']
30;Red Corner;1997;Tous publics;122;['Crime', ' Drama', ' Thriller            '];6.3;-1;An American attorney on business in China is wrongfully arrested and put on trial for murder, with a female defense lawyer from the country the only key to proving his innocence.;['Jon Avnet', None];['Richard Gere', 'Bai Ling', 'Bradley Whitford', 'Byron Mann']
31;Le mariage de mon meilleur ami;1997;Tous publics;105;['Comedy', ' Drama', ' Romance            '];6.3;50;When a woman's long-time friend reveals he's engaged, she realizes she loves him herself and sets out to get him, with only days before the wedding.;['P.J. Hogan', None];['Julia Roberts', 'Dermot Mulroney', 'Cameron Diaz', 'Rupert Everett']
32;Mad City;1997;Tous publics;114;['Crime', ' Drama', ' Thriller            '];6.3;45;A distraught man inadvertently takes a group of children hostage in a museum while a hungry, seasoned reporter tries to resurrect his career covering the story.;['Costa-Gavras', None];['John Travolta', 'Dustin Hoffman', 'Alan Alda', 'Mia Kirshner']
33;Les seigneurs de Harlem;1997;Tous publics;130;['Crime', ' Drama            '];6.3;50;Black gangsters in 1930 Harlem fights Dutch Schultz who is trying to horn in on their numbers racket.;['Bill Duke', None];['Laurence Fishburne', 'Tim Roth', 'Vanessa Williams', 'Andy Garcia']
34;Les hommes de l'ombre;1996;R;107;['Crime', ' Drama', ' Mystery            '];6.3;51;In 1950's Los Angeles, a special crime squad of the LAPD investigates the murder of a young woman.;['Lee Tamahori', None];['Nick Nolte', 'Melanie Griffith', 'Jennifer Connelly', 'Chazz Palminteri']
35;Evita;1996;Tous publics;135;['Biography', ' Drama', ' History            '];6.3;45;The hit musical based on the life of Eva Perón (Evita Duarte), a B-picture Argentinian actress who eventually became the wife of Argentinian president Juan Domingo Perón, and the most beloved and hated woman in Argentina.;['Alan Parker', None];['Madonna', 'Jonathan Pryce', 'Antonio Banderas', 'Jimmy Nail']
36;Sabrina;1995;Tous Public;127;['Comedy', ' Drama', ' Romance            '];6.3;56;An ugly duckling having undergone a remarkable change, still harbors feelings for her crush: a carefree playboy, but not before his business-focused brother has something to say about it.;['Sydney Pollack', None];['Harrison Ford', 'Julia Ormond', 'Greg Kinnear', 'Nancy Marchand']
37;Meurtre en suspens;1995;Accord parental;90;['Action', ' Crime', ' Drama            '];6.3;-1;An unimpressive, everyday man is forced into a situation where he is told to kill a politician to save his kidnapped daughter.;['John Badham', None];['Johnny Depp', 'Christopher Walken', 'Courtney Chase', 'Charles S. Dutton']
38;Le patchwork de la vie;1995;Tous publics;117;['Comedy', ' Drama', ' Romance            '];6.3;-1;Bride-to-be Finn Dodd hears tales of romance and sorrow from her elders as they construct a quilt.;['Jocelyn Moorhouse', None];['Winona Ryder', 'Ellen Burstyn', 'Anne Bancroft', 'Kaelynn Craddick']
39;Crossing Guard;1995;R;111;['Drama', ' Thriller            '];6.3;46;Freddy Gale is a seedy jeweller who has sworn to kill the drunk driver who killed his little girl.;['Sean Penn', None];['Jack Nicholson', 'David Morse', 'Anjelica Huston', 'Robin Wright']
40;2 garçons, 1 fille, 3 possibilités;1994;16;93;['Comedy', ' Drama', ' Romance            '];6.3;-1;A girl named Alex is by mistake housed with 2 guys, Stuart and Eddy, in a college dorm suite. After initial problems they become friends. Stuart has the hots for Alex, Alex for Eddy and Eddy for Stuart. Can it work?;['Andrew Fleming', None];['Lara Flynn Boyle', 'Josh Charles', 'Stephen Baldwin', 'Alexis Arquette']
41;Frankenstein;1994;12;123;['Drama', ' Horror', ' Romance            '];6.3;49;When the brilliant but unorthodox scientist Dr. Victor Frankenstein rejects the artificial man that he has created, the Creature escapes and later swears revenge.;['Kenneth Branagh', None];['Robert De Niro', 'Kenneth Branagh', 'Helena Bonham Carter', 'Tom Hulce']
42;La disparue;1993;12;109;['Drama', ' Horror', ' Mystery            '];6.3;49;The boyfriend of an abducted woman never gives up the search as the abductor looks on.;['George Sluizer', None];['Jeff Bridges', 'Kiefer Sutherland', 'Nancy Travis', 'Sandra Bullock']
43;Jennifer 8;1992;Tous publics;124;['Crime', ' Drama', ' Mystery            '];6.3;48;John Berlin, a former Los Angeles homicide detective, investigates a multiple murder case in San Diego. The only witness is a blind girl to whom he is immediately attracted.;['Bruce Robinson', None];['Andy Garcia', 'Uma Thurman', 'Lance Henriksen', 'Graham Beckel']
44;Forever Young;1992;Tous Public;102;['Drama', ' Romance', ' Sci-Fi            '];6.3;-1;During a cryogenics test, a pilot frozen in 1939 awakes in 1992 but time is running out, as his body starts to age rapidly.;['Steve Miner', None];['Mel Gibson', 'Jamie Lee Curtis', 'Elijah Wood', 'Isabel Glasser']
45;Bodyguard;1992;Tous publics;129;['Action', ' Drama', ' Music            '];6.3;39;A former Secret Service agent takes on the job of bodyguard to an R&B singer, whose lifestyle is most unlike a President's.;['Mick Jackson', None];['Kevin Costner', 'Whitney Houston', 'Gary Kemp', 'Bill Cobbs']
46;Doc Hollywood;1991;Tous publics;104;['Comedy', ' Drama', ' Romance            '];6.3;56;A young doctor on his way across the country to a job interview crashes his car in a small town and is sentenced to work for several days at the town hospital.;['Michael Caton-Jones', None];['Michael J. Fox', 'Julie Warner', 'Barnard Hughes', 'Woody Harrelson']
47;Henry & June;1990;12;136;['Biography', ' Drama            '];6.3;62;Anaïs Nin meets the American writer, Henry Miller, in Paris in 1931. She keeps a diary of her sexual awakening which includes Henry and his wife, June.;['Philip Kaufman', None];['Fred Ward', 'Uma Thurman', 'Maria de Medeiros', 'Richard E. Grant']
48;Green Card;1990;Tous publics;107;['Comedy', ' Drama', ' Romance            '];6.3;58;A man wanting to stay in the US enters into a marriage of convenience, but it turns into more than that.;['Peter Weir', None];['Gérard Depardieu', 'Andie MacDowell', 'Bebe Neuwirth', 'Gregg Edelman']
49;Vengeance aveugle;1989;Tous publics;86;['Action', ' Comedy', ' Crime            '];6.3;31;A blind Vietnam vet, trained as a swordfighter, comes to America and helps to rescue the son of a fellow soldier.;['Phillip Noyce', None];"['Rutger Hauer', ""Terry O'Quinn"", 'Brandon Call', 'Noble Willingham']"
0;Mine 9;2019;Not Rated;83;['Drama', ' Thriller            '];6.2;65;Two miles into the earth, nine Appalachian miners struggle to survive after a methane explosion leaves them with one hour of oxygen.;['Eddie Mensore', None];['Terry Serpico', 'Mark Ashworth', 'Kevin Sizemore', 'Clint James']
1;The Whole Truth;2016;R;93;['Crime', ' Drama', ' Mystery            '];6.2;46;A defense attorney works to get his teenage client acquitted of murdering his wealthy father.;['Courtney Hunt', None];['Keanu Reeves', 'Renée Zellweger', 'Gugu Mbatha-Raw', 'Gabriel Basso']
2;Maggie a un plan;2015;R;98;['Comedy', ' Drama', ' Romance            '];6.2;76;Maggie wants to have a baby, raising him on her own, but when she gets romantically involved with John, a married man, things get complicated and all the balance of Maggie's plans may collapse.;['Rebecca Miller', None];['Greta Gerwig', 'Ethan Hawke', 'Julianne Moore', 'Maya Rudolph']
3;Berlin Syndrome;2017;16;116;['Drama', ' Horror', ' Mystery            '];6.2;70;A passionate holiday romance leads to an obsessive relationship, when an Australian photojournalist wakes one morning in a Berlin apartment and is unable to leave.;['Cate Shortland', None];['Teresa Palmer', 'Max Riemelt', 'Matthias Habich', 'Emma Bading']
4;MI-5 Infiltration;2015;Tous publics;104;['Action', ' Drama', ' Thriller            '];6.2;47;When a terrorist escapes custody during a routine handover, Will Holloway must team with disgraced MI5 Intelligence Chief Harry Pearce to track him down before an imminent terrorist attack on London.;['Bharat Nalluri', None];['Kit Harington', 'Peter Firth', 'Jennifer Ehle', 'Michael Wildman']
5;Bienvenue à Marwen;2018;Tous publics;116;['Biography', ' Comedy', ' Drama            '];6.2;40;A victim of a brutal attack finds a unique and beautiful therapeutic outlet to help him through his recovery process.;['Robert Zemeckis', None];"['Steve Carell', 'Falk Hentschel', ""Matt O'Leary"", 'Nikolai Witschl']"
6;Ne t'endors pas;2016;PG-13;97;['Drama', ' Fantasy', ' Horror            '];6.2;68;A couple adopt an orphaned child whose dreams - and nightmares - manifest physically as he sleeps.;['Mike Flanagan', None];['Kate Bosworth', 'Oleksandr Reshetilov', 'Thomas Jane', 'Jacob Tremblay']
7;Crazy Amy;2015;Tous publics;125;['Comedy', ' Drama', ' Romance            '];6.2;75;Having thought that monogamy was never possible, a commitment-phobic career woman may have to face her fears when she meets a good guy.;['Judd Apatow', None];['Amy Schumer', 'Bill Hader', 'Brie Larson', 'Colin Quinn']
8;Manhattan Nocturne;2016;16;113;['Crime', ' Drama', ' Mystery            '];6.2;44;A reporter becomes involved with a mysterious woman while investigating her late husband's death.;['Brian DeCubellis', None];['Adrien Brody', 'Yvonne Strahovski', 'Campbell Scott', 'Jennifer Beals']
9;Inferno;I) (2016;Tous publics;121;['Action', ' Adventure', ' Crime            '];6.2;42;When Robert Langdon wakes up in an Italian hospital with amnesia, he teams up with Dr. Sienna Brooks and they race across Europe together against the clock to foil a deadly global plot.;['Ron Howard', None];['Tom Hanks', 'Felicity Jones', 'Irrfan Khan', 'Ben Foster']
10;Ruth & Alex;2014;Tous Public;88;['Comedy', ' Drama            '];6.2;55;A long-time married couple who've spent their lives together in the same New York apartment become overwhelmed by personal and real estate-related issues when they plan to move away.;['Richard Loncraine', None];['Diane Keaton', 'Morgan Freeman', 'Cynthia Nixon', 'Carrie Preston']
11;Le Chemin du pardon;I) (2017;PG-13;132;['Drama', ' Fantasy            '];6.2;32;"A grieving man receives a mysterious, personal invitation to meet with God at a place called ""The Shack.""";['Stuart Hazeldine', None];['Sam Worthington', 'Octavia Spencer', 'Tim McGraw', 'Radha Mitchell']
12;Yves Saint Laurent;2014;Tous publics;106;['Biography', ' Drama            '];6.2;51;A look at the life of French designer Yves Saint-Laurent from the beginning of his career in 1958 when he met his lover and business partner, Pierre Bergé.;['Jalil Lespert', None];['Pierre Niney', 'Guillaume Gallienne', 'Charlotte Le Bon', 'Laura Smet']
13;Sweet Virginia;2017;R;93;['Action', ' Drama', ' Thriller            '];6.2;72;A former rodeo champ befriends a young man with a propensity for violence.;['Jamie M. Dagg', None];['Jon Bernthal', 'Christopher Abbott', 'Imogen Poots', 'Rosemarie DeWitt']
14;Contrôle parental;2018;Tous publics;102;['Comedy', ' Drama            '];6.2;69;Three parents try to stop their daughters from losing their virginity on prom night.;['Kay Cannon', None];['Leslie Mann', 'John Cena', 'Ike Barinholtz', 'Kathryn Newton']
15;Un jour dans la vie de Billy Lynn;2016;Tous publics;113;['Action', ' Drama', ' Sport            '];6.2;53;19-year-old Billy Lynn is brought home for a victory tour after a harrowing Iraq battle. Through flashbacks, the film shows what really happened to his squad - contrasting the realities of war with America's perceptions.;['Ang Lee', None];['Joe Alwyn', 'Garrett Hedlund', 'Arturo Castro', 'Mason Lee']
16;Palo Alto;2013;R;100;['Drama            '];6.2;69;An unflinching portrait of adolescent lust, boredom, and self-destruction that centers around a shy young girl on the cusp of an illicit relationship with her soccer coach.;['Gia Coppola', None];['Emma Roberts', 'James Franco', 'Jack Kilmer', 'Zoe Levin']
17;Dark Places;2015;12;113;['Crime', ' Drama', ' Mystery            '];6.2;39;Libby Day was only eight years old when her family was brutally murdered in their rural Kansas farmhouse. Almost thirty years later, she reluctantly agrees to revisit the crime and uncovers the wrenching truths that led up to that tragic night.;['Gilles Paquet-Brenner', None];['Charlize Theron', 'Nicholas Hoult', 'Christina Hendricks', 'Chloë Grace Moretz']
18;English Revolution;2013;NaN;90;['Drama', ' History', ' Mystery            '];6.2;73;Amid the Civil War in 17th-century England, a group of deserters flee from battle through an overgrown field. Captured by an alchemist, the men are forced to help him search to find a hidden treasure that he believes is buried in the field.;['Ben Wheatley', None];['Julian Barratt', 'Peter Ferdinando', 'Richard Glover', 'Ryan Pope']
19;Un amour sans fin;2014;Tous publics;104;['Drama', ' Romance            '];6.2;30;The story of a privileged girl and a charismatic boy whose instant desire sparks a love affair made only more reckless by parents trying to keep them apart.;['Shana Feste', None];['Gabriella Wilde', 'Alex Pettyfer', 'Bruce Greenwood', 'Robert Patrick']
20;Galveston;2018;Tous publics;91;['Action', ' Crime', ' Drama            '];6.2;57;After escaping a set up, a dying hitman returns to his hometown of Galveston where he plans his revenge.;['Mélanie Laurent', None];['Ben Foster', 'Jeffrey Grover', 'Christopher Amitrano', 'Mark Hicks']
21;Una;2016;R;94;['Drama            '];6.2;62;"When a young woman unexpectedly arrives at her much-older former lover's workplace, looking for answers, the secrets of their dark past threaten to unravel his new life. What follows is an ...                See full summary »
";['Benedict Andrews', None];['Ruby Stokes', 'Rooney Mara', 'Riz Ahmed', 'Ben Mendelsohn']
