;name;year;certificate;runtime;genre;rating;metascore;text-muted;director;stars
30;Un justicier dans la ville;1974;12;93;['Action', ' Crime', ' Drama            '];6.9;51;A New York City architect becomes a one-man vigilante squad after his wife is murdered by street punks. In self-defense, the vengeful man kills muggers on the mean streets after dark.;['Michael Winner', None];['Charles Bronson', 'Hope Lange', 'Vincent Gardenia', 'Steven Keats']
31;Le dernier Tango à Paris;1972;16;129;['Drama', ' Romance            '];6.9;77;A young Parisian woman meets a middle-aged American businessman who demands their clandestine relationship be based only on sex.;['Bernardo Bertolucci', None];['Marlon Brando', 'Maria Schneider', 'Maria Michi', 'Giovanna Galletti']
32;Le Petit Monde de Charlotte;1973;NaN;94;['Animation', ' Adventure', ' Drama            '];6.9;73;Wilbur is a farm pig who's terrified that he'll end up on the dinner table. His friend Charlotte, a charming spider, comes to his rescue. She weaves words into her web, convincing the farmer that Wilbur is too special a pig to kill.;['    Directors:', 'Charles A. Nichols, ', 'Iwao Takamoto', None];['Debbie Reynolds', 'Henry Gibson', 'Paul Lynde', 'Rex Allen']
33;Histoires d'outre-tombe;1972;12;92;['Drama', ' Horror', ' Mystery            '];6.9;-1;Five strangers get lost in a crypt and, after meeting the mysterious Crypt Keeper, receive visions of how they will die.;['Freddie Francis', None];['Joan Collins', 'Peter Cushing', 'Ralph Richardson', 'Geoffrey Bayldon']
34;Un frisson dans la nuit;1971;12;102;['Drama', ' Thriller            '];6.9;78;The life of a disc jockey is turned upside down after a romantic encounter with an obsessed fan.;['Clint Eastwood', None];['Clint Eastwood', 'Jessica Walter', 'Donna Mills', 'John Larch']
35;Ce plaisir qu'on dit charnel;1971;13;98;['Drama            '];6.9;77;Chronicling the lifelong sexual development of two men who meet and become friends in college.;['Mike Nichols', None];['Jack Nicholson', 'Candice Bergen', 'Art Garfunkel', 'Ann-Margret']
36;Zabriskie Point;1970;Tous publics;113;['Drama            '];6.9;-1;At a time of chronic civil unrest in late 1960s America, a young idealist and an anthropology student cross paths at Zabriskie Point in Death Valley, California. They start an unrestrained relationship by making love on the dusty terrain.;['Michelangelo Antonioni', None];['Mark Frechette', 'Daria Halprin', 'Paul Fix', 'G.D. Spradlin']
37;Love Story;1970;Tous publics;100;['Drama', ' Romance            '];6.9;84;A boy and a girl from different backgrounds fall in love regardless of their upbringing - and then tragedy strikes.;['Arthur Hiller', None];"['Ali MacGraw', ""Ryan O'Neal"", 'John Marley', 'Ray Milland']"
38;La Bataille d'Angleterre;1969;Tous publics;132;['Action', ' Drama', ' History            '];6.9;-1;In 1940, the British Royal Air Force fights a desperate battle to prevent the Luftwaffe from gaining air superiority over the English Channel as a prelude to a possible Axis invasion of the U.K.;['Guy Hamilton', None];['Michael Caine', 'Trevor Howard', 'Harry Andrews', 'Curd Jürgens']
39;L'affaire Thomas Crown;1968;Tous publics;102;['Crime', ' Drama', ' Romance            '];6.9;66;A debonair, adventuresome bank executive believes he has pulled off the perfect multi-million dollar heist, only to match wits with a sexy insurance investigator who will do anything to get her man.;['Norman Jewison', None];['Steve McQueen', 'Faye Dunaway', 'Paul Burke', 'Jack Weston']
40;Le masque de la mort rouge;1964;13;89;['Drama', ' Horror            '];6.9;77;"A European prince terrorizes the local peasantry while using his castle as a refuge against the ""Red Death"" plague that stalks the land.";['Roger Corman', None];['Vincent Price', 'Hazel Court', 'Jane Asher', 'David Weston']
41;Sa majesté des mouches;1963;Tous publics;92;['Adventure', ' Drama', ' Thriller            '];6.9;67;Schoolboys marooned on a Pacific island create their own savage civilization.;['Peter Brook', None];['James Aubrey', 'Tom Chapin', 'Hugh Edwards', 'Roger Elwin']
42;La chute de la maison Usher;1960;NaN;79;['Drama', ' Horror            '];6.9;75;Upon entering his fiancée's family mansion, a man discovers a savage family curse and fears that his future brother-in-law has entombed his bride-to-be prematurely.;['Roger Corman', None];['Vincent Price', 'Mark Damon', 'Myrna Fahey', 'Harry Ellerbe']
43;La comtesse aux pieds nus;1954;12;128;['Crime', ' Drama', ' Mystery            '];6.9;-1;This is the life of a Hollywood movie star named Maria, as told by writer/director Harry Dawes, from being discovered in Madrid, Spain, until her funeral in Italy.;['Joseph L. Mankiewicz', None];"['Humphrey Bogart', 'Ava Gardner', ""Edmond O'Brien"", 'Marius Goring']"
44;Trois mille ans à t'attendre;2022;Tous publics;108;['Drama', ' Fantasy', ' Romance            '];6.8;60;A lonely scholar, on a trip to Istanbul, discovers a Djinn who offers her three wishes in exchange for his freedom.;['George Miller', None];['Tilda Swinton', 'Idris Elba', 'Erdil Yasaroglu', 'Sarah Houbolt']
45;Good Newwz;2019;Not Rated;134;['Comedy', ' Drama            '];6.8;-1;Two couples with the same surnames pursue in-vitro fertilization and wait for their upcoming babies. Trouble ensues when they find that the sperms of each couple have been mixed with each other.;['Raj Mehta', None];['Akshay Kumar', 'Kareena Kapoor', 'Diljit Dosanjh', 'Kiara Advani']
46;À quel prix?;2020;13;118;['Biography', ' Drama', ' History            '];6.8;67;An attorney in Washington D.C. battles against cynicism, bureaucracy and politics to help the victims of 9/11.;['Sara Colangelo', None];['Michael Keaton', 'Amy Ryan', 'Stanley Tucci', 'Tate Donovan']
47;Brittany Runs a Marathon;2019;R;104;['Comedy', ' Drama            '];6.8;72;A young woman decides to make positive changes in her life by training for the New York City Marathon.;['Paul Downs Colaizzo', None];['Jillian Bell', 'Jennifer Dundas', 'Patch Darragh', 'Alice Lee']
48;Judy;II) (2019;Tous publics;118;['Biography', ' Drama', ' Romance            '];6.8;66;Legendary performer Judy Garland arrives in London in the winter of 1968 to perform a series of sold-out concerts.;['Rupert Goold', None];['Renée Zellweger', 'Jessie Buckley', 'Finn Wittrock', 'Rufus Sewell']
49;L'Étau de Munich;2021;13;130;['Biography', ' Drama', ' History            '];6.8;53;A British diplomat travels to Munich in the run-up to World War II, where a former classmate of his from Oxford is also en route, but is working for the German government.;['Christian Schwochow', None];['George MacKay', 'Jannis Niewöhner', 'Jeremy Irons', 'Liv Lisa Fries']
0;Le Pari: Draft Day;I) (2014;PG-13;110;['Drama', ' Sport            '];6.8;54;At the NFL Draft, General Manager Sonny Weaver has the opportunity to rebuild his team when he trades for the number one pick. He must decide what he's willing to sacrifice on a life-changing day for a few hundred young men with NFL dreams.;['Ivan Reitman', None];['Kevin Costner', 'Chadwick Boseman', 'Jennifer Garner', 'Frank Langella']
1;Une nouvelle chance;2012;Tous publics;111;['Drama', ' Sport            '];6.8;58;A daughter tries to remedy her dysfunctional relationship with her ailing father, a decorated baseball scout, by helping him in a recruiting trip which could be his last.;['Robert Lorenz', None];['Clint Eastwood', 'Amy Adams', 'John Goodman', 'Justin Timberlake']
2;L'intégriste malgré lui;2012;R;130;['Drama', ' Thriller            '];6.8;54;A young Pakistani man chasing corporate success on Wall Street finds himself embroiled in a conflict between his American Dream, a hostage crisis, and the enduring call of his family's homeland.;['Mira Nair', None];['Riz Ahmed', 'Liev Schreiber', 'Kiefer Sutherland', 'Kate Hudson']
3;The 33;2015;Tous Public;127;['Biography', ' Drama', ' History            '];6.8;55;Based on the real-life event, when a gold and copper mine collapses, it traps 33 miners underground for 69 days.;['Patricia Riggen', None];['Antonio Banderas', 'Rodrigo Santoro', 'Juliette Binoche', 'James Brolin']
4;Un homme très recherché;2014;Tous publics;122;['Crime', ' Drama', ' Thriller            '];6.8;73;A Chechen Muslim illegally immigrates to Hamburg, where he gets caught in the international war on terror.;['Anton Corbijn', None];['Philip Seymour Hoffman', 'Rachel McAdams', 'Daniel Brühl', 'Robin Wright']
5;Singham;2011;NaN;143;['Action', ' Crime', ' Drama            '];6.8;-1;A truly honest police officer is transferred to a town controlled by a gangster he has humiliated. The gangster believes he can use good power to bring down this officer who made him look foolish and weak.;['Rohit Shetty', None];['Ajay Devgn', 'Prakash Raj', 'Sudhanshu Pandey', 'Kajal Aggarwal']
6;Kodachrome;2017;13;105;['Drama            '];6.8;57;Set during the final days of the admired photo development system known as Kodachrome, a father and son hit the road in order to reach the Kansas photo lab before it closes its doors for good.;['Mark Raso', None];['Ed Harris', 'Jason Sudeikis', 'Elizabeth Olsen', 'Bruce Greenwood']
7;The East;2013;Tous publics;116;['Crime', ' Drama', ' Thriller            '];6.8;68;An operative for an elite private intelligence firm finds her priorities changing dramatically after she is tasked with infiltrating an anarchist group known for executing covert attacks upon major corporations.;['Zal Batmanglij', None];['Brit Marling', 'Alexander Skarsgård', 'Elliot Page', 'Toby Kebbell']
8;Chappie;2015;Tous publics avec avertissement;120;['Action', ' Crime', ' Drama            '];6.8;41;In the near future, crime is patrolled by a mechanized police force. When one police droid, Chappie, is stolen and given new programming, he becomes the first robot with the ability to think and feel for himself.;['Neill Blomkamp', None];['Sharlto Copley', 'Dev Patel', 'Hugh Jackman', 'Sigourney Weaver']
9;Hysteria;2014;12;112;['Drama', ' Horror', ' Mystery            '];6.8;52;"An Oxford graduate takes up a job in a mental asylum, only to discover that the ""revolutionary"" new treatments are inhumane, and that there is more going on than meets the eye.";['Brad Anderson', None];['Kate Beckinsale', 'Jim Sturgess', 'David Thewlis', 'Brendan Gleeson']
10;The First Time;I) (2012;PG-13;95;['Comedy', ' Drama', ' Romance            '];6.8;55;A shy senior and a down-to-earth junior fall in love over one weekend.;['Jonathan Kasdan', None];"[""Dylan O'Brien"", 'Britt Robertson', 'Victoria Justice', 'James Frecheville']"
11;Jersey Boys;2014;Tous publics;134;['Biography', ' Drama', ' Music            '];6.8;54;The story of four young men from the wrong side of the tracks in New Jersey who came together to form the iconic 1960s rock group The Four Seasons.;['Clint Eastwood', None];['John Lloyd Young', 'Erich Bergen', 'Michael Lomenda', 'Vincent Piazza']
12;Bernie;2011;Tous Public;99;['Biography', ' Comedy', ' Crime            '];6.8;75;In small-town Texas, an affable mortician strikes up a friendship with a wealthy widow, though when she starts to become controlling, he goes to great lengths to separate himself from her grasp.;['Richard Linklater', None];['Jack Black', 'Shirley MacLaine', 'Matthew McConaughey', 'Brady Coleman']
13;Stoker;2013;12;99;['Drama', ' Thriller            '];6.8;58;After India's father dies, her Uncle Charlie, whom she never knew existed, comes to live with her and her unstable mother. She comes to suspect this mysterious, charming man has ulterior motives and becomes increasingly infatuated with him.;['Park Chan-wook', None];['Mia Wasikowska', 'Nicole Kidman', 'Matthew Goode', 'Dermot Mulroney']
14;3 mètres au-dessus du ciel - Twilight Love;2010;NaN;118;['Action', ' Drama', ' Romance            '];6.8;-1;A privileged woman and a reckless man fall in love despite their different social classes.;['Fernando González Molina', None];['Mario Casas', 'María Valverde', 'Álvaro Cervantes', 'Marina Salas']
15;Courageous;I) (2011;PG-13;130;['Drama            '];6.8;42;When a tragedy strikes close to home, four police officers struggle with their faith and their roles as husbands and fathers. Together they make a decision that will change all of their lives.;['Alex Kendrick', None];['Alex Kendrick', 'Ken Bevel', 'Kevin Downes', 'Renee Jewell']
16;K.O. - Bleed for This;2016;Accord parental;117;['Biography', ' Drama', ' Sport            '];6.8;62;The inspirational story of World Champion Boxer Vinny Pazienza who, after a near fatal car crash which left him not knowing if he'd ever walk again, made one of sports' most incredible comebacks.;['Ben Younger', None];['Miles Teller', 'Aaron Eckhart', 'Katey Sagal', 'Ciarán Hinds']
17;Je te promets;2012;Tous publics;104;['Drama', ' Romance            '];6.8;43;A car accident puts Paige in a coma, and when she wakes up with severe memory loss, her husband Leo works to win her heart again.;['Michael Sucsy', None];['Rachel McAdams', 'Channing Tatum', 'Sam Neill', 'Jessica Lange']
18;Le territoire des loups;2011;12;117;['Action', ' Adventure', ' Drama            '];6.8;64;After their plane crashes in Alaska, six oil workers are led by a skilled huntsman to survival, but a pack of merciless wolves haunts their every step.;['Joe Carnahan', None];['Liam Neeson', 'Dermot Mulroney', 'Frank Grillo', 'Dallas Roberts']
19;Contagion;2011;Tous publics;106;['Drama', ' Thriller            '];6.8;70;Healthcare professionals, government officials and everyday people find themselves in the midst of a pandemic as the CDC works to find a cure.;['Steven Soderbergh', None];['Matt Damon', 'Kate Winslet', 'Jude Law', 'Gwyneth Paltrow']
20;Puncture;2011;R;100;['Biography', ' Drama            '];6.8;54;A David and Goliath law drama about a drug-addicted lawyer who takes on a health supply corporation while battling his own personal demons.;['    Directors:', 'Adam Kassen, ', 'Mark Kassen', None];['Chris Evans', 'Mark Kassen', 'Vinessa Shaw', 'Marshall Bell']
21;The Skeleton Twins;2014;Tous publics;93;['Comedy', ' Drama', ' Romance            '];6.8;74;Having both coincidentally cheated death on the same day, estranged twins reunite with the possibility of mending their relationship.;['Craig Johnson', None];['Kristen Wiig', 'Bill Hader', 'Luke Wilson', 'Ty Burrell']
22;L'incroyable histoire de Winter le dauphin;2011;Tous publics;113;['Drama', ' Family            '];6.8;64;A story centered on the friendship between a boy and a dolphin whose tail was lost in a crab trap.;['Charles Martin Smith', None];['Morgan Freeman', 'Ashley Judd', 'Harry Connick Jr.', 'Nathan Gamble']
23;Anonymous;I) (2011;Tous publics;130;['Drama', ' Thriller            '];6.8;50;The theory that it was in fact Edward De Vere, Earl of Oxford, who penned Shakespeare's plays. Set against the backdrop of the succession of Queen Elizabeth I and the Essex rebellion against her.;['Roland Emmerich', None];['Rhys Ifans', 'Vanessa Redgrave', 'David Thewlis', 'Sebastian Armesto']
24;The Iceman;2012;16;106;['Biography', ' Crime', ' Drama            '];6.8;60;The story of Richard Kuklinski, the notorious contract killer and family man. When he was finally arrested in 1986, neither his wife nor his daughters had any clue about his real profession.;['Ariel Vromen', None];['Michael Shannon', 'Chris Evans', 'James Franco', 'Winona Ryder']
25;Outrage;2010;12;109;['Action', ' Crime', ' Drama            '];6.8;67;The boss of a major crime syndicate orders his lieutenant to bring a rogue gang of drug traffickers in line, a job that gets passed on to his long-suffering subordinate.;['Takeshi Kitano', None];['Takeshi Kitano', 'Kippei Shîna', 'Ryô Kase', 'Fumiyo Kohinata']
26;Fight Games;2011;R;92;['Comedy', ' Drama', ' Sport            '];6.8;64;Labeled an outcast by his brainy family, a bouncer overcomes long odds to lead a team of under performing misfits to semi-pro hockey glory, beating the crap out of everything that stands in his way.;['Michael Dowse', None];['Seann William Scott', 'Jay Baruchel', 'Alison Pill', 'Eugene Levy']
27;Des saumons dans le désert;2011;Tous publics;107;['Comedy', ' Drama', ' Romance            '];6.8;58;A fisheries expert is approached by a consultant to help realize a sheik's vision of bringing the sport of fly-fishing to the desert and embarks on an upstream journey of faith and fish to prove the impossible possible.;['Lasse Hallström', None];['Ewan McGregor', 'Emily Blunt', 'Amr Waked', 'Kristin Scott Thomas']
28;Quartet;2012;Tous Public;98;['Comedy', ' Drama', ' Music            '];6.8;64;At a home for retired musicians, the annual concert to celebrate Composer Giuseppe Verdi's birthday is disrupted by the arrival of Jean (Dame Maggie Smith), an eternal diva and the former wife of one of the residents.;['Dustin Hoffman', None];['Maggie Smith', 'Michael Gambon', 'Billy Connolly', 'Tom Courtenay']
29;Martha Marcy May Marlene;2011;Tous publics avec avertissement;102;['Drama', ' Mystery', ' Thriller            '];6.8;75;Haunted by painful memories and increasing paranoia, a damaged woman struggles to re-assimilate with her family after fleeing an abusive cult.;['Sean Durkin', None];['Elizabeth Olsen', 'Sarah Paulson', 'John Hawkes', 'Christopher Abbott']
30;New York;2009;NaN;153;['Crime', ' Drama', ' Thriller            '];6.8;35;A contemporary story of 3 friends discovering a new world set against the larger than life New York City. But one day the world around them changed.;['Kabir Khan', None];['John Abraham', 'Katrina Kaif', 'Neil Nitin Mukesh', 'Irrfan Khan']
31;Swan Song;I) (2021;10;112;['Drama', ' Romance', ' Sci-Fi            '];6.8;66;In the near future, a terminally ill man explores a heart wrenching, emotionally complex solution to save his wife and son from grief by duplicating himself without them knowing.;['Benjamin Cleary', None];['Mahershala Ali', 'Naomie Harris', 'Awkwafina', 'Glenn Close']
32;Defendor: héros ou zéro;2009;R;101;['Comedy', ' Crime', ' Drama            '];6.8;57;"Arthur Poppington, a regular man who adopts a superhero persona, known as ""Defendor"", combs the city streets at night, in search of his archenemy, Captain Industry.";['Peter Stebbings', None];['Woody Harrelson', 'Kat Dennings', 'Sandra Oh', 'Elias Koteas']
33;The Vanishing of Sidney Hall;2017;R;119;['Drama', ' Mystery', ' Romance            '];6.8;18;Sidney Hall finds accidental success and unexpected love at an early age, then disappears without a trace.;['Shawn Christensen', None];['Logan Lerman', 'Elle Fanning', 'Kyle Chandler', 'Michelle Monaghan']
34;Middle Men;2009;R;105;['Comedy', ' Crime', ' Drama            '];6.8;60;Chronicles Jack Harris, one of the pioneers of Internet commerce, as he wrestles with his morals and struggles not to drown in a sea of con men, mobsters, drug addicts, and porn stars.;['George Gallo', None];['Luke Wilson', 'Giovanni Ribisi', 'Gabriel Macht', 'James Caan']
35;Ondine;2009;Tous publics;111;['Drama', ' Mystery', ' Romance            '];6.8;65;An Irish fisherman discovers a woman in his fishing net whom his precocious daughter believes to be a selkie.;['Neil Jordan', None];['Colin Farrell', 'Alicja Bachleda', 'Dervla Kirwan', 'Alison Barry']
36;L'Affaire Rachel Singer;I) (2010;Tous publics avec avertissement;113;['Drama', ' Thriller            '];6.8;65;In 1965, three Mossad Agents cross into East Berlin to apprehend a notorious Nazi war criminal. Thirty years later, the secrets the Agents share come back to haunt them.;['John Madden', None];['Helen Mirren', 'Sam Worthington', 'Tom Wilkinson', 'Jessica Chastain']
37;Un incroyable talent;2013;Tous Public;103;['Biography', ' Comedy', ' Drama            '];6.8;52;The true story of Paul Potts, a shy, bullied shop assistant by day and an amateur opera singer by night who became a phenomenon after being chosen for -- and ultimately winning -- Britain's Got Talent (2007).;['David Frankel', None];['James Corden', 'Alexandra Roach', 'Julie Walters', 'Colm Meaney']
38;Cemetery Junction;2010;R;95;['Comedy', ' Drama            '];6.8;-1;A 1970s-set comedy centered on three young working class friends in a dreary suburb of Reading.;['    Directors:', 'Ricky Gervais, ', 'Stephen Merchant', None];['Christian Cooke', 'Felicity Jones', 'Tom Hughes', 'Jack Doolan']
39;La Maison;III) (2022;13;97;['Animation', ' Comedy', ' Drama            '];6.8;-1;Across different eras, a poor family, an anxious developer and a fed-up landlady become tied to the same mysterious house in this animated dark comedy.;['    Directors:', 'Paloma Baeza, ', 'Emma De Swaef, ', 'Niki Lindroth von Bahr, ', 'Marc James Roels', None];['Mia Goth', 'Matthew Goode', 'Claudie Blakley', 'Eleanor De Swaef-Roels']
40;La guerre de l'ombre;2008;R;117;['Crime', ' Drama', ' Thriller            '];6.8;57;Martin McGartland joins the I.R.A. and feeds information to Britain's Special Branch Agent Fergus.;['Kari Skogland', None];['Ben Kingsley', 'Jim Sturgess', 'Kevin Zegers', 'Natalie Press']
41;Adventureland - Job d'été à éviter;2009;R;107;['Comedy', ' Drama', ' Romance            '];6.8;76;In the summer of 1987, a college graduate takes a 'nowhere' job at his local amusement park, only to find it's the perfect course to get him prepared for the real world.;['Greg Mottola', None];['Jesse Eisenberg', 'Kristen Stewart', 'Ryan Reynolds', 'Martin Starr']
42;Ink;I) (2009;NaN;107;['Action', ' Drama', ' Fantasy            '];6.8;-1;A mysterious creature, known as Ink, steals a child's soul in hopes of using it as a bargaining chip to join the Incubi - the group of supernatural beings responsible for creating nightmares.;['Jamin Winans', None];['Christopher Soren Kelly', 'Quinn Hunchar', 'Jessica Duffy', 'Jennifer Batter']
43;La vie extraordinaire de Louis Wain;2021;PG-13;111;['Biography', ' Drama', ' History            '];6.8;63;English artist Louis Wain rises to prominence at the end of the 19th century for his surreal cat paintings that seemed to reflect his declining sanity.;['Will Sharpe', None];['Benedict Cumberbatch', 'Claire Foy', 'Andrea Riseborough', 'Toby Jones']
44;Loin de la terre brûlée;2008;R;107;['Crime', ' Drama', ' Romance            '];6.8;45;A drama with a two-tiered storyline concerning a mother and daughter who try to form a bond after the young woman's difficult childhood.;['Guillermo Arriaga', None];['Charlize Theron', 'John Corbett', 'José María Yazpik', 'Robin Tunney']
45;Le drôle de Noël de Scrooge;2009;Tous Public;96;['Animation', ' Adventure', ' Comedy            '];6.8;55;An animated retelling of Charles Dickens' classic novel about a Victorian-era miser taken on a journey of self-redemption, courtesy of several mysterious Christmas apparitions.;['Robert Zemeckis', None];['Jim Carrey', 'Gary Oldman', 'Colin Firth', 'Steve Valentine']
46;Mank;2020;13;131;['Biography', ' Comedy', ' Drama            '];6.8;79;1930s Hollywood is re-evaluated through the eyes of scathing social critic and alcoholic screenwriter Herman J. Mankiewicz as he races to finish the screenplay of Citizen Kane (1941).;['David Fincher', None];['Gary Oldman', 'Amanda Seyfried', 'Lily Collins', 'Tom Pelphrey']
47;Love away;2009;NaN;125;['Drama', ' Romance            '];6.8;51;While on a trip to Thailand, a successful American businessman tries to radically change his life. Back in New York, his wife and daughter find their relationship with their live-in Filipino maid changing around them. At the same time, in the Philippines, the maid's family struggles to deal with her absence.;['Lukas Moodysson', None];['Gael García Bernal', 'Michelle Williams', 'Marife Necesito', 'Sophie Nyweide']
48;Le Livre d'Eli;2010;Tous publics avec avertissement;118;['Action', ' Adventure', ' Drama            '];6.8;53;A post-apocalyptic tale, in which a lone man fights his way across America in order to protect a sacred book that holds the secrets to saving humankind.;['    Directors:', 'Albert Hughes, ', 'Allen Hughes', None];['Denzel Washington', 'Mila Kunis', 'Ray Stevenson', 'Gary Oldman']
49;Flashbacks of a Fool;2008;R;109;['Drama            '];6.8;-1;A fading Hollywood star looks back at the days of his youth as he returns home from his best friend's funeral.;['Baillie Walsh', None];['Daniel Craig', 'Harry Eden', 'Eve', 'Olivia Williams']
0;Intermission;2003;R;105;['Comedy', ' Crime', ' Drama            '];6.8;64;A variety of losers in Dublin have harrowingly farcical intersecting stories of love, greed and violence.;['John Crowley', None];['Cillian Murphy', 'Kelly Macdonald', 'Colin Farrell', 'Shirley Henderson']
1;Frère des ours;2003;Tous publics;85;['Animation', ' Adventure', ' Comedy            '];6.8;48;When a young Inuit hunter needlessly kills a bear, he is magically changed into a bear himself as punishment with a talkative cub being his only guide to changing back.;['    Directors:', 'Aaron Blaise, ', 'Robert Walker', None];['Joaquin Phoenix', 'Jeremy Suarez', 'Rick Moranis', 'Jason Raize']
2;Thirteen;2003;16;100;['Drama            '];6.8;70;A thirteen-year-old girl's relationship with her mother is put to the test as she discovers drugs, sex, and petty crime in the company of her cool but troubled best friend.;['Catherine Hardwicke', None];['Evan Rachel Wood', 'Holly Hunter', 'Nikki Reed', 'Vanessa Hudgens']
3;Veronica Guerin;2003;R;98;['Biography', ' Crime', ' Drama            '];6.8;55;An Irish journalist writes a series of stories about drug dealers.;['Joel Schumacher', None];['Cate Blanchett', 'Colin Farrell', 'Brenda Fricker', 'Ciarán Hinds']
4;Rent;2005;Tous Public;135;['Drama', ' Musical', ' Romance            '];6.8;53;This is the film version of the Pulitzer and Tony Award winning musical about Bohemians in the East Village of New York City struggling with life, love and AIDS, and the impacts they have on America.;['Chris Columbus', None];['Taye Diggs', 'Wilson Jermaine Heredia', 'Rosario Dawson', 'Anthony Rapp']
