;name;year;certificate;runtime;genre;rating;metascore;text-muted;director;stars
25;24 Hour Party People;2002;Tous publics;117;['Biography', ' Comedy', ' Drama            '];7.3;85;In 1976, Tony Wilson sets up Factory Records and brings Manchester's music to the world.;['Michael Winterbottom', None];['Steve Coogan', 'Lennie James', 'John Thomson', 'Nigel Pivaro']
26;Hilary and Jackie;1998;R;121;['Biography', ' Drama', ' Music            '];7.3;78;The tragic story of world renowned classic cellist Jacqueline du Pré, as told from the point of view of her sister, flautist Hilary du Pré-Finzi.;['Anand Tucker', None];['Emily Watson', 'Rachel Griffiths', 'James Frain', 'David Morrissey']
27;Tarzan;1999;Tous publics;88;['Animation', ' Adventure', ' Comedy            '];7.3;79;A man raised by gorillas must decide where he really belongs when he discovers he is a human.;['    Directors:', 'Chris Buck, ', 'Kevin Lima', None];['Tony Goldwyn', 'Minnie Driver', 'Brian Blessed', 'Glenn Close']
28;Professeur Holland;1995;Tous Public;143;['Drama', ' Music            '];7.3;59;A frustrated composer finds fulfillment as a high school music teacher.;['Stephen Herek', None];['Richard Dreyfuss', 'Glenne Headly', 'Jay Thomas', 'Olympia Dukakis']
29;Tina;1993;Tous publics;118;['Biography', ' Drama', ' Music            '];7.3;76;The story of singer Tina Turner's rise to stardom and how she gained the courage to break free from her abusive husband, Ike Turner.;['Brian Gibson', None];['Angela Bassett', 'Laurence Fishburne', 'RaéVen Kelly', 'Virginia Capers']
30;Phantom of the Paradise;1974;12;91;['Comedy', ' Drama', ' Fantasy            '];7.3;67;A disfigured composer sells his soul for the woman he loves so that she will perform his music. However, an evil record tycoon betrays him and steals his music to open his rock palace, The Paradise.;['Brian De Palma', None];['Paul Williams', 'William Finley', 'Jessica Harper', 'Gerrit Graham']
31;L'amour chante et danse;1942;Tous Public;100;['Comedy', ' Drama', ' Music            '];7.3;-1;At an inn which is open only on holidays, a crooner and a hoofer vie for the affections of a beautiful up-and-coming performer.;['    Directors:', 'Mark Sandrich, ', 'Robert Allen', None];['Bing Crosby', 'Fred Astaire', 'Marjorie Reynolds', 'Virginia Dale']
32;Milla;2019;Tous publics;118;['Comedy', ' Drama', ' Music            '];7.2;77;Milla, a seriously ill teenager, falls in love with a drug dealer, Moses, her parents' worst nightmare.;['Shannon Murphy', None];['Eliza Scanlen', 'Michelle Lotters', 'Toby Wallace', 'Sora Wakaki']
33;Crazy Heart;2009;Tous publics;112;['Drama', ' Music', ' Romance            '];7.2;83;A faded country music musician is forced to reassess his dysfunctional life during a doomed romance that also inspires him.;['Scott Cooper', None];['Jeff Bridges', 'Maggie Gyllenhaal', 'Colin Farrell', 'James Keane']
34;De battre mon cœur s'est arrêté;2005;Tous publics;108;['Crime', ' Drama', ' Music            '];7.2;75;Will Thomas still lead a life of crime and cruelty, just like his thuggish father, or will he pursue his dream of becoming a pianist?;['Jacques Audiard', None];['Romain Duris', 'Aure Atika', 'Emmanuelle Devos', 'Niels Arestrup']
35;Rock academy;2003;Tous Public;109;['Comedy', ' Music            '];7.2;82;After being kicked out of his rock band, Dewey Finn becomes a substitute teacher of an uptight elementary private school, only to try and turn his class into a rock band.;['Richard Linklater', None];['Jack Black', 'Mike White', 'Joan Cusack', 'Adam Pascal']
36;A Mighty Wind;2003;PG-13;91;['Comedy', ' Music            '];7.2;81;Mockumentary captures the reunion of 1960s folk trio the Folksmen as they prepare for a show at The Town Hall to memorialize a recently deceased concert promoter.;['Christopher Guest', None];['Christopher Guest', 'Eugene Levy', 'Michael McKean', 'Harry Shearer']
37;8 Mile;2002;Tous publics;110;['Drama', ' Music            '];7.2;77;A young rapper, struggling with every aspect of his life, wants to make it big but his friends and foes make this odyssey of rap harder than it may seem.;['Curtis Hanson', None];['Eminem', 'Brittany Murphy', 'Kim Basinger', 'Mekhi Phifer']
38;Accords & désaccords;1999;Tous publics;95;['Comedy', ' Drama', ' Music            '];7.2;70;In the 1930s, jazz guitarist Emmet Ray idolizes Django Reinhardt, faces gangsters and falls in love with a mute woman.;['Woody Allen', None];['Sean Penn', 'Samantha Morton', 'Woody Allen', 'Ben Duncan']
39;Les virtuoses;1996;R;108;['Comedy', ' Drama', ' Music            '];7.2;60;The coal mine in a northern English village may be closing, which would also mean the end of the miners' brass band.;['Mark Herman', None];['Pete Postlethwaite', 'Tara Fitzgerald', 'Ewan McGregor', 'Stephen Tompkinson']
40;Ballroom Dancing;1992;Tous Public;94;['Comedy', ' Drama', ' Music            '];7.2;72;A maverick dancer risks his career by performing an unusual routine and sets out to succeed with a new partner.;['Baz Luhrmann', None];['Paul Mercurio', 'Tara Morice', 'Bill Hunter', 'Pat Thomson']
41;Les Doors;1991;Tous publics;140;['Biography', ' Drama', ' Music            '];7.2;62;The story of the famous and influential 1960s rock band The Doors and its lead singer and composer, Jim Morrison, from his days as a UCLA film student in Los Angeles, to his untimely death in Paris, France at age 27 in 1971.;['Oliver Stone', None];['Val Kilmer', 'Meg Ryan', 'Kyle MacLachlan', 'Frank Whaley']
42;Pump Up the Volume;1990;Tous publics;102;['Comedy', ' Drama', ' Music            '];7.2;77;Mark runs a pirate radio station and causes an uproar when he speaks his mind and enthralls fellow teens.;['Allan Moyle', None];['Christian Slater', 'Samantha Mathis', 'Anthony Lucero', 'Andy Romano']
43;Top Secret !;1984;Tous publics;90;['Comedy', ' Crime', ' Music            '];7.2;68;An American rock and roll singer becomes involved in a Resistance plot to rescue a scientist imprisoned in East Germany.;['    Directors:', 'Jim Abrahams, ', 'David Zucker, ', 'Jerry Zucker', None];['Val Kilmer', 'Omar Sharif', 'Jeremy Kemp', 'Warren Clarke']
44;Diva;1981;NaN;117;['Crime', ' Music', ' Thriller            '];7.2;-1;Two tapes, two Parisian mob killers, one corrupt policeman, an opera fan, a teenage thief, and the coolest philosopher ever filmed all twist their way through an intricate and stylish French-language thriller.;['Jean-Jacques Beineix', None];['Wilhelmenia Fernandez', 'Frédéric Andréi', 'Richard Bohringer', 'Thuy An Luu']
45;Quadrophenia;1979;16;120;['Drama', ' Music            '];7.2;79;Jimmy loathes his job and parents. He seeks solace with his mod clique, scooter riding, and drugs, only to be disappointed.;['Franc Roddam', None];['Phil Daniels', 'Leslie Ash', 'Phil Davis', 'Mark Wingett']
46;Shadows;1958;Tous Public;81;['Drama', ' Music', ' Romance            '];7.2;86;Cassavetes' jazz-scored improvisational film explores interracial friendships and relationships in Beat-Era (1950s) New York City.;['John Cassavetes', None];['Ben Carruthers', 'Lelia Goldoni', 'Hugh Hurd', 'Anthony Ray']
47;Wild Rose;2018;Tous publics;101;['Drama', ' Music            '];7.1;80;A troubled young Glaswegian woman dreams of becoming a Nashville country star.;['Tom Harper', None];['Jessie Buckley', 'Matt Costello', 'Jane Patterson', 'Lesley Hart']
48;Metallica Through the Never;2013;Tous publics;93;['Music            '];7.1;61;Trip, a young roadie for Metallica, is sent on an urgent mission during the band's show. But what seems like a simple assignment turns into a surreal adventure.;['Nimród Antal', None];['Dane DeHaan', 'James Hetfield', 'Lars Ulrich', 'Kirk Hammett']
49;The Hit Girls;2012;Tous publics;112;['Comedy', ' Music', ' Romance            '];7.1;66;Beca, a freshman at Barden University, is cajoled into joining The Bellas, her school's all-girls singing group. Injecting some much needed energy into their repertoire, The Bellas take on their male rivals in a campus competition.;['Jason Moore', None];['Anna Kendrick', 'Brittany Snow', 'Rebel Wilson', 'Anna Camp']
0;Ill Manors;2012;12;121;['Crime', ' Drama', ' Music            '];7.1;-1;The lives of four drug dealers, one user, and two prostitutes are explored.;['Plan B', None];['Riz Ahmed', 'Sliem Ben-Salah', 'Ed Skrein', 'Lee Allen']
1;Nowhere Boy;2009;Tous publics;98;['Biography', ' Drama', ' Music            '];7.1;67;A chronicle of John Lennon's first years, focused mainly in his adolescence and his relationship with his stern aunt Mimi, who raised him, and his absentee mother Julia, who re-entered his life at a crucial moment in his young life.;['Sam Taylor-Johnson', None];['Aaron Taylor-Johnson', 'Kristin Scott Thomas', 'Anne-Marie Duff', 'David Threlfall']
2;Le Quatuor;2012;Tous publics;105;['Drama', ' Music            '];7.1;67;Members of a world-renowned string quartet struggle to stay together in the face of death, competing egos, and insuppressible lust.;['Yaron Zilberman', None];['Philip Seymour Hoffman', 'Christopher Walken', 'Catherine Keener', 'Mark Ivanir']
3;Kinky Boots;2005;Tous Public;107;['Comedy', ' Drama', ' Music            '];7.1;57;A drag queen comes to the rescue of a man who, after inheriting his father's shoe factory, needs to diversify his product if he wants to keep the business afloat.;['Julian Jarrold', None];['Chiwetel Ejiofor', 'Joel Edgerton', 'Sarah-Jane Potts', 'Jemima Rooper']
4;Human Traffic;1999;Tous publics;99;['Comedy', ' Music            '];7.1;53;Five friends spend one lost weekend in a mix of music, love and club culture.;['Justin Kerrigan', None];['John Simm', 'Lorraine Pilkington', 'Shaun Parkes', 'Nicola Reynolds']
5;Fantasia 2000;1999;Tous publics;75;['Animation', ' Family', ' Fantasy            '];7.1;59;An update of the original film with new interpretations of great works of classical music.;['    Directors:', 'James Algar, ', 'Gaëtan Brizzi, ', 'Paul Brizzi, ', 'Hendel Butoy, ', 'Francis Glebas, ', 'Eric Goldberg, ', 'Don Hahn, ', 'Pixote Hunt', None];['James Levine', 'Steve Martin', 'Itzhak Perlman', 'Quincy Jones']
6;Bird;1988;Tous publics;161;['Biography', ' Drama', ' Music            '];7.1;78;"The troubled life and career of jazz musician Charlie ""Bird"" Parker.";['Clint Eastwood', None];['Forest Whitaker', 'Diane Venora', 'Michael Zelniker', 'Samuel E. Wright']
7;Crossroads;1986;NaN;99;['Drama', ' Music', ' Mystery            '];7.1;55;A wannabe blues guitar virtuoso seeks a long-lost song by the legendary musician Robert Johnson.;['Walter Hill', None];['Ralph Macchio', 'Joe Seneca', 'Jami Gertz', 'Joe Morton']
8;Green Room;2015;R;95;['Crime', ' Drama', ' Horror            '];7.0;79;A punk rock band is forced to fight for survival after witnessing a murder at a neo-Nazi skinhead bar.;['Jeremy Saulnier', None];['Anton Yelchin', 'Imogen Poots', 'Alia Shawkat', 'Patrick Stewart']
9;Danny Collins;2015;R;106;['Biography', ' Comedy', ' Drama            '];7.0;58;An aging rock star decides to change his life when he discovers a 40-year-old letter written to him by John Lennon.;['Dan Fogelman', None];['Al Pacino', 'Annette Bening', 'Jennifer Garner', 'Bobby Cannavale']
10;Les Saphirs;2012;Tous publics;103;['Biography', ' Comedy', ' Drama            '];7.0;67;It's 1968, and four young, talented Australian Aboriginal girls learn about love, friendship and war when their all-girl group The Sapphires entertain the US troops in Vietnam.;['Wayne Blair', None];"[""Chris O'Dowd"", 'Deborah Mailman', 'Jessica Mauboy', 'Shari Sebbens']"
11;Ma vie avec Liberace;2013;18;118;['Biography', ' Drama', ' Music            '];7.0;-1;A chronicle of the tempestuous six-year romance between megastar singer Liberace and his young lover Scott Thorson.;['Steven Soderbergh', None];['Michael Douglas', 'Matt Damon', 'Scott Bakula', 'Eric Zuckerman']
12;Cadillac Records;2008;R;109;['Biography', ' Drama', ' Music            '];7.0;65;Chronicles the rise of Chess Records and its recording artists.;['Darnell Martin', None];['Adrien Brody', 'Jeffrey Wright', 'Beyoncé', 'Columbus Short']
13;The Dirt;2019;18;107;['Biography', ' Comedy', ' Drama            '];7.0;39;Based on the bestselling autobiography from Mötley Crüe, the film is an unflinching tale of success and excess as four misfits rise from the streets of Hollywood to the heights of international fame.;['Jeff Tremaine', None];['Douglas Booth', 'Iwan Rheon', 'Colson Baker', 'Daniel Webber']
14;Madame Henderson présente;2005;Tous publics;103;['Comedy', ' Drama', ' Music            '];7.0;71;Laura Henderson (Dame Judi Dench) buys an old London theater and opens it up as the Windmill, a performance hall which goes down in history for, amongst other things, its all-nude revues.;['Stephen Frears', None];['Judi Dench', 'Bob Hoskins', 'Christopher Guest', 'Will Young']
15;Coffee and Cigarettes;2003;Tous publics;95;['Comedy', ' Drama', ' Music            '];7.0;65;A series of vignettes that all have coffee and cigarettes in common.;['Jim Jarmusch', None];['Bill Murray', 'Tom Waits', 'Roberto Benigni', 'RZA']
16;Les dames de Cornouailles;2004;Tous publics;104;['Drama', ' Music', ' Romance            '];7.0;61;Two sisters befriend a mysterious foreigner who washes up on the beach of their 1930s Cornish seaside village.;['Charles Dance', None];['Judi Dench', 'Maggie Smith', 'Daniel Brühl', 'Freddie Jones']
17;Little Voice;1998;Tous publics;97;['Comedy', ' Drama', ' Music            '];7.0;68;A shy reclusive lady is convinced by an invisible entity to sing. Subsequently, she finds herself noticed by a sleazy talent agent and her talent being showcased on-stage. She also meets a kind but nervous man who becomes her best friend.;['Mark Herman', None];['Brenda Blethyn', 'Jane Horrocks', 'Michael Caine', 'Ewan McGregor']
18;Wayne's World;1992;Tous publics;94;['Comedy', ' Music            '];7.0;57;Two slacker friends try to promote their public-access cable show.;['Penelope Spheeris', None];['Mike Myers', 'Dana Carvey', 'Rob Lowe', 'Tia Carrere']
19;Hairspray;1988;Tous publics;92;['Comedy', ' Drama', ' Family            '];7.0;77;A 'pleasantly plump' teenager teaches 1962 Baltimore a thing or two about integration after landing a spot on a local TV dance show.;['John Waters', None];['Sonny Bono', 'Ruth Brown', 'Divine', 'Debbie Harry']
20;Dirty Dancing;I) (1987;Tous publics;100;['Drama', ' Music', ' Romance            '];7.0;65;"Spending the summer at a Catskills resort with her family, Frances ""Baby"" Houseman falls in love with the camp's dance instructor, Johnny Castle.";['Emile Ardolino', None];['Patrick Swayze', 'Jennifer Grey', 'Jerry Orbach', 'Cynthia Rhodes']
21;Sid & Nancy;1986;12;112;['Biography', ' Drama', ' Music            '];7.0;76;The relationship between Sid Vicious, bassist for British punk group Sex Pistols, and his girlfriend Nancy Spungen is portrayed.;['Alex Cox', None];['Gary Oldman', 'Chloe Webb', 'David Hayman', 'Debby Bishop']
22;La route semée d'étoiles;1944;Tous Public;126;['Comedy', ' Drama', ' Music            '];7.0;-1;When young Father O'Malley arrives at St. Dominic's, old Father Fitzgibbon doesn't think much of the church's newest member.;['Leo McCarey', None];['Bing Crosby', 'Barry Fitzgerald', 'Frank McHugh', 'James Brown']
23;Climax;I) (2018;16;97;['Drama', ' Horror', ' Music            '];6.9;67;French dancers gather in a remote, empty school building to rehearse on a wintry night. The all-night celebration morphs into a hallucinatory nightmare when they learn their sangria is laced with LSD.;['Gaspar Noé', None];['Sofia Boutella', 'Romain Guillermic', 'Souheila Yacoub', 'Kiddy Smile']
24;Music of my Life;2019;Tous publics;118;['Comedy', ' Drama', ' Music            '];6.9;71;In England in 1987, a teenager from an Asian family learns to live his life, understand his family and find his own voice through the music of American rock star Bruce Springsteen.;['Gurinder Chadha', None];['Billy Barratt', 'Ronak Singh Chadha Berges', 'Viveik Kalra', 'Lee Barnett']
25;Hearts Beat Loud;2018;PG-13;97;['Comedy', ' Drama', ' Music            '];6.9;65;A father and daughter form an unlikely songwriting duo in the summer before she leaves for college.;['Brett Haley', None];['Nick Offerman', 'Kiersey Clemons', 'Blythe Danner', 'Toni Collette']
26;Get on Up, James Brown: une épopée américaine;2014;Tous publics;139;['Biography', ' Drama', ' Music            '];6.9;71;A chronicle of James Brown's rise from extreme poverty to become one of the most influential musicians in history.;['Tate Taylor', None];['Chadwick Boseman', 'Nelsan Ellis', 'Dan Aykroyd', 'Viola Davis']
27;Frank;II) (2014;Tous publics;95;['Comedy', ' Drama', ' Music            '];6.9;75;Jon, a young wanna-be musician, discovers he's bitten off more than he can chew when he joins an eccentric pop band led by the mysterious and enigmatic Frank.;['Lenny Abrahamson', None];['Michael Fassbender', 'Domhnall Gleeson', 'Maggie Gyllenhaal', 'Moira Brooker']
28;Rio;2011;Tous publics;96;['Animation', ' Adventure', ' Comedy            '];6.9;63;When Blu, a domesticated macaw from small-town Minnesota, meets the fiercely independent Jewel, he takes off on an adventure to Rio de Janeiro with the bird of his dreams.;['Carlos Saldanha', None];['Jesse Eisenberg', 'Anne Hathaway', 'George Lopez', 'Karen Disher']
29;Gainsbourg (Vie héroïque);2010;Tous publics;135;['Biography', ' Drama', ' Music            '];6.9;58;A glimpse at the life of French singer Serge Gainsbourg, from growing up in 1940s Nazi-occupied Paris through his successful song-writing years in the 1960s to his death in 1991 at the age of 62.;['Joann Sfar', None];['Eric Elmosnino', 'Lucy Gordon', 'Laetitia Casta', 'Doug Jones']
30;Le Blues de Ma Rainey;2020;16;94;['Drama', ' Music            '];6.9;87;Tensions rise when trailblazing blues singer Ma Rainey and her band gather at a recording studio in Chicago in 1927.;['George C. Wolfe', None];['Viola Davis', 'Chadwick Boseman', 'Glynn Turman', 'Colman Domingo']
31;Black Snake Moan;2006;Tous publics avec avertissement;116;['Drama', ' Music            '];6.9;52;A God-fearing bluesman takes to a wild young woman who, as a victim of childhood sexual abuse, looks everywhere for love, never quite finding it.;['Craig Brewer', None];['Christina Ricci', 'Samuel L. Jackson', 'Justin Timberlake', 'S. Epatha Merkerson']
32;Wedding Singer : Demain on se marie !;1998;Tous publics;97;['Comedy', ' Music', ' Romance            '];6.9;59;Robbie, a singer, and Julia, a waitress, are both engaged, but to the wrong people. Fortune intervenes to help them discover each other.;['Frank Coraci', None];['Adam Sandler', 'Drew Barrymore', 'Christine Taylor', 'Allen Covert']
33;Velvet Goldmine;1998;Tous publics;118;['Drama', ' Music            '];6.9;65;In 1984, British journalist Arthur Stuart investigates the career of 1970s glam superstar Brian Slade, who was heavily influenced in his early years by hard-living and rebellious American singer Curt Wild.;['Todd Haynes', None];['Ewan McGregor', 'Jonathan Rhys Meyers', 'Christian Bale', 'Toni Collette']
34;That Thing You Do!;1996;Tous Public;108;['Comedy', ' Drama', ' Music            '];6.9;71;A local Pennsylvania band scores a one-hit wonder in 1964 and rides the star-making machinery as long as they can, with lots of help from their manager.;['Tom Hanks', None];['Tom Hanks', 'Liv Tyler', 'Charlize Theron', 'Tom Everett Scott']
35;Susie et les Baker Boys;1989;NaN;114;['Comedy', ' Drama', ' Music            '];6.9;85;The lives of two struggling musicians, who happen to be brothers, inevitably change when they team up with a beautiful, up-and-coming singer.;['Steve Kloves', None];['Jeff Bridges', 'Michelle Pfeiffer', 'Beau Bridges', 'Ellie Raab']
36;L'Excellente Aventure de Bill & Ted;1989;Tous publics;90;['Adventure', ' Comedy', ' Music            '];6.9;50;Two rock-'n-rolling teens, on the verge of failing their class, are approached by a time machine that helps them make the ultimate history presentation.;['Stephen Herek', None];['Keanu Reeves', 'Alex Winter', 'George Carlin', 'Terry Camilleri']
37;Au fil de la vie;1988;Tous publics;123;['Comedy', ' Drama', ' Music            '];6.9;46;A privileged rich debutante and a cynical struggling entertainer share a turbulent, but strong childhood friendship over the years.;['Garry Marshall', None];['Bette Midler', 'Barbara Hershey', 'John Heard', 'Spalding Gray']
38;La Bamba;1987;Tous publics;108;['Biography', ' Drama', ' Music            '];6.9;65;Biographical story of the rise from nowhere of early rock and roll singer Ritchie Valens who died at age 17 in a plane crash with Buddy Holly and The Big Bopper.;['Luis Valdez', None];['Lou Diamond Phillips', 'Esai Morales', 'Rosanna DeSoto', 'Elizabeth Peña']
39;Faut trouver le joint;1978;16;86;['Comedy', ' Music            '];6.9;57;Two stoners unknowingly smuggle a van - made entirely of marijuana - from Mexico to L.A., with incompetent Sgt. Stedenko on their trail.;['    Directors:', 'Lou Adler, ', 'Tommy Chong', None];['Cheech Marin', 'Tommy Chong', 'Strother Martin', 'Edie Adams']
40;Yesterday;III) (2019;Tous publics;116;['Comedy', ' Fantasy', ' Music            '];6.8;55;A struggling musician realizes he's the only person on Earth who can remember The Beatles after waking up in an alternate reality where they never existed.;['Danny Boyle', None];['Himesh Patel', 'Lily James', 'Sophia Di Martino', 'Ellise Chappell']
41;Patti Cake$;2017;R;109;['Drama', ' Music            '];6.8;67;PATTI CAKE$ is centered on aspiring rapper Patricia Dombrowski, a.k.a. Killa P, a.k.a. Patti Cake$, who is fighting an unlikely quest for glory in her downtrodden hometown in New Jersey.;['Geremy Jasper', None];['Danielle Macdonald', 'Sahr Ngaujah', 'Bridget Everett', 'Mamoudou Athie']
42;Florence Foster Jenkins;2016;Tous Public;111;['Biography', ' Comedy', ' Drama            '];6.8;71;The story of Florence Foster Jenkins, a New York heiress who dreamed of becoming an opera singer, despite having a terrible singing voice.;['Stephen Frears', None];['Meryl Streep', 'Hugh Grant', 'Simon Helberg', 'Rebecca Ferguson']
43;Beyond the Lights;2014;PG-13;116;['Drama', ' Music', ' Romance            '];6.8;73;The pressures of fame have superstar singer Noni on the edge, until she meets Kaz, a young cop who works to help her find the courage to develop her own voice and break free to become the artist she was meant to be.;['Gina Prince-Bythewood', None];['Gugu Mbatha-Raw', 'Nate Parker', 'Minnie Driver', 'Danny Glover']
44;Jersey Boys;2014;Tous publics;134;['Biography', ' Drama', ' Music            '];6.8;54;The story of four young men from the wrong side of the tracks in New Jersey who came together to form the iconic 1960s rock group The Four Seasons.;['Clint Eastwood', None];['John Lloyd Young', 'Erich Bergen', 'Michael Lomenda', 'Vincent Piazza']
45;Quartet;2012;Tous Public;98;['Comedy', ' Drama', ' Music            '];6.8;64;At a home for retired musicians, the annual concert to celebrate Composer Giuseppe Verdi's birthday is disrupted by the arrival of Jean (Dame Maggie Smith), an eternal diva and the former wife of one of the residents.;['Dustin Hoffman', None];['Maggie Smith', 'Michael Gambon', 'Billy Connolly', 'Tom Courtenay']
46;Un incroyable talent;2013;Tous Public;103;['Biography', ' Comedy', ' Drama            '];6.8;52;The true story of Paul Potts, a shy, bullied shop assistant by day and an amateur opera singer by night who became a phenomenon after being chosen for -- and ultimately winning -- Britain's Got Talent (2007).;['David Frankel', None];['James Corden', 'Alexandra Roach', 'Julie Walters', 'Colm Meaney']
47;Walk Hard: The Dewey Cox Story;2007;R;96;['Comedy', ' Music            '];6.8;63;Singer Dewey Cox overcomes adversity to become a musical legend.;['Jake Kasdan', None];['John C. Reilly', 'Jenna Fischer', 'David Krumholtz', 'Nat Faxon']
48;Horton;2008;Tous Public;86;['Animation', ' Adventure', ' Comedy            '];6.8;71;Horton the Elephant struggles to protect a microscopic community from his neighbors who refuse to believe it exists.;['    Directors:', 'Jimmy Hayward, ', 'Steve Martino', None];['Jim Carrey', 'Steve Carell', 'Carol Burnett', 'Will Arnett']
49;Bienvenue chez les Robinson;2007;Tous Public;95;['Animation', ' Adventure', ' Comedy            '];6.8;61;Lewis is a brilliant inventor who meets mysterious stranger named Wilbur Robinson, whisking Lewis away in a time machine and together they team up to track down Bowler Hat Guy in a showdown that ends with an unexpected twist of fate.;['Stephen J. Anderson', None];['Daniel Hansen', 'Wesley Singerman', 'Angela Bassett', 'Jordan Fry']
0;I'm Not There;2007;Tous publics;135;['Biography', ' Drama', ' Music            '];6.8;73;Ruminations on the life of Bob Dylan, where six characters embody a different aspect of the musician's life and work.;['Todd Haynes', None];['Christian Bale', 'Cate Blanchett', 'Heath Ledger', 'Ben Whishaw']
1;Tenacious D in the Pick of Destiny;2006;Tous publics;94;['Adventure', ' Comedy', ' Music            '];6.8;55;To become the greatest band of all time, two slacker, wannabe-rockers set out on a quest to steal a legendary guitar pick that gives its holders incredible guitar skills, from a maximum security Rock and Roll museum.;['Liam Lynch', None];['Jack Black', 'Kyle Gass', 'JR Reed', 'Ronnie James Dio']
2;La musique de mon coeur;1999;Tous publics;124;['Drama', ' Music            '];6.8;54;Story of a schoolteacher's struggle to teach violin to inner-city Harlem kids.;['Wes Craven', None];['Meryl Streep', 'Cloris Leachman', 'Henry Dinhofer', 'Michael Angarano']
3;Detroit Rock City;1999;Tous publics;95;['Adventure', ' Comedy', ' Music            '];6.8;33;In 1978, four rebellious teenagers try to scam their way into a KISS concert.;['Adam Rifkin', None];['Edward Furlong', 'Giuseppe Andrews', 'James DeBello', 'Sam Huntington']
