;name;year;certificate;runtime;genre;rating;metascore;text-muted;director;stars
11;En territoire ennemi;2001;Tous publics;106;['Action', ' Drama', ' Thriller            '];6.4;49;A disillusioned pilot shot down over war-torn Bosnia is ensnared in the conflict in war-torn Bosnia. In the crosshairs of the enemy and an assassin, the spoiled pilot runs for his life as his commanding officer risks all to save him.;['John Moore', None];['Gene Hackman', 'Owen Wilson', 'Gabriel Macht', 'Charles Malik Whitfield']
12;Enigma;2001;R;119;['Drama', ' Mystery', ' Romance            '];6.4;64;A young genius frantically races against time to crack an enemy code and solve the mystery surrounding the woman he loves.;['Michael Apted', None];['Dougray Scott', 'Kate Winslet', 'Saffron Burrows', 'Jeremy Northam']
13;Le déshonneur d'Elisabeth Campbell;1999;12;116;['Crime', ' Drama', ' Mystery            '];6.4;47;When the daughter of a well-known and well-respected base commander is murdered, an undercover detective is summoned to look into the matter and finds a slew of cover-ups at West Point.;['Simon West', None];['John Travolta', 'Madeleine Stowe', 'James Cromwell', 'Timothy Hutton']
14;Le monde ne suffit pas;1999;Tous publics;128;['Action', ' Adventure', ' Thriller            '];6.4;57;James Bond uncovers a nuclear plot while protecting an oil heiress from her former kidnapper, an international terrorist who can't feel pain.;['Michael Apted', None];['Pierce Brosnan', 'Sophie Marceau', 'Robert Carlyle', 'Denise Richards']
15;The Yards;2000;Tous publics;115;['Crime', ' Drama', ' Romance            '];6.4;58;Leo is released from prison after serving time for car theft. His plan to go straight falls apart when he meets his corrupt uncle for a job and later an old friend working there. It culminates at the (railroad) yards.;['James Gray', None];['Mark Wahlberg', 'Joaquin Phoenix', 'Charlize Theron', 'James Caan']
16;Couvre-feu;1998;Tous publics;116;['Action', ' Thriller            '];6.4;53;The secret U.S. abduction of a suspected terrorist leads to a wave of terrorist attacks in New York City, which leads to the declaration of martial-law.;['Edward Zwick', None];['Denzel Washington', 'Bruce Willis', 'Annette Bening', 'Tony Shalhoub']
17;Trader;1999;Tous publics;101;['Crime', ' Drama', ' History            '];6.4;-1;The story of Nick Leeson, an ambitious investment broker who singlehandedly bankrupted one of the oldest and most important banks in Britain.;['James Dearden', None];['Ewan McGregor', 'Anna Friel', 'Cristian Solimeno', 'Lorna Pegler']
18;Star Trek : Insurrection;1998;Tous publics;103;['Action', ' Adventure', ' Sci-Fi            '];6.4;64;When the crew of the Enterprise learn of a Federation conspiracy against the inhabitants of a unique planet, Captain Picard begins an open rebellion.;['Jonathan Frakes', None];['Patrick Stewart', 'Jonathan Frakes', 'Brent Spiner', 'LeVar Burton']
19;Bangkok aller simple;1999;Tous publics;100;['Drama', ' Mystery', ' Thriller            '];6.4;44;Two women are arrested for smuggling while vacationing in Thailand.;['Jonathan Kaplan', None];['Claire Danes', 'Kate Beckinsale', 'Bill Pullman', 'Jacqueline Kim']
20;Le chacal;1997;Tous publics;124;['Action', ' Crime', ' Drama            '];6.4;36;"An imprisoned I.R.A. fighter is freed to help stop a brutal, seemingly ""faceless"" assassin from completing his next job.";['Michael Caton-Jones', None];['Bruce Willis', 'Richard Gere', 'Sidney Poitier', 'Diane Venora']
21;La piste du tueur;1997;Tous publics;118;['Crime', ' Mystery', ' Thriller            '];6.4;-1;An FBI agent tries to catch a serial killer who kidnapped his son.;['Jeb Stuart', None];['Danny Glover', 'Dennis Quaid', 'Claudia Stedelin', 'Ian Nelson']
22;Twister;I) (1996;Tous publics;113;['Action', ' Adventure', ' Thriller            '];6.4;68;Bill and Jo Harding, advanced storm chasers on the brink of divorce, must join together to create an advanced weather alert system by putting themselves in the cross-hairs of extremely violent tornadoes.;['Jan de Bont', None];['Helen Hunt', 'Bill Paxton', 'Cary Elwes', 'Jami Gertz']
23;Dernier recours;1996;12;101;['Action', ' Crime', ' Drama            '];6.4;-1;A drifting gunslinger-for-hire finds himself in the middle of an ongoing war between the Irish and Italian mafia in a Prohibition era ghost town.;['Walter Hill', None];['Bruce Willis', 'Bruce Dern', 'William Sanderson', 'Christopher Walken']
24;Dangereuse alliance;1996;12;101;['Drama', ' Fantasy', ' Horror            '];6.4;55;A newcomer to a Catholic prep high school falls in with a trio of outcast teenage girls who practice witchcraft, and they all soon conjure up various spells and curses against those who anger them.;['Andrew Fleming', None];['Robin Tunney', 'Fairuza Balk', 'Neve Campbell', 'Rachel True']
25;The Prophecy;1995;R;98;['Action', ' Crime', ' Drama            '];6.4;44;At the scene of a bizarre murder, L.A. homicide detective Thomas Dagget discovers a lethal heavenly prophecy now being fulfilled on earth. In his fight to stop the forces of evil, he finds an unlikely ally in an elementary school teacher.;['Gregory Widen', None];['Christopher Walken', 'Elias Koteas', 'Virginia Madsen', 'Eric Stoltz']
26;Juste cause;1995;Tous publics;102;['Action', ' Crime', ' Drama            '];6.4;48;A Harvard professor is lured back into the courtroom after twenty-five years to take the case of a young black man condemned to death for the horrific murder of a child.;['Arne Glimcher', None];['Sean Connery', 'Laurence Fishburne', 'Kate Capshaw', 'Blair Underwood']
27;Crying Freeman;1995;12;102;['Action', ' Crime', ' Thriller            '];6.4;-1;A woman sees an assassin outside San Francisco killing yakuza men and later in Vancouver. She's been told that he leaves no witness. Will she be his next victim or...?;['Christophe Gans', None];['Julie Condra', 'Kevan Ohtsji', 'Mark Dacascos', 'Debbie Podowski']
28;Freddy sort de la nuit;1994;12;112;['Fantasy', ' Horror', ' Mystery            '];6.4;64;A demonic force has chosen Freddy Krueger as its portal to the real world. Can Heather Langenkamp play the part of Nancy one last time and trap the evil trying to enter our world?;['Wes Craven', None];['Heather Langenkamp', 'Robert Englund', 'Jf Davis', 'Miko Hughes']
29;La rivière sauvage;1994;Tous publics;111;['Adventure', ' Crime', ' Thriller            '];6.4;63;Rafting expert Gail takes on a pair of armed killers while navigating a spectacularly violent river.;['Curtis Hanson', None];['Meryl Streep', 'Kevin Bacon', 'David Strathairn', 'Joseph Mazzello']
30;Killing Zoe;1993;16;96;['Crime', ' Thriller            '];6.4;49;The cab driver sets American Zed up with Zoe in his Paris hotel. Despite FFR1000 charged, she's an art student with day jobs e.g. bank. Safecracker Zed meets his junkie friend after 11 years to rob a bank.;['Roger Avary', None];['Eric Stoltz', 'Julie Delpy', 'Martin Raymond', 'Eric Pascal Chaltiel']
31;Malice;1993;12;107;['Crime', ' Mystery', ' Thriller            '];6.4;52;"A tale about a happily married couple who would like to have children. Tracy teaches art, Andy's a college dean. Things are never the same after she is taken to hospital and operated upon by Jed, a ""know all"" doctor.";['Harold Becker', None];['Alec Baldwin', 'Nicole Kidman', 'Bill Pullman', 'Bebe Neuwirth']
32;Le bon fils;1993;Tous publics;87;['Drama', ' Thriller            '];6.4;45;A young boy stays with his aunt and uncle and becomes friends with his cousin, a boy of the same age who shows increasing signs of violent and psychopathic behavior.;['Joseph Ruben', None];['Macaulay Culkin', 'Elijah Wood', 'Wendy Crewson', 'David Morse']
33;Obsession fatale;1992;12;111;['Crime', ' Drama', ' Thriller            '];6.4;61;A burglar holds a knife to Karen's throat while her husband does nothing. The couple ends up befriending the cop that comes. The friendship ends when the cop beats up the culprit. Karen isn't ready to end it. Things get ugly with the cop.;['Jonathan Kaplan', None];['Kurt Russell', 'Ray Liotta', 'Madeleine Stowe', 'Roger E. Mosley']
34;J.F. partagerait appartement;1992;12;107;['Drama', ' Thriller            '];6.4;63;A woman advertising for a new roommate finds that something very strange is going on with the tenant who decides to move in.;['Barbet Schroeder', None];['Bridget Fonda', 'Jennifer Jason Leigh', 'Steven Weber', 'Peter Friedman']
35;Une lueur dans la nuit;1992;R;132;['Drama', ' Romance', ' Thriller            '];6.4;-1;An American woman of Irish and Jewish-German parentage goes undercover in Nazi Germany.;['David Seltzer', None];['Michael Douglas', 'Melanie Griffith', 'Liam Neeson', 'Joely Richardson']
36;Le sous-sol de la peur;1991;16;102;['Comedy', ' Horror', ' Mystery            '];6.4;57;Two adults and a juvenile break into a house occupied by a brother and sister and their stolen children. There, they must fight for their lives.;['Wes Craven', None];['Brandon Quintin Adams', 'Everett McGill', 'Wendy Robie', 'A.J. Langer']
37;Jamais sans ma fille;1991;NaN;116;['Drama', ' Thriller            '];6.4;57;An American woman, trapped in Islamic Iran by her brutish husband, must find a way to escape with her daughter as well.;['Brian Gilbert', None];['Sally Field', 'Alfred Molina', 'Sheila Rosenthal', 'Roshan Seth']
38;Fenêtre sur Pacifique;1990;Tous publics;102;['Thriller            '];6.4;55;A couple work hard to renovate their dream house and become landlords to pay for it. Unfortunately, one of their tenants has plans of his own.;['John Schlesinger', None];['Melanie Griffith', 'Matthew Modine', 'Michael Keaton', 'Mako']
39;L'île oubliée;1990;Accord parental;90;['Adventure', ' Drama', ' Thriller            '];6.4;49;Stranded on an island, a group of schoolboys degenerate into savagery.;['Harry Hook', None];['Balthazar Getty', 'Chris Furrh', 'Danuel Pipoly', 'James Badge Dale']
40;The Hot Spot;1990;NaN;130;['Crime', ' Drama', ' Romance            '];6.4;56;Upon arriving to a small town, a drifter quickly gets into trouble with the local authorities - and the local women - after he robs a bank.;['Dennis Hopper', None];['Don Johnson', 'Virginia Madsen', 'Jennifer Connelly', 'Charles Martin Smith']
41;Darkman;1990;12;96;['Action', ' Sci-Fi', ' Thriller            '];6.4;65;A brilliant scientist left for dead returns to exact revenge on the people who burned him alive.;['Sam Raimi', None];['Liam Neeson', 'Frances McDormand', 'Colin Friels', 'Larry Drake']
42;Tango & Cash;1989;Tous publics;104;['Action', ' Comedy', ' Crime            '];6.4;41;Framed by their ruthless arch-nemesis, a mismatched LAPD crime-fighting duo has to put its differences aside to even the score with the evil kingpin who put them behind bars once and for all.;['    Directors:', 'Andrey Konchalovskiy, ', 'Albert Magnoli', None];['Sylvester Stallone', 'Kurt Russell', 'Teri Hatcher', 'Jack Palance']
43;Opération crépuscule;1989;Tous publics;108;['Action', ' Crime', ' Drama            '];6.4;55;Experienced Green Beret sergeant Johnny Gallagher is escorting a prisoner, Airborne Ranger Thomas Boyette, back to the US, but Boyette escapes and Gallagher must risk life and limb to catch him.;['Andrew Davis', None];['Gene Hackman', 'Tommy Lee Jones', 'Joanna Cassidy', 'John Heard']
44;Haute Sécurité;1989;13;109;['Action', ' Crime', ' Drama            '];6.4;52;With only six months left of his sentence, inmate Frank Leone is transferred from a minimum security prison to a maximum security prison by a vindictive warden.;['John Flynn', None];['Sylvester Stallone', 'Donald Sutherland', 'John Amos', 'Sonny Landham']
45;Kickboxer;1989;Tous publics;97;['Action', ' Sport', ' Thriller            '];6.4;33;Kurt Sloane must learn the ancient kick boxing art of Muay Thai in order to avenge his brother.;['    Directors:', 'Mark DiSalle, ', 'David Worth', None];['Jean-Claude Van Damme', 'Dennis Alexio', 'Dennis Chan', 'Michel Qissi']
46;Phantasm II;1988;12;97;['Action', ' Fantasy', ' Horror            '];6.4;42;Mike, now released from a psychiatric hospital, meets with Reggie, and discover his dreams ( the events of the original film) are real, and they both journey to find and stop the evil Tall Man from his grim work.;['Don Coscarelli', None];['James Le Gros', 'Reggie Bannister', 'Angus Scrimm', 'Paula Irvine']
47;Hellraiser 2: Les écorchés;1988;16;97;['Horror', ' Thriller            '];6.4;41;Kirsty is brought to an institution after the horrible events of Le Pacte (1987), where the occult-obsessive head doctor resurrects Julia and unleashes the Cenobites and their demonic underworld.;['Tony Randel', None];['Doug Bradley', 'Ashley Laurence', 'Clare Higgins', 'Kenneth Cranham']
48;La veuve noire;1987;NaN;102;['Crime', ' Drama', ' Thriller            '];6.4;70;A federal investigator tracks down a gold-digging woman who moves from husband to husband to kill them and collect the inheritance.;['Bob Rafelson', None];['Debra Winger', 'Theresa Russell', 'Sami Frey', 'Dennis Hopper']
49;Remo sans arme et dangereux;1985;Tous publics;121;['Action', ' Adventure', ' Comedy            '];6.4;46;"An officially ""dead"" cop is trained to become an extraordinary unique assassin in service of the US President.";['Guy Hamilton', None];['Fred Ward', 'Joel Grey', 'Wilford Brimley', 'J.A. Preston']
0;Apocalypse 2024;1975;Tous publics;91;['Comedy', ' Drama', ' Sci-Fi            '];6.4;68;A young man and his telepathic dog wander a post-apocalyptic wasteland.;['L.Q. Jones', None];['Don Johnson', 'Jason Robards', 'Susanne Benton', 'Tim McIntire']
1;Le survivant;1971;12;98;['Action', ' Drama', ' Sci-Fi            '];6.4;56;Biological war has decimated life on Earth. Los Angeles is a windswept ghost town where Robert Neville tools his convertible through sunlit streets foraging for supplies.;['Boris Sagal', None];['Charlton Heston', 'Anthony Zerbe', 'Rosalind Cash', 'Paul Koslo']
2;Un shérif à New-York;1968;Tous publics;93;['Action', ' Comedy', ' Crime            '];6.4;-1;Arizona Deputy Sheriff Coogan (Clint Eastwood) is sent to New York City to escort an escaped fugitive back for trial.;['Don Siegel', None];['Clint Eastwood', 'Lee J. Cobb', 'Susan Clark', 'Tisha Sterling']
3;I Care a Lot;2020;13;118;['Comedy', ' Crime', ' Drama            '];6.3;66;A crooked legal guardian who drains the savings of her elderly wards meets her match when a woman she tries to swindle turns out to be more than she first appears.;['J Blakeson', None];['Rosamund Pike', 'Peter Dinklage', 'Eiza González', 'Dianne Wiest']
4;The Guilty;2021;13;90;['Crime', ' Drama', ' Thriller            '];6.3;63;A demoted police officer assigned to a call dispatch desk is conflicted when he receives an emergency phone call from a kidnapped woman.;['Antoine Fuqua', None];['Jake Gyllenhaal', 'Riley Keough', 'Peter Sarsgaard', 'Christina Vidal']
5;Bodies Bodies Bodies;2022;R;94;['Comedy', ' Horror', ' Thriller            '];6.3;69;When a group of rich 20-somethings plan a hurricane party at a remote family mansion, a party game turns deadly in this fresh and funny look at backstabbing, fake friends, and one party gone very, very wrong.;['Halina Reijn', None];['Amandla Stenberg', 'Maria Bakalova', 'Rachel Sennott', 'Chase Sui Wonders']
6;Red Notice;2021;13;118;['Action', ' Comedy', ' Thriller            '];6.3;37;An Interpol agent successfully tracks down the world's most wanted art thief, with help from a rival thief. But nothing is as it seems, as a series of double-crosses ensue.;['Rawson Marshall Thurber', None];['Dwayne Johnson', 'Ryan Reynolds', 'Gal Gadot', 'Ritu Arya']
7;Prospect : L'Ambre de la lune verte;2018;Accord parental;100;['Adventure', ' Drama', ' Sci-Fi            '];6.3;68;"A teenage girl and her father travel to a remote alien moon, aiming to strike it rich. They've secured a contract to harvest a large deposit of the elusive gems hidden in the depths of the moon's toxic forest. But there are others roving the wilderness and the job quickly devolves into a fight to survive. Forced to contend not only with the forest's other ruthless inhabitants, but with her own ...                See full summary »
";['    Directors:', 'Christopher Caldwell, ', 'Zeek Earl', None];['Sophie Thatcher', 'Jay Duplass', 'Pedro Pascal', 'Luke Pitzrick']
8;Conjuring: Sous l'emprise du Diable;2021;12;112;['Horror', ' Mystery', ' Thriller            '];6.3;53;The Warrens investigate a murder that may be linked to a demonic possession.;['Michael Chaves', None];"['Patrick Wilson', 'Vera Farmiga', ""Ruairi O'Connor"", 'Sarah Catherine Hook']"
9;Guns Akimbo;2019;16;98;['Action', ' Comedy', ' Crime            '];6.3;42;A guy relies on his newly-acquired gladiator skills to save his ex-girlfriend from kidnappers.;['Jason Howden', None];['Daniel Radcliffe', 'Samara Weaving', 'Ned Dennehy', 'Natasha Liu Bordizzo']
10;Archive;2020;Tous publics;109;['Drama', ' Mystery', ' Sci-Fi            '];6.3;67;2038: George Almore is working on a true human-equivalent AI. His latest prototype is almost ready. This sensitive phase is also the riskiest. Especially as he has a goal that must be hidden at all costs.;['Gavin Rothery', None];['Theo James', 'Stacy Martin', 'Rhona Mitra', 'Peter Ferdinando']
11;The King's Man: Première mission;2021;Tous publics;131;['Action', ' Adventure', ' Thriller            '];6.3;44;In the early years of the 20th century, the Kingsman agency is formed to stand against a cabal plotting a war to wipe out millions.;['Matthew Vaughn', None];['Ralph Fiennes', 'Gemma Arterton', 'Rhys Ifans', 'Harris Dickinson']
12;Don't Let Go;2019;R;103;['Drama', ' Horror', ' Mystery            '];6.3;49;After a man's family dies in what appears to be a murder, he gets a phone call from one of the dead, his niece. He's not sure if she's a ghost or if he's going mad, but as it turns out, he's not.;['Jacob Estes', None];['David Oyelowo', 'Storm Reid', 'Mykelti Williamson', 'Alfred Molina']
13;Haunt;I) (2019;R;92;['Horror', ' Thriller            '];6.3;69;"On Halloween, a group of friends encounter an ""extreme"" haunted house that promises to feed on their darkest fears. The night turns deadly as they come to the horrifying realization that some nightmares are real.";['    Directors:', 'Scott Beck, ', 'Bryan Woods', None];['Katie Stevens', 'Will Brittain', 'Lauryn Alisa McClain', 'Andrew Lewis Caldwell']
14;Code 7500 - Un avion en détresse;2019;R;93;['Action', ' Drama', ' Thriller            '];6.3;58;When terrorists try to seize control of a Berlin-Paris flight, a soft-spoken American co-pilot struggles to save the lives of the passengers and crew while forging a surprising connection with one of the hijackers.;['Patrick Vollrath', None];['Joseph Gordon-Levitt', 'Omid Memar', 'Aylin Tezel', 'Carlo Kitzlinger']
15;Le bon apôtre;2018;Tous publics;130;['Drama', ' Fantasy', ' Horror            '];6.3;62;In 1905, a drifter on a dangerous mission to rescue his kidnapped sister tangles with a sinister religious cult on an isolated island.;['Gareth Evans', None];['Dan Stevens', 'Richard Elfyn', 'Paul Higgins', 'Bill Milner']
16;ARQ;2016;16;88;['Action', ' Sci-Fi', ' Thriller            '];6.3;-1;Trapped in a lab and stuck in a time loop, a disoriented couple fends off masked raiders while harboring a new energy source that could save humanity.;['Tony Elliott', None];['Robbie Amell', 'Rachael Taylor', 'Shaun Benson', 'Gray Powell']
17;Le Rituel;I) (2017;16;94;['Horror', ' Mystery', ' Thriller            '];6.3;57;A group of old college friends reunite for a trip to a forest in Sweden, Northern Europe, but encounter a menacing presence there stalking them.;['David Bruckner', None];['Rafe Spall', 'Arsher Ali', 'Robert James-Collier', 'Sam Troughton']
18;Les proies;2017;Tous publics;93;['Drama', ' Thriller', ' War            '];6.3;77;The unexpected arrival of a wounded Union soldier at a girls school in Virginia during the American Civil War leads to jealousy and betrayal.;['Sofia Coppola', None];['Nicole Kidman', 'Kirsten Dunst', 'Elle Fanning', 'Colin Farrell']
19;Bright;I) (2017;16;117;['Action', ' Fantasy', ' Thriller            '];6.3;29;A detective must work with an Orc to find a powerful wand before evil creatures do.;['David Ayer', None];['Will Smith', 'Joel Edgerton', 'Noomi Rapace', 'Edgar Ramírez']
20;Ocean's 8;2018;Tous publics;110;['Action', ' Comedy', ' Crime            '];6.3;61;Debbie Ocean gathers an all-female crew to attempt an impossible heist at New York City's yearly Met Gala.;['Gary Ross', None];['Sandra Bullock', 'Cate Blanchett', 'Anne Hathaway', 'Mindy Kaling']
21;Headshot;II) (2016;NaN;118;['Action', ' Drama', ' Thriller            '];6.3;61;Uwais plays a young man who washes ashore, an amnesiac with a serious head injury whose past comes back to haunt him shortly after being nursed back to health by a young doctor. Violence ensues. Sweet, sweet violence.;['    Directors:', 'Kimo Stamboel, ', 'Timo Tjahjanto', None];['Iko Uwais', 'Chelsea Islan', 'Sunny Pang', 'Very Tri Yulisman']
22;Godzilla vs Kong;2021;Tous publics;113;['Action', ' Sci-Fi', ' Thriller            '];6.3;59;The epic next chapter in the cinematic Monsterverse pits two of the greatest icons in motion picture history against each other--the fearsome Godzilla and the mighty Kong--with humanity caught in the balance.;['Adam Wingard', None];['Alexander Skarsgård', 'Millie Bobby Brown', 'Rebecca Hall', 'Brian Tyree Henry']
23;Mindhorn;2016;NaN;89;['Comedy', ' Thriller            '];6.3;70;"A has-been actor best known for playing the title character in the 1980s detective series ""Mindhorn"" must work with the police when a serial killer says that he will only speak with Detective Mindhorn, whom he believes to be a real person.";['Sean Foley', None];['Julian Barratt', 'Simon Farnaby', 'Essie Davis', 'Steve Coogan']
24;Golem, le tueur de Londres;2016;12;109;['Crime', ' Mystery', ' Thriller            '];6.3;63;In Victorian London, a Scotland Yard inspector hunts down the sadistic killer behind a series of gory, Jack the Ripper-Like murders.;['Juan Carlos Medina', None];['Douglas Booth', 'Olivia Cooke', 'Sam Reid', 'María Valverde']
25;Free Fire;2016;12;91;['Action', ' Comedy', ' Crime            '];6.3;63;Set in Boston in 1978, a meeting in a deserted warehouse between two gangs turns into a shoot-out and a game of survival.;['Ben Wheatley', None];['Sharlto Copley', 'Brie Larson', 'Armie Hammer', 'Cillian Murphy']
26;Polar;I) (2019;18;118;['Action', ' Thriller            '];6.3;19;A retiring assassin suddenly finds himself on the receiving end of a hit, contracted by none other than his own employer seeking to cash in on the pensions of aging employees.;['Jonas Åkerlund', None];['Mads Mikkelsen', 'Vanessa Hudgens', 'Katheryn Winnick', 'Fei Ren']
27;Instinct de survie;2016;Tous publics;86;['Action', ' Drama', ' Horror            '];6.3;59;A mere 200 yards from shore, surfer Nancy is attacked by a great white shark, with her short journey to safety becoming the ultimate contest of wills.;['Jaume Collet-Serra', None];['Blake Lively', 'Óscar Jaenada', 'Angelo Josue Lozano Corzo', 'Joseph Salas']
28;Le Labyrinthe : La Terre brûlée;2015;Tous publics avec avertissement;131;['Action', ' Adventure', ' Sci-Fi            '];6.3;43;After having escaped the Maze, the Gladers now face a new set of challenges on the open roads of a desolate landscape filled with unimaginable obstacles.;['Wes Ball', None];"[""Dylan O'Brien"", 'Kaya Scodelario', 'Thomas Brodie-Sangster', 'Giancarlo Esposito']"
29;La 9ème vie de Louis Drax;2016;R;108;['Thriller            '];6.3;41;A psychologist who begins working with a young boy who has suffered a near-fatal fall finds himself drawn into a mystery that tests the boundaries of fantasy and reality.;['Alexandre Aja', None];['Jamie Dornan', 'Aiden Longworth', 'Sarah Gadon', 'Aaron Paul']
30;Cargo;I) (2017;16;105;['Drama', ' Horror', ' Sci-Fi            '];6.3;65;After an epidemic spreads all over Australia, a father searches for someone willing to protect his daughter.;['    Directors:', 'Ben Howling, ', 'Yolanda Ramke', None];['Simone Landers', 'Martin Freeman', 'Marlee Jane McPherson-Dobbins', 'Lily Anne McPherson-Dobbins']
31;Cop Car;2015;12;88;['Crime', ' Thriller            '];6.3;66;A small-town sheriff sets out to find the two kids who have taken his car on a joy ride.;['Jon Watts', None];['Kevin Bacon', 'James Freedson-Jackson', 'Hays Wellford', 'Shea Whigham']
32;Criminal: Un espion dans la tête;2016;12;113;['Action', ' Sci-Fi', ' Thriller            '];6.3;36;In a last-ditch effort to stop a diabolical plot, a dead CIA operative's memories, secrets, and skills are implanted into a death-row inmate in hopes that he will complete the operative's mission.;['Ariel Vromen', None];['Kevin Costner', 'Ryan Reynolds', 'Gal Gadot', 'Gary Oldman']
33;Projet Almanac;2015;Tous publics;106;['Drama', ' Mystery', ' Sci-Fi            '];6.3;47;A group of teens discover secret plans of a time machine, and construct one. However, things start to get out of control.;['Dean Israelite', None];"['Amy Landecker', ""Sofia Black-D'Elia"", 'Virginia Gardner', 'Jonny Weston']"
34;Creep;I) (2014;R;77;['Horror', ' Thriller            '];6.3;74;A young videographer answers an online ad for a one-day job in a remote town to record the last messages of a dying man. When he notices the man's odd behavior, he starts to question his intentions.;['Patrick Brice', None];['Katie Aselton', 'Patrick Brice', 'Mark Duplass']
35;Malavita;I) (2013;Tous publics;111;['Comedy', ' Crime', ' Thriller            '];6.3;42;The Manzoni family, a notorious mafia clan, is relocated to Normandy, France under the Witness Protection Program, where fitting in soon becomes challenging, as their old habits die hard.;['Luc Besson', None];"['Robert De Niro', 'Michelle Pfeiffer', 'Dianna Agron', ""John D'Leo""]"
