;name;year;certificate;runtime;genre;rating;metascore;text-muted;director;stars
0;The Dark Knight : Le Chevalier noir;2008;Tous publics;152;['Action', ' Crime', ' Drama            '];9.0;84;When the menace known as the Joker wreaks havoc and chaos on the people of Gotham, Batman must accept one of the greatest psychological and physical tests of his ability to fight injustice.;['Christopher Nolan', None];['Christian Bale', 'Heath Ledger', 'Aaron Eckhart', 'Michael Caine']
1;Kill Bill: The Whole Bloody Affair;2011;NaN;247;['Action', ' Crime', ' Thriller            '];8.8;-1;The Bride must kill her ex-boss and lover Bill who betrayed her at her wedding rehearsal, shot her in the head and took away her unborn daughter. But first, she must make the other four members of the Deadly Viper Assassination Squad suffer.;['Quentin Tarantino', None];['Uma Thurman', 'Lucy Liu', 'Vivica A. Fox', 'Michael Madsen']
2;Inception;2010;Tous publics;148;['Action', ' Adventure', ' Sci-Fi            '];8.8;74;A thief who steals corporate secrets through the use of dream-sharing technology is given the inverse task of planting an idea into the mind of a C.E.O., but his tragic past may doom the project and his team to disaster.;['Christopher Nolan', None];['Leonardo DiCaprio', 'Joseph Gordon-Levitt', 'Elliot Page', 'Ken Watanabe']
3;Seven;1995;12;127;['Crime', ' Drama', ' Mystery            '];8.6;65;Two detectives, a rookie and a veteran, hunt a serial killer who uses the seven deadly sins as his motives.;['David Fincher', None];['Morgan Freeman', 'Brad Pitt', 'Kevin Spacey', 'Andrew Kevin Walker']
4;Le Silence des agneaux;1991;16;118;['Crime', ' Drama', ' Thriller            '];8.6;85;A young F.B.I. cadet must receive the help of an incarcerated and manipulative cannibal killer to help catch another serial killer, a madman who skins his victims.;['Jonathan Demme', None];['Jodie Foster', 'Anthony Hopkins', 'Lawrence A. Bonney', 'Kasi Lemmons']
5;Parasite;2019;Tous publics avec avertissement;132;['Drama', ' Thriller            '];8.5;96;Greed and class discrimination threaten the newly formed symbiotic relationship between the wealthy Park family and the destitute Kim clan.;['Bong Joon Ho', None];['Song Kang-ho', 'Lee Sun-kyun', 'Cho Yeo-jeong', 'Choi Woo-sik']
6;Le Prestige;2006;Tous publics;130;['Drama', ' Mystery', ' Sci-Fi            '];8.5;66;After a tragic accident, two stage magicians in 1890s London engage in a battle to create the ultimate illusion while sacrificing everything they have to outwit each other.;['Christopher Nolan', None];['Christian Bale', 'Hugh Jackman', 'Scarlett Johansson', 'Michael Caine']
7;Les infiltrés;2006;Tous publics avec avertissement;151;['Crime', ' Drama', ' Thriller            '];8.5;85;An undercover cop and a mole in the police attempt to identify each other while infiltrating an Irish gang in South Boston.;['Martin Scorsese', None];['Leonardo DiCaprio', 'Matt Damon', 'Jack Nicholson', 'Mark Wahlberg']
8;Usual Suspects;1995;Tous publics;106;['Crime', ' Drama', ' Mystery            '];8.5;77;A sole survivor tells of the twisty events leading up to a horrific gun battle on a boat, which began when five criminals met at a seemingly random police lineup.;['Bryan Singer', None];['Kevin Spacey', 'Gabriel Byrne', 'Chazz Palminteri', 'Stephen Baldwin']
9;Léon;1994;12;110;['Action', ' Crime', ' Drama            '];8.5;64;12-year-old Mathilda is reluctantly taken in by Léon, a professional assassin, after her family is murdered. An unusual relationship forms as she becomes his protégée and learns the assassin's trade.;['Luc Besson', None];['Jean Reno', 'Gary Oldman', 'Natalie Portman', 'Danny Aiello']
10;Psychose;1960;18;109;['Horror', ' Mystery', ' Thriller            '];8.5;97;A Phoenix secretary embezzles $40,000 from her employer's client, goes on the run and checks into a remote motel run by a young man under the domination of his mother.;['Alfred Hitchcock', None];['Anthony Perkins', 'Janet Leigh', 'Vera Miles', 'John Gavin']
11;Fenêtre sur cour;1954;Tous publics;112;['Mystery', ' Thriller            '];8.5;100;A wheelchair-bound photographer spies on his neighbors from his Greenwich Village courtyard apartment window, and becomes convinced one of them has committed murder, despite the skepticism of his fashion-model girlfriend.;['Alfred Hitchcock', None];['James Stewart', 'Grace Kelly', 'Wendell Corey', 'Thelma Ritter']
12;Joker;I) (2019;12 avec avertissement;122;['Crime', ' Drama', ' Thriller            '];8.4;59;A mentally troubled stand-up comedian embarks on a downward spiral that leads to the creation of an iconic villain.;['Todd Phillips', None];['Joaquin Phoenix', 'Robert De Niro', 'Zazie Beetz', 'Frances Conroy']
13;Memento;2000;Tous publics;113;['Mystery', ' Thriller            '];8.4;80;A man with short-term memory loss attempts to track down his wife's murderer.;['Christopher Nolan', None];['Guy Pearce', 'Carrie-Anne Moss', 'Joe Pantoliano', 'Mark Boone Junior']
14;Aliens : Le Retour;1986;13;137;['Action', ' Adventure', ' Sci-Fi            '];8.4;84;Fifty-seven years after surviving an apocalyptic attack aboard her space vessel by merciless space creatures, Officer Ripley awakens from hyper-sleep and tries to warn anyone who will listen about the predators.;['James Cameron', None];['Sigourney Weaver', 'Michael Biehn', 'Carrie Henn', 'Paul Reiser']
15;Témoin à charge;1957;Tous publics;116;['Crime', ' Drama', ' Mystery            '];8.4;76;A veteran British barrister must defend his client in a murder trial that has surprise after surprise.;['Billy Wilder', None];['Tyrone Power', 'Marlene Dietrich', 'Charles Laughton', 'Elsa Lanchester']
16;Reservoir Dogs;1992;16;99;['Crime', ' Thriller            '];8.3;79;When a simple jewelry heist goes horribly wrong, the surviving criminals begin to suspect that one of them is a police informant.;['Quentin Tarantino', None];['Harvey Keitel', 'Tim Roth', 'Michael Madsen', 'Chris Penn']
17;La mort aux trousses;1959;Tous publics;136;['Action', ' Adventure', ' Mystery            '];8.3;98;A New York City advertising executive goes on the run after being mistaken for a government agent by a group of foreign spies, and falls for a woman whose loyalties he begins to doubt.;['Alfred Hitchcock', None];['Cary Grant', 'Eva Marie Saint', 'James Mason', 'Jessie Royce Landis']
18;Sueurs froides;1958;Tous publics;128;['Mystery', ' Romance', ' Thriller            '];8.3;100;A former San Francisco police detective juggles wrestling with his personal demons and becoming obsessed with the hauntingly beautiful woman he has been hired to trail, who may be deeply disturbed.;['Alfred Hitchcock', None];['James Stewart', 'Kim Novak', 'Barbara Bel Geddes', 'Tom Helmore']
19;Assurance sur la mort;1944;Tous publics;107;['Crime', ' Drama', ' Film-Noir            '];8.3;95;A Los Angeles insurance representative lets an alluring housewife seduce him into a scheme of insurance fraud and murder that arouses the suspicion of his colleague, an insurance investigator.;['Billy Wilder', None];['Fred MacMurray', 'Barbara Stanwyck', 'Edward G. Robinson', 'Byron Barr']
20;Andhadhun;2018;NaN;139;['Comedy', ' Crime', ' Music            '];8.2;-1;A series of mysterious events change the life of a blind pianist, who must now report a crime that he should technically know nothing of.;['Sriram Raghavan', None];['Tabu', 'Ayushmann Khurrana', 'Radhika Apte', 'Anil Dhawan']
21;Drishyam;2015;NaN;163;['Crime', ' Drama', ' Mystery            '];8.2;-1;Desperate measures are taken by a man who tries to save his family from the dark side of the law, after they commit an unexpected crime.;['Nishikant Kamat', None];['Ajay Devgn', 'Shriya Saran', 'Tabu', 'Rajat Kapoor']
22;It's Such a Beautiful Day;2012;NaN;62;['Animation', ' Comedy', ' Drama            '];8.2;90;Bill struggles to put together his shattered psyche, in this new feature film version of Don Hertzfeldt's animated short film trilogy.;[];['    Director:', 'Don Hertzfeldt']
23;Shutter Island;2010;12;138;['Mystery', ' Thriller            '];8.2;63;In 1954, a U.S. Marshal investigates the disappearance of a murderer who escaped from a hospital for the criminally insane.;['Martin Scorsese', None];['Leonardo DiCaprio', 'Emily Mortimer', 'Mark Ruffalo', 'Ben Kingsley']
24;No Country for Old Men;2007;12;122;['Crime', ' Drama', ' Thriller            '];8.2;92;Violence and mayhem ensue after a hunter stumbles upon a drug deal gone wrong and more than two million dollars in cash near the Rio Grande.;['    Directors:', 'Ethan Coen, ', 'Joel Coen', None];['Tommy Lee Jones', 'Javier Bardem', 'Josh Brolin', 'Woody Harrelson']
25;V pour vendetta;2005;Tous publics avec avertissement;132;['Action', ' Drama', ' Sci-Fi            '];8.2;62;"In a future British dystopian society, a shadowy freedom fighter, known only by the alias of ""V"", plots to overthrow the tyrannical government - with the help of a young woman.";['James McTeigue', None];['Hugo Weaving', 'Natalie Portman', 'Rupert Graves', 'Stephen Rea']
26;Kill Bill: Volume I;2003;16;111;['Action', ' Crime', ' Drama            '];8.2;69;After awakening from a four-year coma, a former assassin wreaks vengeance on the team of assassins who betrayed her.;['Quentin Tarantino', None];['Uma Thurman', 'David Carradine', 'Daryl Hannah', 'Michael Madsen']
27;Sixième sens;1999;12;107;['Drama', ' Mystery', ' Thriller            '];8.2;64;A frightened, withdrawn Philadelphia boy who communicates with spirits seeks the help of a disheartened child psychologist.;['M. Night Shyamalan', None];['Bruce Willis', 'Haley Joel Osment', 'Toni Collette', 'Olivia Williams']
28;L.A. Confidential;1997;Tous publics;138;['Crime', ' Drama', ' Mystery            '];8.2;90;As corruption grows in 1950s Los Angeles, three policemen - one strait-laced, one brutal, and one sleazy - investigate a series of murders with their own brand of justice.;['Curtis Hanson', None];['Kevin Spacey', 'Russell Crowe', 'Guy Pearce', 'Kim Basinger']
29;Jurassic Park;1993;Tous publics;127;['Action', ' Adventure', ' Sci-Fi            '];8.2;68;A pragmatic paleontologist touring an almost complete theme park on an island in Central America is tasked with protecting a couple of kids after a power failure causes the park's cloned dinosaurs to run loose.;['Steven Spielberg', None];['Sam Neill', 'Laura Dern', 'Jeff Goldblum', 'Richard Attenborough']
30;Piège de cristal;1988;Tous publics;132;['Action', ' Thriller            '];8.2;72;An NYPD officer tries to save his wife and several others taken hostage by German terrorists during a Christmas party at the Nakatomi Plaza in Los Angeles.;['John McTiernan', None];['Bruce Willis', 'Alan Rickman', 'Bonnie Bedelia', 'Reginald VelJohnson']
31;Chinatown;1974;12;130;['Drama', ' Mystery', ' Thriller            '];8.2;92;A private detective hired to expose an adulterer in 1930s Los Angeles finds himself caught up in a web of deceit, corruption, and murder.;['Roman Polanski', None];['Jack Nicholson', 'Faye Dunaway', 'John Huston', 'Perry Lopez']
32;Z;1969;Tous publics;127;['Crime', ' Drama', ' Thriller            '];8.2;86;The public murder of a prominent politician and doctor amid a violent demonstration is covered up by military and government officials. A tenacious magistrate is determined not to let them get away with it.;['Costa-Gavras', None];['Yves Montand', 'Irene Papas', 'Jean-Louis Trintignant', 'François Périer']
33;La Grande Évasion;1963;Tous publics;172;['Adventure', ' Drama', ' History            '];8.2;86;Allied prisoners of war plan for several hundred of their number to escape from a German camp during World War II.;['John Sturges', None];['Steve McQueen', 'James Garner', 'Richard Attenborough', 'Charles Bronson']
34;Le crime était presque parfait;1954;Tous publics;105;['Crime', ' Thriller            '];8.2;75;A former tennis star arranges the murder of his adulterous wife.;['Alfred Hitchcock', None];['Ray Milland', 'Grace Kelly', 'Robert Cummings', 'John Williams']
35;Le salaire de la peur;1953;Tous Public;156;['Adventure', ' Drama', ' Thriller            '];8.2;85;In a decrepit South American village, four men are hired to transport an urgent nitroglycerine shipment without the equipment that would make it safe.;['Henri-Georges Clouzot', None];['Yves Montand', 'Charles Vanel', 'Peter van Eyck', 'Folco Lulli']
36;Logan;2017;12 avec avertissement;137;['Action', ' Drama', ' Sci-Fi            '];8.1;77;In a future where mutants are nearly extinct, an elderly and weary Logan leads a quiet life. But when Laura, a mutant child pursued by scientists, comes to him for help, he must get her to safety.;['James Mangold', None];['Hugh Jackman', 'Patrick Stewart', 'Dafne Keen', 'Boyd Holbrook']
37;Room;I) (2015;Tous publics;118;['Drama', ' Thriller            '];8.1;86;Held captive for 7 years in an enclosed space, a woman and her young son finally gain their freedom, allowing the boy to experience the outside world for the first time.;['Lenny Abrahamson', None];['Brie Larson', 'Jacob Tremblay', 'Sean Bridgers', 'Wendy Crewson']
38;Gone Girl;2014;Tous publics avec avertissement;149;['Drama', ' Mystery', ' Thriller            '];8.1;79;With his wife's disappearance having become the focus of an intense media circus, a man sees the spotlight turned on him when it's suspected that he may not be innocent.;['David Fincher', None];['Ben Affleck', 'Rosamund Pike', 'Neil Patrick Harris', 'Tyler Perry']
39;Prisoners;2013;12;153;['Crime', ' Drama', ' Mystery            '];8.1;70;When Keller Dover's daughter and her friend go missing, he takes matters into his own hands as the police pursue multiple leads and the pressure mounts.;['Denis Villeneuve', None];['Hugh Jackman', 'Jake Gyllenhaal', 'Viola Davis', 'Melissa Leo']
40;Mad Max: Fury Road;2015;Tous publics avec avertissement;120;['Action', ' Adventure', ' Sci-Fi            '];8.1;90;In a post-apocalyptic wasteland, a woman rebels against a tyrannical ruler in search for her homeland with the aid of a group of female prisoners, a psychotic worshiper, and a drifter named Max.;['George Miller', None];['Tom Hardy', 'Charlize Theron', 'Nicholas Hoult', 'Zoë Kravitz']
41;Memories of Murder;2003;Tous publics;131;['Crime', ' Drama', ' Mystery            '];8.1;82;In a small Korean province in 1986, two detectives struggle with the case of multiple young women being found raped and murdered by an unknown culprit.;['Bong Joon Ho', None];['Song Kang-ho', 'Kim Sang-kyung', 'Roe-ha Kim', 'Jae-ho Song']
42;Fargo;1996;12;98;['Crime', ' Thriller            '];8.1;85;Minnesota car salesman Jerry Lundegaard's inept crime falls apart due to his and his henchmen's bungling and the persistent police work of the quite pregnant Marge Gunderson.;['    Directors:', 'Joel Coen, ', 'Ethan Coen', None];['William H. Macy', 'Frances McDormand', 'Steve Buscemi', 'Peter Stormare']
43;Blade Runner;1982;Tous publics avec avertissement;117;['Action', ' Drama', ' Sci-Fi            '];8.1;84;A blade runner must pursue and terminate four replicants who stole a ship in space, and have returned to Earth to find their creator.;['Ridley Scott', None];['Harrison Ford', 'Rutger Hauer', 'Sean Young', 'Edward James Olmos']
44;Les Dents de la mer;1975;13;124;['Adventure', ' Thriller            '];8.1;87;When a killer shark unleashes chaos on a beach community off Cape Cod, it's up to a local sheriff, a marine biologist, and an old seafarer to hunt the beast down.;['Steven Spielberg', None];['Roy Scheider', 'Robert Shaw', 'Richard Dreyfuss', 'Lorraine Gary']
45;Persona;1966;Tous publics;85;['Drama', ' Thriller            '];8.1;86;A nurse is put in charge of a mute actress and finds that their personae are melding together.;['Ingmar Bergman', None];['Bibi Andersson', 'Liv Ullmann', 'Margaretha Krook', 'Gunnar Björnstrand']
46;Du rififi chez les hommes;1955;16;118;['Crime', ' Drama', ' Thriller            '];8.1;97;Four men plan a technically perfect crime, but the human element intervenes...;['Jules Dassin', None];['Jean Servais', 'Carl Möhner', 'Robert Manuel', 'Janine Darcey']
47;Sur les quais...;1954;Tous publics;108;['Crime', ' Drama', ' Thriller            '];8.1;91;An ex-prize fighter turned New Jersey longshoreman struggles to stand up to his corrupt union bosses, including his older brother, as he starts to connect with the grieving sister of one of the syndicate's victims.;['Elia Kazan', None];['Marlon Brando', 'Karl Malden', 'Lee J. Cobb', 'Rod Steiger']
48;Les diaboliques;1955;Tous publics;117;['Crime', ' Drama', ' Horror            '];8.1;-1;The wife and mistress of a loathed school principal plan to murder him with what they believe is the perfect alibi.;['Henri-Georges Clouzot', None];['Simone Signoret', 'Véra Clouzot', 'Paul Meurisse', 'Charles Vanel']
49;Le troisième homme;1949;Tous publics;104;['Film-Noir', ' Mystery', ' Thriller            '];8.1;97;Pulp novelist Holly Martins travels to shadowy, postwar Vienna, only to find himself investigating the mysterious death of an old friend, Harry Lime.;['Carol Reed', None];['Orson Welles', 'Joseph Cotten', 'Alida Valli', 'Trevor Howard']
0;La vengeance dans la peau;2007;Tous publics;115;['Action', ' Mystery', ' Thriller            '];8.0;85;Jason Bourne dodges a ruthless C.I.A. official and his Agents from a new assassination program while searching for the origins of his life as a trained killer.;['Paul Greengrass', None];['Matt Damon', 'Edgar Ramírez', 'Joan Allen', 'Julia Stiles']
1;Sin City;2005;R;124;['Crime', ' Thriller            '];8.0;74;An exploration of the dark and miserable Basin City and three of its residents, all of whom are caught up in violent corruption.;['    Directors:', 'Frank Miller, ', 'Quentin Tarantino, ', 'Robert Rodriguez', None];['Mickey Rourke', 'Clive Owen', 'Bruce Willis', 'Jessica Alba']
2;Casino Royale;2006;Tous publics avec avertissement;144;['Action', ' Adventure', ' Thriller            '];8.0;80;After earning 00 status and a licence to kill, secret agent James Bond sets out on his first mission as 007. Bond must defeat a private banker funding terrorists in a high-stakes game of poker at Casino Royale, Montenegro.;['Martin Campbell', None];['Daniel Craig', 'Eva Green', 'Judi Dench', 'Jeffrey Wright']
3;Kill Bill: Volume II;2004;12;137;['Action', ' Crime', ' Thriller            '];8.0;83;The Bride continues her quest of vengeance against her former boss and lover Bill, the reclusive bouncer Budd, and the treacherous, one-eyed Elle.;['Quentin Tarantino', None];['Uma Thurman', 'David Carradine', 'Michael Madsen', 'Daryl Hannah']
4;Infernal Affairs;2002;12;101;['Action', ' Crime', ' Drama            '];8.0;75;A story between a mole in the police department and an undercover cop. Their objectives are the same: to find out who is the mole, and who is the cop.;['    Directors:', 'Andrew Lau, ', 'Alan Mak', None];['Andy Lau', 'Tony Chiu-Wai Leung', 'Anthony Chau-Sang Wong', 'Eric Tsang']
5;Donnie Darko;2001;Tous publics;113;['Drama', ' Mystery', ' Sci-Fi            '];8.0;88;After narrowly escaping a bizarre accident, a troubled teenager is plagued by visions of a man in a large rabbit suit who manipulates him to commit a series of crimes.;['Richard Kelly', None];['Jake Gyllenhaal', 'Jena Malone', 'Mary McDonnell', 'Holmes Osborne']
6;L'Armée des 12 singes;1995;Tous publics avec avertissement;129;['Mystery', ' Sci-Fi', ' Thriller            '];8.0;74;In a future world devastated by disease, a convict is sent back in time to gather information about the man-made virus that wiped out most of the human population on the planet.;['Terry Gilliam', None];['Bruce Willis', 'Madeleine Stowe', 'Brad Pitt', 'Joseph Melito']
7;JFK;1991;Tous publics;189;['Drama', ' History', ' Thriller            '];8.0;72;New Orleans District Attorney Jim Garrison discovers there's more to the Kennedy assassination than the official story.;['Oliver Stone', None];['Kevin Costner', 'Gary Oldman', 'Jack Lemmon', 'Walter Matthau']
8;Un après-midi de chien;1975;Tous publics;125;['Biography', ' Crime', ' Drama            '];8.0;86;Three amateur bank robbers plan to hold up a bank. A nice simple robbery: Walk in, take the money, and run. Unfortunately, the supposedly uncomplicated heist suddenly becomes a bizarre nightmare as everything that could go wrong does.;['Sidney Lumet', None];['Al Pacino', 'John Cazale', 'Penelope Allen', 'Sully Boyar']
9;Le Limier;1972;Tous publics;138;['Mystery', ' Thriller            '];8.0;-1;A man who loves games and theater invites his wife's lover to meet him, setting up a battle of wits with potentially deadly results.;['Joseph L. Mankiewicz', None];['Laurence Olivier', 'Michael Caine', 'Alec Cawthorne', 'John Matthews']
10;Point limite;1964;Tous Public;112;['Drama', ' Thriller            '];8.0;75;A technical malfunction sends American planes to Moscow to deliver a nuclear attack. Can all-out war be averted?;['Sidney Lumet', None];"['Henry Fonda', 'Walter Matthau', 'Fritz Weaver', ""Dan O'Herlihy""]"
11;Qu'est-il arrivé à Baby Jane?;1962;12;134;['Drama', ' Horror', ' Thriller            '];8.0;75;A former child star torments her paraplegic sister in their decaying Hollywood mansion.;['Robert Aldrich', None];['Bette Davis', 'Joan Crawford', 'Victor Buono', 'Wesley Addy']
12;La soif du mal;1958;Tous Public;95;['Crime', ' Drama', ' Film-Noir            '];8.0;99;A stark, perverse story of murder, kidnapping, and police corruption in a Mexican border town.;['Orson Welles', None];['Charlton Heston', 'Orson Welles', 'Janet Leigh', 'Joseph Calleia']
13;L'ultime razzia;1956;Tous publics;84;['Crime', ' Drama', ' Film-Noir            '];8.0;91;Crook Johnny Clay assembles a five-man team to plan and execute a daring racetrack robbery.;['Stanley Kubrick', None];['Sterling Hayden', 'Coleen Gray', 'Vince Edwards', 'Jay C. Flippen']
14;La nuit du chasseur;1955;Tous publics;92;['Crime', ' Drama', ' Film-Noir            '];8.0;99;A religious fanatic marries a gullible widow whose young children are reluctant to tell him where their real daddy hid the $10,000 he'd stolen in a robbery.;['Charles Laughton', None];['Robert Mitchum', 'Shelley Winters', 'Lillian Gish', 'James Gleason']
15;Le train sifflera trois fois;1952;Tous publics;85;['Drama', ' Thriller', ' Western            '];8.0;89;"A town Marshal, despite the disagreements of his newlywed bride and the townspeople around him, must face a gang of deadly killers alone at ""high noon"" when the gang leader, an outlaw he ""sent up"" years ago, arrives on the noon train.";['Fred Zinnemann', None];['Gary Cooper', 'Grace Kelly', 'Thomas Mitchell', 'Lloyd Bridges']
16;La griffe du passé;1947;Tous Public;97;['Crime', ' Drama', ' Film-Noir            '];8.0;85;A private eye escapes his past to run a gas station in a small town, but his past catches up with him. Now he must return to the big city world of danger, corruption, double crosses, and duplicitous dames.;['Jacques Tourneur', None];['Robert Mitchum', 'Jane Greer', 'Kirk Douglas', 'Rhonda Fleming']
17;Le cuirassé Potemkine;1925;Tous publics;75;['Drama', ' History', ' Thriller            '];8.0;97;In the midst of the Russian Revolution of 1905, the crew of the battleship Potemkin mutiny against the brutal, tyrannical regime of the vessel's officers. The resulting street demonstration in Odessa brings on a police massacre.;['Sergei Eisenstein', None];['Aleksandr Antonov', 'Vladimir Barskiy', 'Grigoriy Aleksandrov', 'Ivan Bobrov']
18;À couteaux tirés;2019;Tous publics;130;['Comedy', ' Crime', ' Drama            '];7.9;82;A detective investigates the death of the patriarch of an eccentric, combative family.;['Rian Johnson', None];['Daniel Craig', 'Chris Evans', 'Ana de Armas', 'Jamie Lee Curtis']
19;The Raid 2;2014;16 avec avertissement;150;['Action', ' Crime', ' Thriller            '];7.9;71;Only a short time after the first raid, Rama goes undercover with the thugs of Jakarta and plans to bring down the syndicate and uncover the corruption within his police force.;['Gareth Evans', None];['Iko Uwais', 'Yayan Ruhian', 'Arifin Putra', 'Oka Antara']
20;Vishwaroopam;2013;NaN;148;['Action', ' Thriller            '];7.9;-1;When a classical dancer's suspecting wife sets an investigator behind him, a series of violent events are triggered, revealing his real identity and connection to a darker world.;['Kamal Haasan', None];['Pooja Kumar', 'Miles Anderson', 'Kamal Haasan', 'Rahul Bose']
21;X-Men: Days of Future Past;2014;Tous publics;132;['Action', ' Adventure', ' Sci-Fi            '];7.9;75;The X-Men send Wolverine to the past in a desperate effort to change history and prevent an event that results in doom for both humans and mutants.;['Bryan Singer', None];['Patrick Stewart', 'Ian McKellen', 'Hugh Jackman', 'James McAvoy']
22;The Batman;2022;Tous publics avec avertissement;176;['Action', ' Crime', ' Drama            '];7.9;72;When a sadistic serial killer begins murdering key political figures in Gotham, Batman is forced to investigate the city's hidden corruption and question his family's involvement.;['Matt Reeves', None];['Robert Pattinson', 'Zoë Kravitz', 'Jeffrey Wright', 'Colin Farrell']
23;District 9;2009;Tous publics;112;['Action', ' Sci-Fi', ' Thriller            '];7.9;81;Violence ensues after an extraterrestrial race forced to live in slum-like conditions on Earth finds a kindred spirit in a government agent exposed to their biotechnology.;['Neill Blomkamp', None];['Sharlto Copley', 'David James', 'Jason Cope', 'Nathalie Boltt']
24;Bons baisers de Bruges;2008;Tous publics avec avertissement;107;['Comedy', ' Crime', ' Drama            '];7.9;67;Guilt-stricken after a job gone wrong, hitman Ray and his partner await orders from their ruthless boss in Bruges, Belgium, the last place in the world Ray wants to be.;['Martin McDonagh', None];['Colin Farrell', 'Brendan Gleeson', 'Ciarán Hinds', 'Elizabeth Berrington']
