;name;year;certificate;runtime;genre;rating;metascore;text-muted;director;stars
16;Retreat;I) (2011;12;90;['Drama', ' Horror', ' Thriller            '];5.8;-1;Kate and Martin escape from personal tragedy to an Island Retreat. Cut off from the outside world, their attempts to recover are shattered when a Man is washed ashore, with news of airborne killer disease that is sweeping through Europe.;['Carl Tibbetts', None];['Thandiwe Newton', 'Cillian Murphy', 'Jamie Bell', 'Jimmy Yuill']
17;Old Boy;2013;16;104;['Action', ' Drama', ' Mystery            '];5.8;49;Obsessed with vengeance, a man sets out to find out why he was kidnapped and locked into solitary confinement for twenty years without reason.;['Spike Lee', None];['Josh Brolin', 'Elizabeth Olsen', 'Samuel L. Jackson', 'Sharlto Copley']
18;The Reef;2010;R;94;['Adventure', ' Drama', ' Horror            '];5.8;-1;A great white shark hunts the crew of a capsized sailboat along the Great Barrier Reef.;['Andrew Traucki', None];['Damian Walshe-Howling', 'Gyton Grantley', 'Adrienne Pickering', 'Zoe Naylor']
19;Présumé coupable;2009;PG-13;106;['Crime', ' Drama', ' Mystery            '];5.8;35;"Remake of the 1956 film noir film ""Beyond a Reasonable Doubt"" in which a writer's plan to expose a corrupt district attorney takes an unexpected turn.";['Peter Hyams', None];['Jesse Metcalfe', 'Amber Tamblyn', 'Michael Douglas', 'Joel David Moore']
20;Till Death;I) (2021;Accord parental;88;['Thriller            '];5.8;66;A woman is left handcuffed to her dead husband as part of a sick revenge plot. Unable to unshackle, she has to survive as two killers arrive to finish her off.;['S.K. Dale', None];['Megan Fox', 'Eoin Macken', 'Callan Mulvey', 'Jack Roth']
21;The Man from Toronto;2022;13;110;['Action', ' Adventure', ' Comedy            '];5.8;34;The world's deadliest assassin and New York's biggest screw-up are mistaken for each other at an Airbnb rental.;['Patrick Hughes', None];['Kevin Hart', 'Woody Harrelson', 'Jasmine Mathews', 'Kaley Cuoco']
22;Saw 5;2008;16;92;['Action', ' Crime', ' Horror            '];5.8;20;Following Jigsaw's grisly demise, Mark Hoffman is commended as a hero, but Agent Strahm is suspicious, and delves into Hoffman's past. Meanwhile, another group of people are put through a series of gruesome tests.;['David Hackl', None];['Scott Patterson', 'Costas Mandylor', 'Tobin Bell', 'Betsy Russell']
23;Old;2021;12;108;['Drama', ' Horror', ' Mystery            '];5.8;55;A vacationing family discovers that the secluded beach where they're relaxing for a few hours is somehow causing them to age rapidly, reducing their entire lives into a single day.;['M. Night Shyamalan', None];['Gael García Bernal', 'Vicky Krieps', 'Rufus Sewell', 'Alex Wolff']
24;The Contractor;2022;16;103;['Action', ' Thriller            '];5.8;52;A discharged U.S. Special Forces sergeant, James Harper, risks everything for his family when he joins a private contracting organization.;['Tarik Saleh', None];['Chris Pine', 'Gillian Jacobs', 'Sander Thomas', 'Toby Dixon']
25;Antebellum;2020;12;105;['Drama', ' Horror', ' Mystery            '];5.8;43;Successful author Veronica Henley finds herself trapped in a horrifying reality and must uncover the mind-bending mystery before it's too late.;['    Directors:', 'Gerard Bush, ', 'Christopher Renz', None];['Janelle Monáe', 'Eric Lange', 'Jena Malone', 'Jack Huston']
26;Chiens de paille;2011;16;110;['Action', ' Drama', ' Thriller            '];5.8;45;Los Angeles screenwriter David Sumner relocates with his wife to her hometown in the deep South. There, while tensions build between them, a brewing conflict with locals becomes a threat to them both.;['Rod Lurie', None];['James Marsden', 'Kate Bosworth', 'Alexander Skarsgård', 'James Woods']
27;Mad Money;2008;PG-13;104;['Comedy', ' Crime', ' Thriller            '];5.8;41;Three female employees of the Federal Reserve plot to steal money that is about to be destroyed.;['Callie Khouri', None];['Diane Keaton', 'Queen Latifah', 'Katie Holmes', 'Ted Danson']
28;Black Water;2007;R;90;['Action', ' Adventure', ' Drama            '];5.8;-1;A terrifying tale of survival in the mangrove swamps of Northern Australia;['    Directors:', 'David Nerlich, ', 'Andrew Traucki', None];['Diana Glenn', 'Maeve Dermody', 'Andy Rodoreda', 'Ben Oxenbould']
29;Joshua;2007;12;106;['Drama', ' Horror', ' Thriller            '];5.8;69;"The arrival of a newborn girl causes the gradual disintegration of the Cairn family; particularly for 9-year-old Joshua (Kogan), an eccentric boy whose proper upbringing and refined tastes both take a sinister turn.";['George Ratliff', None];['Sam Rockwell', 'Vera Farmiga', 'Jacob Kogan', 'Celia Weston']
30;Wolfman;2010;12;103;['Drama', ' Fantasy', ' Horror            '];5.8;43;Upon his return to his ancestral homeland, an American man is bitten and subsequently cursed by a werewolf.;['Joe Johnston', None];['Benicio Del Toro', 'Anthony Hopkins', 'Emily Blunt', 'Simon Merrells']
31;Sans aucun remords;II) (2021;16;109;['Action', ' Thriller', ' War            '];5.8;41;An elite Navy SEAL, goes on a path to avenge his wife's murder only to find himself inside of a larger conspiracy.;['Stefano Sollima', None];['Michael B. Jordan', 'Jodie Turner-Smith', 'Jamie Bell', 'Guy Pearce']
32;Le dernier rite;2009;Not Rated;92;['Drama', ' Horror', ' Mystery            '];5.8;33;After a family is forced to relocate for their son's health, they begin experiencing supernatural behavior in their new home, and uncover a sinister history.;['Peter Cornwell', None];['Virginia Madsen', 'Martin Donovan', 'Elias Koteas', 'Kyle Gallner']
33;Wind Chill;2007;R;91;['Adventure', ' Drama', ' Horror            '];5.8;52;Two college students share a ride home for the holidays, but when they break down on a deserted stretch of road, they are preyed upon by the ghosts of people who have died there.;['Gregory Jacobs', None];['Emily Blunt', 'Ashton Holmes', 'Martin Donovan', 'Ned Bellamy']
34;Goal 2: La consécration;2007;Tous Public;115;['Adventure', ' Drama', ' Sport            '];5.8;-1;When Newcastle United soccer star Santiago Muñez (Kuno Becker) is offered a spot with Real Madrid, he accepts, but the move - accompanied by big money and fame - tests his ties and loyalties to family, friends, and business acquaintances.;['Jaume Collet-Serra', None];['Kuno Becker', 'Alessandro Nivola', 'Anna Friel', 'Stephen Dillane']
35;Kill Bobby Z;2007;R;97;['Action', ' Crime', ' Thriller            '];5.8;-1;A DEA agent provides former Marine Tim Kearney with a way out of his prison sentence: impersonate Bobby Z, a recently deceased drug dealer, in a hostage switch with a crime lord.;['John Herzfeld', None];['Paul Walker', 'Laurence Fishburne', 'Olivia Wilde', 'Jason Flemyng']
36;Au-delà de l'illusion;2007;PG;97;['Drama', ' History', ' Romance            '];5.8;48;On a tour of Britain in 1926, Harry Houdini (Guy Pearce) enters into a passionate affair with a psychic out to con him.;['Gillian Armstrong', None];['Catherine Zeta-Jones', 'Guy Pearce', 'Timothy Spall', 'Saoirse Ronan']
37;Waist Deep;2006;R;97;['Action', ' Crime', ' Drama            '];5.8;37;An ex-convict (Tyrese) gets tangled up with a gang after his car is hijacked with his son inside.;['Vondie Curtis-Hall', None];['Tyrese Gibson', 'Meagan Good', 'Larenz Tate', 'Shawn Parr']
38;L'assistant du vampire;2009;Tous Public;119;['Action', ' Adventure', ' Fantasy            '];5.8;43;Teenager Darren Shan meets a mysterious man at a freak show who turns out to be a vampire. After a series of events, Darren must leave his normal life and go on the road with the Cirque du Freak, becoming a creature of the night.;['Paul Weitz', None];['Chris Massoglia', 'John C. Reilly', 'Salma Hayek', 'Josh Hutcherson']
39;Les Passagers;2008;Tous publics;93;['Mystery', ' Romance', ' Thriller            '];5.8;40;A grief counselor working with a group of plane-crash survivors finds herself at the root of a mystery when her clients begin to disappear.;['Rodrigo García', None];['Anne Hathaway', 'Patrick Wilson', 'David Morse', 'Andre Braugher']
40;Massacre à la tronçonneuse: Le commencement;2006;16;91;['Horror', ' Thriller            '];5.8;30;Before being sent to serve in Vietnam, two brothers and their girlfriends take one last road trip, but when they get into an accident, a terrifying experience will take them to a secluded house of horrors, with a chainsaw-wielding killer.;['Jonathan Liebesman', None];['Jordana Brewster', 'Matt Bomer', 'Diora Baird', 'Taylor Handley']
41;Destination finale 3;2006;12;93;['Horror', ' Thriller            '];5.8;41;Six years after students cheated death, another teen has a premonition she and her friends will be involved in an accident. When the vision proves true, the student and survivors deal with the repercussions of cheating the Grim Reaper.;['James Wong', None];['Mary Elizabeth Winstead', 'Ryan Merriman', 'Kris Lemche', 'Alexz Johnson']
42;Firewall;2006;Tous publics;105;['Action', ' Crime', ' Thriller            '];5.8;45;A security specialist is forced into robbing the bank that he's protecting, as a bid to pay off his family's ransom.;['Richard Loncraine', None];['Harrison Ford', 'Virginia Madsen', 'Paul Bettany', 'Carly Schroeder']
43;Cry Wolf;2005;Tous Public;90;['Drama', ' Horror', ' Mystery            '];5.8;39;Eight unsuspecting high school seniors at a posh boarding school, who delight themselves on playing games of lies, come face-to-face with terror and learn that nobody believes a liar - even when they're telling the truth.;['Jeff Wadlow', None];['Julian Morris', 'Lindy Booth', 'Jared Padalecki', 'Erica Yates']
44;Open water - En eaux profondes;2003;Tous publics;79;['Adventure', ' Drama', ' Horror            '];5.8;63;Based on the true story of two scuba divers accidentally stranded in shark infested waters after their tour boat has left.;['Chris Kentis', None];['Blanchard Ryan', 'Daniel Travis', 'Saul Stein', 'Michael E. Williamson']
45;Ginger snaps - Aux origines du mal;2004;R;94;['Drama', ' Horror', ' Thriller            '];5.8;-1;Set in 19th Century Canada, Brigette and her sister Ginger take refuge in a Traders' Fort which later becomes under siege by some savage werewolves.;['Grant Harvey', None];['Katharine Isabelle', 'Emily Perkins', 'Nathaniel Arcand', 'JR Bourne']
46;Mémoire effacée;2004;Tous publics;91;['Drama', ' Mystery', ' Sci-Fi            '];5.8;43;After being told that their children never existed, a man and woman soon discover there is a much bigger enemy at work.;['Joseph Ruben', None];['Julianne Moore', 'Dominic West', 'Christopher Kovaleski', 'Matthew Pleszewicz']
47;Gothika;2003;12;98;['Horror', ' Mystery', ' Thriller            '];5.8;38;A depressed psychiatrist wakes up as a patient in the asylum where she worked, with no memory of why she is there or what she has done.;['Mathieu Kassovitz', None];['Halle Berry', 'Penélope Cruz', 'Robert Downey Jr.', 'Charles S. Dutton']
48;L'enlèvement;2004;Tous publics;95;['Drama', ' Mystery', ' Thriller            '];5.8;60;As an executive is held captive by a former employee, it's up to his wife to deliver the ransom.;['Pieter Jan Brugge', None];['Robert Redford', 'Willem Dafoe', 'Helen Mirren', 'Alessandro Nivola']
49;Suspect Zero;2004;12;99;['Crime', ' Horror', ' Mystery            '];5.8;37;A mysterious serial killer is hunting other serial killers, and one F.B.I. Agent suspects there may be more to the vigilante than they imagine.;['E. Elias Merhige', None];['Aaron Eckhart', 'Ben Kingsley', 'Carrie-Anne Moss', 'Harry Lennix']
0;The Million Dollar Hotel;2000;Tous publics;122;['Drama', ' Mystery', ' Thriller            '];5.8;25;Tragi-comic, romantic whodunnit set in a run down hotel which plays host to mentally ill people too poor to afford medical insurance.;['Wim Wenders', None];['Jeremy Davies', 'Milla Jovovich', 'Mel Gibson', 'Jimmy Smits']
1;Halloween, 20 ans après;1998;12;86;['Horror', ' Thriller            '];5.8;52;Laurie Strode, now the dean of a Northern California private school with an assumed name, must battle the Shape one last time, as the life of her own son hangs in the balance.;['Steve Miner', None];['Jamie Lee Curtis', 'Josh Hartnett', 'Adam Arkin', 'Michelle Williams']
2;Relic;1997;12;110;['Horror', ' Mystery', ' Sci-Fi            '];5.8;55;A homicide detective and an anthropologist try to destroy a South American lizard-like god, who's on a people eating rampage in a Chicago museum.;['Peter Hyams', None];['Penelope Ann Miller', 'Tom Sizemore', 'Linda Hunt', 'James Whitmore']
3;Mary Reilly;1996;R;108;['Drama', ' Horror', ' Romance            '];5.8;44;A housemaid falls in love with Dr. Henry Jekyll and his darkly mysterious counterpart, Mr. Edward Hyde.;['Stephen Frears', None];['Julia Roberts', 'John Malkovich', 'George Cole', 'Michael Gambon']
4;Mort subite;1995;12;111;['Action', ' Crime', ' Thriller            '];5.8;-1;A former fireman takes on a group of terrorists holding the Vice President and others hostage during the seventh game of the NHL Stanley Cup finals.;['Peter Hyams', None];['Jean-Claude Van Damme', 'Powers Boothe', 'Raymond J. Barry', 'Whittni Wright']
5;La Mutante;1995;12;108;['Action', ' Horror', ' Sci-Fi            '];5.8;49;A group of scientists try to track down and trap a killer alien seductress before she successfully mates with a human.;['Roger Donaldson', None];['Natasha Henstridge', 'Michael Madsen', 'Ben Kingsley', 'Alfred Molina']
6;Mortal Kombat;1995;Tous publics;101;['Action', ' Adventure', ' Fantasy            '];5.8;60;Three unknowing martial artists are summoned to a mysterious island to compete in a tournament whose outcome will decide the fate of the world.;['Paul W.S. Anderson', None];['Christopher Lambert', 'Robin Shou', 'Linden Ashby', 'Cary-Hiroyuki Tagawa']
7;Guet-apens;1994;Tous publics;115;['Action', ' Adventure', ' Crime            '];5.8;51;An ex-con and his devoted wife must flee from danger when a heist doesn't go as planned.;['Roger Donaldson', None];['Alec Baldwin', 'Kim Basinger', 'Michael Madsen', 'James Woods']
8;À toute allure;1994;Tous publics;97;['Action', ' Adventure', ' Comedy            '];5.8;-1;Escaped convict Jack Hammond takes a woman hostage and sets off for the Mexican border with the police hot on his tail.;['Adam Rifkin', None];['Charlie Sheen', 'Kristy Swanson', 'Henry Rollins', 'Josh Mostel']
9;Piège en eaux troubles;1993;12;102;['Action', ' Crime', ' Mystery            '];5.8;36;Coming from a police family, Tom Hardy ends up fighting his uncle after the murder of his father. Tom believes the killer is another cop and goes on the record with his allegations. Demoted then to river duty, the killer taunts Tom.;['Rowdy Herrington', None];['Bruce Willis', 'Sarah Jessica Parker', 'Dennis Farina', 'Tom Sizemore']
10;The Crush;1993;12;89;['Drama', ' Thriller            '];5.8;34;A journalist becomes the unwanted center of attention for a 14-year-old girl, who proceeds to sabotage his life after he refuses her sexual advances.;['Alan Shapiro', None];['Cary Elwes', 'Alicia Silverstone', 'Jennifer Rubin', 'Kurtwood Smith']
11;Lune de miel à Las Vegas;1992;Tous publics;96;['Comedy', ' Romance', ' Thriller            '];5.8;63;Jack loses $65,000 in poker in Las Vegas, where he's marrying Betsy. The wedding will have to wait as the poker winner wants the weekend with Betsy to cancel the debt. She accepts. Whom will she marry?;['Andrew Bergman', None];['James Caan', 'Nicolas Cage', 'Sarah Jessica Parker', 'Pat Morita']
12;F/X2, effets très spéciaux;1991;NaN;108;['Action', ' Thriller            '];5.8;48;A special effects man helps his girlfriend's ex, a cop, with a sting operation, where the ex gets killed. Something's off and he investigates with help from an ex-cop PI friend.;['Richard Franklin', None];['Bryan Brown', 'Brian Dennehy', 'Rachel Ticotin', 'Joanna Gleason']
13;RoboCop 2;1990;12;117;['Action', ' Crime', ' Sci-Fi            '];5.8;42;RoboCop returns to protect the citizens of old Detroit but faces a deadly challenge when a rogue OCP member secretly creates a new, evil RoboCop 2.;['Irvin Kershner', None];"['Peter Weller', 'Nancy Allen', 'Belinda Bauer', ""Dan O'Herlihy""]"
14;Échec et mort;1990;12;96;['Action', ' Crime', ' Drama            '];5.8;41;Left for dead with his wife killed in their house, L.A. Detective Mason Storm will have to make a quick recovery, expose those behind the murder and take revenge.;['Bruce Malmuth', None];['Steven Seagal', 'Kelly LeBrock', 'William Sadler', 'Frederick Coffin']
15;Un flic à Chicago;1989;NaN;108;['Action', ' Crime', ' Drama            '];5.8;53;Truman, a Chicago cop, sets out to find the killer of his brother. Meanwhile, another of his brothers, Briar (a hillbilly) decides to find the killer himself.;['John Irvin', None];['Patrick Swayze', 'Liam Neeson', 'Adam Baldwin', 'Helen Hunt']
16;Leviathan;1989;NaN;98;['Adventure', ' Horror', ' Mystery            '];5.8;51;Perched on the hull of a wrecked Soviet freighter, a team of deep-sea miners led by head oceanographer Steven Beck comes face to face with a mutant creature that's the product of a failed genetic experiment.;['George P. Cosmatos', None];['Peter Weller', 'Richard Crenna', 'Amanda Pays', 'Daniel Stern']
17;La septième prophétie;1988;Tous publics;97;['Drama', ' Fantasy', ' Horror            '];5.8;-1;Abby Quinn is eagerly awaiting childbirth but is haunted by dreams where she suffers a miscarriage. When she decides to rent a room to a mysterious stranger, she realizes a chain of events that will unleash the end of humanity.;['Carl Schultz', None];['Demi Moore', 'Michael Biehn', 'Jürgen Prochnow', 'Peter Friedman']
18;Rambo III;1988;Tous publics;102;['Action', ' Adventure', ' Thriller            '];5.8;36;Rambo mounts a one-man mission to rescue his friend Colonel Trautman from the clutches of the formidable invading Soviet forces in Afghanistan.;['Peter MacDonald', None];['Sylvester Stallone', 'Richard Crenna', 'Marc de Jonge', 'Kurtwood Smith']
19;Halloween 4;1988;12;88;['Horror', ' Thriller            '];5.8;34;Ten years after his original massacre, the invalid Michael Myers awakens on Halloween Eve and returns to Haddonfield to kill his seven-year-old niece. Can Dr. Loomis stop him?;['Dwight H. Little', None];['Donald Pleasence', 'Ellie Cornell', 'Danielle Harris', 'George P. Wilbur']
20;Cobra;1986;12;87;['Action', ' Crime', ' Thriller            '];5.8;25;A tough-on-crime street cop must protect the only surviving witness to a strange murderous cult with far-reaching plans.;['George P. Cosmatos', None];['Sylvester Stallone', 'Brigitte Nielsen', 'Reni Santoni', 'Andrew Robinson']
21;Le justicier de New York;1985;16;92;['Action', ' Crime', ' Drama            '];5.8;18;Architect/vigilante Paul Kersey arrives back in New York City and is forcibly recruited by a crooked police chief to fight street crime caused by a large gang terrorizing the neighborhoods.;['Michael Winner', None];['Charles Bronson', 'Deborah Raffin', 'Ed Lauter', 'Martin Balsam']
22;Douce nuit, sanglante nuit;1984;16;79;['Horror', ' Thriller            '];5.8;31;Little Billy witness his parents getting killed by Santa after being warned by his senile grandpa that Santa punishes those who are naughty. Now Billy is 18, and out of the orphanage, and he has just become Santa, himself.;['Charles E. Sellier Jr.', None];['Lilyan Chauvin', 'Gilmer McCormick', 'Toni Nero', 'Robert Brian Wilson']
23;Runaway - L'évadé du futur;1984;Tous publics;99;['Action', ' Crime', ' Sci-Fi            '];5.8;50;In the near future, a police officer specializes in malfunctioning robots. When a robot turns out to have been programmed to kill, he begins to uncover a homicidal plot to create killer robots... and his son becomes a target.;['Michael Crichton', None];['Tom Selleck', 'Cynthia Rhodes', 'Gene Simmons', 'Kirstie Alley']
24;Le monstre du train;1980;16;97;['Horror', ' Mystery', ' Thriller            '];5.8;42;Three years after a prank went terribly awry, the six college students responsible are targeted by a masked killer at a New Year's Eve party aboard a moving train.;['Roger Spottiswoode', None];['Ben Johnson', 'Jamie Lee Curtis', 'Hart Bochner', 'David Copperfield']
25;Les Dents de la mer, 2ᵉ partie;1978;Tous publics;116;['Adventure', ' Horror', ' Thriller            '];5.8;51;Police chief Brody must protect the citizens of Amity after a second monstrous shark begins terrorizing the waters.;['Jeannot Szwarc', None];['Roy Scheider', 'Lorraine Gary', 'Murray Hamilton', 'Joseph Mascolo']
26;Escape Game 2 - Le Monde est un piège;2021;Tous publics;88;['Action', ' Adventure', ' Horror            '];5.7;48;Six people unwillingly find themselves locked in another series of escape rooms, slowly uncovering what they have in common to survive. Joining forces with two of the original survivors, they soon discover they've all played the game before.;['Adam Robitel', None];['Taylor Russell', 'Logan Miller', 'Deborah Ann Woll', 'Thomas Cocquerel']
27;The Vanished;2020;R;115;['Action', ' Crime', ' Horror            '];5.7;-1;A husband and wife will stop at nothing to find their missing daughter, who disappeared on a family camping trip. When the police don't have any leads, the duo takes over.;['Peter Facinelli', None];['Anne Heche', 'Thomas Jane', 'Jason Patric', 'Alex Haydon']
28;Jurassic World: Le monde d'après;2022;Tous publics;147;['Action', ' Adventure', ' Sci-Fi            '];5.7;38;Four years after the destruction of Isla Nublar, Biosyn operatives attempt to track down Maisie Lockwood, while Dr Ellie Sattler investigates a genetically engineered swarm of giant insects.;['Colin Trevorrow', None];['Chris Pratt', 'Bryce Dallas Howard', 'Laura Dern', 'Sam Neill']
29;Come Play;2020;PG-13;96;['Drama', ' Horror', ' Mystery            '];5.7;58;A monster named Larry manifests itself through smart phones and mobile devices. Feature film version of the 2017 short film.;['Jacob Chase', None];['Azhy Robertson', 'Gillian Jacobs', 'John Gallagher Jr.', 'Winslow Fegley']
30;Velvet Buzzsaw;2019;16;113;['Horror', ' Mystery', ' Thriller            '];5.7;61;A satire set in the contemporary art world scene of Los Angeles, where big money artists and mega-collectors pay a high price when art collides with commerce.;['Dan Gilroy', None];['Jake Gyllenhaal', 'Rene Russo', 'Zawe Ashton', 'Tom Sturridge']
31;Black Crab;2022;16;114;['Action', ' Adventure', ' Drama            '];5.7;54;In a post-apocalyptic world, six soldiers on a covert mission must transport a mysterious package across a frozen archipelago. Noomi Rapace stars.;['Adam Berg', None];['Noomi Rapace', 'Jakob Oftebro', 'Dar Salim', 'Erik Enge']
32;Acts of Vengeance;2017;12;87;['Action', ' Drama', ' Thriller            '];5.7;49;A fast-talking lawyer transforms his body and takes a vow of silence, not to be broken until he finds out who killed his wife and daughter and has his revenge.;['Isaac Florentine', None];['Antonio Banderas', 'Karl Urban', 'Paz Vega', 'Cristina Serafini']
33;La Femme à la fenêtre;2021;16;100;['Crime', ' Drama', ' Mystery            '];5.7;41;An agoraphobic woman living alone in New York begins spying on her new neighbors, only to witness a disturbing act of violence.;['Joe Wright', None];['Amy Adams', 'Gary Oldman', 'Anthony Mackie', 'Fred Hechinger']
34;Insidious: la dernière clé;2018;12;103;['Horror', ' Mystery', ' Thriller            '];5.7;49;Parapsychologist Dr. Elise Rainier faces her most fearsome and personal haunting yet, as she is drawn back to her ghostly childhood home, where the terror began.;['Adam Robitel', None];['Lin Shaye', 'Leigh Whannell', 'Angus Sampson', 'Kirk Acevedo']
35;The Domestics;2018;16;95;['Action', ' Horror', ' Sci-Fi            '];5.7;-1;In the weeks following an apocalyptic event, a husband and wife venture across the countryside inhabited by deadly factions in search of safety, and must work together as they are pushed to the breaking point in order to survive.;['Mike P. Nelson', None];['Kate Bosworth', 'Tyler Hoechlin', 'Sonoya Mizuno', 'Lance Reddick']
36;Close;I) (2019;16;94;['Action', ' Drama', ' Thriller            '];5.7;51;A female bodyguard is hired to protect an heiress on the run from assassins.;['Vicky Jewson', None];['Noomi Rapace', 'Olivia Jewson', 'Abdellatif Chaouqi', 'Sophie Nélisse']
37;La part obscure;2018;NaN;100;['Mystery', ' Thriller            '];5.7;59;A blind musician hears a murder committed in the apartment upstairs from hers that sends her down a dark path into London's gritty criminal underworld.;['Anthony Byrne', None];['Natalie Dormer', 'Ed Skrein', 'Emily Ratajkowski', 'Neil Maskell']
38;Aftermath;IV) (2017;Tous publics;94;['Drama', ' Thriller            '];5.7;44;Two strangers' lives become inextricably bound together after a devastating plane crash.;['Elliott Lester', None];['Arnold Schwarzenegger', 'Scoot McNairy', 'Maggie Grace', 'Judah Nelson']
39;Bons baisers du tueur;2020;18;104;['Crime', ' Drama', ' Thriller            '];5.7;29;"A New York detective investigates the death of his daughter who was murdered while on her honeymoon in London; he recruits the help of a Scandinavian journalist when other couples throughout Europe suffer a similar fate.";['Danis Tanovic', None];['Jeffrey Dean Morgan', 'Famke Janssen', 'Cush Jumbo', 'Joachim Król']
40;Darkest Minds: Rébellion;2018;Tous publics;104;['Action', ' Adventure', ' Drama            '];5.7;39;Imprisoned by an adult world that now fears everyone under 18, a group of teens form a resistance group to fight back and reclaim control of their future.;['Jennifer Yuh Nelson', None];['Amandla Stenberg', 'Mandy Moore', 'Bradley Whitford', 'Harris Dickinson']
