;name;year;certificate;runtime;genre;rating;metascore;text-muted;director;stars
7;Breakdown - Point de rupture;I) (1997;12;93;['Crime', ' Drama', ' Mystery            '];7.0;73;A man searches for his missing wife after his car breaks down in the middle of the desert.;['Jonathan Mostow', None];['Kurt Russell', 'J.T. Walsh', 'Kathleen Quinlan', 'M.C. Gainey']
8;Cannibal! The Musical;1993;12;95;['Comedy', ' Musical', ' Thriller            '];7.0;-1;The sole survivor of an ill-fated mining expedition tells how his taste for gold was replaced by that of human flesh.;['Trey Parker', None];['Trey Parker', 'Dian Bachar', 'Stephen Blackpool', 'Stan Brakhage']
9;Last Seduction;1994;Tous publics;110;['Crime', ' Drama', ' Romance            '];7.0;85;A devious sexpot steals her husband's drug money and hides out in a small town where she meets the perfect dupe for her next scheme.;['John Dahl', None];['Linda Fiorentino', 'Peter Berg', 'Bill Pullman', 'Michael Raysses']
10;Red Rock West;1993;Tous publics;98;['Crime', ' Drama', ' Thriller            '];7.0;79;Upon arriving to a small town, a drifter is mistaken for a hitman, but when the real hitman arrives, complications ensue.;['John Dahl', None];['Nicolas Cage', 'Dennis Hopper', 'Lara Flynn Boyle', 'Craig Reay']
11;Juice;1992;R;95;['Action', ' Crime', ' Drama            '];7.0;60;"Four inner-city teenagers get caught up in the pursuit of power and happiness, which they refer to as ""the juice"".";['Ernest R. Dickerson', None];['Omar Epps', 'Tupac Shakur', 'Jermaine Hopkins', 'Khalil Kain']
12;Basic Instinct;1992;16;127;['Drama', ' Mystery', ' Thriller            '];7.0;41;A violent police detective investigates a brutal murder that might involve a manipulative and seductive novelist.;['Paul Verhoeven', None];['Michael Douglas', 'Sharon Stone', 'George Dzundza', 'Jeanne Tripplehorn']
13;Bad Lieutenant;1992;16;96;['Crime', ' Drama', ' Thriller            '];7.0;70;While investigating a young nun's rape, a corrupt New York City police detective, with a serious drug and gambling addiction, tries to change his ways and find forgiveness and redemption.;['Abel Ferrara', None];['Harvey Keitel', 'Brian McElroy', 'Frank Acciarito', 'Peggy Gormley']
14;Le dernier samaritain;1991;12;105;['Action', ' Comedy', ' Crime            '];7.0;52;A private detective's protected female witness is murdered, prompting him and the victim's boyfriend to investigate the crime that leads to a corrupt politician and a crooked football team owner.;['Tony Scott', None];['Bruce Willis', 'Damon Wayans', 'Chelsea Field', 'Noble Willingham']
15;Henry, portrait d'un serial killer;1986;16 avec avertissement;83;['Biography', ' Crime', ' Drama            '];7.0;80;Arriving in Chicago, Henry moves in with ex-con acquaintance Otis and starts schooling him in the ways of the serial killer.;['John McNaughton', None];['Michael Rooker', 'Tracy Arnold', 'Tom Towles', 'Mary Demas']
16;Appel d'urgence;1988;Tous publics;87;['Action', ' Drama', ' Romance            '];7.0;-1;A young man hears a chance phone call telling him that a nuclear war has started and missiles will hit his city in 70 minutes.;['Steve De Jarnatt', None];['Anthony Edwards', 'Mare Winningham', 'John Agar', 'Lou Hancock']
17;Hidden;1987;12;97;['Horror', ' Sci-Fi', ' Thriller            '];7.0;69;A cop and an FBI agent race for answers after law abiding people suddenly become violent criminals.;['Jack Sholder', None];['Kyle MacLachlan', 'Michael Nouri', 'Claudia Christian', 'Clarence Felder']
18;Piège mortel;1982;NaN;116;['Comedy', ' Crime', ' Mystery            '];7.0;54;A Broadway playwright puts murder in his plan to take credit for a student's play.;['Sidney Lumet', None];['Michael Caine', 'Christopher Reeve', 'Dyan Cannon', 'Irene Worth']
19;Ces garçons qui venaient du Brésil;1978;16;125;['Drama', ' Mystery', ' Sci-Fi            '];7.0;40;A Nazi hunter in Paraguay discovers a sinister and bizarre plot to rekindle the Third Reich.;['Franklin J. Schaffner', None];['Gregory Peck', 'Laurence Olivier', 'James Mason', 'Lilli Palmer']
20;L'espion qui m'aimait;1977;Tous publics;125;['Action', ' Adventure', ' Thriller            '];7.0;55;James Bond investigates the hijacking of British and Russian submarines carrying nuclear warheads, with the help of a K.G.B. agent whose lover he killed.;['Lewis Gilbert', None];['Roger Moore', 'Barbara Bach', 'Curd Jürgens', 'Richard Kiel']
21;La dernière vague;1977;NaN;106;['Drama', ' Fantasy', ' Mystery            '];7.0;85;A Sydney lawyer defends five Aboriginal Persons in a ritualized taboo murder and in the process learns disturbing things about himself and premonitions.;['Peter Weir', None];['Richard Chamberlain', 'Olivia Hamnett', 'David Gulpilil', 'Frederick Parslow']
22;La petite fille au bout du chemin;1976;Tous publics;91;['Drama', ' Horror', ' Mystery            '];7.0;53;"In a little seaside town, thirteen year-old Rynn Jacobs is celebrating her birthday alone on a Halloween night. She and her father had arrived from England recently and leased the house for...                See full summary »
";['Nicolas Gessner', None];['Jodie Foster', 'Martin Sheen', 'Alexis Smith', 'Mort Shuman']
23;La tour infernale;1974;Tous publics;165;['Action', ' Drama', ' Thriller            '];7.0;69;At the opening party of a colossal, but poorly constructed, office building, a massive fire breaks out that threatens to destroy the tower and everyone in it.;['John Guillermin', None];['Paul Newman', 'Steve McQueen', 'William Holden', 'Faye Dunaway']
24;Le dossier Odessa;1974;Tous Public;130;['Drama', ' Thriller            '];7.0;-1;Following the suicide of an elderly Jewish man, a journalist in possession of the man's diary investigates the alleged sighting of a former S.S. Captain, who commanded a concentration camp during World War II.;['Ronald Neame', None];['Jon Voight', 'Maximilian Schell', 'Maria Schell', 'Mary Tamm']
25;Soleil vert;1973;13;97;['Crime', ' Mystery', ' Sci-Fi            '];7.0;66;A nightmarish futuristic fantasy about the controlling power of big corporations and an innocent cop who stumbles on the truth.;['Richard Fleischer', None];['Charlton Heston', 'Edward G. Robinson', 'Leigh Taylor-Young', 'Chuck Connors']
26;La vie privée de Sherlock Holmes;1970;Tous Public;125;['Adventure', ' Comedy', ' Crime            '];7.0;-1;When a bored Holmes eagerly takes the case of Gabrielle Valladon after an attempt on her life, the search for her missing husband leads to Loch Ness and the legendary monster.;['Billy Wilder', None];['Robert Stephens', 'Christopher Lee', 'Colin Blakely', 'Geneviève Page']
27;Les Monstres de l'espace;1967;Tous publics;97;['Horror', ' Mystery', ' Sci-Fi            '];7.0;-1;A mysterious artifact is unearthed in London, and famous scientist Bernard Quatermass is called in to divine its origins and explain its strange effects on people.;['Roy Ward Baker', None];['James Donald', 'Andrew Keir', 'Barbara Shelley', 'Julian Glover']
28;Cul-de-sac;1966;Tous publics;112;['Comedy', ' Drama', ' Thriller            '];7.0;75;"In search of help, two wounded gangsters on the run find refuge in the secluded castle of a feeble man and his wife; however, under the point of a gun, nothing is what it seems.";['Roman Polanski', None];['Donald Pleasence', 'Françoise Dorléac', 'Lionel Stander', 'Jack MacGowran']
29;Alphaville, une étrange aventure de Lemmy Caution;1965;Tous publics;99;['Drama', ' Mystery', ' Sci-Fi            '];7.0;-1;A U.S. secret agent is sent to the distant space city of Alphaville where he must find a missing person and free the city from its tyrannical ruler.;['Jean-Luc Godard', None];['Eddie Constantine', 'Anna Karina', 'Akim Tamiroff', 'Valérie Boisgel']
30;Frankenstein s'est échappé;1957;Tous publics;82;['Horror', ' Sci-Fi', ' Thriller            '];7.0;59;While awaiting execution for murder, Baron Victor Frankenstein tells the story of a creature he built and brought to life - only for it to behave not as he intended.;['Terence Fisher', None];['Peter Cushing', 'Hazel Court', 'Robert Urquhart', 'Christopher Lee']
31;La Guerre des mondes;1953;Tous publics;85;['Action', ' Sci-Fi', ' Thriller            '];7.0;78;A small town in California is attacked by Martians, beginning a worldwide invasion.;['Byron Haskin', None];['Gene Barry', 'Ann Robinson', 'Les Tremayne', 'Robert Cornthwaite']
32;Niagara;1953;Tous publics;92;['Film-Noir', ' Thriller            '];7.0;-1;As two couples are visiting Niagara Falls, tensions between one wife and her husband reach the level of murder.;['Henry Hathaway', None];['Marilyn Monroe', 'Joseph Cotten', 'Jean Peters', 'Max Showalter']
33;Le Grand Alibi;1950;Tous publics;110;['Film-Noir', ' Mystery', ' Thriller            '];7.0;-1;A struggling actress tries to help a friend prove his innocence after he's accused of murdering the husband of a high-society entertainer.;['Alfred Hitchcock', None];['Marlene Dietrich', 'Jane Wyman', 'Richard Todd', 'Michael Wilding']
34;Sabotage;1936;Tous Public;76;['Crime', ' Thriller            '];7.0;85;A Scotland Yard undercover detective is on the trail of a saboteur who is part of a plot to set off a bomb in London. But when the detective's cover is blown, the plot begins to unravel.;['Alfred Hitchcock', None];['Sylvia Sidney', 'Oskar Homolka', 'Desmond Tester', 'John Loder']
35;Une soirée étrange;1932;Tous publics;72;['Adventure', ' Comedy', ' Drama            '];7.0;-1;Seeking shelter from a storm, five travelers are in for a bizarre and terrifying night when they stumble upon the Femm family estate.;['James Whale', None];['Boris Karloff', 'Melvyn Douglas', 'Charles Laughton', 'Gloria Stuart']
36;L'ombre de Staline;2019;Tous publics;141;['Biography', ' Drama', ' Thriller            '];6.9;68;A Welsh journalist breaks the news in the western media of the famine in Ukraine in the early 1930s.;['Agnieszka Holland', None];['James Norton', 'Vanessa Kirby', 'Peter Sarsgaard', 'Joseph Mawle']
37;Traîné sur le bitume;2018;Tous publics;158;['Action', ' Thriller            '];6.9;60;Once two overzealous cops get suspended from the force, they must delve into the criminal underworld to get their proper compensation.;['S. Craig Zahler', None];['Mel Gibson', 'Vince Vaughn', 'Tory Kittles', 'Michael Jai White']
38;The Night Comes for Us;2018;18;121;['Action', ' Thriller            '];6.9;69;Ito, a gangland enforcer, caught amidst a treacherous and violent insurrection within his Triad crime family upon his return home from a stint abroad.;['Timo Tjahjanto', None];['Iko Uwais', 'Joe Taslim', 'Julie Estelle', 'Hannah Al Rashid']
39;Monos;2019;12;102;['Adventure', ' Drama', ' Thriller            '];6.9;78;On a remote mountaintop, eight kids with guns watch over a hostage and a conscripted milk cow.;['Alejandro Landes', None];['Sofia Buenaventura', 'Julián Giraldo', 'Karen Quintero', 'Laura Castrillón']
40;I Don't Feel at Home in This World Anymore.;2017;16;93;['Comedy', ' Crime', ' Drama            '];6.9;75;When a depressed woman is burgled, she finds a new sense of purpose by tracking down the thieves alongside her obnoxious neighbour. But they soon find themselves dangerously out of their depth against a pack of degenerate criminals.;['Macon Blair', None];['Melanie Lynskey', 'Chris Doubek', 'Marilyn Faith Hickey', 'Jared Roylance']
41;Everybody Knows;2018;Tous publics;133;['Crime', ' Drama', ' Mystery            '];6.9;68;Laura, a Spanish woman living in Buenos Aires, returns to her hometown outside Madrid with her two children to attend her sister's wedding. However, the trip is upset by unexpected events that bring secrets into the open.;['Asghar Farhadi', None];['Penélope Cruz', 'Javier Bardem', 'Ricardo Darín', 'Eduard Fernández']
42;The Witch;2015;12;92;['Drama', ' Fantasy', ' Horror            '];6.9;83;A family in 1630s New England is torn apart by the forces of witchcraft, black magic and possession.;['Robert Eggers', None];['Anya Taylor-Joy', 'Ralph Ineson', 'Kate Dickie', 'Julian Richings']
43;Legend;I) (2015;12;132;['Biography', ' Crime', ' Drama            '];6.9;55;Identical twin gangsters Ronald and Reginald Kray terrorize London during the 1960s.;['Brian Helgeland', None];['Tom Hardy', 'Emily Browning', 'Taron Egerton', 'Paul Anderson']
44;Slow West;2015;R;84;['Action', ' Adventure', ' Drama            '];6.9;72;A young Scottish man travels across America in pursuit of the woman he loves, attracting the attention of an outlaw who is willing to serve as a guide.;['John Maclean', None];['Kodi Smit-McPhee', 'Caren Pistorius', 'Aorere Paki', 'Jeffrey Thomas']
45;White God;2014;12;121;['Drama', ' Thriller            '];6.9;80;Thirteen-year-old Lili fights to protect her dog Hagen. She is devastated when her father eventually sets Hagen free on the streets. Still innocently believing love can conquer any difficulty, Lili sets out to find her dog and save him.;['Kornél Mundruczó', None];['Zsófia Psotta', 'Sándor Zsótér', 'Lili Horvát', 'Szabolcs Thuróczy']
46;Game Night;I) (2018;Tous publics;100;['Action', ' Adventure', ' Comedy            '];6.9;66;A group of friends who meet regularly for game nights find themselves entangled in a real-life mystery when the shady brother of one of them is seemingly kidnapped by dangerous gangsters.;['    Directors:', 'John Francis Daley, ', 'Jonathan Goldstein', None];['Jason Bateman', 'Rachel McAdams', 'Kyle Chandler', 'Sharon Horgan']
47;Enemy;2013;Tous publics;91;['Drama', ' Mystery', ' Thriller            '];6.9;61;A man seeks out his exact look-alike after spotting him in a movie.;['Denis Villeneuve', None];['Jake Gyllenhaal', 'Mélanie Laurent', 'Sarah Gadon', 'Isabella Rossellini']
48;Non-Stop;2014;Tous publics;106;['Action', ' Mystery', ' Thriller            '];6.9;56;An air marshal springs into action during a transatlantic flight after receiving a series of text messages demanding $150 million into an off-shore account, or someone will die every 20 minutes.;['Jaume Collet-Serra', None];['Liam Neeson', 'Julianne Moore', 'Scoot McNairy', 'Michelle Dockery']
49;Last Days of Summer;2013;Tous publics;111;['Drama', ' Romance', ' Thriller            '];6.9;52;Depressed single mom Adele and her son Henry offer a wounded, fearsome man a ride. As police search town for the escaped convict, the mother and son gradually learn his true story as their options become increasingly limited.;['Jason Reitman', None];['Kate Winslet', 'Josh Brolin', 'Gattlin Griffith', 'Clark Gregg']
0;Frankenweenie;2012;Tous publics;87;['Animation', ' Comedy', ' Drama            '];6.9;74;When a boy's beloved dog passes away suddenly, he attempts to bring the animal back to life through a powerful science experiment.;['Tim Burton', None];"['Winona Ryder', ""Catherine O'Hara"", 'Martin Short', 'Martin Landau']"
1;Nope;2022;Tous publics avec avertissement;130;['Horror', ' Mystery', ' Sci-Fi            '];6.9;77;The residents of a lonely gulch in inland California bear witness to an uncanny and chilling discovery.;['Jordan Peele', None];['Daniel Kaluuya', 'Keke Palmer', 'Brandon Perea', 'Michael Wincott']
2;Le Gangster, le flic & l'assassin;2019;12;109;['Action', ' Crime', ' Thriller            '];6.9;65;A crime boss teams up with a cop to track down a serial killer.;['Won-Tae Lee', None];['Ma Dong-seok', 'Jeon Bae-soo', 'Mu-Yeol Kim', 'Kim Sungkyu']
3;Trahison;2008;Tous Public;114;['Action', ' Crime', ' Drama            '];6.9;61;When straight arrow FBI agent Roy Clayton heads up the investigation into a dangerous international conspiracy, all clues seem to lead back to former U.S. Special Operations officer, Samir Horn.;['Jeffrey Nachmanoff', None];['Don Cheadle', 'Guy Pearce', 'Archie Panjabi', 'Saïd Taghmaoui']
4;Ocean's 13;2007;Tous publics;122;['Crime', ' Thriller            '];6.9;62;Danny Ocean rounds up the boys for a third heist after casino owner Willy Bank double-crosses one of the original eleven, Reuben Tishkoff.;['Steven Soderbergh', None];['George Clooney', 'Brad Pitt', 'Matt Damon', 'Michael Mantell']
5;Hyper tension;2006;12;88;['Action', ' Crime', ' Thriller            '];6.9;57;Professional assassin Chev Chelios learns his rival has injected him with a poison that will kill him if his heart rate drops.;['    Directors:', 'Mark Neveldine, ', 'Brian Taylor', None];['Jason Statham', 'Amy Smart', 'Carlos Sanz', 'Jose Pablo Cantillo']
6;Alpha Dog;2006;12;122;['Biography', ' Crime', ' Drama            '];6.9;53;Johnny and his pals kidnap Jake's 15-year-old brother Zach, then assign his buddy Frankie to be Zach's minder. They develop a brotherly friendship. Zach parties with his captors as things begin to spin out of control.;['Nick Cassavetes', None];['Emile Hirsch', 'Justin Timberlake', 'Anton Yelchin', 'Bruce Willis']
7;New Police Story;2004;R;123;['Action', ' Crime', ' Thriller            '];6.9;-1;A hero cop accidentally leads his team into a trap from which he is the only survivor. Drowning his guilt in booze, he is eventually assigned a new younger partner who turns out to have his own secrets.;['Benny Chan', None];['Jackie Chan', 'Nicholas Tse', 'Charlie Yeung', 'Daniel Wu']
8;Benjamin Gates et le Trésor des Templiers;2004;Tous publics;131;['Action', ' Adventure', ' Mystery            '];6.9;39;A historian races to find the legendary Templar Treasure before a team of mercenaries.;['Jon Turteltaub', None];['Nicolas Cage', 'Diane Kruger', 'Justin Bartha', 'Sean Bean']
9;Syriana;2005;Tous publics;128;['Drama', ' Thriller            '];6.9;76;A politically charged epic about the state of the oil industry in the hands of those personally involved in and affected by it.;['Stephen Gaghan', None];['George Clooney', 'Matt Damon', 'Amanda Peet', 'Kayvan Novak']
10;The Assassination of Richard Nixon;2004;Tous publics avec avertissement;95;['Biography', ' Crime', ' Drama            '];6.9;63;Based on real life events, Assassination is set in 1974 and centers on a businessman who decides to take extreme measures to achieve his American dream.;['Niels Mueller', None];['Sean Penn', 'Naomi Watts', 'Don Cheadle', 'Jack Thompson']
11;Rencontre à Wicker Park;2004;Tous Public;114;['Drama', ' Mystery', ' Romance            '];6.9;40;A young Chicago advertising executive believes a woman he sees in a café is his long-lost love. His belief leads to obsession, as he puts his life on hold in order to trail her.;['Paul McGuigan', None];['Josh Hartnett', 'Diane Kruger', 'Matthew Lillard', 'Rose Byrne']
12;Mission: Impossible III;2006;Tous publics;126;['Action', ' Adventure', ' Thriller            '];6.9;66;IMF agent Ethan Hunt comes into conflict with a dangerous and sadistic arms dealer who threatens his life and his fiancée in response.;['J.J. Abrams', None];['Tom Cruise', 'Michelle Monaghan', 'Ving Rhames', 'Philip Seymour Hoffman']
13;Le dernier château;2001;R;131;['Action', ' Drama', ' Thriller            '];6.9;43;A court-martialed General rallies together twelve hundred inmates to rise against a corrupt and sadistic warden.;['Rod Lurie', None];['Robert Redford', 'James Gandolfini', 'Mark Ruffalo', 'Steve Burton']
14;Vanilla Sky;2001;Tous publics;136;['Fantasy', ' Mystery', ' Romance            '];6.9;45;A self-indulgent and vain publishing magnate finds his privileged life upended after a vehicular accident with a resentful lover.;['Cameron Crowe', None];['Tom Cruise', 'Penélope Cruz', 'Cameron Diaz', 'Kurt Russell']
15;Kaho Naa... Pyaar Hai;2000;NaN;172;['Action', ' Musical', ' Romance            '];6.9;-1;A young girl meets the doppelganger of her deceased boyfriend and now has a chance to find the people who have murdered him.;['Rakesh Roshan', None];['Hrithik Roshan', 'Ameesha Patel', 'Anupam Kher', 'Dalip Tahil']
16;Manipulations;2000;Tous publics;126;['Drama', ' Thriller            '];6.9;59;Senator Laine Hanson is a contender for U.S. Vice President, but information and disinformation about her past surfaces that threatens to derail her confirmation.;['Rod Lurie', None];['Joan Allen', 'Gary Oldman', 'Jeff Bridges', 'Christian Slater']
17;L'Anglais;1999;Tous publics;89;['Crime', ' Drama', ' Mystery            '];6.9;73;An extremely volatile and dangerous Englishman goes to Los Angeles to find the man he considers responsible for his daughter's death.;['Steven Soderbergh', None];['Terence Stamp', 'Peter Fonda', 'Lesley Ann Warren', 'Luis Guzmán']
18;Hypnose;1999;12;99;['Horror', ' Mystery', ' Thriller            '];6.9;67;After being hypnotized by his sister-in-law, a man begins seeing haunting visions of a girl's ghost and a mystery begins to unfold around him.;['David Koepp', None];['Kevin Bacon', 'Zachary David Cope', 'Kathryn Erbe', 'Illeana Douglas']
19;Loin du paradis;1998;Tous publics;111;['Drama', ' Romance', ' Thriller            '];6.9;54;Two friends must choose whether to help a third friend who was arrested in Malaysia for drug possession.;['Joseph Ruben', None];['Vince Vaughn', 'Anne Heche', 'Joaquin Phoenix', 'David Conrad']
20;La méthode zéro;1998;R;116;['Comedy', ' Crime', ' Drama            '];6.9;-1;The world's greatest detective Daryl Zero aided by his associate Steve Arlo investigates a complex and mysterious case of blackmail and missing keys for shady tycoon Gregory Stark who is less than forthcoming about what is really happening!;['Jake Kasdan', None];"['Bill Pullman', 'Ben Stiller', ""Ryan O'Neal"", 'Kim Dickens']"
21;Suicide Kings;1997;12;106;['Comedy', ' Crime', ' Drama            '];6.9;43;A group of youngsters kidnap a respected Mafia figure.;"[""Peter O'Fallon"", None]";['Christopher Walken', 'Denis Leary', 'Sean Patrick Flanery', 'Mark Watson']
22;À couteaux tirés;1997;Tous publics;117;['Action', ' Adventure', ' Drama            '];6.9;-1;An intellectual billionaire and two other men struggle to band together and survive after getting stranded in the Alaskan wilderness with a blood-thirsty Kodiak Bear hunting them down.;['Lee Tamahori', None];['Anthony Hopkins', 'Alec Baldwin', 'Elle Macpherson', 'Harold Perrineau']
23;Les ailes de l'enfer;1997;12;115;['Action', ' Crime', ' Thriller            '];6.9;52;Newly-paroled ex-con and former U.S. Ranger Cameron Poe finds himself trapped in a prisoner-transport plane when the passengers seize control.;['Simon West', None];['Nicolas Cage', 'John Cusack', 'John Malkovich', 'Colm Meaney']
24;Affliction;1997;Tous publics;114;['Drama', ' Mystery', ' Thriller            '];6.9;79;A deeply troubled small-town cop investigates a suspicious hunting death while other events jeopardize his sanity.;['Paul Schrader', None];['Nick Nolte', 'Sissy Spacek', 'James Coburn', 'Brigid Tierney']
25;Get Shorty (Stars et truands);1995;Tous publics;105;['Comedy', ' Crime', ' Thriller            '];6.9;82;A mobster travels to Hollywood to collect a debt, and discovers that the movie business is much the same as his current job.;['Barry Sonnenfeld', None];['Gene Hackman', 'Rene Russo', 'Danny DeVito', 'John Travolta']
26;Génération sacrifiée;1995;16;119;['Action', ' Crime', ' Drama            '];6.9;-1;A Vietnam vet adjusts to life after the war while trying to support his family, but the chance of a better life may involve crime and bloodshed.;['    Directors:', 'Albert Hughes, ', 'Allen Hughes', None];['Larenz Tate', 'Keith David', 'Chris Tucker', 'Freddy Rodríguez']
27;Danger immédiat;1994;Tous publics;141;['Action', ' Crime', ' Drama            '];6.9;74;CIA Analyst Jack Ryan is drawn into an illegal war fought by the US government against a Colombian drug cartel.;['Phillip Noyce', None];['Harrison Ford', 'Willem Dafoe', 'Anne Archer', 'Joaquim de Almeida']
28;Police Story 3: Supercop;1992;R;96;['Action', ' Comedy', ' Crime            '];6.9;-1;A Hong Kong detective teams up with his female Red Chinese counterpart to stop a Chinese drug czar.;['Stanley Tong', None];['Jackie Chan', 'Michelle Yeoh', 'Maggie Cheung', 'Kenneth Tsang']
29;Dernière limite;1992;16;107;['Action', ' Crime', ' Thriller            '];6.9;67;A uniformed cop is recruited by a drug enforcement agent to infiltrate a drug smuggling ring looking to expand its operation.;['Bill Duke', None];['Laurence Fishburne', 'Jeff Goldblum', 'Lira Angel', 'René Assa']
30;Présumé innocent;1990;Tous publics;127;['Mystery', ' Thriller            '];6.9;72;As a lawyer investigates the murder of a colleague, he finds himself more connected to the crime than anyone else.;['Alan J. Pakula', None];['Harrison Ford', 'Raul Julia', 'Greta Scacchi', 'Brian Dennehy']
31;The King of New York;1990;16;103;['Crime', ' Thriller            '];6.9;66;A drug kingpin is released from prison and seeks to take total control of the criminal underworld in order to give back to the community.;['Abel Ferrara', None];['Christopher Walken', 'David Caruso', 'Laurence Fishburne', 'Victor Argo']
32;Les arnaqueurs;1990;Tous publics;110;['Crime', ' Drama', ' Thriller            '];6.9;86;A small-time conman has torn loyalties between his estranged mother and new girlfriend, both of whom are high-stakes grifters with their own angles to play.;['Stephen Frears', None];['Anjelica Huston', 'John Cusack', 'Annette Bening', 'Jan Munroe']
33;Frantic;1988;Tous publics;120;['Crime', ' Drama', ' Mystery            '];6.9;66;In a hotel room in Paris, a doctor comes out of the shower and finds that his wife has disappeared. He soon finds himself caught up in a world of intrigue, espionage, gangsters, drugs and murder.;['Roman Polanski', None];['Harrison Ford', 'Betty Buckley', 'Emmanuelle Seigner', 'Djiby Soumare']
34;Opéra;1987;12;107;['Crime', ' Horror', ' Mystery            '];6.9;68;A young opera singer is stalked by a deranged fan bent on killing the people associated with her to claim her for himself.;['Dario Argento', None];['Cristina Marsillach', 'Ian Charleson', 'Urbano Barberini', 'Daria Nicolodi']
