;name;year;certificate;runtime;genre;rating;metascore;text-muted;director;stars
29;The Night Listener;2006;R;91;['Crime', ' Drama', ' Horror            '];5.9;51;In the midst of his crumbling relationship, a radio show host begins speaking to his biggest fan, a young boy, via the telephone. But when questions about the boy's identity come up, the host's life is thrown into chaos.;['Patrick Stettner', None];['Robin Williams', 'Toni Collette', 'Rory Culkin', 'Joe Morton']
30;The X-Files: Régénération;2008;Tous publics avec avertissement;104;['Crime', ' Drama', ' Horror            '];5.9;47;Mulder and Scully are called back to duty by the FBI when a former priest claims to be receiving psychic visions pertaining to a kidnapped agent.;['Chris Carter', None];['David Duchovny', 'Gillian Anderson', 'Billy Connolly', 'Amanda Peet']
31;Possédée;I) (2012;12;92;['Horror', ' Mystery', ' Thriller            '];5.9;45;A young girl buys an antique box at a yard sale, unaware that inside the collectible lives a malicious ancient spirit. The girl's father teams with his ex-wife to find a way to end the curse upon their child.;['Ole Bornedal', None];['Natasha Calis', 'Jeffrey Dean Morgan', 'Kyra Sedgwick', 'Madison Davenport']
32;88 minutes;2007;Tous publics;108;['Crime', ' Drama', ' Mystery            '];5.9;17;On the day that a serial killer that he helped put away is supposed to be executed, a noted forensic psychologist and college professor receives a call informing him that he has 88 minutes left to live.;['Jon Avnet', None];['Al Pacino', 'Alicia Witt', 'Ben McKenzie', 'Leelee Sobieski']
33;The Grudge;2004;12;91;['Horror', ' Mystery', ' Thriller            '];5.9;49;An American nurse living and working in Tokyo is exposed to a mysterious supernatural curse, one that locks a person in a powerful rage before claiming their life and spreading to another victim.;['Takashi Shimizu', None];['Sarah Michelle Gellar', 'Jason Behr', 'Clea DuVall', 'William Mapother']
34;Trouble jeu;2005;12;101;['Horror', ' Mystery            '];5.9;35;As a widower tries to piece together his life in the wake of his wife's suicide, his daughter finds solace, at first, in her imaginary friend.;['John Polson', None];['Robert De Niro', 'Dakota Fanning', 'Famke Janssen', 'Elisabeth Shue']
35;Les frères Grimm;2005;Tous publics;118;['Action', ' Adventure', ' Comedy            '];5.9;51;Will and Jake Grimm are traveling con-artists who encounter a genuine fairy-tale curse which requires true courage instead of their usual bogus exorcisms.;['Terry Gilliam', None];['Matt Damon', 'Heath Ledger', 'Monica Bellucci', 'Petr Ratimec']
36;À l'aube du 6ème jour;2000;Tous publics;123;['Action', ' Mystery', ' Sci-Fi            '];5.9;49;A man meets a clone of himself and stumbles into a grand conspiracy about clones taking over the world.;['Roger Spottiswoode', None];['Arnold Schwarzenegger', 'Michael Rapaport', 'Tony Goldwyn', 'Michael Rooker']
37;Fausses rumeurs;I) (2000;Tous publics;90;['Drama', ' Mystery', ' Thriller            '];5.9;31;Three college students base their class project around gossip and how fast it spreads, which soon spirals out of control.;['Davis Guggenheim', None];['James Marsden', 'Lena Headey', 'Norman Reedus', 'Kate Hudson']
38;Traque sur internet;I) (1995;Tous publics;114;['Action', ' Crime', ' Drama            '];5.9;51;A computer programmer stumbles upon a conspiracy, putting her life and the lives of those around her in great danger.;['Irwin Winkler', None];['Sandra Bullock', 'Jeremy Northam', 'Dennis Miller', 'Diane Baker']
39;48 heures de plus;1990;Tous publics;95;['Action', ' Comedy', ' Crime            '];5.9;23;Jack Cates once again enlists the aid of ex-con Reggie Hammond - this time to take down The Iceman, a ruthless drug lord operating in the San Francisco bay area.;['Walter Hill', None];['Eddie Murphy', 'Nick Nolte', 'Brion James', 'Kevin Tighe']
40;Mais qui est Harry Crumb?;1989;Tous publics;94;['Comedy', ' Mystery            '];5.9;44;Harry Crumb is a bumbling and inept private investigator who is hired to solve the kidnapping of a young heiress which he's not expected to solve because his employer is the mastermind behind the kidnapping.;['Paul Flaherty', None];['John Candy', 'Jeffrey Jones', 'Annie Potts', 'Tim Thomerson']
41;Presidio: Base militaire, San Francisco;1988;Tous publics;97;['Action', ' Crime', ' Mystery            '];5.9;31;A San Francisco civilian police detective is forced to work on a series of murders with his former enemy commanding officer while dating his daughter.;['Peter Hyams', None];['Sean Connery', 'Mark Harmon', 'Meg Ryan', 'Jack Warden']
42;Golden Child : L'Enfant sacré du Tibet;1986;Tous publics;94;['Action', ' Adventure', ' Comedy            '];5.9;37;A private detective specializing in missing children is charged with the task of finding a special child whom dark forces want to eliminate.;['Michael Ritchie', None];['Eddie Murphy', 'J.L. Reate', 'Charles Dance', 'Charlotte Lewis']
43;Rosemary's Killer;1981;12;89;['Horror', ' Mystery', ' Thriller            '];5.9;45;An unknown killer, clad in World War II U.S. Army fatigues, stalks a small New Jersey town bent on reliving a 35 year-old double murder by focusing on a group of college kids holding an annual graduation dance.;['Joseph Zito', None];['Vicky Dawson', 'Christopher Goutman', 'Lawrence Tierney', 'Farley Granger']
44;Vivarium;2019;Tous publics avec avertissement;97;['Horror', ' Mystery', ' Sci-Fi            '];5.8;64;A young couple looking for the perfect home find themselves trapped in a mysterious labyrinth-like neighborhood of identical houses.;['Lorcan Finnegan', None];['Imogen Poots', 'Danielle Ryan', 'Molly McCann', 'Jesse Eisenberg']
45;The Wretched;2019;12;95;['Horror', ' Mystery            '];5.8;61;A defiant teenage boy, struggling with his parents' imminent divorce, faces off with a thousand year-old witch, who is living beneath the skin of and posing as the woman next door.;['    Directors:', 'Brett Pierce, ', 'Drew T. Pierce', None];['John-Paul Howard', 'Piper Curda', 'Jamison Jones', 'Azie Tesfai']
46;Eli;I) (2019;16;98;['Drama', ' Horror', ' Mystery            '];5.8;-1;A boy receiving treatment for his auto-immune disorder discovers that the house he's living in isn't as safe as he thought.;['Ciarán Foy', None];['Charlie Shotwell', 'Kelly Reilly', 'Max Martini', 'Lili Taylor']
47;High Life;2018;12 avec avertissement;113;['Adventure', ' Drama', ' Horror            '];5.8;77;A father and his daughter struggle to survive in deep space where they live in isolation.;['Claire Denis', None];['Robert Pattinson', 'Juliette Binoche', 'André 3000', 'Mia Goth']
48;The Prodigy;2019;R;92;['Fantasy', ' Horror', ' Mystery            '];5.8;45;A mother concerned about her young son's disturbing behavior thinks something supernatural may be affecting him.;['Nicholas McCarthy', None];['Taylor Schilling', 'Jackson Robert Scott', 'Peter Mooney', 'Colm Feore']
49;The Void;I) (2016;NaN;90;['Horror', ' Mystery', ' Sci-Fi            '];5.8;62;Shortly after delivering a patient to an understaffed hospital, a police officer experiences strange and violent occurrences seemingly linked to a group of mysterious hooded figures.;['    Directors:', 'Jeremy Gillespie, ', 'Steven Kostanski', None];['Aaron Poole', 'Kenneth Welsh', 'Ellen Wong', 'Kathleen Munroe']
0;A Christmas Horror Story;2015;NaN;99;['Fantasy', ' Horror', ' Mystery            '];5.8;49;Interwoven stories that take place on Christmas Eve, as told by one festive radio host: A family brings home more than a Christmas tree, a student documentary becomes a living nightmare, a Christmas spirit terrorizes, Santa slays evil.;['    Directors:', 'Grant Harvey, ', 'Steven Hoban, ', 'Brett Sullivan', None];['William Shatner', 'George Buza', 'Rob Archer', 'Zoé De Grand Maison']
1;Reminiscence;2021;Tous publics;116;['Mystery', ' Romance', ' Sci-Fi            '];5.8;46;Nick Bannister, a private investigator of the mind, navigates the alluring world of the past when his life is changed by new client Mae. A simple case becomes an obsession after she disappears and he fights to learn the truth about her.;['Lisa Joy', None];['Hugh Jackman', 'Rebecca Ferguson', 'Thandiwe Newton', 'Cliff Curtis']
2;Last Shift;I) (2014;R;88;['Horror', ' Mystery            '];5.8;-1;A rookie cop's 1st shift alone in the last night of a closing police station turns into a living nightmare.;['Anthony DiBlasi', None];['Juliana Harkavy', 'Joshua Mikel', 'Hank Stone', 'J. LaRose']
3;The Canal;2014;NaN;92;['Drama', ' Horror', ' Mystery            '];5.8;55;A film archivist finds his sanity crumbling after he is given an old 16mm film reel with footage from a horrific murder that occurred in the early 1900's.;['Ivan Kavanagh', None];['Rupert Evans', 'Antonia Campbell-Hughes', 'Hannah Hoekstra', 'Kelly Byrne']
4;Paranormal Activity 3;2011;Tous publics;83;['Horror', ' Mystery            '];5.8;59;In 1988, young sisters Katie and Kristi befriend an invisible entity who resides in their home Name Toby.;['    Directors:', 'Henry Joost, ', 'Ariel Schulman', None];['Chloe Csengery', 'Jessica Tyler Brown', 'Christopher Nicholas Smith', 'Lauren Bittner']
5;The Tunnel;I) (2011;NaN;94;['Horror', ' Mystery', ' Thriller            '];5.8;-1;An investigation into a government cover-up leads to a network of abandoned train tunnels deep beneath the heart of Sydney. As a journalist and her crew hunt for the story it quickly becomes clear the story is hunting them.;['Carlo Ledesma', None];['Bel Deliá', 'Andy Rodoreda', 'Steve Davis', 'Luke Arnold']
6;Absentia;I) (2011;R;87;['Drama', ' Horror', ' Mystery            '];5.8;-1;A woman and her sister begin to link a mysterious tunnel to a series of disappearances, including that of her own husband.;['Mike Flanagan', None];['Katie Parker', 'Courtney Bell', 'Dave Levine', 'Justin Gordon']
7;The Mortal Instruments: La Cité des ténèbres;2013;Tous publics avec avertissement;130;['Action', ' Adventure', ' Fantasy            '];5.8;33;When her mother disappears, Clary Fray learns that she descends from a line of warriors who protect our world from demons. She joins forces with others like her and heads into a dangerous alternate New York called the Shadow World.;['Harald Zwart', None];['Lily Collins', 'Jamie Campbell Bower', 'Robert Sheehan', 'Jemima West']
8;Old Boy;2013;16;104;['Action', ' Drama', ' Mystery            '];5.8;49;Obsessed with vengeance, a man sets out to find out why he was kidnapped and locked into solitary confinement for twenty years without reason.;['Spike Lee', None];['Josh Brolin', 'Elizabeth Olsen', 'Samuel L. Jackson', 'Sharlto Copley']
9;Présumé coupable;2009;PG-13;106;['Crime', ' Drama', ' Mystery            '];5.8;35;"Remake of the 1956 film noir film ""Beyond a Reasonable Doubt"" in which a writer's plan to expose a corrupt district attorney takes an unexpected turn.";['Peter Hyams', None];['Jesse Metcalfe', 'Amber Tamblyn', 'Michael Douglas', 'Joel David Moore']
10;Old;2021;12;108;['Drama', ' Horror', ' Mystery            '];5.8;55;A vacationing family discovers that the secluded beach where they're relaxing for a few hours is somehow causing them to age rapidly, reducing their entire lives into a single day.;['M. Night Shyamalan', None];['Gael García Bernal', 'Vicky Krieps', 'Rufus Sewell', 'Alex Wolff']
11;Antebellum;2020;12;105;['Drama', ' Horror', ' Mystery            '];5.8;43;Successful author Veronica Henley finds herself trapped in a horrifying reality and must uncover the mind-bending mystery before it's too late.;['    Directors:', 'Gerard Bush, ', 'Christopher Renz', None];['Janelle Monáe', 'Eric Lange', 'Jena Malone', 'Jack Huston']
12;Le dernier rite;2009;Not Rated;92;['Drama', ' Horror', ' Mystery            '];5.8;33;After a family is forced to relocate for their son's health, they begin experiencing supernatural behavior in their new home, and uncover a sinister history.;['Peter Cornwell', None];['Virginia Madsen', 'Martin Donovan', 'Elias Koteas', 'Kyle Gallner']
13;Les Passagers;2008;Tous publics;93;['Mystery', ' Romance', ' Thriller            '];5.8;40;A grief counselor working with a group of plane-crash survivors finds herself at the root of a mystery when her clients begin to disappear.;['Rodrigo García', None];['Anne Hathaway', 'Patrick Wilson', 'David Morse', 'Andre Braugher']
14;Cry Wolf;2005;Tous Public;90;['Drama', ' Horror', ' Mystery            '];5.8;39;Eight unsuspecting high school seniors at a posh boarding school, who delight themselves on playing games of lies, come face-to-face with terror and learn that nobody believes a liar - even when they're telling the truth.;['Jeff Wadlow', None];['Julian Morris', 'Lindy Booth', 'Jared Padalecki', 'Erica Yates']
15;Jusqu'au cou;2004;Tous Public;95;['Adventure', ' Comedy', ' Mystery            '];5.8;29;After their friend dies, three men decide to fulfill their childhood dream by going on a camping expedition for the lost D. B. Cooper bounty, with calamitous results.;['Steven Brill', None];['Matthew Lillard', 'Seth Green', 'Dax Shepard', 'Matthew Price']
16;Mémoire effacée;2004;Tous publics;91;['Drama', ' Mystery', ' Sci-Fi            '];5.8;43;After being told that their children never existed, a man and woman soon discover there is a much bigger enemy at work.;['Joseph Ruben', None];['Julianne Moore', 'Dominic West', 'Christopher Kovaleski', 'Matthew Pleszewicz']
17;Gothika;2003;12;98;['Horror', ' Mystery', ' Thriller            '];5.8;38;A depressed psychiatrist wakes up as a patient in the asylum where she worked, with no memory of why she is there or what she has done.;['Mathieu Kassovitz', None];['Halle Berry', 'Penélope Cruz', 'Robert Downey Jr.', 'Charles S. Dutton']
18;L'enlèvement;2004;Tous publics;95;['Drama', ' Mystery', ' Thriller            '];5.8;60;As an executive is held captive by a former employee, it's up to his wife to deliver the ransom.;['Pieter Jan Brugge', None];['Robert Redford', 'Willem Dafoe', 'Helen Mirren', 'Alessandro Nivola']
19;Suspect Zero;2004;12;99;['Crime', ' Horror', ' Mystery            '];5.8;37;A mysterious serial killer is hunting other serial killers, and one F.B.I. Agent suspects there may be more to the vigilante than they imagine.;['E. Elias Merhige', None];['Aaron Eckhart', 'Ben Kingsley', 'Carrie-Anne Moss', 'Harry Lennix']
20;Espion amateur;2001;PG-13;108;['Action', ' Comedy', ' Crime            '];5.8;-1;At a Hong Kong shopping center, Buck Yuen's (Jackie Chan's) intuition warns him. He saves a robbery's loot and gets on television, ends up in Istanbul via South Korea, and accidentally becomes a spy. Fortunately, he knows Kung Fu.;['Teddy Chan', None];['Jackie Chan', 'Min Kim', 'Eric Tsang', 'Vivian Hsu']
21;La prison de verre;2001;12;106;['Crime', ' Drama', ' Mystery            '];5.8;34;An orphaned teenager is taken in by a Malibu couple but discovers they aren't the caring friends they seemed to be.;['Daniel Sackheim', None];['Diane Lane', 'Leelee Sobieski', 'Stellan Skarsgård', 'Bruce Dern']
22;The Million Dollar Hotel;2000;Tous publics;122;['Drama', ' Mystery', ' Thriller            '];5.8;25;Tragi-comic, romantic whodunnit set in a run down hotel which plays host to mentally ill people too poor to afford medical insurance.;['Wim Wenders', None];['Jeremy Davies', 'Milla Jovovich', 'Mel Gibson', 'Jimmy Smits']
23;Relic;1997;12;110;['Horror', ' Mystery', ' Sci-Fi            '];5.8;55;A homicide detective and an anthropologist try to destroy a South American lizard-like god, who's on a people eating rampage in a Chicago museum.;['Peter Hyams', None];['Penelope Ann Miller', 'Tom Sizemore', 'Linda Hunt', 'James Whitmore']
24;Souviens-toi... l'été dernier;1997;12;101;['Horror', ' Mystery            '];5.8;52;Four young friends bound by a tragic accident are reunited when they find themselves being stalked by a hook-wielding maniac in their small seaside town.;['Jim Gillespie', None];['Jennifer Love Hewitt', 'Sarah Michelle Gellar', 'Anne Heche', 'Ryan Phillippe']
25;Piège en eaux troubles;1993;12;102;['Action', ' Crime', ' Mystery            '];5.8;36;Coming from a police family, Tom Hardy ends up fighting his uncle after the murder of his father. Tom believes the killer is another cop and goes on the record with his allegations. Demoted then to river duty, the killer taunts Tom.;['Rowdy Herrington', None];['Bruce Willis', 'Sarah Jessica Parker', 'Dennis Farina', 'Tom Sizemore']
26;Leviathan;1989;NaN;98;['Adventure', ' Horror', ' Mystery            '];5.8;51;Perched on the hull of a wrecked Soviet freighter, a team of deep-sea miners led by head oceanographer Steven Beck comes face to face with a mutant creature that's the product of a failed genetic experiment.;['George P. Cosmatos', None];['Peter Weller', 'Richard Crenna', 'Amanda Pays', 'Daniel Stern']
27;Le monstre du train;1980;16;97;['Horror', ' Mystery', ' Thriller            '];5.8;42;Three years after a prank went terribly awry, the six college students responsible are targeted by a masked killer at a New Year's Eve party aboard a moving train.;['Roger Spottiswoode', None];['Ben Johnson', 'Jamie Lee Curtis', 'Hart Bochner', 'David Copperfield']
28;Escape Game 2 - Le Monde est un piège;2021;Tous publics;88;['Action', ' Adventure', ' Horror            '];5.7;48;Six people unwillingly find themselves locked in another series of escape rooms, slowly uncovering what they have in common to survive. Joining forces with two of the original survivors, they soon discover they've all played the game before.;['Adam Robitel', None];['Taylor Russell', 'Logan Miller', 'Deborah Ann Woll', 'Thomas Cocquerel']
29;Come Play;2020;PG-13;96;['Drama', ' Horror', ' Mystery            '];5.7;58;A monster named Larry manifests itself through smart phones and mobile devices. Feature film version of the 2017 short film.;['Jacob Chase', None];['Azhy Robertson', 'Gillian Jacobs', 'John Gallagher Jr.', 'Winslow Fegley']
30;Velvet Buzzsaw;2019;16;113;['Horror', ' Mystery', ' Thriller            '];5.7;61;A satire set in the contemporary art world scene of Los Angeles, where big money artists and mega-collectors pay a high price when art collides with commerce.;['Dan Gilroy', None];['Jake Gyllenhaal', 'Rene Russo', 'Zawe Ashton', 'Tom Sturridge']
31;Seuls sur Terre;2018;Tous publics;99;['Drama', ' Mystery', ' Sci-Fi            '];5.7;51;The apocalypse proves a blessing in disguise for one lucky recluse -- until a second survivor arrives with the threat of companionship.;['Reed Morano', None];['Peter Dinklage', 'Elle Fanning', 'Charlotte Gainsbourg', 'Paul Giamatti']
32;La Femme à la fenêtre;2021;16;100;['Crime', ' Drama', ' Mystery            '];5.7;41;An agoraphobic woman living alone in New York begins spying on her new neighbors, only to witness a disturbing act of violence.;['Joe Wright', None];['Amy Adams', 'Gary Oldman', 'Anthony Mackie', 'Fred Hechinger']
33;Insidious: la dernière clé;2018;12;103;['Horror', ' Mystery', ' Thriller            '];5.7;49;Parapsychologist Dr. Elise Rainier faces her most fearsome and personal haunting yet, as she is drawn back to her ghostly childhood home, where the terror began.;['Adam Robitel', None];['Lin Shaye', 'Leigh Whannell', 'Angus Sampson', 'Kirk Acevedo']
34;La part obscure;2018;NaN;100;['Mystery', ' Thriller            '];5.7;59;A blind musician hears a murder committed in the apartment upstairs from hers that sends her down a dark path into London's gritty criminal underworld.;['Anthony Byrne', None];['Natalie Dormer', 'Ed Skrein', 'Emily Ratajkowski', 'Neil Maskell']
35;The Do-Over;2016;16;108;['Action', ' Adventure', ' Comedy            '];5.7;22;Two down-on-their-luck guys decide to fake their own deaths and start over with new identities, only to find the people they're pretending to be are in even deeper trouble.;['Steven Brill', None];['Adam Sandler', 'David Spade', 'Paula Patton', 'Kathryn Hahn']
36;We Are Still Here;I) (2015;NaN;84;['Horror', ' Mystery            '];5.7;65;In the cold, wintery fields of New England, a lonely old house wakes up every thirty years - and demands a sacrifice.;['Ted Geoghegan', None];['Andrew Sensenig', 'Barbara Crampton', 'Larry Fessenden', 'Lisa Marie']
37;Divergente 3 : Au-delà du mur;2016;Tous publics;120;['Action', ' Adventure', ' Mystery            '];5.7;33;After the earth-shattering revelations of Insurgent, Tris must escape with Four beyond the wall that encircles Chicago, to finally discover the shocking truth of the world around them.;['Robert Schwentke', None];['Shailene Woodley', 'Theo James', 'Jeff Daniels', 'Naomi Watts']
38;Jigsaw;I) (2017;16;92;['Crime', ' Horror', ' Mystery            '];5.7;39;Bodies are turning up around the city, each having met a uniquely gruesome demise. As the investigation proceeds, evidence points to one suspect: John Kramer, the man known as Jigsaw, who has been dead for over 10 years.;['    Directors:', 'Michael Spierig, ', 'Peter Spierig', None];['Matt Passmore', 'Tobin Bell', 'Callum Keith Rennie', 'Hannah Emily Anderson']
39;Honeymoon;2014;12;87;['Drama', ' Fantasy', ' Horror            '];5.7;65;A newlywed couple finds their lake-country honeymoon descend into chaos after Paul finds Bea wandering and disoriented in the middle of the night.;['Leigh Janiak', None];['Rose Leslie', 'Harry Treadaway', 'Ben Huber', 'Hanna Brown']
40;Sea Fever;2019;NaN;95;['Drama', ' Horror', ' Mystery            '];5.7;60;The crew of a West of Ireland trawler, marooned at sea, struggle for their lives against a growing parasite in their water supply.;['Neasa Hardiman', None];['Hermione Corfield', 'Dag Malmberg', 'Jack Hickey', 'Olwen Fouéré']
41;Lost River;2014;Tous publics;95;['Drama', ' Fantasy', ' Mystery            '];5.7;42;A single mother is swept into a dark underworld, while her teenage son discovers a road that leads him to a secret underwater town.;['Ryan Gosling', None];['Christina Hendricks', 'Iain De Caestecker', 'Matt Smith', 'Saoirse Ronan']
42;Antiviral;2012;12;108;['Horror', ' Mystery', ' Sci-Fi            '];5.7;55;In a blackly satirical near future, a thriving industry sells celebrity illnesses to their obsessed fans. Employee Syd March's attempts to exploit the system backfire when they involve him in a potentially deadly mystery.;['Brandon Cronenberg', None];['Caleb Landry Jones', 'Lisa Berry', 'Sarah Gadon', 'Malcolm McDowell']
43;The Pact;II) (2012;R;89;['Horror', ' Mystery', ' Thriller            '];5.7;54;As a woman struggles to come to grips with her past in the wake of her mother's death and the disappearance of her sister, an unsettling presence emerges in her childhood home.;['Nicholas McCarthy', None];['Caity Lotz', 'Casper Van Dien', 'Mark Steger', 'Agnes Bruckner']
44;The Dyatlov Pass Incident;2013;R;100;['Horror', ' Mystery', ' Thriller            '];5.7;49;A group of students go to the location of the infamous Dyatlov pass incident to make a documentary, but things take a turn for the worse as the secret of what happened there is revealed.;['Renny Harlin', None];['Holly Goss', 'Matt Stokoe', 'Luke Albright', 'Ryan Hawley']
45;Faces;2011;R;103;['Crime', ' Drama', ' Mystery            '];5.7;-1;"A horror-thriller centered on a woman living with ""face-blindness"" after surviving a serial killer's attack. As she lives with her condition, one in which facial features change each time she loses sight of them, the killer closes in.";['Julien Magnat', None];['Milla Jovovich', 'Julian McMahon', 'David Atrakchi', 'Michael Shanks']
46;Paranormal Activity 2;2010;Tous publics;91;['Horror', ' Mystery            '];5.7;53;"After experiencing what they think are a series of ""break-ins"", a family sets up security cameras around their home, only to realize that the events unfolding before them are more sinister than they seem.";['Tod Williams', None];['Katie Featherston', 'Micah Sloat', 'Molly Ephraim', 'David Bierend']
47;Kaboom;2010;12;86;['Comedy', ' Mystery', ' Romance            '];5.7;64;"A sexually ""undeclared"" college freshman's clairvoyant/prophetic dreams are the first sign that something very strange is going on involving his class-mates -- with him at the center.";['Gregg Araki', None];['Thomas Dekker', 'Haley Bennett', 'Chris Zylka', 'Roxane Mesquida']
48;Paperboy;2012;12;107;['Crime', ' Drama', ' Mystery            '];5.7;45;A reporter returns to his Florida hometown to investigate a case involving a death row inmate.;['Lee Daniels', None];['Matthew McConaughey', 'Nicole Kidman', 'John Cusack', 'Zac Efron']
49;Le dernier exorcisme;2010;16;87;['Horror', ' Mystery', ' Thriller            '];5.7;63;A troubled evangelical minister agrees to let his last exorcism be filmed by a documentary crew.;['Daniel Stamm', None];['Patrick Fabian', 'Ashley Bell', 'Iris Bahr', 'Louis Herthum']
0;A Classic Horror Story;2021;NaN;95;['Drama', ' Horror', ' Mystery            '];5.7;-1;In this gruesome suspense film, strangers traveling in southern Italy become stranded in the woods, where they must fight desperately to get out alive.;['    Directors:', 'Roberto De Feo, ', 'Paolo Strippoli', None];['Matilda Anna Ingrid Lutz', 'Francesco Russo', 'Peppino Mazzotta', 'Will Merrick']
1;48 heures chrono;V) (2012;R;104;['Crime', ' Mystery', ' Thriller            '];5.7;-1;An obsessed cop is on the trail of a serial killer prowling the streets of Buffalo, N.Y. but when his teenage daughter disappears, he drops any professional restraint to get the killer.;"[""Morgan O'Neill"", None]";['John Cusack', 'Dallas Roberts', 'Vincent Messina', 'Jennifer Carpenter']
2;2:22;2017;PG-13;98;['Drama', ' Mystery', ' Romance            '];5.7;-1;A man's life is derailed when an ominous pattern of events repeats itself in exactly the same manner every day, ending at precisely 2:22 p.m.;['Paul Currie', None];['Michiel Huisman', 'Teresa Palmer', 'Sam Reid', 'John Waters']
