;name;year;certificate;runtime;genre;rating;metascore;text-muted;director;stars
18;Suicide Squad;2016;Tous publics avec avertissement;123;['Action', ' Adventure', ' Fantasy            '];5.9;40;A secret government agency recruits some of the most dangerous incarcerated super-villains to form a defensive task force. Their first mission: save the world from the apocalypse.;['David Ayer', None];['Will Smith', 'Jared Leto', 'Margot Robbie', 'Viola Davis']
19;Star Wars: The Clone Wars;2008;Tous Public;98;['Animation', ' Action', ' Adventure            '];5.9;35;After the Republic's victory on Christophsis, Anakin and his new apprentice, Ahsoka Tano, must rescue the kidnapped son of Jabba the Hutt. Political intrigue complicates their mission.;['Dave Filoni', None];['Matt Lanter', 'Nika Futterman', 'Tom Kane', 'Ashley Eckstein']
20;Fatman;2020;12;100;['Action', ' Adventure', ' Comedy            '];5.9;40;A rowdy, unorthodox Santa Claus is fighting to save his declining business. Meanwhile, Billy, a neglected and precocious 12 year old, hires a hit man to kill Santa after receiving a lump of coal in his stocking.;['    Directors:', 'Eshom Nelms, ', 'Ian Nelms', None];['Mel Gibson', 'Walton Goggins', 'Marianne Jean-Baptiste', 'Chance Hurstfield']
21;Sex and Death 101;2007;16;117;['Comedy', ' Drama', ' Fantasy            '];5.9;24;A guy's life is turned around by an email, which includes the names of everyone he's had sex with and ever will have sex with. His situation gets worse when he encounters a femme fatale (Ryder) who targets men guilty of sex crime.;['Daniel Waters', None];['Robert Wisdom', 'Tanc Sade', 'Patton Oswalt', 'Simon Baker']
22;Prémonitions;I) (2007;Tous publics;96;['Drama', ' Fantasy', ' Mystery            '];5.9;29;"A depressed woman learns that her husband was killed in a car accident the previous day, then awakens the next morning to find him alive and well at home; then awakens the day after that to find that he's dead.";['Mennan Yapo', None];['Sandra Bullock', 'Julian McMahon', 'Amber Valletta', 'Shyann McClure']
23;Igor;2008;Tous publics;87;['Animation', ' Comedy', ' Family            '];5.9;40;Animated fable about a cliché hunchbacked evil scientist's assistant who aspires to become a scientist himself, much to the displeasure of the rest of the evil science community.;['Tony Leondis', None];['John Cusack', 'Molly Shannon', 'Steve Buscemi', 'Myleene Klass']
24;Gnomeo et Juliette;2011;Tous Public;84;['Animation', ' Adventure', ' Comedy            '];5.9;53;Separated by a garden fence and a feud, are blue gnomes on one side and red gnomes on the other. This doesn't stop blue Gnomeo and red Juliet from falling in love with each other. Do they have a future together?;['Kelly Asbury', None];['James McAvoy', 'Emily Blunt', 'Maggie Smith', 'Ashley Jensen']
25;Les frères Grimm;2005;Tous publics;118;['Action', ' Adventure', ' Comedy            '];5.9;51;Will and Jake Grimm are traveling con-artists who encounter a genuine fairy-tale curse which requires true courage instead of their usual bogus exorcisms.;['Terry Gilliam', None];['Matt Damon', 'Heath Ledger', 'Monica Bellucci', 'Petr Ratimec']
26;Drop Dead Fred;1991;Tous publics;103;['Comedy', ' Drama', ' Fantasy            '];5.9;25;A young woman finds her already unstable life rocked by the presence of a rambunctious imaginary friend from childhood.;['Ate de Jong', None];['Phoebe Cates', 'Rik Mayall', 'Marsha Mason', 'Tim Matheson']
27;Vice Versa;1988;Tous publics;98;['Comedy', ' Fantasy            '];5.9;61;A divorced executive named Marshall and his 11-year-old son, Charlie, casually touch a magical Tibetan skull, releasing a mysterious power that transfers Marshall's mind to Charlie's body and vice versa. Their problems have just begun.;['Brian Gilbert', None];['Judge Reinhold', 'Fred Savage', 'Corinne Bohrer', 'Swoosie Kurtz']
28;Mannequin;1987;PG;90;['Comedy', ' Fantasy', ' Romance            '];5.9;21;A young artist, searching for his vocation, makes a mannequin so perfect he falls in love with it. Finding the mannequin in a store window, he gets a job there and his creation comes to life.;['Michael Gottlieb', None];['Andrew McCarthy', 'Kim Cattrall', 'Estelle Getty', 'James Spader']
29;Golden Child : L'Enfant sacré du Tibet;1986;Tous publics;94;['Action', ' Adventure', ' Comedy            '];5.9;37;A private detective specializing in missing children is charged with the task of finding a special child whom dark forces want to eliminate.;['Michael Ritchie', None];['Eddie Murphy', 'J.L. Reate', 'Charles Dance', 'Charlotte Lewis']
30;Conan le destructeur;1984;Tous publics;103;['Action', ' Adventure', ' Fantasy            '];5.9;53;Conan leads a ragtag group of adventurers on a quest for a princess.;['Richard Fleischer', None];"['Arnold Schwarzenegger', 'Grace Jones', ""Olivia d'Abo"", 'Wilt Chamberlain']"
31;Le Parc Des Merveilles;2019;Tous publics;85;['Animation', ' Adventure', ' Comedy            '];5.8;45;The imagination of a wildly creative girl comes alive in an amusement park.;['Dylan Brown', None];['Sofia Mali', 'Jennifer Garner', 'Ken Hudson Campbell', 'Kenan Thompson']
32;Double mortel;2018;NaN;103;['Drama', ' Fantasy', ' Horror            '];5.8;-1;Maria, an alienated high-school student, has her life turned upside down when she switches places with her sinister mirror image.;['Assaf Bernstein', None];['India Eisley', 'Jason Isaacs', 'Mira Sorvino', 'Penelope Mitchell']
33;The Prodigy;2019;R;92;['Fantasy', ' Horror', ' Mystery            '];5.8;45;A mother concerned about her young son's disturbing behavior thinks something supernatural may be affecting him.;['Nicholas McCarthy', None];['Taylor Schilling', 'Jackson Robert Scott', 'Peter Mooney', 'Colm Feore']
34;Mine;II) (2016;NaN;106;['Drama', ' Fantasy', ' Thriller            '];5.8;40;After a failed assassination attempt, a United States Marine finds himself stranded in the desert. Exposed to the elements, he must survive the dangers of the desert and battle the psychological and physical tolls of the treacherous conditions.;['    Directors:', 'Fabio Guaglione, ', 'Fabio Resinaro', None];['Armie Hammer', 'Annabelle Wallis', 'Tom Cullen', 'Clint Dyer']
35;A Christmas Horror Story;2015;NaN;99;['Fantasy', ' Horror', ' Mystery            '];5.8;49;Interwoven stories that take place on Christmas Eve, as told by one festive radio host: A family brings home more than a Christmas tree, a student documentary becomes a living nightmare, a Christmas spirit terrorizes, Santa slays evil.;['    Directors:', 'Grant Harvey, ', 'Steven Hoban, ', 'Brett Sullivan', None];['William Shatner', 'George Buza', 'Rob Archer', 'Zoé De Grand Maison']
36;The Cobbler;2014;PG-13;99;['Comedy', ' Drama', ' Fantasy            '];5.8;23;A cobbler, bored of his everyday life, stumbles upon a magical heirloom that allows him to become other people and see the world in a different way.;['Tom McCarthy', None];['Adam Sandler', 'Melonie Diaz', 'Steve Buscemi', 'Method Man']
37;Noël chez les Cooper;2015;PG-13;107;['Comedy', ' Fantasy', ' Romance            '];5.8;31;The intertwined stories of four generations of Coopers unfold right before the annual family reunion on Christmas Eve. Can they survive the most beautiful time of the year?;['Jessie Nelson', None];['Steve Martin', 'Diane Keaton', 'John Goodman', 'Ed Helms']
38;I Still See You;2018;Tous publics;98;['Fantasy', ' Horror', ' Sci-Fi            '];5.8;31;Set ten years after an apocalyptic event that killed millions and left the world inhabited by ghosts.;['Scott Speer', None];['Bella Thorne', 'Richard Harmon', 'Dermot Mulroney', 'Amy Price-Francis']
39;La famille Addams;2019;Tous publics;86;['Animation', ' Comedy', ' Family            '];5.8;46;The eccentrically macabre family moves to a bland suburb where Wednesday Addams' friendship with the daughter of a hostile and conformist local reality show host exacerbates conflict between the families.;['    Directors:', 'Greg Tiernan, ', 'Conrad Vernon', None];['Oscar Isaac', 'Charlize Theron', 'Chloë Grace Moretz', 'Finn Wolfhard']
40;The Mortal Instruments: La Cité des ténèbres;2013;Tous publics avec avertissement;130;['Action', ' Adventure', ' Fantasy            '];5.8;33;When her mother disappears, Clary Fray learns that she descends from a line of warriors who protect our world from demons. She joins forces with others like her and heads into a dangerous alternate New York called the Shadow World.;['Harald Zwart', None];['Lily Collins', 'Jamie Campbell Bower', 'Robert Sheehan', 'Jemima West']
41;Downsizing;2017;Tous publics;135;['Drama', ' Fantasy', ' Sci-Fi            '];5.8;63;A social satire in which a man realizes he would have a better life if he were to shrink himself to five inches tall, allowing him to live in wealth and splendor.;['Alexander Payne', None];['Matt Damon', 'Christoph Waltz', 'Hong Chau', 'Kristen Wiig']
42;Orgueil et préjugés et zombies;2016;PG-13;108;['Action', ' Comedy', ' Fantasy            '];5.8;45;Five sisters in 19th century England must cope with the pressures to marry while protecting themselves from a growing population of zombies.;['Burr Steers', None];['Lily James', 'Sam Riley', 'Jack Huston', 'Bella Heathcote']
43;Hanté par ses ex;2009;Tous Public;115;['Comedy', ' Fantasy', ' Romance            '];5.8;34;While attending his brother's wedding, a serial womanizer is haunted by the ghosts of his past girlfriends.;['Mark Waters', None];['Matthew McConaughey', 'Jennifer Garner', 'Emma Stone', 'Michael Douglas']
44;Percy Jackson: Le voleur de foudre;2010;Tous Public;118;['Adventure', ' Family', ' Fantasy            '];5.8;47;A teenager discovers he's the descendant of a Greek god and sets out on an adventure to settle an on-going battle between the gods.;['Chris Columbus', None];['Logan Lerman', 'Kevin McKidd', 'Steve Coogan', 'Brandon T. Jackson']
45;Le Choc des Titans;2010;Tous publics;106;['Action', ' Adventure', ' Fantasy            '];5.8;39;Perseus, a demigod and the son of Zeus, battles the minions of Hades and the Underworld in order to stop them from conquering Olympus and Earth.;['Louis Leterrier', None];['Sam Worthington', 'Liam Neeson', 'Ralph Fiennes', 'Jason Flemyng']
46;Wolfman;2010;12;103;['Drama', ' Fantasy', ' Horror            '];5.8;43;Upon his return to his ancestral homeland, an American man is bitten and subsequently cursed by a werewolf.;['Joe Johnston', None];['Benicio Del Toro', 'Anthony Hopkins', 'Emily Blunt', 'Simon Merrells']
47;Mille mots;I) (2012;Tous Public;91;['Comedy', ' Drama', ' Fantasy            '];5.8;26;After stretching the truth on a deal with a spiritual guru, literary agent Jack McCall finds a Bodhi tree on his property. Its appearance holds a valuable lesson on the consequences of every word he speaks.;['Brian Robbins', None];['Eddie Murphy', 'Cliff Curtis', 'Kerry Washington', 'Clark Duke']
48;L'assistant du vampire;2009;Tous Public;119;['Action', ' Adventure', ' Fantasy            '];5.8;43;Teenager Darren Shan meets a mysterious man at a freak show who turns out to be a vampire. After a series of events, Darren must leave his normal life and go on the road with the Cirque du Freak, becoming a creature of the night.;['Paul Weitz', None];['Chris Massoglia', 'John C. Reilly', 'Salma Hayek', 'Josh Hutcherson']
49;Lucas, fourmi malgré lui;2006;Tous publics;88;['Animation', ' Adventure', ' Comedy            '];5.8;59;After Lucas Nickle floods an ant colony with his water gun, he's magically shrunken down to insect size and sentenced to hard labor in the ruins.;['John A. Davis', None];['Paul Giamatti', 'Nicolas Cage', 'Julia Roberts', 'Meryl Streep']
0;Beowulf : La Légende Viking;2005;Accord parental;104;['Action', ' Adventure', ' Drama            '];5.8;53;In Denmark, during the 6th century, Danish king Hrothgar and his warriors kill a troll whose son, Grendel, vows revenge.;['Sturla Gunnarsson', None];['Hringur Ingvarsson', 'Spencer Wilding', 'Stellan Skarsgård', 'Ingvar Sigurdsson']
1;Voyage au centre de la Terre;2008;Tous publics;93;['Action', ' Adventure', ' Family            '];5.8;57;On a quest to find out what happened to his missing brother, a scientist, his nephew and their mountain guide discover a fantastic and dangerous lost world in the center of the earth.;['Eric Brevig', None];['Brendan Fraser', 'Josh Hutcherson', 'Anita Briem', 'Seth Meyers']
2;La Ligue des gentlemen extraordinaires;2003;Tous publics;110;['Action', ' Adventure', ' Fantasy            '];5.8;30;In an alternate Victorian Age world, a group of famous contemporary fantasy, science fiction, and adventure characters team up on a secret mission.;['Stephen Norrington', None];['Sean Connery', 'Stuart Townsend', 'Peta Wilson', 'Jason Flemyng']
3;Peter Pan 2 : Retour au Pays imaginaire;2002;Tous publics;72;['Animation', ' Adventure', ' Family            '];5.8;49;In London during World War II, this is the story of Wendy's daughter, Jane, who is kidnapped by Captain Hook and Peter Pan must come to the rescue.;['    Directors:', 'Robin Budd, ', 'Donovan Cook', None];['Blayne Weaver', 'Harriet Owen', 'Corey Burton', 'Jeff Bennett']
4;La fin des temps;1999;12;122;['Action', ' Fantasy', ' Horror            '];5.8;33;At the end of the century, Satan visits New York in search of a bride. It's up to an ex-cop who now runs an elite security outfit to stop him.;['Peter Hyams', None];['Arnold Schwarzenegger', 'Gabriel Byrne', 'Robin Tunney', 'Kevin Pollak']
5;Babe, le cochon dans la ville;1998;Tous publics;97;['Adventure', ' Comedy', ' Drama            '];5.8;68;Babe, fresh from his victory in the sheepherding contest, returns to Farmer Hoggett's farm, but after Farmer Hoggett is injured and unable to work, Babe has to go to the big city to save the farm.;['George Miller', None];['Magda Szubanski', 'Elizabeth Daily', 'Mickey Rooney', 'James Cromwell']
6;Wishmaster;1997;12;90;['Fantasy', ' Horror            '];5.8;-1;A demonic djinn attempts to grant its owner three wishes, which will allow him to summon his brethren to Earth.;['Robert Kurtzman', None];['Tammy Lauren', 'Andrew Divoff', 'Angus Scrimm', 'Ari Barak']
7;Le petit monde des Borrowers;1997;Tous publics;89;['Adventure', ' Comedy', ' Family            '];5.8;-1;A secret family of four-inch people living inside the walls of a house must save their home from an evil real estate developer.;['Peter Hewitt', None];['John Goodman', 'Jim Broadbent', 'Mark Williams', 'Celia Imrie']
8;La peau sur les os;1996;R;93;['Fantasy', ' Horror            '];5.8;33;An obese attorney is cursed by a gypsy to rapidly and uncontrollably lose weight.;['Tom Holland', None];['Robert John Burke', 'Joe Mantegna', 'Lucinda Jenney', 'Bethany Joy Lenz']
9;Jack;1996;Tous publics;113;['Comedy', ' Drama', ' Fantasy            '];5.8;31;Because of an unusual disorder that has aged him four times faster than a typical human being, a boy looks like a 40-year-old man as he starts fifth grade at public school after being homeschooled.;['Francis Ford Coppola', None];['Robin Williams', 'Diane Lane', 'Brian Kerwin', 'Jennifer Lopez']
10;Mortal Kombat;1995;Tous publics;101;['Action', ' Adventure', ' Fantasy            '];5.8;60;Three unknowing martial artists are summoned to a mysterious island to compete in a tournament whose outcome will decide the fate of the world.;['Paul W.S. Anderson', None];['Christopher Lambert', 'Robin Shou', 'Linden Ashby', 'Cary-Hiroyuki Tagawa']
11;Dracula mort et heureux de l'être;1995;Tous Public;88;['Comedy', ' Fantasy', ' Horror            '];5.8;-1;Mel Brooks ' parody of the classic vampire story and its famous film adaptations.;['Mel Brooks', None];['Leslie Nielsen', 'Mel Brooks', 'Peter MacNicol', 'Steven Weber']
12;La septième prophétie;1988;Tous publics;97;['Drama', ' Fantasy', ' Horror            '];5.8;-1;Abby Quinn is eagerly awaiting childbirth but is haunted by dreams where she suffers a miscarriage. When she decides to rent a room to a mysterious stranger, she realizes a chain of events that will unleash the end of humanity.;['Carl Schultz', None];['Demi Moore', 'Michael Biehn', 'Jürgen Prochnow', 'Peter Friedman']
13;Zardoz;1974;Tous publics;105;['Adventure', ' Fantasy', ' Sci-Fi            '];5.8;46;In the distant future, a savage trained only to kill finds a way into the community of bored immortals that alone preserves humanity's achievements.;['John Boorman', None];['Sean Connery', 'Charlotte Rampling', 'Sara Kestelman', 'John Alderton']
14;Barbarella;1968;16;98;['Adventure', ' Comedy', ' Fantasy            '];5.8;51;Barbarella, an astronaut from the 41st century, sets out to find and stop the evil scientist Durand Durand, whose Positronic Ray threatens to bring evil back into the galaxy.;['Roger Vadim', None];"['Jane Fonda', 'John Phillip Law', 'Anita Pallenberg', ""Milo O'Shea""]"
15;An American Pickle;2020;PG-13;88;['Comedy', ' Fantasy            '];5.7;58;An immigrant worker at a pickle factory is accidentally preserved for 100 years and wakes up in modern-day Brooklyn.;['Brandon Trost', None];['Seth Rogen', 'Sarah Snook', 'Molly Evensen', 'Eliot Glazer']
16;The Holiday Calendar;2018;7;95;['Drama', ' Fantasy', ' Romance            '];5.7;-1;A struggling but talented photographer inherits an antique holiday advent calendar, the contents of which seem to predict the future. Will this magical calendar lead her to love this holiday season?;['Bradley Walsh', None];['Kat Graham', 'Quincy Brown', 'Ethan Peck', 'Ron Cephas Jones']
17;Samaritan;2022;14+;102;['Action', ' Drama', ' Fantasy            '];5.7;45;A young boy learns that a superhero who was thought to have gone missing after an epic battle twenty years ago may in fact still be around.;['Julius Avery', None];"['Sylvester Stallone', ""Javon 'Wanna' Walton"", 'Pilou Asbæk', 'Dascha Polanco']"
18;Mulan;2020;Tous publics;115;['Action', ' Adventure', ' Drama            '];5.7;66;A young Chinese maiden disguises herself as a male warrior in order to save her father.;['Niki Caro', None];['Liu Yifei', 'Donnie Yen', 'Gong Li', 'Jet Li']
19;Strange Magic;2015;Tous Public;99;['Animation', ' Adventure', ' Comedy            '];5.7;25;Goblins, elves, fairies and imps, and their misadventures sparked by the battle over a powerful potion.;['Gary Rydstrom', None];['Evan Rachel Wood', 'Elijah Kelley', 'Kristin Chenoweth', 'Maya Rudolph']
20;Underworld: Blood Wars;2016;12;91;['Action', ' Adventure', ' Fantasy            '];5.7;23;Vampire death dealer Selene (Kate Beckinsale) fights to end the eternal war between the Lycan clan and the Vampire faction that betrayed her.;['Anna Foerster', None];['Kate Beckinsale', 'Theo James', 'Tobias Menzies', 'Lara Pulver']
21;Pan;2015;Tous publics;111;['Action', ' Adventure', ' Comedy            '];5.7;36;Twelve-year-old orphan Peter is spirited away to the magical world of Neverland, where he finds both fun and danger, and ultimately discovers his destiny: to become the hero who will be forever known as Peter Pan.;['Joe Wright', None];['Levi Miller', 'Hugh Jackman', 'Garrett Hedlund', 'Rooney Mara']
22;Honeymoon;2014;12;87;['Drama', ' Fantasy', ' Horror            '];5.7;65;A newlywed couple finds their lake-country honeymoon descend into chaos after Paul finds Bea wandering and disoriented in the middle of the night.;['Leigh Janiak', None];['Rose Leslie', 'Harry Treadaway', 'Ben Huber', 'Hanna Brown']
23;Little Evil;2017;NaN;94;['Comedy', ' Fantasy', ' Horror            '];5.7;-1;Gary, who has just married Samantha, the woman of his dreams, discovers that her six-year-old son may be the Antichrist.;['Eli Craig', None];['Evangeline Lilly', 'Owen Atlas', 'Adam Scott', 'Marcus Terrell Smith']
24;Le sanctuaire;2015;12;97;['Fantasy', ' Horror', ' Thriller            '];5.7;65;A family who moved into a remote mill house in Ireland finds themselves in a fight for survival with demonic creatures living in the woods.;['Corin Hardy', None];['Joseph Mawle', 'Bojana Novakovic', 'Michael McElhatton', 'Michael Smiley']
25;Lost River;2014;Tous publics;95;['Drama', ' Fantasy', ' Mystery            '];5.7;42;A single mother is swept into a dark underworld, while her teenage son discovers a road that leads him to a secret underwater town.;['Ryan Gosling', None];['Christina Hendricks', 'Iain De Caestecker', 'Matt Smith', 'Saoirse Ronan']
26;Premature;2014;R;93;['Comedy', ' Drama', ' Fantasy            '];5.7;34;A high school senior has to re-live losing his virginity over and over again until he gets it right, with the right girl.;['Dan Beers', None];['John Karna', 'Caroline Traywick', 'Kate Kneeland', 'Steve Coulter']
27;Chaos Walking;2021;Tous publics;109;['Action', ' Adventure', ' Fantasy            '];5.7;38;Two unlikely companions embark on a perilous adventure through the badlands of an unexplored planet as they try to escape a dangerous and disorienting reality where all thoughts are seen and heard by everyone.;['Doug Liman', None];['Tom Holland', 'Daisy Ridley', 'Demián Bichir', 'David Oyelowo']
28;Percy Jackson : La Mer des monstres;2013;Tous publics;106;['Adventure', ' Family', ' Fantasy            '];5.7;39;In order to restore their dying safe haven, the son of Poseidon and his friends embark on a quest to the Sea of Monsters, to find the mythical Golden Fleece, all the while trying to stop an ancient evil from rising.;['Thor Freudenthal', None];['Logan Lerman', 'Alexandra Daddario', 'Brandon T. Jackson', 'Nathan Fillion']
29;La colère des Titans;2012;Tous publics;99;['Action', ' Adventure', ' Fantasy            '];5.7;37;Perseus braves the treacherous underworld to rescue his father, Zeus, captured by his son, Ares, and brother Hades who unleash the ancient Titans upon the world.;['Jonathan Liebesman', None];['Sam Worthington', 'Liam Neeson', 'Rosamund Pike', 'Ralph Fiennes']
30;Rubber;2010;Tous publics;82;['Comedy', ' Fantasy', ' Horror            '];5.7;59;A homicidal car tire, discovering it has destructive psionic power, sets its sights on a desert town once a mysterious woman becomes its obsession.;['Quentin Dupieux', None];['Stephen Spinella', 'Roxane Mesquida', 'Wings Hauser', 'Jack Plotnick']
31;Les Trois Mousquetaires;2011;Tous publics;110;['Action', ' Adventure', ' Fantasy            '];5.7;35;The hot-headed young D'Artagnan along with three former legendary but now down-on-their-luck Musketeers must unite and defeat a beautiful double agent and her villainous employer from seizing the French throne and engulfing Europe in war.;['Paul W.S. Anderson', None];['Logan Lerman', 'Matthew Macfadyen', 'Ray Stevenson', 'Milla Jovovich']
32;Voyage au centre de la Terre 2 : L'Île mystérieuse;2012;Tous publics;94;['Action', ' Adventure', ' Comedy            '];5.7;41;Sean Anderson partners with his mom's husband on a mission to find his grandfather, who is thought to be missing on a mythical island.;['Brad Peyton', None];['Josh Hutcherson', 'Dwayne Johnson', 'Michael Caine', 'Luis Guzmán']
33;The Hole;2009;Accord parental;92;['Fantasy', ' Thriller            '];5.7;57;A pair of brothers stumble upon a mysterious hole in their basement that leads to the darkest corridors of their fears and nightmares.;['Joe Dante', None];['Chris Massoglia', 'Haley Bennett', 'Nathan Gamble', 'Teri Polo']
34;Night Teeth;2021;16;107;['Action', ' Crime', ' Drama            '];5.7;42;A college student moonlighting as a chauffeur picks up two mysterious women for a night of party-hopping across LA. But when he uncovers their bloodthirsty intentions - and their dangerous, shadowy underworld - he must fight to stay alive.;['Adam Randall', None];['Jorge Lendeborg Jr.', 'Debby Ryan', 'Lucy Fry', 'Raúl Castillo']
35;La montagne ensorcelée;2009;Tous Public;98;['Action', ' Adventure', ' Family            '];5.7;52;A Las Vegas cabbie enlists the help of a UFO expert to protect two siblings with paranormal powers from the clutches of an organization that wants to use the kids for their nefarious plans.;['Andy Fickman', None];['Dwayne Johnson', 'Carla Gugino', 'AnnaSophia Robb', 'Alexander Ludwig']
36;Priest;2011;Tous publics;87;['Action', ' Fantasy', ' Horror            '];5.7;41;A priest disobeys church law to track down the vampires who kidnapped his niece.;['Scott Stewart', None];['Paul Bettany', 'Cam Gigandet', 'Maggie Q', 'Karl Urban']
37;La Voix des morts : La Lumière;2007;12;99;['Drama', ' Fantasy', ' Horror            '];5.7;-1;Following the loss of his family, a man attempts suicide only to discover upon waking that he can identify people who are about to die;['Patrick Lussier', None];['Nathan Fillion', 'Katee Sackhoff', 'Craig Fairbrass', 'Adrian Holmes']
38;Chicken Little;2005;Tous Public;81;['Animation', ' Adventure', ' Comedy            '];5.7;48;After ruining his reputation with the town, a courageous chicken must come to the rescue of his fellow citizens when aliens start an invasion.;['Mark Dindal', None];['Zach Braff', 'Joan Cusack', 'Garry Marshall', 'Don Knotts']
39;Hyper Noël;2002;Tous publics;104;['Comedy', ' Family', ' Fantasy            '];5.7;48;Scott Calvin has been a humble Santa Claus for eight years, but it might come to an end if he doesn't find a Mrs. Claus.;['Michael Lembeck', None];['Tim Allen', 'Spencer Breslin', 'Elizabeth Mitchell', 'Eric Lloyd']
40;Le petit vampire;2000;Tous publics;95;['Adventure', ' Comedy', ' Family            '];5.7;45;A lonely American boy living in Scotland makes a new best friend, a fellow nine year-old who happens to be a vampire.;['Uli Edel', None];['Jonathan Lipnicki', 'Rollo Weeks', 'Richard E. Grant', 'Jim Carter']
41;Les visiteurs en Amérique;2001;Tous publics;88;['Adventure', ' Comedy', ' Fantasy            '];5.7;38;A French count is in England to marry the princess. She's killed. A wizard helps him time travel back before the murder - but ends up in Chicago, April 2000. A descendant helps him. Can he return to the 1100s?;['Jean-Marie Poiré', None];['Jean Reno', 'Christina Applegate', 'Christian Clavier', 'Matt Ross']
