;name;year;certificate;runtime;genre;rating;metascore;text-muted;director;stars
2;Passé virtuel;1999;Tous publics;100;['Mystery', ' Sci-Fi', ' Thriller            '];7.0;36;A computer scientist running a virtual reality simulation of 1937 becomes the primary suspect when his colleague and mentor is murdered.;['Josef Rusnak', None];"['Craig Bierko', 'Gretchen Mol', 'Armin Mueller-Stahl', ""Vincent D'Onofrio""]"
3;The X-Files, le film: Combattre le futur;1998;Tous publics;121;['Drama', ' Mystery', ' Sci-Fi            '];7.0;60;Mulder and Scully must fight the government in a conspiracy and find the truth about an alien colonization of Earth.;['Rob Bowman', None];['David Duchovny', 'Gillian Anderson', 'John Neville', 'William B. Davis']
4;Le témoin du mal;1998;Tous publics;124;['Action', ' Crime', ' Drama            '];7.0;-1;Homicide detective John Hobbes witnesses the execution of serial killer Edgar Reese. Soon after the execution, the killings start again, and they are very similar to Reese's style.;['Gregory Hoblit', None];['Denzel Washington', 'John Goodman', 'Donald Sutherland', 'Embeth Davidtz']
5;Breakdown - Point de rupture;I) (1997;12;93;['Crime', ' Drama', ' Mystery            '];7.0;73;A man searches for his missing wife after his car breaks down in the middle of the desert.;['Jonathan Mostow', None];['Kurt Russell', 'J.T. Walsh', 'Kathleen Quinlan', 'M.C. Gainey']
6;Basic Instinct;1992;16;127;['Drama', ' Mystery', ' Thriller            '];7.0;41;A violent police detective investigates a brutal murder that might involve a manipulative and seductive novelist.;['Paul Verhoeven', None];['Michael Douglas', 'Sharon Stone', 'George Dzundza', 'Jeanne Tripplehorn']
7;Meurtre au soleil;1982;Tous publics;117;['Crime', ' Drama', ' Mystery            '];7.0;61;Trying to find how a millionaire wound up with a phony diamond brings Hercule Poirot to an exclusive island resort frequented by the rich and famous. When a murder is committed, everyone has an alibi.;['Guy Hamilton', None];['Peter Ustinov', 'James Mason', 'Maggie Smith', 'Colin Blakely']
8;Piège mortel;1982;NaN;116;['Comedy', ' Crime', ' Mystery            '];7.0;54;A Broadway playwright puts murder in his plan to take credit for a student's play.;['Sidney Lumet', None];['Michael Caine', 'Christopher Reeve', 'Dyan Cannon', 'Irene Worth']
9;Ces garçons qui venaient du Brésil;1978;16;125;['Drama', ' Mystery', ' Sci-Fi            '];7.0;40;A Nazi hunter in Paraguay discovers a sinister and bizarre plot to rekindle the Third Reich.;['Franklin J. Schaffner', None];['Gregory Peck', 'Laurence Olivier', 'James Mason', 'Lilli Palmer']
10;La dernière vague;1977;NaN;106;['Drama', ' Fantasy', ' Mystery            '];7.0;85;A Sydney lawyer defends five Aboriginal Persons in a ritualized taboo murder and in the process learns disturbing things about himself and premonitions.;['Peter Weir', None];['Richard Chamberlain', 'Olivia Hamnett', 'David Gulpilil', 'Frederick Parslow']
11;La petite fille au bout du chemin;1976;Tous publics;91;['Drama', ' Horror', ' Mystery            '];7.0;53;"In a little seaside town, thirteen year-old Rynn Jacobs is celebrating her birthday alone on a Halloween night. She and her father had arrived from England recently and leased the house for...                See full summary »
";['Nicolas Gessner', None];['Jodie Foster', 'Martin Sheen', 'Alexis Smith', 'Mort Shuman']
12;Le retour de la panthère rose;1975;Tous publics;113;['Comedy', ' Crime', ' Mystery            '];7.0;61;Inspector Jacque Clouseau (Peter Sellers) is put on the case when the Pink Panther diamond is stolen, with the Phantom's trademark glove the only clue.;['Blake Edwards', None];['Peter Sellers', 'Christopher Plummer', 'Catherine Schell', 'Herbert Lom']
13;Soleil vert;1973;13;97;['Crime', ' Mystery', ' Sci-Fi            '];7.0;66;A nightmarish futuristic fantasy about the controlling power of big corporations and an innocent cop who stumbles on the truth.;['Richard Fleischer', None];['Charlton Heston', 'Edward G. Robinson', 'Leigh Taylor-Young', 'Chuck Connors']
14;La vie privée de Sherlock Holmes;1970;Tous Public;125;['Adventure', ' Comedy', ' Crime            '];7.0;-1;When a bored Holmes eagerly takes the case of Gabrielle Valladon after an attempt on her life, the search for her missing husband leads to Loch Ness and the legendary monster.;['Billy Wilder', None];['Robert Stephens', 'Christopher Lee', 'Colin Blakely', 'Geneviève Page']
15;Les Monstres de l'espace;1967;Tous publics;97;['Horror', ' Mystery', ' Sci-Fi            '];7.0;-1;A mysterious artifact is unearthed in London, and famous scientist Bernard Quatermass is called in to divine its origins and explain its strange effects on people.;['Roy Ward Baker', None];['James Donald', 'Andrew Keir', 'Barbara Shelley', 'Julian Glover']
16;Alphaville, une étrange aventure de Lemmy Caution;1965;Tous publics;99;['Drama', ' Mystery', ' Sci-Fi            '];7.0;-1;A U.S. secret agent is sent to the distant space city of Alphaville where he must find a missing person and free the city from its tyrannical ruler.;['Jean-Luc Godard', None];['Eddie Constantine', 'Anna Karina', 'Akim Tamiroff', 'Valérie Boisgel']
17;La chambre des tortures;1961;12;80;['Drama', ' Horror', ' Mystery            '];7.0;78;In the sixteenth century, Francis Barnard travels to Spain to clarify the strange circumstances of his sister's death after she had married the son of a cruel Spanish Inquisitor.;['Roger Corman', None];['Vincent Price', 'Barbara Steele', 'John Kerr', 'Luana Anders']
18;Mais qui a tué Harry?;1955;Tous publics;99;['Comedy', ' Mystery            '];7.0;74;Harry's dead and, while no one really minds, everyone feels responsible. After Harry's body is found in the woods, several locals must determine not only how and why he was killed but what to do with the body.;['Alfred Hitchcock', None];['John Forsythe', 'Shirley MacLaine', 'Edmund Gwenn', 'Mildred Natwick']
19;Le Grand Alibi;1950;Tous publics;110;['Film-Noir', ' Mystery', ' Thriller            '];7.0;-1;A struggling actress tries to help a friend prove his innocence after he's accused of murdering the husband of a high-society entertainer.;['Alfred Hitchcock', None];['Marlene Dietrich', 'Jane Wyman', 'Richard Todd', 'Michael Wilding']
20;Tully;2018;Tous publics;95;['Comedy', ' Drama', ' Mystery            '];6.9;75;A struggling mother of three forms an unexpected bond with the night nanny hired to help with her newborn baby.;['Jason Reitman', None];['Charlize Theron', 'Mackenzie Davis', 'Ron Livingston', 'Asher Miles Fallica']
21;Everybody Knows;2018;Tous publics;133;['Crime', ' Drama', ' Mystery            '];6.9;68;Laura, a Spanish woman living in Buenos Aires, returns to her hometown outside Madrid with her two children to attend her sister's wedding. However, the trip is upset by unexpected events that bring secrets into the open.;['Asghar Farhadi', None];['Penélope Cruz', 'Javier Bardem', 'Ricardo Darín', 'Eduard Fernández']
22;The Witch;2015;12;92;['Drama', ' Fantasy', ' Horror            '];6.9;83;A family in 1630s New England is torn apart by the forces of witchcraft, black magic and possession.;['Robert Eggers', None];['Anya Taylor-Joy', 'Ralph Ineson', 'Kate Dickie', 'Julian Richings']
23;Enemy;2013;Tous publics;91;['Drama', ' Mystery', ' Thriller            '];6.9;61;A man seeks out his exact look-alike after spotting him in a movie.;['Denis Villeneuve', None];['Jake Gyllenhaal', 'Mélanie Laurent', 'Sarah Gadon', 'Isabella Rossellini']
24;Non-Stop;2014;Tous publics;106;['Action', ' Mystery', ' Thriller            '];6.9;56;An air marshal springs into action during a transatlantic flight after receiving a series of text messages demanding $150 million into an off-shore account, or someone will die every 20 minutes.;['Jaume Collet-Serra', None];['Liam Neeson', 'Julianne Moore', 'Scoot McNairy', 'Michelle Dockery']
25;Trance;I) (2013;Tous publics;101;['Crime', ' Drama', ' Mystery            '];6.9;61;An art auctioneer becomes mixed up with a group of criminals partners with a hypnotherapist in order to recover a lost painting.;['Danny Boyle', None];['James McAvoy', 'Rosario Dawson', 'Vincent Cassel', 'Danny Sapani']
26;The Highwaymen;2019;16;132;['Biography', ' Crime', ' Drama            '];6.9;58;The untold true story of the legendary detectives who brought down Bonnie and Clyde.;['John Lee Hancock', None];['Kevin Costner', 'Woody Harrelson', 'Kathy Bates', 'John Carroll Lynch']
27;Le royaume de Ga'Hoole - La légende des gardiens;2010;Tous publics;97;['Animation', ' Action', ' Adventure            '];6.9;53;When a young owl is abducted by an evil Owl army, he must escape with new-found friends and seek the legendary Guardians to stop the menace.;['Zack Snyder', None];['Jim Sturgess', 'Hugo Weaving', 'David Wenham', 'Emily Barclay']
28;Secret d'état;2014;R;112;['Biography', ' Crime', ' Drama            '];6.9;60;Journalist Gary Webb, California 1996, started investigating CIA's role in the 1980s in getting crack cocaine to the black part of LA to get money and weapons to the Contras/freedom fighters in Nicaragua.;['Michael Cuesta', None];['Jeremy Renner', 'Robert Patrick', 'Jena Sims', 'Robert Pralgo']
29;Triangle;2009;16;99;['Fantasy', ' Mystery', ' Sci-Fi            '];6.9;-1;Five friends set sail and their yacht is overturned by a strange and sudden storm. A mysterious ship arrives to rescue them, and what happens next cannot be explained.;['Christopher Smith', None];['Melissa George', 'Joshua McIvor', 'Jack Taylor', 'Michael Dorman']
30;Pig;I) (2021;Tous publics;92;['Drama', ' Mystery            '];6.9;82;A truffle hunter who lives alone in the Oregon wilderness must return to his past in Portland in search of his beloved foraging pig after she is kidnapped.;['Michael Sarnoski', None];['Nicolas Cage', 'Alex Wolff', 'Adam Arkin', 'Cassandra Violet']
31;Nope;2022;Tous publics avec avertissement;130;['Horror', ' Mystery', ' Sci-Fi            '];6.9;77;The residents of a lonely gulch in inland California bear witness to an uncanny and chilling discovery.;['Jordan Peele', None];['Daniel Kaluuya', 'Keke Palmer', 'Brandon Perea', 'Michael Wincott']
32;Extrêmement fort & incroyablement près;2011;Tous publics;129;['Adventure', ' Drama', ' Mystery            '];6.9;46;A nine-year-old amateur inventor, Francophile, and pacifist searches New York City for the lock that matches a mysterious key left behind by his father, who died in the World Trade Center on September 11, 2001.;['Stephen Daldry', None];['Thomas Horn', 'Tom Hanks', 'Sandra Bullock', 'Max von Sydow']
33;My Name Is Hallam Foe;2007;R;95;['Drama', ' Mystery', ' Romance            '];6.9;62;Hallam's talent for spying on people reveals his darkest fears-and his most peculiar desires. Driven to expose the true cause of his mother's death, he instead finds himself searching the rooftops of the city for love.;['David Mackenzie', None];['Jamie Bell', 'Ruth Milne', 'John Paul Lawler', 'Claire Forlani']
34;Benjamin Gates et le Trésor des Templiers;2004;Tous publics;131;['Action', ' Adventure', ' Mystery            '];6.9;39;A historian races to find the legendary Templar Treasure before a team of mercenaries.;['Jon Turteltaub', None];['Nicolas Cage', 'Diane Kruger', 'Justin Bartha', 'Sean Bean']
35;Rencontre à Wicker Park;2004;Tous Public;114;['Drama', ' Mystery', ' Romance            '];6.9;40;A young Chicago advertising executive believes a woman he sees in a café is his long-lost love. His belief leads to obsession, as he puts his life on hold in order to trail her.;['Paul McGuigan', None];['Josh Hartnett', 'Diane Kruger', 'Matthew Lillard', 'Rose Byrne']
36;Bubba Ho-Tep;2002;Tous publics;92;['Comedy', ' Fantasy', ' Horror            '];6.9;57;"Elvis Presley and a black ""JFK"" stay in a nursing home where nothing happens - until a wayward Egyptian mummy comes and sucks out the old people's souls thru their anuses. The two decide to fight back.";['Don Coscarelli', None];['Bruce Campbell', 'Ossie Davis', 'Bob Ivy', 'Ella Joyce']
37;Vanilla Sky;2001;Tous publics;136;['Fantasy', ' Mystery', ' Romance            '];6.9;45;A self-indulgent and vain publishing magnate finds his privileged life upended after a vehicular accident with a resentful lover.;['Cameron Crowe', None];['Tom Cruise', 'Penélope Cruz', 'Cameron Diaz', 'Kurt Russell']
38;Coeurs perdus en Atlantide;2001;Tous publics;101;['Drama', ' Mystery            '];6.9;55;Widowed Liz Garfield and her son Bobby change when mysterious stranger Ted Brautigan enters their lives.;['Scott Hicks', None];['Anthony Hopkins', 'Anton Yelchin', 'Hope Davis', 'Mika Boorem']
39;L'Anglais;1999;Tous publics;89;['Crime', ' Drama', ' Mystery            '];6.9;73;An extremely volatile and dangerous Englishman goes to Los Angeles to find the man he considers responsible for his daughter's death.;['Steven Soderbergh', None];['Terence Stamp', 'Peter Fonda', 'Lesley Ann Warren', 'Luis Guzmán']
40;Hypnose;1999;12;99;['Horror', ' Mystery', ' Thriller            '];6.9;67;After being hypnotized by his sister-in-law, a man begins seeing haunting visions of a girl's ghost and a mystery begins to unfold around him.;['David Koepp', None];['Kevin Bacon', 'Zachary David Cope', 'Kathryn Erbe', 'Illeana Douglas']
41;La méthode zéro;1998;R;116;['Comedy', ' Crime', ' Drama            '];6.9;-1;The world's greatest detective Daryl Zero aided by his associate Steve Arlo investigates a complex and mysterious case of blackmail and missing keys for shady tycoon Gregory Stark who is less than forthcoming about what is really happening!;['Jake Kasdan', None];"['Bill Pullman', 'Ben Stiller', ""Ryan O'Neal"", 'Kim Dickens']"
42;Suicide Kings;1997;12;106;['Comedy', ' Crime', ' Drama            '];6.9;43;A group of youngsters kidnap a respected Mafia figure.;"[""Peter O'Fallon"", None]";['Christopher Walken', 'Denis Leary', 'Sean Patrick Flanery', 'Mark Watson']
43;Affliction;1997;Tous publics;114;['Drama', ' Mystery', ' Thriller            '];6.9;79;A deeply troubled small-town cop investigates a suspicious hunting death while other events jeopardize his sanity.;['Paul Schrader', None];['Nick Nolte', 'Sissy Spacek', 'James Coburn', 'Brigid Tierney']
44;Clockers;1995;16;128;['Crime', ' Drama', ' Mystery            '];6.9;71;Young drug pushers in the projects of Brooklyn live hard dangerous lives, trapped between their drug bosses and the detectives out to stop them.;['Spike Lee', None];['Harvey Keitel', 'John Turturro', 'Delroy Lindo', 'Mekhi Phifer']
45;Présumé innocent;1990;Tous publics;127;['Mystery', ' Thriller            '];6.9;72;As a lawyer investigates the murder of a colleague, he finds himself more connected to the crime than anyone else.;['Alan J. Pakula', None];['Harrison Ford', 'Raul Julia', 'Greta Scacchi', 'Brian Dennehy']
46;Élémentaire, mon cher... Lock Holmes;1988;Tous publics;107;['Comedy', ' Crime', ' Mystery            '];6.9;-1;A drunken Sherlock Holmes is really just a cover for the real detective, Dr. Watson.;['Thom Eberhardt', None];['Michael Caine', 'Ben Kingsley', 'Jeffrey Jones', 'Lysette Anthony']
47;Frantic;1988;Tous publics;120;['Crime', ' Drama', ' Mystery            '];6.9;66;In a hotel room in Paris, a doctor comes out of the shower and finds that his wife has disappeared. He soon finds himself caught up in a world of intrigue, espionage, gangsters, drugs and murder.;['Roman Polanski', None];['Harrison Ford', 'Betty Buckley', 'Emmanuelle Seigner', 'Djiby Soumare']
48;Opéra;1987;12;107;['Crime', ' Horror', ' Mystery            '];6.9;68;A young opera singer is stalked by a deranged fan bent on killing the people associated with her to claim her for himself.;['Dario Argento', None];['Cristina Marsillach', 'Ian Charleson', 'Urbano Barberini', 'Daria Nicolodi']
49;Fletch aux trousses;1985;Tous publics;98;['Comedy', ' Crime', ' Mystery            '];6.9;68;"Irwin M. ""Fletch"" Fletcher is a newspaper reporter being offered a large sum to off a cancerous millionaire, but is on the run, risking his job and finding clues when it's clear the man is healthy.";['Michael Ritchie', None];['Chevy Chase', 'Joe Don Baker', 'Dana Wheeler-Nicholson', 'Richard Libertini']
0;Morts suspectes;1978;12;113;['Drama', ' Mystery', ' Thriller            '];6.9;60;When a young female doctor notices an unnatural amount of comas occurring in her hospital she uncovers a horrible conspiracy.;['Michael Crichton', None];['Michael Douglas', 'Rip Torn', 'Geneviève Bujold', 'Elizabeth Ashley']
1;Les femmes de Stepford;1975;NaN;115;['Horror', ' Mystery', ' Sci-Fi            '];6.9;54;Joanna Eberhart has come to the quaint little town of Stepford, Connecticut with her family, but soon discovers there lies a sinister truth in the all too perfect behavior of the female residents.;['Bryan Forbes', None];['Katharine Ross', 'Paula Prentiss', 'Peter Masterson', 'Nanette Newman']
2;Soeurs de sang;1972;16;93;['Horror', ' Mystery', ' Thriller            '];6.9;70;A small-time reporter tries to convince the police she saw a murder in the apartment across from hers.;['Brian De Palma', None];['Margot Kidder', 'Jennifer Salt', 'Charles Durning', 'William Finley']
3;Histoires d'outre-tombe;1972;12;92;['Drama', ' Horror', ' Mystery            '];6.9;-1;Five strangers get lost in a crypt and, after meeting the mysterious Crypt Keeper, receive visions of how they will die.;['Freddie Francis', None];['Joan Collins', 'Peter Cushing', 'Ralph Richardson', 'Geoffrey Bayldon']
4;Le chien des Baskerville;1959;Tous publics;87;['Horror', ' Mystery            '];6.9;-1;When a nobleman is threatened by a family curse on his newly inherited estate, detective Sherlock Holmes is hired to investigate.;['Terence Fisher', None];['Peter Cushing', 'André Morell', 'Christopher Lee', 'Marla Landi']
5;La comtesse aux pieds nus;1954;12;128;['Crime', ' Drama', ' Mystery            '];6.9;-1;This is the life of a Hollywood movie star named Maria, as told by writer/director Harry Dawes, from being discovered in Madrid, Spain, until her funeral in Italy.;['Joseph L. Mankiewicz', None];"['Humphrey Bogart', 'Ava Gardner', ""Edmond O'Brien"", 'Marius Goring']"
6;Wedding Nightmare;I) (2019;12;95;['Action', ' Comedy', ' Horror            '];6.8;64;A bride's wedding night takes a sinister turn when her eccentric new in-laws force her to take part in a terrifying game.;['    Directors:', 'Matt Bettinelli-Olpin, ', 'Tyler Gillett', None];"['Samara Weaving', 'Adam Brody', ""Mark O'Brien"", 'Henry Czerny']"
7;Boss Level;2020;Accord parental;100;['Action', ' Adventure', ' Comedy            '];6.8;56;Trapped in a time loop that constantly repeats the day of his murder, a former special forces agent must unlock the mystery behind his untimely demise.;['Joe Carnahan', None];['Frank Grillo', 'Mel Gibson', 'Naomi Watts', 'Michelle Yeoh']
8;L'ombre d'Emily;2018;Tous publics;117;['Comedy', ' Crime', ' Mystery            '];6.8;67;Stephanie is a single mother with a parenting vlog who befriends Emily, a secretive upper-class woman who has a child at the same elementary school. When Emily goes missing, Stephanie takes it upon herself to investigate.;['Paul Feig', None];['Anna Kendrick', 'Blake Lively', 'Henry Golding', 'Andrew Rannells']
9;Us;II) (2019;12;116;['Horror', ' Mystery', ' Thriller            '];6.8;81;A family's serene beach vacation turns to chaos when their doppelgängers appear and begin to terrorize them.;['Jordan Peele', None];"[""Lupita Nyong'o"", 'Winston Duke', 'Elisabeth Moss', 'Tim Heidecker']"
10;I See You;II) (2019;12;98;['Crime', ' Drama', ' Horror            '];6.8;65;A police man and his doctor wife have some marriage problems and the son blames the mother. For his job the police man investegates the case of a missing boy. And the possible kidnap looks like some cases of a few years ago.;['Adam Randall', None];['Helen Hunt', 'Jon Tenney', 'Owen Teague', 'Judah Lewis']
11;Escape from Pretoria;2020;10;106;['Biography', ' Crime', ' Mystery            '];6.8;56;Based on the real-life prison break of two political captives, Escape From Pretoria is a race-against-time thriller set in the tumultuous apartheid days of South Africa.;['Francis Annan', None];['Daniel Radcliffe', 'Daniel Webber', 'Ian Hart', 'Mark Leonard Winter']
12;Jersey Affair;III) (2017;12;107;['Crime', ' Drama', ' Mystery            '];6.8;74;A troubled woman living in an isolated community finds herself pulled between the control of her oppressive family and the allure of a secretive outsider suspected of a series of brutal murders.;['Michael Pearce', None];['Jessie Buckley', 'Geraldine James', 'Oliver Maltman', 'Trystan Gravelle']
13;Tout l'argent du monde;2017;Tous publics avec avertissement;132;['Biography', ' Crime', ' Drama            '];6.8;72;The story of the kidnapping of 16-year-old John Paul Getty III and the desperate attempt by his devoted mother to convince his billionaire grandfather Jean Paul Getty to pay the ransom.;['Ridley Scott', None];['Michelle Williams', 'Christopher Plummer', 'Mark Wahlberg', 'Romain Duris']
14;Canicule;2020;10 avec avertissement;117;['Crime', ' Drama', ' Mystery            '];6.8;69;Aaron Falk returns to his drought-stricken hometown to attend a tragic funeral. But his return opens a decades-old wound - the unsolved death of a teenage girl.;['Robert Connolly', None];"['Eric Bana', ""Genevieve O'Reilly"", ""Keir O'Donnell"", 'John Polson']"
15;The Jane Doe Identity;2016;12 avec avertissement;86;['Horror', ' Mystery', ' Thriller            '];6.8;65;A father and son, both coroners, are pulled into a complex mystery while attempting to identify the body of a young woman, who was apparently harboring dark secrets.;['André Øvredal', None];['Brian Cox', 'Emile Hirsch', 'Ophelia Lovibond', 'Michael McElhatton']
16;It Follows;2014;12;100;['Horror', ' Mystery', ' Thriller            '];6.8;83;A young woman is followed by an unknown supernatural force after a sexual encounter.;['David Robert Mitchell', None];['Maika Monroe', 'Keir Gilchrist', 'Olivia Luccardi', 'Lili Sepe']
17;Mr. Holmes;2015;Tous publics;104;['Drama', ' Mystery            '];6.8;67;An aged, retired Sherlock Holmes deals with dementia, as he tries to remember his final case, and a mysterious woman, whose memory haunts him. He also befriends a fan, the young son of his housekeeper, who wants him to work again.;['Bill Condon', None];['Ian McKellen', 'Laura Linney', 'Hiroyuki Sanada', 'Hattie Morahan']
18;Annihilation;I) (2018;16;115;['Adventure', ' Drama', ' Horror            '];6.8;79;A biologist signs up for a dangerous, secret expedition into a mysterious zone where the laws of nature don't apply.;['Alex Garland', None];['Natalie Portman', 'Jennifer Jason Leigh', 'Tessa Thompson', 'Benedict Wong']
19;Mister Babadook;2014;12;94;['Horror', ' Mystery            '];6.8;86;"A single mother and her child fall into a deep well of paranoia when an eerie children's book titled ""Mister Babadook"" manifests in their home.";['Jennifer Kent', None];['Essie Davis', 'Noah Wiseman', 'Daniel Henshall', 'Hayley McElhinney']
20;Sinister;I) (2012;12 avec avertissement;110;['Horror', ' Mystery', ' Thriller            '];6.8;53;Washed-up true crime writer Ellison Oswalt finds a box of super 8 home movies in his new home, revealing that the murder he is currently researching is the work of a serial killer whose legacy dates back to the 1960s.;['Scott Derrickson', None];['Ethan Hawke', 'Juliet Rylance', 'James Ransone', 'Fred Thompson']
21;Le Labyrinthe;2014;Tous publics avec avertissement;113;['Action', ' Mystery', ' Sci-Fi            '];6.8;57;"Thomas is deposited in a community of boys after his memory is erased, soon learning they're all trapped in a maze that will require him to join forces with fellow ""runners"" for a shot at escape.";['Wes Ball', None];"[""Dylan O'Brien"", 'Kaya Scodelario', 'Will Poulter', 'Thomas Brodie-Sangster']"
22;Hysteria;2014;12;112;['Drama', ' Horror', ' Mystery            '];6.8;52;"An Oxford graduate takes up a job in a mental asylum, only to discover that the ""revolutionary"" new treatments are inhumane, and that there is more going on than meets the eye.";['Brad Anderson', None];['Kate Beckinsale', 'Jim Sturgess', 'David Thewlis', 'Brendan Gleeson']
23;Odd Thomas contre les créatures de l'ombre;2013;Tous publics;100;['Comedy', ' Fantasy', ' Horror            '];6.8;45;In a California desert town, a short-order cook with clairvoyant abilities encounters a mysterious man with a link to dark, threatening forces.;['Stephen Sommers', None];['Anton Yelchin', 'Ashley Sommers', 'Leonor Varela', 'Matthew Page']
24;Night Train to Lisbon;2013;R;111;['Mystery', ' Romance', ' Thriller            '];6.8;30;Swiss Professor Raimund Gregorius (Jeremy Irons) abandons his lectures and buttoned-down life to embark on a thrilling adventure that will take him on a journey to the very heart of himself.;['Bille August', None];['Jeremy Irons', 'Mélanie Laurent', 'Jack Huston', 'Martina Gedeck']
25;Insidious;I) (2010;12;103;['Horror', ' Mystery', ' Thriller            '];6.8;52;A family looks to prevent evil spirits from trapping their comatose child in a realm called The Further.;['James Wan', None];['Patrick Wilson', 'Rose Byrne', 'Ty Simpkins', 'Lin Shaye']
26;Seven Sisters;2017;12;123;['Action', ' Crime', ' Fantasy            '];6.8;47;In a world where families are limited to one child due to overpopulation, a set of identical septuplets must avoid being put to a long sleep by the government and dangerous infighting while investigating the disappearance of one of their own.;['Tommy Wirkola', None];['Noomi Rapace', 'Glenn Close', 'Willem Dafoe', 'Marwan Kenzari']
