;name;year;certificate;runtime;genre;rating;metascore;text-muted;director;stars
48;Quiz Show;1994;PG-13;133;['Biography', ' Drama', ' History            '];7.5;92;A young lawyer, Richard Goodwin, investigates a potentially fixed game show. Charles Van Doren, a big time show winner, is under Goodwin's investigation.;['Robert Redford', None];['Ralph Fiennes', 'John Turturro', 'Rob Morrow', 'Paul Scofield']
49;Rudy;1993;PG;114;['Biography', ' Drama', ' Sport            '];7.5;71;Rudy has always been told that he was too small to play college football. But he is determined to overcome the odds and fulfill his dream of playing for Notre Dame.;['David Anspaugh', None];['Sean Astin', 'Jon Favreau', 'Ned Beatty', 'Greta Lind']
0;Chaplin;1992;16;143;['Biography', ' Comedy', ' Drama            '];7.5;47;An elderly Charlie Chaplin discusses his autobiography with his editor, recounting his amazing journey from his poverty-stricken childhood to world-wide success after the ingenious invention of the Little Tramp.;['Richard Attenborough', None];['Robert Downey Jr.', 'Geraldine Chaplin', 'Paul Rhys', 'John Thaw']
1;Henry V;1989;Tous Public;137;['Biography', ' Drama', ' History            '];7.5;83;In the midst of the Hundred Years War, the young King Henry V of England embarks on the conquest of France in 1415.;['Kenneth Branagh', None];['Kenneth Branagh', 'Derek Jacobi', 'Simon Shepherd', 'James Larkin']
2;Nashville Lady;1980;Tous publics;124;['Biography', ' Drama', ' Music            '];7.5;87;The fictionalized life of singer Loretta Lynn, a girl who rose from humble beginnings to become a country music star in the 1960s/70s.;['Michael Apted', None];['Sissy Spacek', 'Tommy Lee Jones', 'Levon Helm', 'Phyllis Boyens']
3;Midnight Express;1978;16;121;['Biography', ' Crime', ' Drama            '];7.5;59;Billy Hayes, an American college student, is caught smuggling drugs out of Turkey and thrown into prison.;['Alan Parker', None];['Brad Davis', 'Irene Miracle', 'Bo Hopkins', 'Paolo Bonacelli']
4;Judas and the Black Messiah;2021;12;126;['Biography', ' Drama', ' History            '];7.4;85;Offered a plea deal by the FBI, William O'Neal infiltrates the Illinois chapter of the Black Panther Party to gather intelligence on Chairman Fred Hampton.;['Shaka King', None];['LaKeith Stanfield', 'Daniel Kaluuya', 'Jesse Plemons', 'Dominique Fishback']
5;Une vie cachée;2019;Tous publics;174;['Biography', ' Drama', ' Romance            '];7.4;78;The Austrian Franz Jägerstätter, a conscientious objector, refuses to fight for the Nazis in World War II.;['Terrence Malick', None];['August Diehl', 'Valerie Pachner', 'Maria Simon', 'Karin Neuhäuser']
6;Désigné coupable;2021;Tous publics;129;['Biography', ' Drama', ' Thriller            '];7.4;53;Mohamedou Ould Slahi fights for freedom after being detained and imprisoned without charge by the U.S. Government for years.;['Kevin Macdonald', None];['Tahar Rahim', 'Nouhe Hamady Bari', 'Saadna Hamoud', 'Mohamed Yeslem Mousse']
7;Les heures sombres;2017;Tous publics;125;['Biography', ' Drama', ' War            '];7.4;75;In May 1940, the fate of World War II hangs on Winston Churchill, who must decide whether to negotiate with Adolf Hitler, or fight on knowing that it could mean the end of the British Empire.;['Joe Wright', None];['Gary Oldman', 'Lily James', 'Kristin Scott Thomas', 'Ben Mendelsohn']
8;La Dame de Katwe;2016;Tous Public;124;['Biography', ' Drama', ' Sport            '];7.4;73;A Ugandan girl sees her world rapidly change after being introduced to the game of chess.;['Mira Nair', None];"['Madina Nalwanga', 'David Oyelowo', ""Lupita Nyong'o"", 'Martin Kabanza']"
9;Le grand jeu;2017;Tous publics;140;['Biography', ' Crime', ' Drama            '];7.4;71;The true story of Molly Bloom, an Olympic-class skier who ran the world's most exclusive high-stakes poker game and became an FBI target.;['Aaron Sorkin', None];['Jessica Chastain', 'Idris Elba', 'Kevin Costner', 'Michael Cera']
10;Holding the Man;2015;NaN;127;['Biography', ' Drama', ' Romance            '];7.4;-1;The warm, funny and achingly sad story of the 15-year-long love affair between Timothy Conigrave and the boy he fell in love with at high school, John Caleo.;['Neil Armfield', None];['Ryan Corr', 'Sarah Snook', 'Francesco Ferdinandi', 'Craig Stott']
11;Sully;2016;Tous Public;96;['Biography', ' Drama            '];7.4;74;"When pilot Chesley ""Sully"" Sullenberger lands his damaged plane on the Hudson River in order to save the flight's passengers and crew, some consider him a hero while others think he was reckless.";['Clint Eastwood', None];['Tom Hanks', 'Aaron Eckhart', 'Laura Linney', 'Valerie Mahaffey']
12;Dalton Trumbo;2015;Tous publics;124;['Biography', ' Drama            '];7.4;60;In 1947, Dalton Trumbo was Hollywood's top screenwriter, until he and other artists were jailed and blacklisted for their political beliefs.;['Jay Roach', None];['Bryan Cranston', 'Diane Lane', 'Helen Mirren', 'Louis C.K.']
13;The Good Lie;2014;Tous publics;110;['Biography', ' Drama            '];7.4;65;A group of Sudanese refugees, given the chance to resettle in the U.S., arrive in Kansas City, Missouri, where their encounter with an employment agency counselor forever changes all of their lives.;['Philippe Falardeau', None];['Reese Witherspoon', 'Arnold Oceng', 'Ger Duany', 'Emmanuel Jal']
14;McFarland, USA;2015;PG;129;['Biography', ' Drama', ' Sport            '];7.4;60;Jim White moves his family after losing his last job as a football coach, and at his new school he turns seven disappointing students into one of the best cross-country teams in the region.;['Niki Caro', None];['Kevin Costner', 'Maria Bello', 'Ramiro Rodriguez', 'Carlos Pratts']
15;Love & Mercy, la véritable histoire de Brian Wilson des Beach Boys;2014;Tous Public;121;['Biography', ' Drama', ' Music            '];7.4;80;In the 60s, Beach Boys leader Brian Wilson struggles with emerging psychosis as he attempts to craft his avant-garde pop masterpiece. In the 80s, he's a broken, confused man under the 24-hour watch of shady therapist, Dr. Eugene Landy.;['Bill Pohlad', None];['John Cusack', 'Paul Dano', 'Elizabeth Banks', 'Paul Giamatti']
16;Amazing Grace;2006;PG;118;['Biography', ' Drama', ' History            '];7.4;65;The idealist William Wilberforce (Ioan Gruffudd) maneuvers his way through Parliament, endeavoring to end the British transatlantic slave trade.;['Michael Apted', None];['Ioan Gruffudd', 'Albert Finney', 'Michael Gambon', 'Romola Garai']
17;Good Night, and Good Luck;2005;Tous publics;93;['Biography', ' Drama', ' History            '];7.4;80;Broadcast journalist Edward R. Murrow looks to bring down Senator Joseph McCarthy.;['George Clooney', None];['David Strathairn', 'George Clooney', 'Patricia Clarkson', 'Jeff Daniels']
18;L'ennemi public n°1;2008;Tous publics;133;['Action', ' Biography', ' Crime            '];7.4;72;The story of the notorious French gangster Jacques Mesrine, with the focus on his life and death as France's Public Enemy No. 1 in the 1970s.;['Jean-François Richet', None];['Vincent Cassel', 'Ludivine Sagnier', 'Mathieu Amalric', 'Samuel Le Bihan']
19;Un parcours de légende;2005;Tous publics;120;['Biography', ' Drama', ' Sport            '];7.4;55;In the 1913 U.S. Open, twenty-year-old Francis Ouimet played golf against his idol, 1900 U.S. Open champion, Englishman Harry Vardon.;['Bill Paxton', None];['Shia LaBeouf', 'Stephen Dillane', 'Elias Koteas', 'James Paxton']
20;Miracle;2004;Tous Public;135;['Biography', ' Drama', ' History            '];7.4;68;The true story of Herb Brooks, the player-turned-coach who led the 1980 U.S. Olympic hockey team to victory over the seemingly invincible Soviet squad.;"[""Gavin O'Connor"", None]";['Kurt Russell', 'Patricia Clarkson', 'Nathan West', 'Noah Emmerich']
21;American Splendor;2003;Tous publics;101;['Biography', ' Comedy', ' Drama            '];7.4;90;An original mix of fiction and reality illuminates the life of comic book hero everyman Harvey Pekar.;['    Directors:', 'Shari Springer Berman, ', 'Robert Pulcini', None];['Paul Giamatti', 'Shari Springer Berman', 'Harvey Pekar', 'Chris Ambrose']
22;Le chemin de la liberté;2002;Tous publics;94;['Biography', ' Drama            '];7.4;80;In 1931, three half-white, half-Aboriginal girls escape after being plucked from their houses to be trained as domestic staff, and set off on a journey across the Outback.;['Phillip Noyce', None];['Everlyn Sampi', 'Tianna Sansbury', 'Kenneth Branagh', 'Laura Monaghan']
23;Erin Brockovich, seule contre tous;2000;Tous publics;131;['Biography', ' Drama            '];7.4;73;An unemployed single mother becomes a legal assistant and almost single-handedly brings down a California power company accused of polluting a city's water supply.;['Steven Soderbergh', None];['Julia Roberts', 'Albert Finney', 'David Brisbin', 'Dawn Didawick']
24;Topsy-Turvy;1999;Tous publics;160;['Biography', ' Comedy', ' Drama            '];7.4;90;Set in the 1880s, the story of how, during a creative dry spell, the partnership of the legendary musical/theatrical writers Gilbert and Sullivan almost dissolves, before they turn it all around and write the Mikado.;['Mike Leigh', None];['Jim Broadbent', 'Allan Corduner', 'Dexter Fletcher', 'Sukie Smith']
25;Elizabeth;1998;Tous publics;124;['Biography', ' Drama', ' History            '];7.4;75;The early years of the reign of Elizabeth I of England and her difficult task of learning what is necessary to be a monarch.;['Shekhar Kapur', None];['Cate Blanchett', 'Liz Giles', 'Rod Culbertson', 'Paul Fox']
26;Man on the Moon;1999;Tous publics;118;['Biography', ' Comedy', ' Drama            '];7.4;58;The life and career of legendary comedian Andy Kaufman.;['Milos Forman', None];['Jim Carrey', 'Danny DeVito', 'Gerry Becker', 'Greyson Erik Pendry']
27;Ni dieux ni démons;1998;R;105;['Biography', ' Drama            '];7.4;74;The last days of Frankenstein (1931) director James Whale are explored.;['Bill Condon', None];['Ian McKellen', 'Brendan Fraser', 'Lynn Redgrave', 'Lolita Davidovich']
28;Ludwig van B.;1994;Tous publics;121;['Biography', ' Drama', ' Music            '];7.4;-1;"The life and death of the legendary Ludwig van Beethoven. Besides all the work he is known for, the composer once wrote a famous love letter to a nameless beloved, and the movie tries to ...                See full summary »
";['Bernard Rose', None];['Gary Oldman', 'Jeroen Krabbé', 'Isabella Rossellini', 'Johanna ter Steege']
29;Les ombres du coeur;1993;Tous Public;131;['Biography', ' Drama', ' Romance            '];7.4;-1;C.S. Lewis, a world-renowned Christian theologian, writer and professor, leads a passionless life until he meets spirited poet Joy Gresham from the U.S.;['Richard Attenborough', None];['Anthony Hopkins', 'Debra Winger', 'Julian Fellowes', 'Roddy Maude-Roxby']
30;À la recherche de Bobby Fischer;1993;Tous Public;109;['Biography', ' Drama', ' Sport            '];7.4;89;A prepubescent chess prodigy refuses to harden himself in order to become a champion like the famous but unlikable Bobby Fischer.;['Steven Zaillian', None];['Joe Mantegna', 'Ben Kingsley', 'Max Pomeranc', 'Joan Allen']
31;Cry Freedom - Le cri de la liberté;1987;Tous publics;157;['Biography', ' Drama', ' History            '];7.4;59;South African journalist Donald Woods is forced to flee the country after attempting to investigate the death in custody of his friend, the Black anti-Apartheid activist Steve Biko.;['Richard Attenborough', None];['Denzel Washington', 'Kevin Kline', 'Josette Simon', 'Wabei Siyolwe']
32;84 Charing Cross Road;1987;NaN;100;['Biography', ' Drama', ' Romance            '];7.4;-1;True story of a transatlantic business correspondence about used books that developed into a close friendship.;['David Hugh Jones', None];['Anne Bancroft', 'Anthony Hopkins', 'Judi Dench', 'Jean De Baer']
33;Le journal d'Anne Frank;1959;Tous publics;180;['Biography', ' Drama', ' Family            '];7.4;59;During World War II, a teenage Jewish girl named Anne Frank and her family are forced into hiding in the Nazi-occupied Netherlands.;['George Stevens', None];['Millie Perkins', 'Shelley Winters', 'Joseph Schildkraut', 'Richard Beymer']
34;Le roi et moi;1956;Tous Public;133;['Biography', ' Drama', ' Musical            '];7.4;72;A widow accepts a job as a live-in governess to the King of Siam's children.;['Walter Lang', None];['Yul Brynner', 'Deborah Kerr', 'Rita Moreno', 'Martin Benson']
35;Le roi;I) (2019;16;140;['Biography', ' Drama', ' History            '];7.3;62;Hal, wayward prince and heir to the English throne, is crowned King Henry V after his tyrannical father dies. Now the young king must navigate palace politics, the war his father left behind, and the emotional strings of his past life.;['David Michôd', None];['Tom Glynn-Carney', 'Gábor Czap', 'Tom Fisher', 'Edward Ashley']
36;La Voix du pardon;2018;Tous publics;110;['Biography', ' Drama', ' Family            '];7.3;30;The inspiring and unknown true story behind MercyMe's beloved, chart topping song that brings ultimate hope to so many is a gripping reminder of the power of true forgiveness.;['    Directors:', 'Andrew Erwin, ', 'Jon Erwin', None];['J. Michael Finley', 'Madeline Carroll', 'Dennis Quaid', 'Trace Adkins']
37;The Banker;2020;Tous publics;120;['Biography', ' Drama            '];7.3;59;In the 1960s two African-American entrepreneurs hire a working-class white man to pretend to be the head of their business empire while they pose as a janitor and chauffeur.;['George Nolfi', None];['Anthony Mackie', 'Samuel L. Jackson', 'Nicholas Hoult', 'Nia Long']
38;Official Secrets;2019;Tous publics;112;['Biography', ' Crime', ' Drama            '];7.3;63;The true story of a British whistleblower who leaked information to the press about an illegal NSA spy operation designed to push the UN Security Council into sanctioning the 2003 invasion of Iraq.;['Gavin Hood', None];['Keira Knightley', 'Matt Smith', 'Matthew Goode', 'Rhys Ifans']
39;Marshall: La vérité sur l'affaire Spell;2017;10;118;['Biography', ' Crime', ' Drama            '];7.3;66;The story of Thurgood Marshall, the crusading lawyer who would become the first African-American Supreme Court Justice, as he battles through one of his career-defining cases.;['Reginald Hudlin', None];['Chadwick Boseman', 'Josh Gad', 'Kate Hudson', 'Sterling K. Brown']
40;The Best of Enemies;2019;PG-13;133;['Biography', ' Drama', ' History            '];7.3;49;Civil rights activist Ann Atwater faces off against C.P. Ellis, Exalted Cyclops of the Ku Klux Klan, in 1971 Durham, North Carolina over the issue of school integration.;['Robin Bissell', None];['Taraji P. Henson', 'Sam Rockwell', 'Babou Ceesay', 'Anne Heche']
41;Snowden;2016;Tous publics;134;['Biography', ' Crime', ' Drama            '];7.3;58;The NSA's illegal surveillance techniques are leaked to the public by one of the agency's employees, Edward Snowden, in the form of thousands of classified documents distributed to the press.;['Oliver Stone', None];['Joseph Gordon-Levitt', 'Shailene Woodley', 'Melissa Leo', 'Zachary Quinto']
42;Un chat pour la vie;2016;NaN;103;['Biography', ' Drama', ' Family            '];7.3;54;The true feel-good story of how James Bowen, a busker and recovering drug addict, has his life transformed when he meets a stray ginger cat. Based on the international best selling book.;['Roger Spottiswoode', None];['Luke Treadaway', 'Bob the Cat', 'Ruta Gedmintas', 'Joanne Froggatt']
43;The Disaster Artist;2017;Tous publics;104;['Biography', ' Comedy', ' Drama            '];7.3;76;When Greg Sestero, an aspiring film actor, meets the weird and mysterious Tommy Wiseau in an acting class, they form a unique friendship and travel to Hollywood to make their dreams come true.;['James Franco', None];['James Franco', 'Dave Franco', 'Ari Graynor', 'Seth Rogen']
44;The Walk: Rêver plus haut;II) (2015;Tous publics;123;['Adventure', ' Biography', ' Drama            '];7.3;70;In 1974, high-wire artist Philippe Petit recruits a team of people to help him realize his dream: to walk the immense void between the World Trade Center towers.;['Robert Zemeckis', None];['Joseph Gordon-Levitt', 'Charlotte Le Bon', 'Guillaume Baillargeon', 'Émilie Leclerc']
45;La femme au tableau;2015;Tous Public;109;['Biography', ' Drama', ' History            '];7.3;51;Maria Altmann, an octogenarian Jewish refugee, takes on the Austrian government to recover artwork she believes rightfully belongs to her family.;['Simon Curtis', None];['Helen Mirren', 'Ryan Reynolds', 'Daniel Brühl', 'Katie Holmes']
46;Belle;2013;Tous publics;100;['Biography', ' Drama', ' Romance            '];7.3;64;The biracial daughter, Dido Elizabeth Belle (Gugu Mbatha-Raw), of Royal Navy Captain Sir John Lindsay (Matthew Goode) is raised by aristocratic Great-uncle Lord William Murray, 1st Earl of Mansfield (Tom Wilkinson) in 18th century England.;['Amma Asante', None];['Gugu Mbatha-Raw', 'Matthew Goode', 'Emily Watson', 'Miranda Richardson']
47;American Sniper;2014;Tous publics avec avertissement;133;['Action', ' Biography', ' Drama            '];7.3;72;Navy S.E.A.L. sniper Chris Kyle's pinpoint accuracy saves countless lives on the battlefield and turns him into a legend. Back home with his family after four tours of duty, however, Chris finds that it is the war he can't leave behind.;['Clint Eastwood', None];['Bradley Cooper', 'Sienna Miller', 'Kyle Gallner', 'Cole Konis']
48;Rocketman;I) (2019;Tous publics;121;['Biography', ' Drama', ' Musical            '];7.3;69;A musical fantasy about the fantastical human story of Elton John's breakthrough years.;['Dexter Fletcher', None];['Taron Egerton', 'Jamie Bell', 'Richard Madden', 'Bryce Dallas Howard']
49;Belfast;2021;Tous publics;98;['Biography', ' Drama            '];7.3;75;A young boy and his working-class Belfast family experience the tumultuous late 1960s.;['Kenneth Branagh', None];['Jude Hill', 'Lewis McAskie', 'Caitríona Balfe', 'Jamie Dornan']
0;My Beautiful Boy;I) (2018;Tous publics avec avertissement;120;['Biography', ' Drama            '];7.3;62;Based on the best-selling pair of memoirs from father and son David and Nic Sheff, Beautiful Boy chronicles the heartbreaking and inspiring experience of survival, relapse and recovery in a family coping with addiction over many years.;['Felix van Groeningen', None];['Steve Carell', 'Maura Tierney', 'Jack Dylan Grazer', 'Oakley Bull']
1;First Man: Le Premier Homme sur la Lune;2018;Tous publics;141;['Biography', ' Drama', ' History            '];7.3;84;A look at the life of the astronaut, Neil Armstrong, and the legendary space mission that led him to become the first man to walk on the Moon on July 20, 1969.;['Damien Chazelle', None];['Ryan Gosling', 'Claire Foy', 'Jason Clarke', 'Kyle Chandler']
2;Eddie the Eagle;2015;Tous publics;106;['Adventure', ' Biography', ' Comedy            '];7.3;54;The story of Eddie Edwards, the notoriously tenacious British underdog ski jumper who charmed the world at the 1988 Winter Olympics.;['Dexter Fletcher', None];['Taron Egerton', 'Hugh Jackman', 'Tom Costello', 'Jo Hartley']
3;Invictus;2009;Tous publics;134;['Action', ' Biography', ' Drama            '];7.3;74;Nelson Mandela, in his first term as President of South Africa, initiates a unique venture to unite the Apartheid-torn land: enlist the national rugby team on a mission to win the 1995 Rugby World Cup.;['Clint Eastwood', None];['Morgan Freeman', 'Matt Damon', 'Tony Kgoroge', 'Patrick Mofokeng']
4;Fleur du désert;2009;Tous publics;120;['Biography', ' Drama            '];7.3;54;Waris Dirie, born 1965 in Somalia, flees at 13 when sold as 4th wife. She's maid at the Somalian embassy in London, then McDonald's, where she's discovered and becomes int'l top model. 1997, she speaks up against female genital mutilation.;['Sherry Hormann', None];['Soraya Omar-Scego', 'Idriss Abdillahi Houfaneh', 'Awa Saïd Darar', 'Roun Daher Aïnan']
5;Max Manus;2008;NaN;118;['Action', ' Biography', ' Drama            '];7.3;60;The true story about one of the most brilliant saboteurs during World War II and his battle to overcome his inner demons.;['    Directors:', 'Joachim Rønning, ', 'Espen Sandberg', None];['Aksel Hennie', 'Agnes Kittelsen', 'Nicolai Cleve Broch', 'Ken Duken']
6;Il divo;2008;Tous publics;110;['Biography', ' Drama            '];7.3;81;The story of Italian politician Giulio Andreotti, who has served as Prime Minister of Italy seven times since the restoration of democracy in 1946.;['Paolo Sorrentino', None];['Toni Servillo', 'Anna Bonaiuto', 'Giulio Bosetti', 'Flavio Bucci']
7;Red Dog;2011;Tous Public;92;['Biography', ' Comedy', ' Drama            '];7.3;-1;Based on the legendary true story of the Red Dog who united a disparate local community while roaming the Australian outback in search of his long lost master.;['Kriv Stenders', None];['Josh Lucas', 'Rachael Taylor', 'Rohan Nichol', 'Luke Ford']
8;La bande à Baader;2008;Tous publics;150;['Action', ' Biography', ' Crime            '];7.3;76;A look at Germany's terrorist group, The Red Army Faction (RAF), which organized bombings, robberies, kidnappings, and assassinations in the late 1960s and '70s.;['Uli Edel', None];['Martina Gedeck', 'Moritz Bleibtreu', 'Johanna Wokalek', 'Bruno Ganz']
9;Rescue Dawn;2006;Tous Public;120;['Adventure', ' Biography', ' War            '];7.3;77;A U.S. fighter pilot's epic struggle of survival after being shot down on a mission over Laos during the Vietnam War.;['Werner Herzog', None];['Christian Bale', 'Steve Zahn', 'Jeremy Davies', 'Zach Grenier']
10;Lincoln;2012;Tous publics;150;['Biography', ' Drama', ' History            '];7.3;86;As the American Civil War continues to rage, America's president struggles with continuing carnage on the battlefield as he fights with many inside his own cabinet on the decision to emancipate the slaves.;['Steven Spielberg', None];['Daniel Day-Lewis', 'Sally Field', 'David Strathairn', 'Joseph Gordon-Levitt']
11;The Queen;2006;Tous publics;103;['Biography', ' Drama            '];7.3;91;After the death of Princess Diana, Queen Elizabeth II struggles with her reaction to a sequence of events nobody could have predicted.;['Stephen Frears', None];['Helen Mirren', 'Michael Sheen', 'James Cromwell', 'Alex Jennings']
12;Coach Carter;2005;Tous Public;136;['Biography', ' Drama', ' Sport            '];7.3;57;Controversy surrounds high school basketball coach Ken Carter after he benches his entire team for breaking their academic contract with him.;['Thomas Carter', None];"['Samuel L. Jackson', 'Rick Gonzalez', ""Robert Ri'chard"", 'Rob Brown']"
13;Frankie Wilde;2004;R;90;['Biography', ' Comedy', ' Drama            '];7.3;56;A famous DJ in the Ibiza club scene finds the alcohol and drug-fueled party that is his life threatened by the progressive loss of his hearing.;['Michael Dowse', None];['Paul Kaye', 'Beatriz Batarda', 'Kate Magowan', 'Mike Wilmot']
14;Truman Capote;2005;Tous publics;114;['Biography', ' Crime', ' Drama            '];7.3;88;In 1959, Truman Capote learns of the murder of a Kansas family and decides to write a book about the case. While researching for his novel In Cold Blood, Capote forms a relationship with one of the killers, Perry Smith, who is on death row.;['Bennett Miller', None];['Philip Seymour Hoffman', 'Clifton Collins Jr.', 'Catherine Keener', 'Allie Mickelson']
15;Monster;2003;12;109;['Biography', ' Crime', ' Drama            '];7.3;74;Based on the life of Aileen Wuornos, a Daytona Beach prostitute who became a serial killer.;['Patty Jenkins', None];['Charlize Theron', 'Christina Ricci', 'Bruce Dern', 'Lee Tergesen']
16;24 Hour Party People;2002;Tous publics;117;['Biography', ' Comedy', ' Drama            '];7.3;85;In 1976, Tony Wilson sets up Factory Records and brings Manchester's music to the world.;['Michael Winterbottom', None];['Steve Coogan', 'Lennie James', 'John Thomson', 'Nigel Pivaro']
17;Quills, la plume et le sang;2000;12;124;['Biography', ' Drama            '];7.3;70;In a Napoleonic era insane asylum, an inmate, the irrepressible Marquis De Sade, fights a battle of wills against a tyrannically prudish doctor.;['Philip Kaufman', None];['Geoffrey Rush', 'Kate Winslet', 'Joaquin Phoenix', 'Michael Caine']
18;Une vie volée;1999;Tous publics;127;['Biography', ' Drama            '];7.3;51;Based on writer Susanna Kaysen's account of her 18-month stay at a mental hospital in the late 1960s.;['James Mangold', None];['Winona Ryder', 'Angelina Jolie', 'Clea DuVall', 'Brittany Murphy']
19;Antwone Fisher;2002;PG-13;120;['Biography', ' Drama            '];7.3;62;Antwone Fisher, a young navy man, is forced to see a psychiatrist after a violent outburst against a fellow crewman. During the course of treatment a painful past is revealed and a new hope begins.;['Denzel Washington', None];['Denzel Washington', 'Derek Luke', 'Joy Bryant', 'Malcolm David Kelley']
20;Hilary and Jackie;1998;R;121;['Biography', ' Drama', ' Music            '];7.3;78;The tragic story of world renowned classic cellist Jacqueline du Pré, as told from the point of view of her sister, flautist Hilary du Pré-Finzi.;['Anand Tucker', None];['Emily Watson', 'Rachel Griffiths', 'James Frain', 'David Morrissey']
21;Les cendres d'Angela;1999;Tous publics;145;['Biography', ' Drama            '];7.3;54;"Based on the best-selling autobiography by Irish expatriate Frank McCourt, Angela's Ashes follows the experiences of young Frankie and his family as they try against all odds to escape the ...                See full summary »
";['Alan Parker', None];['Emily Watson', 'Robert Carlyle', 'Joe Breen', 'Ciaran Owens']
22;Frida;2002;Tous publics;123;['Biography', ' Drama', ' Romance            '];7.3;61;A biography of artist Frida Kahlo, who channeled the pain of a crippling injury and her tempestuous marriage into her work.;['Julie Taymor', None];['Salma Hayek', 'Alfred Molina', 'Geoffrey Rush', 'Mía Maestro']
