;name;year;certificate;runtime;genre;rating;metascore;text-muted;director;stars
49;Le retour de la momie;2001;Tous publics;130;['Action', ' Adventure', ' Fantasy            '];6.4;48;The mummified body of Imhotep is shipped to a museum in London, where he once again wakes and begins his campaign of rage and terror.;['Stephen Sommers', None];['Brendan Fraser', 'Rachel Weisz', 'John Hannah', 'Arnold Vosloo']
0;Ce que veulent les femmes;2000;Tous publics;127;['Comedy', ' Fantasy', ' Romance            '];6.4;47;A cocky, chauvinistic advertising executive magically acquires the ability to hear what women are thinking.;['Nancy Meyers', None];['Mel Gibson', 'Helen Hunt', 'Marisa Tomei', 'Alan Alda']
1;Final Fantasy: Les créatures de l'esprit;2001;Tous publics;106;['Animation', ' Action', ' Adventure            '];6.4;49;A scientist makes a last stand on Earth with the help of a ragtag team of soldiers against an invasion of alien phantoms.;['    Directors:', 'Hironobu Sakaguchi, ', 'Motonori Sakakibara', None];['Alec Baldwin', 'Steve Buscemi', 'Ming-Na Wen', 'Ving Rhames']
2;Le songe d'une nuit d'été;1999;Tous publics;116;['Comedy', ' Fantasy', ' Romance            '];6.4;61;Lovers' lives are complicated by city law, feuding faerie royalty, and... love.;['Michael Hoffman', None];['Kevin Kline', 'Michelle Pfeiffer', 'Rupert Everett', 'Stanley Tucci']
3;Dinosaure;2000;Tous publics;82;['Animation', ' Adventure', ' Drama            '];6.4;56;An orphaned dinosaur raised by lemurs joins an arduous trek to a sanctuary after a meteorite shower destroys his family home.;['    Directors:', 'Eric Leighton, ', 'Ralph Zondag', None];['D.B. Sweeney', 'Julianna Margulies', 'Samuel E. Wright', 'Alfre Woodard']
4;Phénomène;1996;Tous Public;123;['Drama', ' Fantasy', ' Romance            '];6.4;41;An ordinary man sees a bright light descend from the sky, and discovers he now has super-intelligence and telekinesis.;['Jon Turteltaub', None];['John Travolta', 'Kyra Sedgwick', 'Forest Whitaker', 'Robert Duvall']
5;Cœur de dragon;1996;Tous publics;103;['Action', ' Adventure', ' Fantasy            '];6.4;49;The last dragon and a disillusioned dragonslaying Knight must cooperate to stop an evil King, who was given partial immortality.;['Rob Cohen', None];['Dennis Quaid', 'Sean Connery', 'Dina Meyer', 'Pete Postlethwaite']
6;Dangereuse alliance;1996;12;101;['Drama', ' Fantasy', ' Horror            '];6.4;55;A newcomer to a Catholic prep high school falls in with a trio of outcast teenage girls who practice witchcraft, and they all soon conjure up various spells and curses against those who anger them.;['Andrew Fleming', None];['Robin Tunney', 'Fairuza Balk', 'Neve Campbell', 'Rachel True']
7;The Prophecy;1995;R;98;['Action', ' Crime', ' Drama            '];6.4;44;At the scene of a bizarre murder, L.A. homicide detective Thomas Dagget discovers a lethal heavenly prophecy now being fulfilled on earth. In his fight to stop the forces of evil, he finds an unlikely ally in an elementary school teacher.;['Gregory Widen', None];['Christopher Walken', 'Elias Koteas', 'Virginia Madsen', 'Eric Stoltz']
8;Freddy sort de la nuit;1994;12;112;['Fantasy', ' Horror', ' Mystery            '];6.4;64;A demonic force has chosen Freddy Krueger as its portal to the real world. Can Heather Langenkamp play the part of Nancy one last time and trap the evil trying to enter our world?;['Wes Craven', None];['Heather Langenkamp', 'Robert Englund', 'Jf Davis', 'Miko Hughes']
9;Le cygne et la princesse;1994;Tous publics;93;['Animation', ' Adventure', ' Comedy            '];6.4;70;A power-hungry sorcerer curses a princess to live as a swan by day in this tale of everlasting love.;['Richard Rich', None];['Jack Palance', 'Howard McGillin', 'Michelle Nicastro', 'Liz Callaway']
10;Last Action Hero;1993;Tous publics;130;['Action', ' Adventure', ' Comedy            '];6.4;44;With the help of a magic ticket, a young movie fan is transported into the fictional world of his favorite action movie character.;['John McTiernan', None];['Arnold Schwarzenegger', 'F. Murray Abraham', 'Art Carney', 'Charles Dance']
11;Monsieur Destinée;1990;NaN;116;['Comedy', ' Fantasy', ' Romance            '];6.4;34;Unhappy Larry Burrows sees what his life could've been like, had he made that winning home run as a teenager.;['James Orr', None];['Jim Belushi', 'Linda Hamilton', 'Michael Caine', 'Jon Lovitz']
12;Gremlins 2 : La Nouvelle Génération;1990;Tous publics;106;['Comedy', ' Fantasy', ' Horror            '];6.4;69;The Gremlins are back, and this time, they've taken control of a New York City media mogul's high-tech skyscraper.;['    Directors:', 'Joe Dante, ', 'Chuck Jones', None];['Zach Galligan', 'Phoebe Cates', 'Howie Mandel', 'Tony Randall']
13;Le ciel s'est trompé;1989;Tous Public;108;['Comedy', ' Fantasy', ' Romance            '];6.4;62;A reincarnated man unknowingly falls in love with his own daughter from his previous life. Once he realizes this, he tries to end their relationship before angels erase his memory.;['Emile Ardolino', None];"['Cybill Shepherd', 'Robert Downey Jr.', ""Ryan O'Neal"", 'Mary Stuart Masterson']"
14;Always - Pour toujours;1989;Tous publics;122;['Drama', ' Fantasy', ' Romance            '];6.4;50;The spirit of a recently deceased expert pilot mentors a newer pilot while watching him fall in love with the girlfriend that he left behind.;['Steven Spielberg', None];['Richard Dreyfuss', 'Holly Hunter', 'Brad Johnson', 'John Goodman']
15;L'emprise des ténèbres;1988;12;98;['Fantasy', ' Horror            '];6.4;64;An anthropologist goes to Haiti after hearing rumors about a drug used by black magic practitioners to turn people into zombies.;['Wes Craven', None];['Bill Pullman', 'Cathy Tyson', 'Zakes Mokae', 'Paul Winfield']
16;Phantasm II;1988;12;97;['Action', ' Fantasy', ' Horror            '];6.4;42;Mike, now released from a psychiatric hospital, meets with Reggie, and discover his dreams ( the events of the original film) are real, and they both journey to find and stop the evil Tall Man from his grim work.;['Don Coscarelli', None];['James Le Gros', 'Reggie Bannister', 'Angus Scrimm', 'Paula Irvine']
17;Peggy Sue s'est mariée;1986;Tous publics;103;['Comedy', ' Drama', ' Fantasy            '];6.4;75;Peggy Sue faints at a high school reunion. When she wakes up, she finds herself in her own past, just before she finished school.;['Francis Ford Coppola', None];['Kathleen Turner', 'Nicolas Cage', 'Barry Miller', 'Catherine Hicks']
18;Les Sorciers de la guerre;1977;Tous Public;82;['Animation', ' Adventure', ' Fantasy            '];6.4;-1;On a post-apocalyptic Earth, a wizard and his faire folk comrades fight an evil wizard who's using technology in his bid for conquest.;['Ralph Bakshi', None];['Bob Holt', 'Jesse Welles', 'Richard Romanus', 'David Proval']
19;Kate et Léopold;2001;Tous publics;118;['Comedy', ' Fantasy', ' Romance            '];6.4;44;An English Duke from 1876 is inadvertedly dragged to modern day New York where he falls for a plucky advertising executive.;['James Mangold', None];['Meg Ryan', 'Hugh Jackman', 'Liev Schreiber', 'Breckin Meyer']
20;Les Éternels;2021;Tous publics;156;['Action', ' Adventure', ' Fantasy            '];6.3;52;The saga of the Eternals, a race of immortal beings who lived on Earth and shaped its history and civilizations.;['Chloé Zhao', None];['Gemma Chan', 'Richard Madden', 'Angelina Jolie', 'Salma Hayek']
21;Voyage vers la Lune;2020;Tous publics;95;['Animation', ' Adventure', ' Comedy            '];6.3;60;In this animated musical, a girl builds a rocket ship and blasts off, hoping to meet a mythical moon goddess.;['    Directors:', 'Glen Keane, ', 'John Kahrs', None];['Glen Keane', 'Brycen Hall', 'Ruthie Ann Miles', 'John Cho']
22;Le bon apôtre;2018;Tous publics;130;['Drama', ' Fantasy', ' Horror            '];6.3;62;In 1905, a drifter on a dangerous mission to rescue his kidnapped sister tangles with a sinister religious cult on an isolated island.;['Gareth Evans', None];['Dan Stevens', 'Richard Elfyn', 'Paul Higgins', 'Bill Milner']
23;Bright;I) (2017;16;117;['Action', ' Fantasy', ' Thriller            '];6.3;29;A detective must work with an Orc to find a powerful wand before evil creatures do.;['David Ayer', None];['Will Smith', 'Joel Edgerton', 'Noomi Rapace', 'Edgar Ramírez']
24;Hotel Transylvanie 3: Des vacances monstrueuses;2018;Tous publics;97;['Animation', ' Adventure', ' Comedy            '];6.3;54;Count Dracula and company participate in a cruise for sea-loving monsters, unaware that their boat is being commandeered by the monster-hating Van Helsing family.;['Genndy Tartakovsky', None];['Adam Sandler', 'Andy Samberg', 'Selena Gomez', 'Kevin James']
25;Noelle;2019;G;100;['Adventure', ' Comedy', ' Family            '];6.3;48;Santa's daughter must take over the family business when her father retires and her brother, who is supposed to inherit the Santa role, gets cold feet.;['Marc Lawrence', None];['Anna Kendrick', 'Shirley MacLaine', 'Bill Hader', 'Kingsley Ben-Adir']
26;Injustice;2021;R;78;['Animation', ' Action', ' Adventure            '];6.3;-1;"On an alternate Earth, the Joker tricks Superman into killing Lois Lane, which causes a rampage in the hero. Superman decides to take control of Earth; Batman and his allies will have to attempt to stop him.";['Matt Peters', None];['Justin Hartley', 'Anson Mount', 'Laura Bailey', 'Zach Callison']
27;Baby Boss;2017;Tous publics;97;['Animation', ' Adventure', ' Comedy            '];6.3;50;A suit-wearing, briefcase-carrying baby pairs up with his 7-year old brother to stop the dastardly plot of the CEO of Puppy Co.;['Tom McGrath', None];['Alec Baldwin', 'Steve Buscemi', 'Jimmy Kimmel', 'Lisa Kudrow']
28;Dumbo;2019;Tous publics;112;['Adventure', ' Family', ' Fantasy            '];6.3;51;A young elephant, whose oversized ears enable him to fly, helps save a struggling circus, but when the circus plans a new venture, Dumbo and his friends discover dark secrets beneath its shiny veneer.;['Tim Burton', None];['Colin Farrell', 'Michael Keaton', 'Danny DeVito', 'Eva Green']
29;Le BGG : Le Bon Gros Géant;2016;Tous publics;117;['Adventure', ' Family', ' Fantasy            '];6.3;66;An orphan little girl befriends a benevolent giant who takes her to Giant Country, where they attempt to stop the man-eating giants that are invading the human world.;['Steven Spielberg', None];['Mark Rylance', 'Ruby Barnhill', 'Penelope Wilton', 'Jemaine Clement']
30;The Night Before - Secret Party;II) (2015;R;101;['Comedy', ' Fantasy            '];6.3;58;On Christmas Eve, three lifelong friends spend the night in New York City looking for the Holy Grail of Christmas parties.;['Jonathan Levine', None];['Joseph Gordon-Levitt', 'Seth Rogen', 'Jillian Bell', 'Lizzy Caplan']
31;Le Grinch;2018;Tous publics;85;['Animation', ' Comedy', ' Family            '];6.3;51;A grumpy Grinch plots to ruin Christmas for the village of Whoville.;['    Directors:', 'Yarrow Cheney, ', 'Scott Mosier', None];['Benedict Cumberbatch', 'Cameron Seely', 'Rashida Jones', 'Pharrell Williams']
32;He Never Died;2015;R;99;['Comedy', ' Drama', ' Fantasy            '];6.3;72;Jack, a social outcast, is thrust out of his comfort zone when the outside world bangs on his door and he can't contain his violent past.;['Jason Krawczyk', None];['Henry Rollins', 'Booboo Stewart', 'Kate Greenhouse', 'Jordan Todosey']
33;L'île des Miam-nimaux: Tempête de boulettes géantes 2;2013;Tous publics;95;['Animation', ' Adventure', ' Comedy            '];6.3;59;Flint Lockwood now works at The Live Corp Company for his idol Chester V. But he's forced to leave his post when he learns that his most infamous machine is still operational, and is churning out menacing food-animal hybrids.;['    Directors:', 'Cody Cameron, ', 'Kris Pearn', None];['Bill Hader', 'Anna Faris', 'Will Forte', 'Neil Patrick Harris']
34;The Brass Teapot;2012;R;101;['Comedy', ' Fantasy', ' Thriller            '];6.3;43;When a couple discovers that a brass teapot makes them money whenever they hurt themselves, they must come to terms with how far they are willing to go.;['Ramaa Mosley', None];['Juno Temple', 'Michael Angarano', 'Alexis Bledel', 'Billy Magnussen']
35;John Dies at the End;2012;R;99;['Comedy', ' Fantasy', ' Horror            '];6.3;53;A new street drug that sends its users across time and dimensions has one drawback: some people return no longer human. Can two college drop-outs save humanity from this silent, otherworldly invasion?;['Don Coscarelli', None];['Chase Williamson', 'Rob Mayes', 'Paul Giamatti', 'Clancy Brown']
36;Le monde fantastique d'Oz;2013;Tous publics;130;['Adventure', ' Family', ' Fantasy            '];6.3;44;A small-time magician is swept away to an enchanted land and is forced into a power struggle between three witches.;['Sam Raimi', None];['James Franco', 'Michelle Williams', 'Rachel Weisz', 'Mila Kunis']
37;The Voices;2014;12;103;['Comedy', ' Crime', ' Fantasy            '];6.3;58;A likable guy pursues his office crush with help from his evil talking pets, but things turn sinister when she stands him up for a date.;['Marjane Satrapi', None];['Ryan Reynolds', 'Gemma Arterton', 'Anna Kendrick', 'Jacki Weaver']
38;Underworld: Nouvelle Ère;2012;12;88;['Action', ' Fantasy', ' Horror            '];6.3;39;When human forces discover the existence of the Vampire and Lycan clans, a war to eradicate both species commences. The vampire warrior Selene leads the battle against humankind.;['    Directors:', 'Måns Mårlind, ', 'Björn Stein', None];['Kate Beckinsale', 'Michael Ealy', 'India Eisley', 'Stephen Rea']
39;Échange standard;2011;R;112;['Comedy', ' Fantasy            '];6.3;39;Dave is a married man with three kids and a loving wife, and Mitch is a single man who is at the prime of his sexual life. One fateful night while Mitch and Dave are peeing in a fountain, lightning strikes and they switch bodies.;['David Dobkin', None];['Jason Bateman', 'Ryan Reynolds', 'Olivia Wilde', 'Leslie Mann']
40;Upside Down;I) (2012;Tous publics;109;['Drama', ' Fantasy', ' Romance            '];6.3;45;Adam and Eden fell in love as teens despite the fact that they live on twinned worlds with gravities that pull in opposite directions. Ten years after a forced separation, Adam sets out on a dangerous quest to reconnect with his love.;['Juan Solanas', None];['Jim Sturgess', 'Kirsten Dunst', 'Timothy Spall', 'Blu Mankuma']
41;Tomb Raider;2018;Tous publics;119;['Action', ' Adventure', ' Fantasy            '];6.3;48;Lara Croft (Alicia Vikander), the fiercely independent daughter of a missing adventurer, must push herself beyond her limits when she discovers the island where her father, Lord Richard Croft (Dominic West) disappeared.;['Roar Uthaug', None];['Alicia Vikander', 'Dominic West', 'Walton Goggins', 'Daniel Wu']
42;Jack le chasseur de géants;2013;Tous publics;114;['Action', ' Adventure', ' Fantasy            '];6.3;51;The ancient war between humans and a race of giants is reignited when Jack, a young farmhand fighting for a kingdom and the love of a princess, opens a gateway between the two worlds.;['Bryan Singer', None];['Nicholas Hoult', 'Stanley Tucci', 'Ewan McGregor', 'Bill Nighy']
43;The Revenants;I) (2009;R;117;['Comedy', ' Fantasy', ' Horror            '];6.3;57;In Los Angeles, a fallen soldier who has joined the ranks of the living dead reunites with his best friend in order to deal with the city's drug dealers and killers - a perfect way to collect the blood that one of them so desperately needs.;['D. Kerry Prior', None];['David Anders', 'Chris Wylde', 'Louise Griffiths', 'Jacy King']
44;L'homme qui tua Don Quichotte;2018;Tous publics;132;['Adventure', ' Comedy', ' Drama            '];6.3;58;Toby, a disillusioned film director, is pulled into a world of time-jumping fantasy when a Spanish cobbler believes himself to be Sancho Panza. He gradually becomes unable to tell dreams from reality.;['Terry Gilliam', None];['José Luis Ferrer', 'Ismael Fritschi', 'Juan López-Tagle', 'Adam Driver']
45;Dead Snow;2009;16;92;['Comedy', ' Fantasy', ' Horror            '];6.3;61;A ski vacation turns horrific for a group of medical students, as they find themselves confronted by an unimaginable menace: Nazi zombies.;['Tommy Wirkola', None];['Jeppe Beck Laursen', 'Charlotte Frogner', 'Jenny Skavlan', 'Geir Vegar Hoel']
46;Les aventures extraordinaires d'Adèle Blanc-Sec;2010;Tous publics;107;['Action', ' Adventure', ' Comedy            '];6.3;-1;An adventure set in the early part of the 20th century and focused on a popular novelist and her dealings with would-be suitors, the cops, monsters, and other distractions.;['Luc Besson', None];['Louise Bourgoin', 'Mathieu Amalric', 'Gilles Lellouche', 'Jean-Paul Rouve']
47;The Invention of Lying;2009;Tous publics;100;['Comedy', ' Fantasy', ' Romance            '];6.3;58;A comedy set in a world where no one has ever lied, until a writer seizes the opportunity for personal gain.;['    Directors:', 'Ricky Gervais, ', 'Matthew Robinson', None];['Ricky Gervais', 'Jennifer Garner', 'Jonah Hill', 'Louis C.K.']
48;Chair de Poule - Le Film;2015;Tous publics;103;['Adventure', ' Comedy', ' Fantasy            '];6.3;60;A teenager teams up with the daughter of young adult horror author R. L. Stine after the writer's imaginary demons are set free on the town of Madison, Delaware.;['Rob Letterman', None];['Jack Black', 'Dylan Minnette', 'Odeya Rush', 'Ryan Lee']
49;Le Monde de Narnia : L'Odyssée du Passeur d'Aurore;2010;Tous publics;113;['Adventure', ' Family', ' Fantasy            '];6.3;53;Lucy and Edmund Pevensie return to Narnia with their cousin Eustace where they meet up with Prince Caspian for a trip across the sea aboard the royal ship The Dawn Treader. Along the way they encounter dragons, dwarves, merfolk, and a band of lost warriors before reaching the edge of the world.;['Michael Apted', None];['Ben Barnes', 'Skandar Keynes', 'Georgie Henley', 'Will Poulter']
0;Shrek 4 : Il était une fin;2010;Tous publics;95;['Animation', ' Adventure', ' Comedy            '];6.3;58;Rumpelstiltskin tricks a mid-life crisis burdened Shrek into allowing himself to be erased from existence and cast in a dark alternate timeline where Rumpelstiltskin rules supreme.;['Mike Mitchell', None];['Mike Myers', 'Cameron Diaz', 'Eddie Murphy', 'Antonio Banderas']
1;Les Intrus;2009;Tous publics avec avertissement;87;['Drama', ' Fantasy', ' Horror            '];6.3;43;Anna returns home after a stint in a mental hospital, but her recovery is jeopardized by her cruel stepmother and ghastly visions of her dead mother.;['    Directors:', 'Charles Guard, ', 'Thomas Guard', None];['Emily Browning', 'Arielle Kebbel', 'Elizabeth Banks', 'David Strathairn']
2;La vie devant ses yeux;2007;R;90;['Drama', ' Fantasy', ' Mystery            '];6.3;38;A woman's survivor's guilt from a Columbine-like event twenty years ago causes her present-day idyllic life to fall apart.;['Vadim Perelman', None];['Uma Thurman', 'Evan Rachel Wood', 'Eva Amurri', 'Gabrielle Brennan']
3;Les contes de Terremer;2006;Tous publics;115;['Animation', ' Adventure', ' Fantasy            '];6.3;47;In a mythical land, a man and a young boy investigate a series of unusual occurrences.;['Gorô Miyazaki', None];"['Timothy Dalton', 'Willem Dafoe', 'Mariska Hargitay', ""Jun'ichi Okada""]"
4;La légende de Beowulf;2007;Tous publics;115;['Animation', ' Action', ' Adventure            '];6.3;59;The warrior Beowulf must fight and defeat the monster Grendel, who is terrorizing Denmark, then Grendel's Mother, who begins killing out of revenge.;['Robert Zemeckis', None];['Ray Winstone', 'Crispin Glover', 'Angelina Jolie', 'Robin Wright']
5;Le petit monde de Charlotte;2006;Tous Public;97;['Adventure', ' Comedy', ' Family            '];6.3;68;Wilbur the pig is scared of the end of the season, because he knows that come that time, he will end up on the dinner table. He hatches a plan with Charlotte, a spider that lives in his pen, to ensure that this will never happen.;['Gary Winick', None];['Dakota Fanning', 'Julia Roberts', 'Oprah Winfrey', 'Steve Buscemi']
6;Tideland;2005;12;120;['Drama', ' Fantasy', ' Horror            '];6.3;26;Because of the actions of her irresponsible parents, a young girl is left alone on a decrepit country estate and survives inside her fantastic imagination.;['Terry Gilliam', None];['Jeff Bridges', 'Jennifer Tilly', 'Jodelle Ferland', 'Janet McTeer']
7;Astro Boy;2009;Tous Public;94;['Animation', ' Action', ' Adventure            '];6.3;53;When an android replica of a boy is rejected by his aggrieved creator, he goes off to find his own identity in an adventure that would make him the greatest hero of his time.;['David Bowers', None];['Freddie Highmore', 'Nicolas Cage', 'Kristen Bell', 'Charlize Theron']
8;Ella au pays enchanté;2004;Tous Public;96;['Comedy', ' Family', ' Fantasy            '];6.3;53;Ella is under a spell to be constantly obedient, a fact she must hide from her new stepfamily in order to protect the prince of the land, her friend for whom she's falling.;"[""Tommy O'Haver"", None]";['Anne Hathaway', 'Hugh Dancy', 'Cary Elwes', 'Joanna Lumley']
9;Freaky friday - Dans la peau de ma mère;2003;Tous Public;97;['Comedy', ' Family', ' Fantasy            '];6.3;70;An overworked mother and her daughter do not get along. When they switch bodies, each is forced to adapt to the other's life for one freaky Friday.;['Mark Waters', None];['Jamie Lee Curtis', 'Lindsay Lohan', 'Mark Harmon', 'Harold Gould']
10;Versus l'ultime guerrier;II) (2000;16;119;['Action', ' Drama', ' Fantasy            '];6.3;-1;There are 666 portals that connect this world to the other side. These are concealed from all human beings. Somewhere in Japan exists the 444th portal.... The forest of resurrection.;['Ryûhei Kitamura', None];['Tak Sakaguchi', 'Hideo Sakaki', 'Chieko Misaka', 'Kenji Matsuda']
11;Osmosis Jones;2001;Tous publics;95;['Animation', ' Action', ' Adventure            '];6.3;57;A policeman white blood cell, with the help of a cold pill, must stop a deadly virus from destroying the human they live in, Frank.;['    Directors:', 'Bobby Farrelly, ', 'Peter Farrelly', None];['Laurence Fishburne', 'Chris Rock', 'David Hyde Pierce', 'Brandy Norwood']
12;Une vie moins ordinaire;1997;Tous publics;103;['Comedy', ' Crime', ' Fantasy            '];6.3;35;Upon being fired, a desperate guy kidnaps a daughter of his former boss. Two angels are sent to Earth to check if love is possible in this case.;['Danny Boyle', None];['Cameron Diaz', 'Ewan McGregor', 'Holly Hunter', 'Delroy Lindo']
13;Les folles aventures de Bill et Ted;1991;Tous Public;93;['Adventure', ' Comedy', ' Fantasy            '];6.3;60;A tyrant from the future creates evil android doubles of Bill and Ted and sends them back to eliminate the originals.;['Peter Hewitt', None];['Keanu Reeves', 'Alex Winter', 'William Sadler', 'Joss Ackland']
14;Legend;1985;Tous publics;94;['Adventure', ' Fantasy', ' Romance            '];6.3;30;A young man must stop the Lord of Darkness from destroying daylight and marrying the woman he loves.;['Ridley Scott', None];['Tom Cruise', 'Mia Sara', 'Tim Curry', 'David Bennent']
15;Taram et le Chaudron magique;1985;Tous publics;80;['Animation', ' Action', ' Adventure            '];6.3;59;A young boy and a group of misfit friends embark on a quest to find a dark magic item of ultimate power before a diabolical tyrant can.;['    Directors:', 'Ted Berman, ', 'Richard Rich', None];['Grant Bardsley', 'Freddie Jones', 'Susan Sheridan', 'Nigel Hawthorne']
16;Splash;1983;Tous publics;111;['Comedy', ' Fantasy', ' Romance            '];6.3;71;A young man is reunited with a mermaid who saved him from drowning as a boy. He falls in love with her, not knowing who or what she is.;['Ron Howard', None];['Tom Hanks', 'Daryl Hannah', 'Eugene Levy', 'John Candy']
17;Peter et Elliott le dragon;1977;Tous publics;128;['Animation', ' Adventure', ' Comedy            '];6.3;46;An orphan boy and his magical dragon come to town with his abusive adoptive parents in pursuit.;['    Directors:', 'Don Chaffey, ', 'Don Bluth', None];['Sean Marshall', 'Helen Reddy', 'Jim Dale', 'Mickey Rooney']
18;Un vendredi dingue, dingue, dingue;1976;Tous Public;95;['Comedy', ' Family', ' Fantasy            '];6.3;51;A mother and daughter find their personalities switched and have to live each other's lives on one strange Friday.;['Gary Nelson', None];['Barbara Harris', 'Jodie Foster', 'John Astin', 'Patsy Kelly']
19;La montagne ensorcelée;1975;Tous publics;97;['Adventure', ' Family', ' Fantasy            '];6.3;60;Two mysterious orphan children have extraordinary powers and are chased by a scheming millionaire. But where do these kids really call home?;['John Hough', None];['Eddie Albert', 'Ray Milland', 'Donald Pleasence', 'Kim Richards']
20;Les trois caballeros;1944;Tous Public;71;['Animation', ' Comedy', ' Family            '];6.3;85;Donald receives his birthday gifts, which include traditional gifts and information about Brazil (hosted by Zé Carioca) and Mexico (by Panchito, a Mexican Charro Rooster).;['    Directors:', 'Norman Ferguson, ', 'Clyde Geronimi, ', 'Jack Kinney, ', 'Bill Roberts, ', 'Harold Young', None];['Aurora Miranda', 'Carmen Molina', 'Dora Luz', 'Sterling Holloway']
21;Eight for Silver;2021;R;111;['Fantasy', ' Horror', ' Mystery            '];6.2;62;In rural 19th-century France, a mysterious, possibly supernatural menace threatens a small village. John McBride, a pathologist, comes to town to investigate the danger - and exorcise some of his own demons in the process.;['Sean Ellis', None];['Boyd Holbrook', 'Kelly Reilly', 'Alistair Petrie', 'Roxane Duran']
