;name;year;certificate;runtime;genre;rating;metascore;text-muted;director;stars
49;Salyut-7;2017;Tous publics;111;['Action', ' Drama', ' History            '];7.2;-1;USSR, June 1985. Based on actual events. After contact with the Salyut 7 space station is lost, cosmonauts Vladimir Dzhanibekov and Viktor Savinykh dock with the empty, frozen craft, and bring her back to life.;['Klim Shipenko', None];['Vladimir Vdovichenkov', 'Pavel Derevyanko', 'Aleksandr Samoylenko', 'Mariya Mironova']
0;Pentagon Papers;2017;Tous publics;116;['Biography', ' Drama', ' History            '];7.2;83;A cover-up spanning four U.S. Presidents pushes the country's first female newspaper publisher and her editor to join an unprecedented battle between press and government.;['Steven Spielberg', None];['Meryl Streep', 'Tom Hanks', 'Sarah Paulson', 'Bob Odenkirk']
1;The Professor and the Madman;2019;NaN;124;['Biography', ' Drama', ' History            '];7.2;27;Professor James Murray begins work compiling words for the first edition of the Oxford English Dictionary in the mid-19th century, and receives over 10,000 entries from a patient at Broadmoor Criminal Lunatic Asylum, Dr. William Minor.;['Farhad Safinia', None];['Mel Gibson', 'Sean Penn', 'Eddie Marsan', 'Natalie Dormer']
2;La mort de Staline;2017;Tous publics;107;['Comedy', ' Drama', ' History            '];7.2;88;Moscow, 1953. After being in power for nearly 30 years, Soviet dictator Joseph Vissarionovich Stalin takes ill and quickly dies. Now the members of the Council of Ministers scramble for power.;['Armando Iannucci', None];['Steve Buscemi', 'Simon Russell Beale', 'Jeffrey Tambor', 'Andrea Riseborough']
3;Opération Anthropoid;2016;R;120;['Action', ' Biography', ' Drama            '];7.2;59;Based on the extraordinary true story of Operation Anthropoid, the WWII mission to assassinate SS General Reinhard Heydrich, the main architect behind the Final Solution and the Reich's third in command after Hitler and Himmler.;['Sean Ellis', None];['Jamie Dornan', 'Cillian Murphy', 'Brian Caspe', 'Karel Hermánek Jr.']
4;The Siege of Jadotville;2016;NaN;108;['Action', ' Drama', ' History            '];7.2;-1;Irish Commandant Pat Quinlan leads a stand off with troops against French and Belgian Mercenaries in the Congo during the early 1960s.;['Richie Smyth', None];['Richard Lukunku', 'Danny Sapani', 'Andrew Stock', 'Mark Strong']
5;Stan et Ollie;2018;Tous publics;98;['Biography', ' Comedy', ' Drama            '];7.2;75;Laurel and Hardy, the world's most famous comedy duo, attempt to reignite their film careers as they embark on what becomes their swan song: a grueling theatre tour of post-war Britain.;['Jon S. Baird', None];['Steve Coogan', 'John C. Reilly', 'Shirley Henderson', 'Nina Arianda']
6;Spare Parts;I) (2015;PG-13;114;['Biography', ' Drama', ' History            '];7.2;50;Four Mexican high school students form a robotics club. With no experience, 800 bucks, used car parts and a dream, this rag tag team goes up against the country's reigning robotics champion, MIT.;['Sean McNamara', None];['George Lopez', 'Jamie Lee Curtis', 'Carlos PenaVega', 'Marisa Tomei']
7;L'Oracle;2013;Tous publics;155;['Adventure', ' Drama', ' History            '];7.2;-1;In 11th-century Persia, a surgeon's apprentice disguises himself as a Jew to study at a school that does not admit Christians.;['Philipp Stölzl', None];['Tom Payne', 'Stellan Skarsgård', 'Olivier Martinez', 'Emma Catherine Rigby']
8;Kon-Tiki;2012;Tous publics;118;['Action', ' Adventure', ' Biography            '];7.2;62;Legendary explorer Thor Heyerdahl's epic 4,300-mile crossing of the Pacific on a balsawood raft in 1947, in an effort to prove that it was possible for South Americans to settle in Polynesia in pre-Columbian times.;['    Directors:', 'Joachim Rønning, ', 'Espen Sandberg', None];['Pål Sverre Hagen', 'Anders Baasmo', 'Gustaf Skarsgård', 'Odd-Magnus Williamson']
9;Cheval de guerre;2011;Tous publics;146;['Action', ' Adventure', ' Drama            '];7.2;72;Young Albert enlists to serve in World War I after his beloved horse is sold to the cavalry. Albert's hopeful journey takes him out of England and to the front lines as the war rages on.;['Steven Spielberg', None];['Jeremy Irvine', 'Emily Watson', 'David Thewlis', 'Benedict Cumberbatch']
10;Mémoires de jeunesse;2014;Tous publics;129;['Biography', ' Drama', ' History            '];7.2;76;A British woman recalls coming of age during World War I - a story of young love, the futility of war, and how to make sense of the darkest times.;['James Kent', None];['Alicia Vikander', 'Kit Harington', 'Taron Egerton', 'Dominic West']
11;Polytechnique;2009;NaN;77;['Crime', ' Drama', ' History            '];7.2;63;A dramatization of the 1989 Montréal Massacre, during which several female engineering students were murdered by an unstable misogynist.;['Denis Villeneuve', None];['Maxim Gaudette', 'Sébastien Huberdeau', 'Karine Vanasse', 'Martin Watier']
12;Secrétariat;2010;Tous publics;123;['Biography', ' Drama', ' Family            '];7.2;61;Penny Chenery Tweedy and colleagues guide her long-shot but precocious stallion to set, in 1973, the unbeaten record for winning the Triple Crown.;['Randall Wallace', None];['Diane Lane', 'John Malkovich', 'Margo Martindale', 'Nelsan Ellis']
13;Victoria - Les jeunes années d'une reine;2009;Tous Public;105;['Biography', ' Drama', ' History            '];7.2;64;A dramatization of the turbulent first years of Queen Victoria's rule, and her enduring romance with Prince Albert.;['Jean-Marc Vallée', None];['Emily Blunt', 'Rupert Friend', 'Paul Bettany', 'Miranda Richardson']
14;Che - 1ère partie - L'Argentin;2008;Tous publics;134;['Biography', ' Drama', ' History            '];7.2;-1;In 1956, Ernesto 'Che' Guevara and a band of Castro-led Cuban exiles mobilize an army to topple the regime of dictator Fulgencio Batista.;['Steven Soderbergh', None];['Julia Ormond', 'Benicio Del Toro', 'Oscar Isaac', 'Pablo Guevara']
15;Le mystificateur;2003;Tous publics;94;['Drama', ' History            '];7.2;73;The story of a young journalist who fell from grace when it was discovered he fabricated over half of his articles from the publication The New Republic magazine.;['Billy Ray', None];['Hayden Christensen', 'Chloë Sevigny', 'Steve Zahn', 'Peter Sarsgaard']
16;Kingdom of Heaven;2005;Tous publics;144;['Action', ' Adventure', ' Drama            '];7.2;63;Balian of Ibelin travels to Jerusalem during the Crusades of the 12th century, and there he finds himself as the defender of the city and its people.;['Ridley Scott', None];['Orlando Bloom', 'Eva Green', 'Liam Neeson', 'Martin Hancock']
17;The Dish;2000;Tous publics;101;['Comedy', ' Drama', ' History            '];7.2;74;A remote Australian community, populated by quirky characters, plays a key role in the first Apollo moon landing.;['Rob Sitch', None];['Sam Neill', 'Billy Mitchell', 'Roz Hammond', 'Christopher-Robin Street']
18;The Patriot : Le Chemin de la liberté;2000;Tous publics avec avertissement;165;['Action', ' Drama', ' History            '];7.2;63;Peaceful farmer Benjamin Martin is driven to lead the Colonial Militia during the American Revolution when a sadistic British officer murders his son.;['Roland Emmerich', None];['Mel Gibson', 'Heath Ledger', 'Joely Richardson', 'Jason Isaacs']
19;Retour à Cold Mountain;2003;Tous publics;154;['Adventure', ' Drama', ' History            '];7.2;73;In the waning days of the American Civil War, a wounded soldier embarks on a perilous journey back home to Cold Mountain, North Carolina to reunite with his sweetheart.;['Anthony Minghella', None];['Jude Law', 'Nicole Kidman', 'Renée Zellweger', 'Eileen Atkins']
20;La dame de Windsor;1997;Tous publics;101;['Biography', ' Drama', ' History            '];7.2;71;When Queen Victoria's husband Prince Albert dies, she finds solace in her trusted servant, Mr. John Brown, but their relationship also brings scandal and turmoil.;['John Madden', None];['Judi Dench', 'Billy Connolly', 'Geoffrey Palmer', 'Antony Sher']
21;La folie du roi George;1994;Tous Public;110;['Biography', ' Comedy', ' Drama            '];7.2;89;When King George III goes mad, his Lieutenants try to adjust the rules to run the country without his participation.;['Nicholas Hytner', None];['Nigel Hawthorne', 'Helen Mirren', 'Rupert Graves', 'Amanda Donohoe']
22;Il était une fois en Chine;1991;Tous publics;134;['Action', ' Adventure', ' Drama            '];7.2;-1;Legendary martial arts hero Wong Fei-Hung fights against foreign forces' plundering of China. When Aunt Yee arrives back from America, Wong Fei-Hung assumes the role of her protector.;['Hark Tsui', None];['Jet Li', 'Rosamund Kwan', 'Biao Yuen', 'Jacky Cheung']
23;Les coulisses de l'exploit;1988;Tous publics;119;['Drama', ' History', ' Sport            '];7.2;71;A dramatization of the Black Sox scandal when the underpaid Chicago White Sox accepted bribes to deliberately lose the 1919 World Series.;['John Sayles', None];['John Cusack', 'Clifton James', 'Jace Alexander', 'Gordon Clapp']
24;Waterloo;I) (1970;Tous Public;134;['Action', ' Biography', ' Drama            '];7.2;-1;Facing the decline of everything he has worked to obtain, conqueror Napoleon Bonaparte and his army confront the British at the Battle of Waterloo.;['Sergey Bondarchuk', None];['Rod Steiger', 'Christopher Plummer', 'Orson Welles', 'Jack Hawkins']
25;Les Révoltés du Bounty;1962;Tous publics;178;['Adventure', ' Drama', ' History            '];7.2;48;In 1787, British ship Bounty leaves Portsmouth to bring a cargo of bread-fruit from Tahiti but the savage on-board conditions imposed by Captain Bligh trigger a mutiny led by officer Fletcher Christian.;['    Directors:', 'Lewis Milestone, ', 'Carol Reed', None];['Marlon Brando', 'Trevor Howard', 'Richard Harris', 'Hugh Griffith']
26;Le Cid;1961;Tous publics;182;['Biography', ' Drama', ' History            '];7.2;79;The fabled Spanish hero Rodrigo Diaz de Vivar (a.k.a. El Cid) overcomes a family vendetta and court intrigue to defend Christian Spain against the Moors.;['Anthony Mann', None];['Charlton Heston', 'Sophia Loren', 'Raf Vallone', 'Geneviève Page']
27;Jules César;1953;Tous Public;120;['Drama', ' History            '];7.2;-1;The growing ambition of Julius Caesar is a source of major concern to his close friend Brutus. Cassius persuades him to participate in his plot to assassinate Caesar but they have both sorely underestimated Mark Antony.;['Joseph L. Mankiewicz', None];['Louis Calhern', 'Marlon Brando', 'James Mason', 'John Gielgud']
28;Un espion ordinaire;2020;Tous publics;112;['Drama', ' History', ' Thriller            '];7.1;65;Businessman Greville Wynne is asked by a Russian source to try to help put an end to the Cuban Missile Crisis.;['Dominic Cooke', None];['Benedict Cumberbatch', 'Merab Ninidze', 'Rachel Brosnahan', 'Vladimir Chuprikov']
29;The Age of Shadows;2016;12;140;['Action', ' History', ' Thriller            '];7.1;78;Korean resistance fighters smuggle explosives to destroy facilities controlled by Japanese forces in this period action thriller.;['Jee-woon Kim', None];['Zach Aguilar', 'Lee Byung-hun', 'Song Kang-ho', 'Gong Yoo']
30;D'abord, ils ont tué mon père;2017;16;136;['Biography', ' Drama', ' History            '];7.1;72;Cambodian author and human rights activist Loung Ung recounts the horrors she suffered as a child under the rule of the deadly Khmer Rouge.;['Angelina Jolie', None];['Sareum Srey Moch', 'Phoeung Kompheak', 'Sveng Socheata', 'Mun Kimhak']
31;The Dig;2021;13;112;['Biography', ' Drama', ' History            '];7.1;73;An archaeologist embarks on the historically important excavation of Sutton Hoo in 1938.;['Simon Stone', None];['Carey Mulligan', 'Ralph Fiennes', 'Lily James', 'Johnny Flynn']
32;Myeong-ryang;2014;Tous publics;128;['Action', ' Drama', ' History            '];7.1;-1;Admiral Yi Sun-sin faces a tough challenge when he is forced to defend his nation with just 13 battleships against 300 Japanese enemy ships in the Battle of Myeongryang.;['Han-min Kim', None];['Choi Min-sik', 'Seung-ryong Ryu', 'Cho Jin-woong', 'Kim Myung-gon']
33;Mandela: Un long chemin vers la liberté;2013;Tous publics;141;['Biography', ' Drama', ' History            '];7.1;60;A chronicle of Nelson Mandela's life journey from his childhood in a rural village through to his inauguration as the first democratically elected president of South Africa.;['Justin Chadwick', None];['Idris Elba', 'Naomie Harris', 'Terry Pheto', 'Robert Hobbs']
34;Into the White;I) (2012;R;104;['Action', ' Biography', ' Drama            '];7.1;-1;Norway, WWII: A group of British and German soldiers find themselves stranded in the wilderness after an aircraft battle. Finding shelter in the same cabin, they realize the only way to survive the winter is to place the rules of war aside.;['Petter Næss', None];['Florian Lukas', 'David Kross', 'Lachlan Nieboer', 'Stig Henrik Hoff']
35;Deepwater;2016;Tous publics avec avertissement;107;['Action', ' Drama', ' History            '];7.1;68;A dramatization of the disaster in April 2010, when the offshore drilling rig called the Deepwater Horizon exploded, resulting in the worst oil spill in American history.;['Peter Berg', None];['Mark Wahlberg', 'Kurt Russell', 'Douglas M. Griffin', 'James DuMont']
36;We Want Sex Equality;2010;Tous publics;113;['Biography', ' Comedy', ' Drama            '];7.1;65;A dramatization of the 1968 strike at the Ford Dagenham car plant, where female workers walked out in protest against sexual discrimination.;['Nigel Cole', None];['Sally Hawkins', 'Bob Hoskins', 'Andrea Riseborough', 'Jaime Winstone']
37;Agora;2009;Tous publics;127;['Adventure', ' Biography', ' Drama            '];7.1;55;A historical drama set in Roman Egypt, concerning a slave who turns to the rising tide of Christianity in the hope of pursuing freedom while falling in love with his mistress, the philosophy and mathematics professor Hypatia of Alexandria.;['Alejandro Amenábar', None];['Rachel Weisz', 'Max Minghella', 'Oscar Isaac', 'Ashraf Barhom']
38;The Northman;2022;12;137;['Action', ' Adventure', ' Drama            '];7.1;82;A young Viking prince is on a quest to avenge his father's murder.;['Robert Eggers', None];['Alexander Skarsgård', 'Nicole Kidman', 'Claes Bang', 'Ethan Hawke']
39;Les insurgés;I) (2008;Tous publics;137;['Action', ' Drama', ' History            '];7.1;58;Jewish brothers in Nazi-occupied Eastern Europe escape into the Belarussian forests, where they join Russian resistance fighters, and endeavor to build a village, in order to protect themselves and about one thousand Jewish non-combatants.;['Edward Zwick', None];['Daniel Craig', 'Liev Schreiber', 'Jamie Bell', 'Alexa Davalos']
40;Walkyrie;2008;Tous publics;121;['Drama', ' History', ' Thriller            '];7.1;56;A dramatization of the July 20, 1944 assassination and political coup plot by desperate renegade German Army officers against Adolf Hitler during World War II.;['Bryan Singer', None];['Tom Cruise', 'Bill Nighy', 'Carice van Houten', 'Kenneth Branagh']
41;Silence;I) (2016;Tous publics avec avertissement;161;['Drama', ' History            '];7.1;79;In the 17th century, two Portuguese Jesuit priests travel to Japan in an attempt to locate their mentor, who is rumored to have committed apostasy, and to propagate Catholicism.;['Martin Scorsese', None];['Andrew Garfield', 'Adam Driver', 'Liam Neeson', 'Tadanobu Asano']
42;Goodbye Bafana;2007;R;118;['Biography', ' Drama', ' History            '];7.1;-1;Goodbye Bafana is the true story of a white South African racist whose life was profoundly altered by the black prisoner he guarded for twenty years. The prisoner's name was Nelson Mandela.;['Bille August', None];['Joseph Fiennes', 'Dennis Haysbert', 'Diane Kruger', 'Patrick Lyster']
43;Mémoires de nos pères;2006;Tous publics avec avertissement;135;['Action', ' Adventure', ' Drama            '];7.1;79;The life stories of the six men who raised the flag at the Battle of Iwo Jima, a turning point in World War II.;['Clint Eastwood', None];['Ryan Phillippe', 'Barry Pepper', 'Joseph Cross', 'Jesse Bradford']
44;Nous étions soldats;2002;12;138;['Action', ' Drama', ' History            '];7.1;65;The story of the first major battle of the American phase of the Vietnam War, and the soldiers on both sides that fought it, while their wives wait nervously and anxiously at home for the good news or the bad news.;['Randall Wallace', None];['Mel Gibson', 'Madeleine Stowe', 'Greg Kinnear', 'Sam Elliott']
45;Shakespeare in Love;1998;Tous publics;123;['Comedy', ' Drama', ' History            '];7.1;87;The world's greatest ever playwright, William Shakespeare, is young, out of ideas and short of cash, but meets his ideal woman and is inspired to write one of his most famous plays.;['John Madden', None];['Gwyneth Paltrow', 'Joseph Fiennes', 'Geoffrey Rush', 'Tom Wilkinson']
46;Titus;1999;Tous publics;162;['Drama', ' History', ' Thriller            '];7.1;57;Titus returns victorious from war, only to plant the seeds of future turmoil for himself and his family.;['Julie Taymor', None];"['Anthony Hopkins', 'Jessica Lange', 'Osheen Jones', ""Dario D'Ambrosi""]"
47;Sept ans au Tibet;1997;Tous publics;136;['Adventure', ' Biography', ' Drama            '];7.1;55;True story of Heinrich Harrer, an Austrian mountain climber who became friends with the Dalai Lama at the time of China's takeover of Tibet.;['Jean-Jacques Annaud', None];['Brad Pitt', 'David Thewlis', 'BD Wong', 'Mako']
48;Nixon;1995;Tous publics;192;['Biography', ' Drama', ' History            '];7.1;66;A biographical story of former U.S. President Richard Nixon, from his days as a young boy, to his eventual Presidency, which ended in shame.;['Oliver Stone', None];['Anthony Hopkins', 'Joan Allen', 'Powers Boothe', 'Ed Harris']
49;Balto chien-loup, héros des neiges;1995;Tous publics;78;['Animation', ' Adventure', ' Drama            '];7.1;-1;An outcast Husky risks his life with other sled dogs to prevent a deadly epidemic from ravaging Nome, Alaska.;['Simon Wells', None];['Kevin Bacon', 'Bob Hoskins', 'Bridget Fonda', 'Jim Cummings']
0;Le mystère Silkwood;1983;NaN;131;['Biography', ' Drama', ' History            '];7.1;64;A worker at a plutonium processing plant is purposefully contaminated, psychologically tortured and possibly murdered to prevent her from exposing worker safety violations at the plant.;['Mike Nichols', None];['Meryl Streep', 'Kurt Russell', 'Cher', 'Craig T. Nelson']
1;Quo Vadis;1951;Tous publics;171;['Biography', ' Drama', ' History            '];7.1;-1;After fierce Roman commander Marcus Vinicius becomes infatuated with beautiful Christian hostage Lygia, he begins to question the tyrannical leadership of the despotic emperor Nero.;['    Directors:', 'Mervyn LeRoy, ', 'Anthony Mann', None];['Robert Taylor', 'Deborah Kerr', 'Leo Genn', 'Peter Ustinov']
2;American Animals;2018;10;116;['Biography', ' Crime', ' Drama            '];7.0;68;Four young men mistake their lives for a movie and attempt one of the most audacious heists in U.S. history.;['Bart Layton', None];['Spencer Reinhard', 'Warren Lipka', 'Eric Borsuk', 'Chas Allen']
3;My Wonder Women;2017;Tous publics;108;['Biography', ' Drama', ' History            '];7.0;68;The story of psychologist William Moulton Marston, and his polyamorous relationship with his wife and their mistress who would inspire his creation of the superheroine, Wonder Woman.;['Angela Robinson', None];['Luke Evans', 'Rebecca Hall', 'Bella Heathcote', 'Connie Britton']
4;USS Greyhound: La bataille de l'Atlantique;2020;Tous publics;91;['Action', ' Drama', ' History            '];7.0;64;Several months after the U.S. entry into World War II, an inexperienced U.S. Navy commander must lead an Allied convoy being stalked by a German submarine wolf pack.;['Aaron Schneider', None];['Tom Hanks', 'Elisabeth Shue', 'Stephen Graham', 'Matt Helm']
5;Résistance;2015;NaN;110;['Action', ' Biography', ' Drama            '];7.0;-1;A story of Lyudmila Pavlichenko, the most successful female sniper in history.;['Sergey Mokritskiy', None];['Yuliya Peresild', 'Evgeniy Tsyganov', 'Oleg Vasilkov', 'Nikita Tarasov']
6;Colonia;2015;Tous publics avec avertissement;110;['Biography', ' Drama', ' History            '];7.0;33;A young woman's desperate search for her abducted boyfriend draws her into the infamous Colonia Dignidad, a sect nobody has ever escaped from.;['Florian Gallenberger', None];['Emma Watson', 'Daniel Brühl', 'Michael Nyqvist', 'Richenda Carey']
7;La promesse d'une vie;2014;Tous publics;111;['Drama', ' History', ' War            '];7.0;50;An Australian man travels to Turkey after the Battle of Gallipoli to try to locate his three missing sons.;['Russell Crowe', None];['Russell Crowe', 'Olga Kurylenko', 'Jai Courtney', 'Isabel Lucas']
8;Ip Man 3;2015;PG-13;105;['Action', ' Biography', ' Drama            '];7.0;57;When a band of brutal gangsters led by a crooked property developer make a play to take over a local school, Master Ip is forced to take a stand.;['Wilson Yip', None];['Donnie Yen', 'Lynn Xiong', 'Jin Zhang', 'Mike Tyson']
9;Ip man 4: Le dernier combat;2019;Tous publics;107;['Action', ' Biography', ' Drama            '];7.0;62;The Kung Fu master travels to the U.S. where his student has upset the local martial arts community by opening a Wing Chun school.;['Wilson Yip', None];['Donnie Yen', 'Scott Adkins', 'Danny Kwok-Kwan Chan', 'Vanness Wu']
10;The Lady;2011;Tous Public;132;['Biography', ' Drama', ' History            '];7.0;43;The story of Aung San Suu Kyi as she becomes the core of Burma's democracy movement, and her relationship with her husband, writer Michael Aris.;['Luc Besson', None];['Michelle Yeoh', 'David Thewlis', 'Jonathan Raggett', 'Jonathan Woodhouse']
11;La femme du gardien de zoo;2017;Tous Public;127;['Biography', ' Drama', ' History            '];7.0;57;Keepers of the Warsaw Zoo, Antonina and Jan Zabinski, must save hundreds of people and animals during the Nazi invasion in WWII Poland.;['Niki Caro', None];['Jessica Chastain', 'Johan Heldenbergh', 'Daniel Brühl', 'Timothy Radford']
12;Le prodige;2014;Tous publics;115;['Biography', ' Drama', ' History            '];7.0;65;Set during the Cold War, American chess prodigy Bobby Fischer finds himself caught between two superpowers and his own struggles as he challenges the Soviet Empire.;['Edward Zwick', None];['Tobey Maguire', 'Liev Schreiber', 'Peter Sarsgaard', 'Michael Stuhlbarg']
13;Public Enemies;2009;Tous publics;140;['Action', ' Biography', ' Crime            '];7.0;70;The Feds try to take down notorious American gangsters John Dillinger, Baby Face Nelson, and Pretty Boy Floyd during a booming crime wave in the 1930s.;['Michael Mann', None];['Christian Bale', 'Johnny Depp', 'Christian Stolte', 'Jason Clarke']
14;Foxcatcher;2014;Tous publics;134;['Biography', ' Drama', ' History            '];7.0;81;"U.S. Olympic wrestling champions and brothers Mark Schultz and Dave Schultz join ""Team Foxcatcher"", led by eccentric multi-millionaire John du Pont, as they train for the 1988 Olympic Games in Seoul, South Korea, but John's self-destructive behavior threatens to consume them all.";['Bennett Miller', None];['Steve Carell', 'Channing Tatum', 'Mark Ruffalo', 'Vanessa Redgrave']
15;Winter in wartime;2008;R;103;['Drama', ' History', ' War            '];7.0;66;In the Nazi-occupied Netherlands, a teenage boy gets involved in the Dutch Resistance after coming to the aid of a wounded RAF pilot.;['Martin Koolhoven', None];['Martijn Lakemeier', 'Jamie Campbell Bower', 'Yorick van Wageningen', 'Raymond Thiry']
16;La guerre selon Charlie Wilson;2007;Tous publics;102;['Biography', ' Comedy', ' Drama            '];7.0;67;A drama based on a Texas congressman Charlie Wilson's covert dealings in Afghanistan, where his efforts to assist rebels in their war with the Soviets have some unforeseen and long-reaching effects.;['Mike Nichols', None];['Tom Hanks', 'Julia Roberts', 'Philip Seymour Hoffman', 'Amy Adams']
17;Agent double;2007;Unrated;110;['Biography', ' Crime', ' Drama            '];7.0;74;FBI upstart Eric O'Neill enters into a power game with his boss, Robert Hanssen, an agent who was put on trial for selling secrets to the Soviet Union.;['Billy Ray', None];['Chris Cooper', 'Ryan Phillippe', 'Dennis Haysbert', 'Laura Linney']
18;Bobby;I) (2006;R;117;['Biography', ' Drama', ' History            '];7.0;54;The story of the assassination of U.S. Senator Robert F. Kennedy, who was shot in the early morning hours of June 5, 1968 in the Ambassador Hotel in Los Angeles, California, and twenty-two people in the hotel, whose lives were never the same.;['Emilio Estevez', None];['Anthony Hopkins', 'Demi Moore', 'Sharon Stone', 'Harry Belafonte']
19;The Grey Zone;2001;R;108;['Drama', ' History', ' War            '];7.0;58;A Nazi doctor, along with the Sonderkommando, Jews who are forced to work in the crematoria of Auschwitz against their fellow Jews, find themselves in a moral grey zone.;['Tim Blake Nelson', None];['David Arquette', 'Velizar Binev', 'David Chandler', 'Michael Stuhlbarg']
20;Kundun;1997;Tous publics;134;['Biography', ' Drama', ' History            '];7.0;74;From childhood to adulthood, Tibet's fourteenth Dalai Lama deals with Chinese oppression and other problems.;['Martin Scorsese', None];['Tenzin Thuthob Tsarong', 'Gyurme Tethong', 'Tulku Jamyang Kunga Tenzin', 'Tenzin Yeshi Paichang']
21;Rasta Rockett;1993;Tous publics;98;['Adventure', ' Comedy', ' Family            '];7.0;60;When a Jamaican sprinter is disqualified from the Olympic Games, he enlists the help of a dishonored coach to start the first Jamaican Bobsled Team.;['Jon Turteltaub', None];['John Candy', 'Leon', 'Doug E. Doug', 'Rawle D. Lewis']
